en,hmr
"also for the courses of the priests and the Levites, and for all the work of the service of the house of Jehovah, and for all the vessels of service in the house of Jehovah;","thiempuhai le Levi mihai a pâwl pâwla an umna ding hmun lim dâm, Lalpa ina dinga bûr le bêl po po hai lim dâm,"
"of gold by weight for the vessels of gold, for all vessels of every kind of service; of silver for all the vessels of silver by weight, for all vessels of every kind of service;","rawngbâwlna ding bûr le bêl chi tin, rângkachak bûr le bêl ding, rângkachak hmang zât ding,"
"by weight also for the candlesticks of gold, and for the lamps thereof, of gold, by weight for every candlestick and for the lamps thereof; and for the candlesticks of silver, silver by weight for every candlestick and for the lamps thereof, according to the use of every candlestick;","rângkachak khâwnvar siena le a khâwnvar ding rângkachak hmang zât ding le, a sathâu khâwnvar siena le chutaka a khâwnvar ta ding chun rângkachak a bûka bûkin a pêk a; tangkaruo khawm tangkaraw sathâu khâwnvar siena dingin le a khâwnvar siena tin bûkzie ang pei chun a pêk a;"
"and the gold by weight for the tables of showbread, for every table; and silver for the tables of silver;","chun, entirna bei siena dinga dawkân dingin rângkachak, dawkân tin ta dingin; chun, tangkaraw daw- kân ta dingin tangkaruo;"
"and the flesh-hooks, and the basins, and the cups, of pure gold; and for the golden bowls by weight for every bowl; and for the silver bowls by weight for every bowl;","sa kuoikimhai le, châwtawlhai le nohai chu, rângkachak inthieng: rângkachak maihûn ding chun mai- hûn tin chu a bûk ang peiin, tang- karaw maihûn ding chun maihûn tin a bûk ang peiin;"
"and for the altar of incense refined gold by weight; and gold for the pattern of the chariot, even the cherubim, that spread out their wings, and covered the ark of the covenant of Jehovah.","chun, riminhnik râwna mâi- châma ding chun rângkachak suk- thieng a bûka bûkin, chun, cherubhai LALPA thuthlungna bâwm an thlahai zâra inkhumtuhai tawlailîr lima dinga chun rângkachak a pêk bawk a."
"All this, said David, have I been made to understand in writing from the hand of Jehovah, even all the works of this pattern.","David chun, “Hieng po po hi LALPA chun keima chungah ama kut ngeia ziekin a mîn hriettir a nih, hi riruongna sin po pohai hi,” a tih a."
"And David said to Solomon his son, Be strong and of good courage, and do it: fear not, nor be dismayed; for Jehovah God, even my God, is with thee; he will not fail thee, nor forsake thee, until all the work for the service of the house of Jehovah be finished.","Chun, David chun a naupa Solomon kuoma chun, “Insukhrât la, insukhuoi la, thaw el rawh; ṭi naw la, beidawng bawk naw rawh; LALPA Pathien, ka Pathien ngei chu i kuomah a um sih a; LALPA ina rawngbâwlna sin po pohai chu zo a ni vawng hmakhat chun inhlawsamtir naw ni cheh a, nghatsan bawk naw ni che."
"And, behold, there are the courses of the priests and the Levites, for all the service of the house of God: and there shall be with thee in all manner of work every willing man that hath skill, for any manner of service: also the captains and all the people will be wholly at thy commandment.","Chun, ngai ta, Pathien ina rawngbâwlna po poa dingin Levi mihai le thiempuhai chu pâwl an um a; sin kawng chi tinrênga ding chun mi themthiem inhâwktak takhai i kuomah um an ta, rawngbâwlna kawng tinrênga ding chun; mipuihai hotuhai po po khawm chu i thu thuin an um ding a nih,” a ta."
"And David the king said unto all the assembly, Solomon my son, whom alone God hath chosen, is yet young and tender, and the work is great; for the palace is not for man, but for Jehovah God.","Chun, lal David chun mipui inkhâwmhai po po kuoma chun, “Ka naupa Solomon Pathienin ama ngei a hung thlang hi, a la naupangin a la dâwng a, sin hlak chu a nasa hle a; a in chu mihriem ta ding ni loin, LALPA Pathien ta ding a ni sih a."
"Now I have prepared with all my might for the house of my God the gold for the things of gold, and the silver for the things of silver, and the brass for the things of brass, the iron for the things of iron, and wood for the things of wood; onyx stones, and stones to be set, stones for inlaid work, and of divers colors, and all manner of precious stones, and marble stones in abundance.","Tuhin, ka Pathien in ta ding chun ka thei ang tâwp po po chu ka lo buotsai tah a; rângkachak thilhai dinga chun rângkachak, tangkaruo thilhai dinga chun tangkaruo, dârsen thilhai dinga chun dârsen dâm, thîr thilhai dinga chun thîr dâm, thing thilhai dinga chun thing dâm, berul lunghai, lung inbûk dinghai, lung a phûma phûm dinghai le, ze tum tum dinghai dâm, lunghlu chi tinrênghai le sailungvâr chihai leh; tam tâwk takin."
"Moreover also, because I have set my affection on the house of my God, seeing that I have a treasure of mine own of gold and silver, I give it unto the house of my God, over and above all that I have prepared for the holy house,","Chu nawa khawm chun, ka Pathien in dinga ditsakna tak ka nei leiin, rângkachak le tangkaruohai keima ta ngei siekhawl ka nei ti ka hmu chun, chu in inthieng ta dinga ka buotsaihai po po bâka chun, ka Pathien in ta ding chun ka pêk sa bawk a;"
"even three thousand talents of gold, of the gold of Ophir, and seven thousand talents of refined silver, wherewith to overlay the walls of the houses;","chu chu rângkachak talent sâng thum, Ophir rângkachak chu; tang- karuo inthieng, a in bang chu sûng- tienga zûtna dingin talent sâng sari: rângkachak thilhaia dingin rângka- chak,"
"of gold for the things of gold, and of silver for the things of silver, and for all manner of work to be made by the hands of artificers. Who then offereth willingly to consecrate himself this day unto Jehovah?","tangkaruo thilhaia dingin tang- karuo, themthiemhai kuta siem dinga sin iengkima dinga hmang ding po pohai chu. LALPA kuomah vawi- sûn hin tu am inpumpêk dingin inphaltakin inhlân a ta?” a ta."
"Then the princes of the fathers’ houses, and the princes of the tribes of Israel, and the captains of thousands and of hundreds, with the rulers over the king’s work, offered willingly;","Chun, pahnam laia hotuhai le, Israel hnam laia hotuhai le, za khat le sâng khat pâwl chunga hotuhai leh, lal sin chunga rorêltuhai le chun phaltakin an inpêk tah a."
"and they gave for the service of the house of God of gold five thousand talents and ten thousand darics, and of silver ten thousand talents, and of brass eighteen thousand talents, and of iron a hundred thousand talents.","Chuongchun, Pathien in rawng- bâwlna ding chun rângkachak talent sâng nga le, darik sîng khat le, tangkaruo talent sîng khat le dârsen talent sîng khat le, sâng riet le, thîr talent nuoi khat an pêk a."
"And they with whom precious stones were found gave them to the treasure of the house of Jehovah, under the hand of Jehiel the Gershonite.","Chun, lunghlu lo neituhai chun LALPA in ro ina dingin Gerson mi Jehiel kuta chun an pêk bawk a."
"Then the people rejoiced, for that they offered willingly, because with a perfect heart they offered willingly to Jehovah: and David the king also rejoiced with great joy.","Chun, mipuihai chu phaltaka an inhlân lei chun an hlim a, lung- ril tluongtaka LALPA kuoma an inhlân lei chun; chun, lal David ngei khawm chu namênin a lâwm nawh a."
"Wherefore David blessed Jehovah before all the assembly; and David said, Blessed be thou, O Jehovah, the God of Israel our father, for ever and ever.","Chuleichun, David chun mipui inkhâwmhai po po hmaa chun LALPA chu ân pâk a; David chun a hril a, “Aw LALPA, kan thlatu Israel Pathien, chatuon chatuonin nang chu inpâkin um la;"
"Thine, O Jehovah, is the greatness, and the power, and the glory, and the victory, and the majesty: for all that is in the heavens and in the earth is thine; thine is the kingdom, O Jehovah, and thou art exalted as head above all.","Aw LALPA, ropuina dâm, thil- thawtheina dâm, chawimawina dâm, hnena dâm, inlalna dâm i ta an na; hnuoi le vâna um po pohai chu i ta an ni vawng sih a; Aw LALPA, lalram chu nangma ta a na, mi po po chungah nang chu lu anga chawi- mawiin i um hi."
"Both riches and honor come of thee, and thou rulest over all; and in thy hand is power and might; and in thy hand it is to make great, and to give strength unto all.","Hausaknahai le inzakainahai chu nangmaa inthawka hung suok a na, nang chun mi po po chungah ro i rêl a; nangma kuta chun thilthaw- theina le hrâtna chu a um a; chun, i kuta chun mi tin kuoma hrâtna pêkna ding le sukropuina ding chu a um a."
"Now therefore, our God, we thank thee, and praise thy glorious name.","Chuleiin, tuhin, kan Pathien, i hming ropui chu kan inpâkin, lâwm- thu kan hril che."
"But who am I, and what is my people, that we should be able to offer so willingly after this sort? for all things come of thee, and of thine own have we given thee.","Hieng anga inhâwktaka inhlân theina che kan hung nei hi, kei hi tu am ka na, ka mihai khawm hi tuhai am an na? thil po po chu nangmaa inthawka suok a na, nangma ta ma ma chu kan pêk el che a ni sih a."
"For we are strangers before thee, and sojourners, as all our fathers were: our days on the earth are as a shadow, and there is no abiding.",Kan thlatuhai po po ang bawk khan i hmaa hin pêm le mikhuol el kan ni sih a; hi hnuoia hin kan nihai chu hlîm ang el a na; tukhawm um sawng hrim khawm an um nawh.
"O Jehovah our God, all this store that we have prepared to build thee a house for thy holy name cometh of thy hand, and is all thine own.","Aw LALPA kan Pathien, i hming inthieng ta dinga in bâwlna dinga hieng kan buotsaihai po po siekhâwm hi nangmaa inthawka hung a na, nangma ta ruok a nih."
"I know also, my God, that thou triest the heart, and hast pleasure in uprightness. As for me, in the uprightness of my heart I have willingly offered all these things: and now have I seen with joy thy people, that are present here, offer willingly unto thee.","Ka Pathien, nang chun lungril chu i fie hlak a, felnaa chun lâwmna i nei ti khawm ka hriet a. Keia ngai chun, keia lungril tluongtakin hieng thilhai po po hi ka lo inhlân tah a; tuhin, i mihai hitaka umhai hin phaltaka i kuoma inhlân dingin anni chu hlimtakin ka hmu a nih."
"O Jehovah, the God of Abraham, of Isaac, and of Israel, our fathers, keep this for ever in the imagination of the thoughts of the heart of thy people, and prepare their heart unto thee;","Aw LALPA, kan thlatuhai Abraham hai, Isak hai, Israel hai Pathien, i mihai lungril ngaituonahai hi kumkhuoa dinga kawl zing dingin; an lungril chu nangmaa chun sukdet rawh;"
"and give unto Solomon my son a perfect heart, to keep thy commandments, thy testimonies, and thy statutes, and to do all these things, and to build the palace, for which I have made provision.","ka naupa Solomon kuoma khawm, i thupêkhai le, i thu inhriet- tirhai le, i thuruothai chu zâwm dingin le, hieng thilhai po po hi thawh a, a châkkhai ka lo sielâwk tahai chun lalin bâwl dingin lungril ṭha famkim pe bawk rawh,” a ta."
"And David said to all the assembly, Now bless Jehovah your God. And all the assembly blessed Jehovah, the God of their fathers, and bowed down their heads, and worshipped Jehovah, and the king.","Chun, David chun, mipui in- khâwmhai po po kuoma chun, “Tuhin LALPA in Pathien chu inpâk ro,” a ta. Chuongchun, mipui inkhâwmhai po po chun LALPA an thlatuhai Pathien chu an inpâk a, an luhai an kûn a, lal le LALPA chu chibai an bûk tah a."
"And they sacrificed sacrifices unto Jehovah, and offered burnt-offerings unto Jehovah, on the morrow after that day, even a thousand bullocks, a thousand rams, and a thousand lambs, with their drink-offerings, and sacrifices in abundance for all Israel,","Chun, LALPA kuoma chun, in- thâwinahaiin a zînga chun an inthâwi tah a; LALPA kuoma chun pumrawhmang thilinhlânhai chu an inhlân a; bâwngchal sâng khat, berâmchal sâng khat, berâmte sâng khat, dâwn mi thilinhlânhai leh, Israel mi po po ta dingin tam tâwk zeta inthâwinahai chu an inhlân a;"
"and did eat and drink before Jehovah on that day with great gladness. And they made Solomon the son of David king the second time, and anointed him unto Jehovah to be prince, and Zadok to be priest.","chu ni chun hlimna nasatak leh LALPA hmaa chun an dâwnin an fâk tah a. Chun, David naupa Solomon chu a ṭum hninaa chun lal dingin an siem nâwk tah a, ama chu hotu ni dingin le Zadok chu thiempu ding- in LALPA hmaa chun hriek an nâl tah a."
"Then Solomon sat on the throne of Jehovah as king instead of David his father, and prospered; and all Israel obeyed him.","Solomon chu a pa David ai awin LALPA lalṭhungphaa chun lalah a ṭhung tah a; ama chu a hung butlingin, Israel mi po pohai chun a thu an awi tah a."
"And all the princes, and the mighty men, and all the sons likewise of king David, submitted themselves unto Solomon the king.","Chun, lalhai po po le, mi thilthawtheitakhai le a naupasalhai po po chu David naupasalhai ang tak khan lal Solomon kuoma chun an intuklût vawng tâwl a."
"And Jehovah magnified Solomon exceedingly in the sight of all Israel, and bestowed upon him such royal majesty as had not been on any king before him in Israel.","Chuongchun, LALPA chun Solomon chu Israel mihai po po mit- hmua chun nasatakin a chawimawi a; Israel rama ama hmaa lal tukhawm chunga um ngai lo, lal inlalna chu ama chunga chun a pêk a."
Now David the son of Jesse reigned over all Israel.,"Chuongchun, Jesai naupa David chun Israel ram po po chunga chun ro a rêl a."
"And the time that he reigned over Israel was forty years; seven years reigned he in Hebron, and thirty and three years reigned he in Jerusalem.","Israel chunga ro a rêl sûng chu kum sâwmli a nih; Hebrona khan kum sari ro a rêl a, Jerusalema khan kum sâwmthum le kum thum a rêl a."
"And he died in a good old age, full of days, riches, and honor: and Solomon his son reigned in his stead.","Ama chu upatakin, tarkûnin, hausatak le inzaumtakin a thi tah a; chuongchun, a naupa Solomon chun ama aia chun ro a rêl tah a."
"Now the acts of David the king, first and last, behold, they are written in the history of Samuel the seer, and in the history of Nathan the prophet, and in the history of Gad the seer,","Chuongchun, lal David thil- thawhai, a hmasa le a nuhnung khawm, zâwlnei Samuel chanchin- bua chun ziekin a um a, zâwlnei Nathan chanchinbua le, zâwlnei Gad chanchinbua khawm chun ziek a nih;"
"with all his reign and his might, and the times that went over him, and over Israel, and over all the kingdoms of the countries.","rambunghaia lalramhai po po chunga le, Israelhai chunga le ama chunga hun lo liem tahai le, a thilthawtheizie le a rorêlhai po po chu chuonghaia chun ziek an nih."
"Now these were the sons of David, that were born unto him in Hebron: the first-born, Amnon, of Ahinoam the Jezreelitess; the second, Daniel, of Abigail the Carmelitess;","Hienghai hi David naupasalhai Hebrona pienghai chu an nih: nau lutîr Amnon, Jezreel mi Ahinoam inei, a pahnina, Daniel, Karmel mi Abigail inei;"
"the third, Absalom the son of Maacah the daughter of Talmai king of Geshur; the fourth, Adonijah the son of Haggith;","a pathumna, Absalom, Gesur lal Talmai naunu Maaka naupa chu; a palina, Haggith naupa Adonija;"
"the fifth, Shephatiah of Abital; the sixth, Ithream by Eglah his wife:","a pangana, Abital inei Sephatia; a parukna, a nuhmei Egla inei Ithream chu."
six were born unto him in Hebron; and there he reigned seven years and six months. And in Jerusalem he reigned thirty and three years;,"Hebrona chun paruk an piengpêk a; chun, chutaka ma chun kum sari le thla ruk sûng ro a rêl a, chun, Jeru- salema chun kum sâwmthum le kum thum a rêl a."
"and these were born unto him in Jerusalem: Shimea, and Shobab, and Nathan, and Solomon, four, of Bath-shua the daughter of Ammiel;","Chun, hienghai hi Jerusalema piengpêkhai chu an nih; Ammiel naunu Bathsua inei pali; Simea hai, Sobab hai, Nathan hai, Solomon hai hi;"
"and Ibhar, and Elishama, and Eliphelet,","chun, Ibhar hai, Elisama hai, Eliphelet hai;"
"and Nogah, and Nepheg, and Japhia,","Noga hai, Nepheg hai, Japhia hai;"
"and Elishama, and Eliada, and Eliphelet, nine.","chun, Elisama hai, Eliada hai, Eliphelet hai, an rêngin pakuo."
"All these were the sons of David, besides the sons of the concubines; and Tamar was their sister.",A thaikêmhai naupasalhai tiem loin hienghai po hi David naupasal- hai chu an na; an farnu chu Tamar a nih.
"And Solomon’s son was Rehoboam, Abijah his son, Asa his son, Jehoshaphat his son,","Chun, Solomon naupa chu Rehoboam a na, ama naupa chu Abija a na; ama naupa chu Asa a na, ama naupa chu Jehosaphat a na;"
"Joram his son, Ahaziah his son, Joash his son,","ama naupa chu Joram a na, ama naupa chu Ahazia a na; ama naupa chu Joas a na,"
"Amaziah his son, Azariah his son, Jotham his son,",Ama naupa chu Amazia a na; ama naupa chu Azaria a na; ama naupa chu Jotham a na;
"Ahaz his son, Hezekiah his son, Manasseh his son,","ama naupa chu Ahaz a na, ama naupa chu Hezekiah a na, ama naupa chu Manasse a na;"
"Amon his son, Josiah his son.","ama naupa chu Amon a na, ama naupa chu Josia a nih,"
"And the sons of Josiah: the first-born Johanan, the second Jehoiakim, the third Zedekiah, the fourth Shallum.","Chun, Josia naupasalhai chu, a upa tak chu Johanan a na, a pahnina chu Jehoiakim a na, a pathumna chu Zedekia a na, a palina chu Sallum a nih."
"And the sons of Jehoiakim: Jeconiah his son, Zedekiah his son.","Chun, Jehoiakim naupasalhai chu Jekonia le Zedekia an nih."
"And the sons of Jeconiah, the captive: Shealtiel his son,","Chun, Jekonia, suok intâng, naupasalhai chu: a naupa Sealtiel,"
"and Malchiram, and Pedaiah, and Shenazzar, Jekamiah, Hoshama, and Nedabiah.","Malkiram, Pedaia, Senazar, Jekamia, Hosama le Nedabia an nih."
"And the sons of Pedaiah: Zerubbabel, and Shimei. And the sons of Zerubbabel: Meshullam, and Hananiah; and Shelomith was their sister;","Chun, Pedaia naupasalhai chu: Zerubbabel le Simei; chun, Zerub- babel naupasalhai chu: Mesullam le Hanania an na, an farnu chu Selomith a nih;"
"and Hashubah, and Ohel, and Berechiah, and Hasadiah, Jushab-hesed, five.","chun, Hasuba, Ohel, Berekia, Hasadia le Jusab-hesed, panga an nih."
"And the sons of Hananiah: Pelatiah, and Jeshaiah; the sons of Rephaiah, the sons of Arnan, the sons of Obadiah, the sons of Shecaniah.","Chun, Hanania naupasalhai chu: Pelatia le Jesaia: Rephaia naupasal- hai, Arnan naupasalhai, Obadia nau- pasalhai, Sekania naupasalhai hi."
"And the sons of Shecaniah: Shemaiah. And the sons of Shemaiah: Hattush, and Igal, and Bariah, and Neariah, and Shaphat, six.","Chun, Sekania naupasalhai chu: Semaia, chun, Semaia naupasal- hai chu: Hattus, Igal, Baria, Nearia le Saphat, paruk an nih."
"And the sons of Neariah: Elioenai, and Hizkiah, and Azrikam, three.","Chun, Nearia naupasalhai chu Elioenai, Hizkia le Azrikam, pathum an nih."
"And the sons of Elioenai: Hodaviah, and Eliashib, and Pelaiah, and Akkub, and Johanan, and Delaiah, and Anani, seven.","Chun, Elioenai naupasalhai chu Hodavia, Eliasib, Pelaia, Akkub, Johanan, Delaia le Anani, pasari an nih."
"The sons of Judah: Perez, Hezron, and Carmi, and Hur, and Shobal.","Juda naupasalhai chu: Perez, Hezron, Karmi, Hur le Sobal an nih."
And Reaiah the son of Shobal begat Jahath; and Jahath begat Ahumai and Lahad. These are the families of the Zorathites.,"Chun, Sobal naupa Reaia chun Jahath a nei a; Jahath chun Ahumai le Lahad a nei a. Hienghai hi Zorath sûngkuohai chu an nih."
"And these were the sons of the father of Etam: Jezreel, and Ishma, and Idbash; and the name of their sister was Hazzelelponi;","Chun, hieng hi Etam pa naupa- salhai chu an nih: Jezreel, Isma le Idbas hi; chun, an farnu hming chu Hazzelelponi a nih;"
"and Penuel the father of Gedor, and Ezer the father of Hushah. These are the sons of Hur, the first-born of Ephrathah, the father of Beth-lehem.","Gedor pa Penuel le Husa pa Ezer. Chun, hienghai hi Hur, Beth-lehem pa Ephratha nau lutîr, naupasalhai chu an nih."
"And Ashhur the father of Tekoa had two wives, Helah and Naarah.","Chun, Tekoa pa Ashhur chun nuhmei pahni: Hela le Naara chu a nei a."
"And Naarah bare him Ahuzzam, and Hepher, and Temeni, and Haahashtari. These were the sons of Naarah.","Naara chun Ahuzzam, Hepher, Temeni le Haahastari a neipêk a. Hienghai hi Naara naupasalhai chu an nih."
"And the sons of Helah were Zereth, Izhar, and Ethnan.","Chun, Hela naupasalhai chu: Zereth, Izhar, le Ethnan hi an nih."
"And Hakkoz begat Anub, and Zobebah, and the families of Aharhel the son of Harum.","Hakkoz chun Anub, Zobeba le Harum naupa Aharhel sûngkuohai chu a nei a."
"And Jabez was more honorable than his brethren: and his mother called his name Jabez, saying, Because I bare him with sorrow.","Chun, Jabez chu a unauhai nêkin inza a kai lem a, a nu chun, “Lung- ngaina puma ka nei a na,” tiin a hminga chun Jabez ân bûk a nih."
"And Jabez called on the God of Israel, saying, Oh that thou wouldest bless me indeed, and enlarge my border, and that thy hand might be with me, and that thou wouldest keep me from evil, that it be not to my sorrow! And God granted him that which he requested.","Jabez chun Israel Pathien chu, “Ka lungngai nawna dinga thil ṭhanawa inthawka mi vêngin, i kut chu ka chunga a um theina dingin, nangin mal mi hung sâwmin, ka ramrihai chu hung suklien ngei i tih,” tiin a ko a. Pathien chun a hni chu a phalpêk tah a."
"And Chelub the brother of Shuhah begat Mehir, who was the father of Eshton.","Chun, Kelub, Suha unaupa chun Mehir a nei a; ama chu Eston pa a nih."
"And Eshton begat Beth-rapha, and Paseah, and Tehinnah the father of Ir-nahash. These are the men of Recah.","Eston chun Beth-rapha, Pasea le Ir-nahas pa Tehinna chu a nei a. Hienghai hi Reka mihai chu an nih."
"And the sons of Kenaz: Othniel, and Seraiah. And the sons of Othniel: Hathath.","Kenaz naupasalhai chu: Othniel le Seraia; chun, Othniel nau- pasalhai chu: Hathath le Meonothai an nih."
And Meonothai begat Ophrah: and Seraiah begat Joab the father of Ge-harashim; for they were craftsmen.,Meonothai chun Ophra a nei a; Seraia chun Geharasim pa Jakob chu a nei a; anni chu mi themthiem mi an nih.
"And the sons of Caleb the son of Jephunneh: Iru, Elah, and Naam; and the sons of Elah; and Kenaz.","Chun, Jephunne naupa Kaleb naupasalhai chu: Iru, Ela le Naam an nih; Ela naupasal hai le Kenaz a nih."
"And the sons of Jehallelel: Ziph, and Ziphah, Tiria, and Asarel.","Chun, Jehallelel naupasalhai chu: Ziph, Zipha, Tiria le Asarel an nih."
"And the sons of Ezrah: Jether, and Mered, and Epher, and Jalon; and she bare Miriam, and Shammai, and Ishbah the father of Eshtemoa.","Ezra naupasalhai chu: Jether, Mered, Epher le Jalon an nih; hienghai hi Pharao naunu Mared nuhmei Bithia naupasalhai chu an nih; chun, Miriam, Sammai le Isba, Estemoa pa chu a nei bawk a."
"And his wife the Jewess bare Jered the father of Gedor, and Heber the father of Soco, and Jekuthiel the father of Zanoah. And these are the sons of Bithiah the daughter of Pharaoh, whom Mered took.","Chun, a nuhmei Ha-jehudijah chun Gedor pa Jared le Soko pa Heber le Janoa pa Jekuthiel chu a nei a."
"And the sons of the wife of Hodiah, the sister of Naham, were the father of Keilah the Garmite, and Eshtemoa the Maacathite.","Chun, Naham farnu Hodia naupasalhai chu: Garmi mi Keila pa le Maakath mi Estemoa chu an nih."
"And the sons of Shimon: Amnon, and Rinnah, Ben-hanan, and Tilon. And the sons of Ishi: Zoheth, and Ben-zoheth.","Simon naupasalhai chu: Am- non, Rina, Ben-hanan le Tilon an nih. Chun, Isi naupasalhai chu: Zoheth le Ben-zoheth an nih."
"The sons of Shelah the son of Judah: Er the father of Lecah, and Laadah the father of Mareshah, and the families of the house of them that wrought fine linen, of the house of Ashbea;","Chun, Juda naupa Sela naupa- salhai chu: Leka pa Era le, Maresa pa Laada le, Asbea sûngkuo, puon zai inhmi khâwngtuhai sûngkuohai po po chu an nih;"
"and Jokim, and the men of Cozeba, and Joash, and Saraph, who had dominion in Moab, and Jashubi-lehem. And the records are ancient.","Chun, Jokim le Kozeba mihai le Joas le Moab rama ram neitu Saraph hai le, Jasubi-lehem hai leh an nih. Hienghai hi thu hlui an nih."
"These were the potters, and the inhabitants of Netaim and Gederah: there they dwelt with the king for his work.",Hienghai hi bêlhemtu Netaim le Gederaa um hai chu an nih: chutaka chun a sinthaw dingin lal kuomah an um a nih.
"The sons of Simeon: Nemuel, and Jamin, Jarib, Zerah, Shaul;","Simeon naupasalhai chu: Nemuel, Jamin, Jarib, Zera le Saul an nih:"
"Shallum his son, Mibsam his son, Mishma his son.","ama naupa Sallum, ama naupa Mibsam, ama naupa Misma."
"And the sons of Mishma: Hammuel his son, Zaccur his son, Shimei his son.","Misma naupasal chu: Hamuel, ama naupa Zakkur, ama naupa Simei."
"And Shimei had sixteen sons and six daughters; but his brethren had not many children, neither did all their family multiply like to the children of Judah.","Simei chun naupasal sâwm le paruk le naunuhmei paruk a nei a; amiruokchu, a unauhai chun nau an hau ve nawh a, Juda thlahai angin an sûngkuo khawm chu an inthla pung rak nawh a."
"And they dwelt at Beer-sheba, and Moladah, and Hazar-shual,","Anni chu Beer-seba le Molada le Hazar-sualah an um a,"
"and at Bilhah, and at Ezem, and at Tolad,","chun, Bilha, Ezem, Tolad,"
"and at Bethuel, and at Hormah, and at Ziklag,","Bethuel, Hormah, Ziklag,"
"and at Beth-marcaboth, and Hazar-susim, and at Beth-biri, and at Shaaraim. These were their cities unto the reign of David.","Beth-markoboth, Hazar-susim- ah, Beth-biriah, Saaraima leh an um bawk a. Hienghai po po hi David rorêl chen khan an khawpuihai an nih."
