en,hmr
"And king David said to Ornan, Nay; but I will verily buy it for the full price: for I will not take that which is thine for Jehovah, nor offer a burnt-offering without cost.","Chun, lal David chun Ornan kuoma chun, “Ni lo e a, a man kim chie ang takin kân châwk ding annâwm; nangma ta chu LALPA ta dingin ka lâkpêk ding che a ni nawh a, chun, pumrawhmang thilinhlân khawm chu man bo chun kân hlân ding a ni nawh,” a ta."
So David gave to Ornan for the place six hundred shekels of gold by weight.,"Chuongchun, David chun Ornan kuoma chun rângkachak a bûk a, shekel za ruk a hmun man ding chun a pêk tah a."
"And David built there an altar unto Jehovah, and offered burnt-offerings and peace-offerings, and called upon Jehovah; and he answered him from heaven by fire upon the altar of burnt-offering.","Chun, Davidin chutaka chun mâichâm chu LALPA ta dingin a siem a, pumrawhmang thilinhlân le, in- remna thilinhlân chu ân hlân a, LALPA chu a ko tah a; chun, ama chun vâna inthawk chun pumraw- hmangna mâichâm chungah meiin a zuk dawn tah a."
And Jehovah commanded the angel; and he put up his sword again into the sheath thereof.,"Chun, LALPA chun vântirko chu thu a pêk a; a kâwlhnâm chu a bâwma chun a khum nâwk tah a."
"At that time, when David saw that Jehovah had answered him in the threshing-floor of Ornan the Jebusite, then he sacrificed there.","Chu huna chun, Jebus mi Ornan hrizâwla chun LALPA chun a zuk dawn ti a hmu phing chun chutaka chun ân thâwi tah a."
"For the tabernacle of Jehovah, which Moses made in the wilderness, and the altar of burnt-offering, were at that time in the high place at Gibeon.","LALPA biekbûk thlalêra Mosien a siem le, pumrawhmang thilin- hlânna mâichâm chu, chu huna chun Gibeona bâwlhmuna chun a la um zing sih a."
But David could not go before it to inquire of God; for he was afraid because of the sword of the angel of Jehovah.,"Nisienlakhawm, chu hmaa chun Pathien rawn dingin David chu a fe thei nawh a,LALPA vântirko kâwlhnâm lei chun a ṭi tlat sih a."
"Then David said, This is the house of Jehovah God, and this is the altar of burnt-offering for Israel.","David chun, “Hi hi LALPA Pathien in a na, hi hi Israel ta dinga pumrawhmang thilinhlânna mâichâm chu a nih,” a ta."
And David commanded to gather together the sojourners that were in the land of Israel; and he set masons to hew wrought stones to build the house of God.,David chun Israel rama mikhuol umhai chu kei khâwm dingin thu a pêk a; Pathien in bâwlna dinga lung sut dingin lung suttuhai a ruot a.
"And David prepared iron in abundance for the nails for the doors of the gates, and for the couplings; and brass in abundance without weight;","David chun ân huonna kawt- khâra ding le a zawmna vêlhaia dingin thîr tamtak a kilna dingin a buotsai a; dârsen chi tamtak el a bûk hriet lo,"
and cedar-trees without number: for the Sidonians and they of Tyre brought cedar-trees in abundance to David.,Sidar thing a nizât hriet lo; Zidon mihai le Tura mihai khan David kuomah Sidar thing an hung lâk ṭeu sih a.
"And David said, Solomon my son is young and tender, and the house that is to be builded for Jehovah must be exceeding magnificent, of fame and of glory throughout all countries: I will therefore make preparation for it. So David prepared abundantly before his death.","Chun, David chun, “Ka naupa Solomon hi a naupangin iengkhawm a hriet si nawh a, LALPA ta dinga in bâwl ding hi ropuitak a ni ding a na, ram po poa ropuitak le hming inthang tak el ding a ni sih a; chuleiin, keiin buotsai ka tih,” a ta. Chuongchun, David chun a thi hma ngei chun nasatakin a buotsai tah a."
"Then he called for Solomon his son, and charged him to build a house for Jehovah, the God of Israel.","Chun, a naupa Solomon chu a ko a; Israelhai Pathien, LALPA ta dinga in bâwl dingin thu a pêk tah a."
"And David said to Solomon his son, As for me, it was in my heart to build a house unto the name of Jehovah my God.","David chun Solomon kuomah, “Ka naupa, keia ta ding chun ka Pathien LALPA hming ta dinga in bâwl chu ka lungrilah a um a."
"But the word of Jehovah came to me, saying, Thou hast shed blood abundantly, and hast made great wars: thou shalt not build a house unto my name, because thou hast shed much blood upon the earth in my sight.","Nisienlakhawm, LALPA thu chu ka kuomah a hung tlung a, ‘Nang chun thisen tamtak în suo tah a, indona ropuitakhaia khawm i ṭhang tah a; ka mithmua hnuoi chunga thisen tamtak în suo ta leiin ka hming ta dingin in bâwl naw ti ni,"
"Behold, a son shall be born to thee, who shall be a man of rest; and I will give him rest from all his enemies round about; for his name shall be Solomon, and I will give peace and quietness unto Israel in his days.","Ngai ta, naupasal hung nei i ta, ama chu mi sâwldamtak nîng a tih, a vêlin, a hmêlmahaia inthawk khawm- in ama chu râlmuongna pêng ka ta, a hming khawm Solomon nîng a ta, ama hun laia chun Israel rama hin muongna le râlmuongna pêng ka tih;"
"He shall build a house for my name; and he shall be my son, and I will be his father; and I will establish the throne of his kingdom over Israel for ever.","keia hming ta dingin in bâwl a ta, ama chu ka naupa nîng a ta, kei ama pa ni bawk ka tih; chun, a ram lalṭhungpha chu Israel chungah kumkhawtluongin sukdet ka tih,’ tiin."
"Now, my son, Jehovah be with thee; and prosper thou, and build the house of Jehovah thy God, as he hath spoken concerning thee.","Tuhin, ka naupa, LALPA chu i kuomah um a ta, inhlâwtlingtir a ti cheh a, nangma chungthua a hril ta angin, i Pathien LALPA in chu bâwl la."
"Only Jehovah give thee discretion and understanding, and give thee charge concerning Israel; that so thou mayest keep the law of Jehovah thy God.","LALPA chun hrietthiem theina le thlierthiem theina pe sienla che; Israel chunga thuneina pe raw se che; chuongchun, LALPA i Pathien dân chu i kawl zing theina dingin,"
"Then shalt thou prosper, if thou observe to do the statutes and the ordinances which Jehovah charged Moses with concerning Israel: be strong, and of good courage; fear not, neither be dismayed.","Israel chungthua LALPAIN Mosie thu a pêk, rorêlna hai le dânhai chu thaw dinga i zâwm tlat chun hung hlawtling i tih; insukhrât la, insukhuoi la, beidawng naw la, ṭit khawm ṭi naw rawh."
"Now, behold, in my affliction I have prepared for the house of Jehovah a hundred thousand talents of gold, and a thousand thousand talents of silver, and of brass and iron without weight; for it is in abundance: timber also and stone have I prepared; and thou mayest add thereto.","Tuhin ngai ta, ka theitâwk hu ang peiin, LALPA in ta ding chun rângkachak talent nuoi khat, tang- karuo talent maktaduoi khat, dârsen le thîr chu a bûk zât hriet lo ka buotsai tah a; chu ding chun, lung le thing khawm a tam tâwkin ka buotsai tah a nih; chu chu sunzawm thei i ta."
"Moreover there are workmen with thee in abundance, hewers and workers of stone and timber, and all men that are skilful in every manner of work:","Chunawa khawm, i kuomah sinthawtuhai tam tâwk tak, lung suttuhai, a âttuhai, thing thaw mi, sin tinrênga themthiem mihai;"
"of the gold, the silver, and the brass, and the iron, there is no number. Arise and be doing, and Jehovah be with thee.","rângkachak le, tangkaruo le, thîr le dârsena themthiemhai, nizât hriet sêng lo rau an na; tho la, thaw el rawh, LALPA chu i kuomah um a tih,” tiin."
"David also commanded all the princes of Israel to help Solomon his son, saying,",David chun Israel hotuhai po po chu a naupa Solomon chu ṭhangpui dingin thu a pêk bawk a;
"Is not Jehovah your God with you? and hath he not given you rest on every side? for he hath delivered the inhabitants of the land into my hand; and the land is subdued before Jehovah, and before his people.","“LALPA in Pathien chu in kuomah a um a ni naw am a nih? Kil tin ela chun muongna a pêk cheu a ni naw am a nih? A ram hluotuhai chu ka kutah a hung pêk tâwl ta sih a; chun, a ram khawm chu LALPA le a mihai hmaa chun an intuklût ta sih a."
"Now set your heart and your soul to seek after Jehovah your God; arise therefore, and build ye the sanctuary of Jehovah God, to bring the ark of the covenant of Jehovah, and the holy vessels of God, into the house that is to be built to the name of Jehovah.","Tuhin, LALPA in Pathien chu zawng dingin in lungril le in lungvar chu ama tieng ngha unla, tho unla, chuongchun, LALPA Pathien hmun inthieng; LALPA thuthlungna bâwm le, Pathien bûr le bêl inthienghai chu hung lâkna dingin, LALPA hmingin in bâwl ro,” tiin."
Now David was old and full of days; and he made Solomon his son king over Israel.,"David chu a hung tar tah a, a hung upa ta hle a, a naupa Solomon chu Israel chunga lal dingin a siem tah a."
"And he gathered together all the princes of Israel, with the priests and the Levites.","Chun, Israel upahai po po le thiempuhai le Levi mihai chu a ko khâwm vawng a."
"And the Levites were numbered from thirty years old and upward: and their number by their polls, man by man, was thirty and eight thousand.","Levi mihai chu kum sâwmthum chung tienga po chu tiem an na; an tiem dânbi ang chun an nizât chu, patling sîng thum le sâng riet an nih."
"Of these, twenty and four thousand were to oversee the work of the house of Jehovah; and six thousand were officers and judges;",Hi laia mi sîng hni le za li hin LALPA in sin chu an enkawl ding a na;
"and four thousand were doorkeepers; and four thousand praised Jehovah with the instruments which I made, said David, to praise therewith.","chun, sâng ruk dang chu hotuhai le rorêltuhai an nih; sâng li chu kawtkhâr vêngtuhai an na; sâng li dang chun, “Inpâkna dinga ka siem,” Davidin a ti, chuong thuomhnawhai le chun LALPA chu inpâk ding an nih."
"And David divided them into courses according to the sons of Levi: Gershon, Kohath, and Merari.","David chun anni chu a pâwl peiin, Levi naupasalhai ang peiin a ṭheh a; Gerson le Kohath le Merari hai hi."
Of the Gershonites: Ladan and Shimei.,Gerson mia chun Ladan le Simei an na.
"The sons of Ladan: Jehiel the chief, and Zetham, and Joel, three.","Ladan naupasalhai chu: Jehiel chu a hotu tak le, Zetham le Joel, hi pathum hi."
"The sons of Shimei: Shelomoth, and Haziel, and Haran, three. These were the heads of the fathers’ houses of Ladan.","Simei naupasalhai chu: Selo- moth, Haziel le Haran, hi pathum hi. Hienghai hi Ladan sûngkuo pahnam luhai chu an nih."
"And the sons of Shimei: Jahath, Zina, and Jeush, and Beriah. These four were the sons of Shimei.","Chun, Simei naupasalhai chu: Jahath, Zina, Jeus le Beria an nih. Hieng palihai hi Simei naupasalhai an nih."
"And Jahath was the chief, and Zizah the second: but Jeush and Beriah had not many sons; therefore they became a fathers’ house in one reckoning.","Chun, Jahath chu a hotu tak a na, Ziza chu a pahnina; amiruokchu, Jeus le Beria chun naupasal tamtak an nei nawh a; chuleiin, tiem dânah thlâ khat an nih."
"The sons of Kohath: Amram, Izhar, Hebron, and Uzziel, four.","Kohath naupasalhai chu: Amram, Izhar, Hebron le Uzziel, hi pali hi."
"The sons of Amram: Aaron and Moses; and Aaron was separated, that he should sanctify the most holy things, he and his sons, for ever, to burn incense before Jehovah, to minister unto him, and to bless in his name, for ever.","Amram naupasalhai chu: Aron le Mosie; chu, Aron le a naupasalhai chu ama le a nauhai chun thil inthienghai chu hlânthieng a, kum- khuoa LALPA hmaa riminhnik raw ding le, ama rawngbâwl ding le, ama hminga malsâwm kumkhuo dinga suktum an nih."
"But as for Moses the man of God, his sons were named among the tribe of Levi.","Nisienlakhawm, Pathien mi Mosie chu, a naupasalhai chu Levi hnam laia lam sa a na."
The sons of Moses: Gershom and Eliezer.,Mosie naupasalhai chu: Gerson le Eliezer an nih.
The sons of Gershom: Shebuel the chief.,Gerson naupasalhai chu: Sebuel chu a hotu tak a nih.
And the sons of Eliezer were: Rehabiah the chief; and Eliezer had no other sons; but the sons of Rehabiah were very many.,"Eliezer naupasalhai chu: Rehabia chu a hotu tak a nih. Eliezer chun naupasal dang a nei nawh a; amiruokchu, Rehabia naupasalhai chu an tam hle."
The sons of Izhar: Shelomith the chief.,Izhar naupasalhai chu: Selo- mith chu a upa tak a nih.
"The sons of Hebron: Jeriah the chief, Amariah the second, Jahaziel the third, and Jekameam the fourth.","Hebron naupasalhai chu: Jeria a hotu tak a na, a pahnina chu Amaria, a pathumna chu Jahaziel, a palina chu Jekameam."
"The sons of Uzziel: Micah the chief, and Isshiah the second.","Uzziel naupasalhai chu: Mika chu a upa tak a na, a pahnina chu Issia."
The sons of Merari: Mahli and Mushi. The sons of Mahli: Eleazar and Kish.,Merari naupasalhai chu: Mahli le Musi. Mahli naupasalhai chu: Eleazar le Kis.
"And Eleazar died, and had no sons, but daughters only: and their brethren the sons of Kish took them to wife.","Chun, Eleazar chu a thih a, naupasal a nei nawh, naunuhmei chau a nei; chun, an unaupahai, Kis naupasalhai chun anni chu nu- hmeiah an nei tâwl a."
"The sons of Mushi: Mahli, and Eder, and Jeremoth, three.","Musi naupasalhai chu: Mahli leh, Eder leh, Jeremoth leh, pathum."
"These were the sons of Levi after their fathers’ houses, even the heads of the fathers’ houses of those of them that were counted, in the number of names by their polls, who did the work for the service of the house of Jehovah, from twenty years old and upward.","Hienghai hi an pahnam anga Levi naupasalhai chu an nih, tiemna laia an pahnamhai luhai chu an na, LALPA ina rawngbâwlnaa sinthaw- tuhai, tiem an ni dânbi anga hming suota nizât, kum sâwmhnia in- thawka chungtieng an nih."
"For David said, Jehovah, the God of Israel, hath given rest unto his people; and he dwelleth in Jerusalem for ever:","David chun, “LALPA Israelhai Pathien chun a mihai chu muongna a pêk a;"
and also the Levites shall no more have need to carry the tabernacle and all the vessels of it for the service thereof.,"chun, Levi mihai khawm chun a biekbûk le chutaka a rawngbâwlna bûr le bêlhai po po chu an zâwn a ṭûl bawk ta nawh a,” a ti sih a."
"For by the last words of David the sons of Levi were numbered, from twenty years old and upward.","David thu nuhnung tak ang- in, Levi thlahai chu, kum sâwm- hni le a chungtienga po chu tiem an na."
"For their office was to wait on the sons of Aaron for the service of the house of Jehovah, in the courts, and in the chambers, and in the purifying of all holy things, even the work of the service of the house of God;","An sinthaw chu Pathien ina rawngbâwlna sinhai: thil inthieng po pohai sukthieng dâm, pindanahai le inhuonna tuol sûnga LALPA Ina rawngbâwlnaa chun Aron naupa- salhai chu an ṭhangpui ding a ni sih a;"
"for the showbread also, and for the fine flour for a meal-offering, whether of unleavened wafers, or of that which is baked in the pan, or of that which is soaked, and for all manner of measure and size;","entirna bei ta ding dâm, bu thilinhlân dinga beiphit inditaka ding, chawl ṭhanglo bei amanih, bêl dara zêu amanih, a suonga suong amanih, ieng anga lien le ieng ang tiet ding khawmin;"
"and to stand every morning to thank and praise Jehovah, and likewise at even;","zîng tina Pathien inpâk dinga ngîr dingin, chuong ang bawkin zântieng khawm;"
"and to offer all burnt-offerings unto Jehovah, on the sabbaths, on the new moons, and on the set feasts, in number according to the ordinance concerning them, continually before Jehovah;","châwlnihai dâm, thlatharhai dâm, ruoiṭhena bi ruotahai dâma LALPA hmaa chuong chungthua thaw rawp a ni ding dân ang peia LALPA kuoma pumrawhmang thilin- hlân chu inhlân ding dâmin;"
"and that they should keep the charge of the tent of meeting, and the charge of the holy place, and the charge of the sons of Aaron their brethren, for the service of the house of Jehovah.","chun, LALPA ina rawngbâwlna dinga, an unau Aron thlahai sin kawl le, hmun inthieng enkawlna sin le, intuokna in enkawlna sin chu an kawl ding a nih;"
"And the courses of the sons of Aaron were these. The sons of Aaron: Nadab and Abihu, Eleazar and Ithamar.","Aron naupasalhai pâwlhai chu hieng hi a nih: Aron naupa- salhai chu: Nadab, Abihu, Eleazar le Ithamar an nih."
"But Nadab and Abihu died before their father, and had no children: therefore Eleazar and Ithamar executed the priest’s office.","Amiruokchu, Nadab le Abihu chu an pa nêkin an thi hmasa a, nau an nei nawh a; chuongchun, Eleazar le Ithamar chun thiempu sin chu an thawh tah a."
"And David with Zadok of the sons of Eleazar, and Ahimelech of the sons of Ithamar, divided them according to their ordering in their service.","Chun, David chun an rawng- bâwlnaa an sinthaw ang peiin, Zadok, Eleazar nauhai le, Ahimelek, Ithamar nauhai chu a ṭheh a."
"And there were more chief men found of the sons of Eleazar than of the sons of Ithamar; and thus were they divided: of the sons of Eleazar there were sixteen, heads of fathers’ houses; and of the sons of Ithamar, according to their fathers’ houses, eight.","Ithamar naupasalhai laia nêk chun Eleazar naupasalhai laia chun hotu tam lem hmu a na; chuong ang chun ṭhe an na; Eleazar naupasalhai pahnam luhai chu sâwm le paruk an na, Ithamar naupasalhai chu an pahnam ang peiin pariet an nih."
"Thus were they divided by lot, one sort with another; for there were princes of the sanctuary, and princes of God, both of the sons of Eleazar, and of the sons of Ithamar.","Chun, aisâna ṭhe an na, chi dân dang dangin, Ithamar naupasalhai le Eleazar naupasalhai laia chun Pathien in hotuhai le hmun inthienga hotuhai chu an um ve ve sih a."
"And Shemaiah the son of Nethanel the scribe, who was of the Levites, wrote them in the presence of the king, and the princes, and Zadok the priest, and Ahimelech the son of Abiathar, and the heads of the fathers’ houses of the priests and of the Levites; one fathers’ house being taken for Eleazar, and one taken for Ithamar.","Chun, Nethanel naupa ziektu Semaia chun lal le, rorêltuhai le, thiempu Zadok le, Abiathar naupa Ahimelek le, Levi mihai le thiempu chihai pahnam luhai hmaa chun a ziek a; Eleazar ta dingin pahnam khat chan chu a tlu a; Ithamar ta dingin pahnam khat chan chu a tlu bawk a."
"Now the first lot came forth to Jehoiarib, the second to Jedaiah,","Chun, aisâna pakhatna chu Jehoiarib chungah a tlah a, a pahnina Jedaia chungah,"
"the third to Harim, the fourth to Seorim,","a pathumna Harim chungah, a palina Seorim chungah;"
"the fifth to Malchijah, the sixth to Mijamin,","a pangana Malkija chungah, a parukna Mijamin chungah,"
"the seventh to Hakkoz, the eighth to Abijah,","a pasarina Hakkoz chungah, a parietna Abija chungah,"
"the ninth to Jeshua, the tenth to Shecaniah,","a pakuona Jeshua chungah, a sâwmna Sekania chungah;"
"the eleventh to Eliashib, the twelfth to Jakim,","A sâwmpakhatna Eliasib chungah, a sâwmpahnina Jakim chungah."
"the thirteenth to Huppah, the fourteenth to Jeshebeab,","A sâwmpathumna Huppa chungah, a sâwmpalina Jesebeab chungah,"
"the fifteenth to Bilgah, the sixteenth to Immer,",A sâwmpangana Bilga chungah a sâwmparukna Immer chungah;
"the seventeenth to Hezir, the eighteenth to Happizzez,","A sâwmpasarina Hezir chung- ah, a sâwmparietna Happizzez chungah."
"the nineteenth to Pethahiah, the twentieth to Jehezkel,","A sâwmpakuona Pethahia chungah, a sâwmhnina Jehezekel chungah,"
"the one and twentieth to Jachin, the two and twentieth to Gamul,","a sâwmhni pakhatna Jakin chungah, a sâwmhni pahnina Gamul chungah;"
"the three and twentieth to Delaiah, the four and twentieth to Maaziah.","A sâwmhni pathumna Delaia chungah, a sâwmhni palina Maazia chungah,"
"This was the ordering of them in their service, to come into the house of Jehovah according to the ordinance given unto them by Aaron their father, as Jehovah, the God of Israel, had commanded him.","LALPA Israelhai Pathienin ama thu a pêk anga, an thlatu Aron hmanga dân a pêk ang taka, LALPA ina rawngbâwl dinga an hung dân dinga, an rawngbâwlnaa an indawt dân chu a nih."
"And of the rest of the sons of Levi: of the sons of Amram, Shubael; of the sons of Shubael, Jehdeiah.","Chun, Levi naupasal danghai chungthua chu: Amram naupasalhai laiah Subael, Subael naupasalhai laiah Jedeia,"
"Of Rehabiah: of the sons of Rehabiah, Isshiah the chief.",Rehabia thlaah: Rehabia nau- pasalhai laiah Issia a hotu.
"Of the Izharites, Shelomoth; of the sons of Shelomoth, Jahath.",Izhar mia chun Selomoth; Selomoth naupasalhai laia chun Jahath.
"And the sons of Hebron: Jeriah the chief, Amariah the second, Jahaziel the third, Jekameam the fourth.","Chun, Hebron naupasalhaia chun: a hotu tak Jeria, a pa- hnina chu Amaria, a pathumna chu Jahaziel, a palina chu Jeka- meam."
"The sons of Uzziel, Micah; of the sons of Micah, Shamir.",Uzziel naupasalhaia chun Mika; Mika naupasalhaia chun Samir.
"The brother of Micah, Isshiah; of the sons of Isshiah, Zechariah.",Mika unaupa chu Issia; Issia naupasalhaia chun Zekaria.
The sons of Merari: Mahli and Mushi; the sons of Jaaziah: Beno.,Merari naupasalhai chu Mahli le Musi; Jaazia naupasalhaia chun Beno;
"The sons of Merari: of Jaaziah, Beno, and Shoham, and Zaccur, and Ibri.","Merari naupasala Jaazia nau- pasalhai chu: Beno, Soham, Zakkur le Ibri."
"Of Mahli: Eleazar, who had no sons.","Mahli naupasal chu: Eleazar, naupasal hrim neilo chu."
Of Kish; the sons of Kish: Jerahmeel.,Kis naupasal chu: Jerahmeel.
"And the sons of Mushi: Mahli, and Eder, and Jerimoth. These were the sons of the Levites after their fathers’ houses.","Chun, Musi naupasalhai chu: Mahli, Eder le Jerimoth. An pahnam ang peia Levi naupasalhai laia lusahai chu hienghai hi an nih."
"These likewise cast lots even as their brethren the sons of Aaron in the presence of David the king, and Zadok, and Ahimelech, and the heads of the fathers’ houses of the priests and of the Levites; the fathers’ houses of the chief even as those of his younger brother.","Hieng hai khawm hin an unau Aron naupasalhai ang bawkin, lal David, Zadok, Ahimelek, Levi mihai le thiempu pahnam luhai hmaah, an unau naupang lemhai le thlatuhai khawm inthuruolin ai chu sân a ni veh a."
"Moreover David and the captains of the host set apart for the service certain of the sons of Asaph, and of Heman, and of Jeduthun, who should prophesy with harps, with psalteries, and with cymbals: and the number of them that did the work according to their service was:","Chunawa khawm David le sipai hotuhai chun dârbenthek le, perkhuong le ṭingṭanghai le thu hril duol duola rawngbâwltu dingin Jeduthun le Heman le Asaph nau- pasalhai chu an ṭheh a; chun, an rawngbâwlna ang peia chuong sin- thawhai sinthawtuhai nizât chu hi hi a nih:"
"of the sons of Asaph: Zaccur, and Joseph, and Nethaniah, and Asharelah, the sons of Asaph, under the hand of Asaph, who prophesied after the order of the king.","Asaph naupasalhai chu: Zakkur, Josef, Nethania le Asarela hai hi Asaph naupasalhai chu an nih, lal thupêk anga Asaph hnuoia thuhril- tuhai chu."
"Of Jeduthun; the sons of Jeduthun: Gedaliah, and Zeri, and Jeshaiah, Hashabiah, and Mattithiah, six, under the hands of their father Jeduthun with the harp, who prophesied in giving thanks and praising Jehovah.","Jeduthun pâwl chu, Jeduthun naupasalhai chu Gedalia, Zeri, Jesaia, Simei, Hasabia le Mattithia hai, paruk hi an pa Jeduthun rawia ṭingṭang le LALPA chu inpâka lâwmthu hriltuhai chu an nih."
"Of Heman; the sons of Heman: Bukkiah, Mattaniah, Uzziel, Shebuel, and Jerimoth, Hananiah, Hanani, Eliathah, Giddalti, and Romamti-ezer, Joshbekashah, Mallothi, Hothir, Mahazioth.","Heman pâwl chu: Heman nau- pasalhai chu: Bukkia, Mattania, Uzziel, Sebuel, Jerimoth, Hanania, Hanani, Eliatha, Giddalti, Romamti- ezer, Josbekasa, Mallothi, Hothir le Mahazioth hai an na;"
"All these were the sons of Heman the king’s seer in the words of God, to lift up the horn. And God gave to Heman fourteen sons and three daughters.",hienghai po po hi Pathien thua saki mûta lal zâwlnei Heman nau- pasalhai an nih. Pathien chun Heman chu naupasal sâwmpali le naunuhmei pathum a pêk a.
"All these were under the hands of their father for song in the house of Jehovah, with cymbals, psalteries, and harps, for the service of the house of God; Asaph, Jeduthun, and Heman being under the order of the king.","Hienghai po po hi Pathien ina rawngbâwlnaa, ṭingṭanghai le dâr- benthekhai le perkhuonghai le LALPA ina hla pâwl dinga an pa hnuoia um an nih; Asaph hai, Jedu- thun hai, Heman hai chu lal thuhnuoiah an um sih a."
"And the number of them, with their brethren that were instructed in singing unto Jehovah, even all that were skilful, was two hundred fourscore and eight.","Chun, anni le an unauhai LAL- PA ta dinga hla sak dinga inchûk- tira uma, sak thiem tahai nizât chu za hni sâwmriet pariet an nih."
"And they cast lots for their offices, all alike, as well the small as the great, the teacher as the scholar.","Chun, a chîn ni leh, a lien ni leh, inchûktirtu le inchûktu khawm, angkhat vawngin, an thil thaw ding chu aisânin an en hlak a."
Now the first lot came forth for Asaph to Joseph: the second to Gedaliah; he and his brethren and sons were twelve:,Asaph ta dinga aisân pakhatna chu Josef chungah a tluh a; a pahnina chu Gedalia chungah; ama le a unauhai le a naupasalhai leh sâwm pahni an nih:
"the third to Zaccur, his sons and his brethren, twelve:","a pathumna chu Zakkur chungah, a naupasalhai le a unauhai leh sâwmpahni an nih."
"the fourth to Izri, his sons and his brethren, twelve:","a palina chu Izri chungah, a naupasalhai le a unauhai le chun sâwmpahni an nih;"
"the fifth to Nethaniah, his sons and his brethren, twelve:","a pangana chu Nethania chungah, a naupasalhai le a unauhai chu sâwmpahni an nih;"
