en,hmr
"What will ye? shall I come unto you with a rod, or in love and a spirit of gentleness?","A ieng am in nuom lem? Hmawltum leh am a ni in kuomah ka hung ding, hmangaina le thuhnuoi- rawl lungril putin?"
"It is actually reported that there is fornication among you, and such fornication as is not even among the Gentiles, that one of you hath his father’s wife.","Nangni lai indit a um ti ân thang veng vung a nih, chuong ang indit chu Jentailhai lai hmana um ngai lo, nangni laia mi pakhatin mâni pa nuhmei a nei kha."
"And ye are puffed up, and did not rather mourn, that he that had done this deed might be taken away from among you.","Chun, chuong thil thawtu chu nangni laia inthawka hnawtdawk dinga lungngai nêk hmanin in uong lem sih a."
"For I verily, being absent in body but present in spirit, have already as though I were present judged him that hath so wrought this thing,","Keima ngei hi taksain ka ṭhang naw nâk a, thlaraua ruok chu ka ṭhang a, chuong ang thil chuong ang lâwm lâwm thawtu chu tu khawm hin Lalpa Isu Krista hmingin nangni laia ṭhang zing angin ka lo ngaituo zo tah:"
"in the name of our Lord Jesus, ye being gathered together, and my spirit, with the power of our Lord Jesus,",nangni le ka thlarau chu ei Lalpa Isu thilthawtheinaa inkhâwmin;
"to deliver such a one unto Satan for the destruction of the flesh, that the spirit may be saved in the day of the Lord Jesus.",mi chuong ang chu a thlarau Lalpa nia chun sandamin a um theina dingin a tisa chu sukbohmang dingin Setan pe inla ka ti a nih.
Your glorying is not good. Know ye not that a little leaven leaveneth the whole lump?,"In uong san hi a ṭha nawh ie, chawl tlâwmtêin bei tlang chu a zawpsuo vawng hlak ti in hriet naw am a nih?"
"Purge out the old leaven, that ye may be a new lump, even as ye are unleavened. For our passover also hath been sacrificed, even Christ:","Chawlṭhanglo in ni ang bawkin bei tlang thar in ni theina dingin chawl hlui chu zenfai ro. Ei Fekân Ruoiṭhena ding khawm an that ta sih a, Krista ngei chu;"
"wherefore let us keep the feast, not with old leaven, neither with the leaven of malice and wickedness, but with the unleavened bread of sincerity and truth.","chuleiin, ruoi ṭhêng ei tiu, chawl hluia ṭhe loin, nunsiet le suolna chawla ṭhe bawk loin, takna le indikna chawlṭhanglo beiin ruoi ṭhe lem ei tiu."
I wrote unto you in my epistle to have no company with fornicators;,Ka lekhathawna khan indit hmanghai pâwl lo dingin in kuomah ka ziek kha;
"not at all meaning with the fornicators of this world, or with the covetous and extortioners, or with idolaters; for then must ye needs go out of the world:","hi khawvêla indit hmanghai amanih, duâm le hlêpruhai amanih, milim betuhai amani chu pâwl dêr lo ding ti ka ni nawh a, chuongchu ni sien la khawvêla inthawka fe suok ngei ding in ni ding a ni sih a."
"but as it is, I wrote unto you not to keep company, if any man that is named a brother be a fornicator, or covetous, or an idolater, or a reviler, or a drunkard, or an extortioner; with such a one no, not to eat.","Tu ruok hin chu tûkhawm unau hming input siin indit hmang mi amanih, mi duâm amanih, milim betu amanih, inhalhmang amanih, zu inruihmang mi amanih, hlêpru mi amani ni sienla, pâwl lo dingin in kuomah ka ziek a nih; chuong ang mi kuoma chun a fâk khawm fa lo dingin."
For what have I to do with judging them that are without? Do not ye judge them that are within?,Puotienga mi chu keiin ka ngaituona ding iengam a um a?
But them that are without God judgeth. Put away the wicked man from among yourselves.,Nangniin sûngtienga mi in ngaituoin puotienga mihai ruok chu Pathienin a ngaituo hlak a ni naw am a nih? chu mi suol chu nangni laia inthawkin hnawt dawk ro.
"Dare any of you, having a matter against his neighbor, go to law before the unrighteous, and not before the saints?",Nangni laia tûkhawmin mi dang chungah thubuoi nei unla mi inthienghai hmaa tlun loin mi felnawhai hmaah in tlun ngam ding am a nih?
"Or know ye not that the saints shall judge the world? and if the world is judged by you, are ye unworthy to judge the smallest matters?","Anleh, mi inthienghai chun khawvêl hi an ngaituo ding a nih ti in hriet naw am a nih? Chun, khawvêl hman hi in ngaituoa um ding a ni chun, thil chîntakhai khawm chu ngaituo tlâklo in ni ding am a nih?"
"Know ye not that we shall judge angels? how much more, things that pertain to this life?","Tulai dam sûng khawsak thu chu hrillo, vântirkohai chen khawm ei ngaituo ding a nih ti in hriet naw am a nih?"
"If then ye have to judge things pertaining to this life, do ye set them to judge who are of no account in the church?","Chuongchun, tulai dam sûng khawsak thuhai ngaituo ding in neiin kohran laia mi hmusitumhai chu in inngaituotir hlak am a nih?"
"I say this to move you to shame. What, cannot there be found among you one wise man who shall be able to decide between his brethren,","In inzakna dingin ka hril a nih. A unau kâra thu sukthlu thei, mi var pakhat bêk nangni lai in hmu thei naw nîng a ti maw!"
"but brother goeth to law with brother, and that before unbelievers?",Unauin a unau rorêlnaa ân tlun hlak hi? Awilohai hmaah a ni nâwk nghâl sih a.
"Nay, already it is altogether a defect in you, that ye have lawsuits one with another. Why not rather take wrong? why not rather be defrauded?","Anih, hi hi in fel zo zânnawna pakhat chu a ni pang el, thubuoi in nei intuo hlak hi. Iengdinga in- diknawtaka thawna chu in tuor lem el naw am a na? Iengdinga suk- dâwngna chu in tuor el naw?"
"Nay, but ye yourselves do wrong, and defraud, and that your brethren.","Anih, nangni ngei khawmin in unauhai chungah in sukdik nawh a, in sukdâwng hlak."
"Or know ye not that the unrighteous shall not inherit the kingdom of God? Be not deceived: neither fornicators, nor idolaters, nor adulterers, nor effeminate, nor abusers of themselves with men,","Anleh, mi felnawhai chun Pathien ram hluo naw ni hai ti in hriet naw am a nih? Hlêmin um naw ro; indithmanghai amanih, milim betuhai amanih, uirehai amanih, mihurhai amanih, mawngkawhurhai amanih,"
"nor thieves, nor covetous, nor drunkards, nor revilers, nor extortioners, shall inherit the kingdom of God.","inruhmanghai amanih, mi du- âmhai amanih, zu inruihmanghai amanih, inhalhmanghai amanih, hlêpruhaiin amanih Pathien ram hluo naw ni hai."
"And such were some of you: but ye were washed, but ye were sanctified, but ye were justified in the name of the Lord Jesus Christ, and in the Spirit of our God.","Chun, nangni ṭhenkhat chuong ang mi in ni hlak kha; nisienla- khawm, Lalpa Isu Krista hminga le ei Pathien Thlaraua sâwpfai in ni tah a, sukthieng in ni tah a, thiemchang in ni tah."
All things are lawful for me; but not all things are expedient. All things are lawful for me; but I will not be brought under the power of any.,"Thil iengkim thaw ka ta dingin a thieng a; nisienlakhawm, thil iengkim thaw a ṭha kher nawh; thil iengkim thaw ka ta dingin a thieng a; nisienlakhawm, ieng thu hnuoia um khawm kân phal nawh."
"Meats for the belly, and the belly for meats: but God shall bring to nought both it and them. But the body is not for fornication, but for the Lord; and the Lord for the body:","Fâk dinghai chu phîng ta ding a na, phîng chu fâk dinghai ta ding a nih; nisienlakhawm, Pathienin sukbo ve vêng a tih. Chun, taksa hi inditna ding a ni nawh a, Lalpa ta ding a ni lem: Lalpa khawm chu taksa ta ding a nih."
"and God both raised the Lord, and will raise up us through his power.","Pathienin Lalpa chu a keitho a, eini khawm a thilthawtheinain mi keitho vêng a tih."
"Know ye not that your bodies are members of Christ? shall I then take away the members of Christ, and make them members of a harlot? God forbid.",In taksahai chu Krista pênghai a nih ti in hriet naw am a nih? Krista pênghai chu lâkpêkin nawchizawr pênghaiah ka siem ding am a nih? Teu lo e!
"Or know ye not that he that is joined to a harlot is one body? for, The twain, saith he, shall become one flesh.","Anleh, nawchizawr zawmpui chu ama leh pumkhat an nih ti in hriet naw am a nih? “An pahniin tisa pumkhat hung ni tâng an tih” ti ziek a ni sih a."
But he that is joined unto the Lord is one spirit.,Lalpa inzawmpui ruok chu ama leh Thlarau pumkhat an nih.
Flee fornication. Every sin that a man doeth is without the body; but he that committeth fornication sinneth against his own body.,Indit hi tlânsan ro. Mihriem isuksuol tinrêng hi taksa puotiengah a nih; mi dithmang ruok chun ama taksa chungah a suksuol a nih.
"Or know ye not that your body is a temple of the Holy Spirit which is in you, which ye have from God? and ye are not your own;","Anleh, in taksa chu in sûnga um Pathien kuoma inthawka in hmu Thlarau Inthieng in a ni ti in hriet naw am a nih? Mâni ta khawm in ni nawh a,"
for ye were bought with a price: glorify God therefore in your body.,"mana inchâwk in ni tah in sawnnaw; chuleiin, in taksaa chun Pathien chawimawi ro."
Now concerning the things whereof ye wrote: It is good for a man not to touch a woman.,"Chun, in thil ziek thuhai kha: Pasal ta dingin nuhmei tâwklo a ṭha a nih. “Pasalin nuhmei a nei naw chun a thaw ṭha a nih,” in tih a."
"But, because of fornications, let each man have his own wife, and let each woman have her own husband.","Nisienlakhawm, inditnahai a um hlak leiin pasalin nuhmei bîk nei seng hai sienla, nuhmei khawmin pasal bîk nei seng raw hai se."
Let the husband render unto the wife her due: and likewise also the wife unto the husband.,Pasal chun a nuhmei kuomah a chan ding tâwk chu pe raw se; chuong ang bawkin nuhmei khawma pasal kuomah a chan ding tâwk chu pe bawk raw se.
"The wife hath not power over her own body, but the husband: and likewise also the husband hath not power over his own body, but the wife.","Nuhmei chun ama taksa chungah thu a nei nawh a, a pasal chun thu a nei lem a nih; chuong ang bawkin pasal khawm chun mâni taksa chungah thu a nei nawh a, a nuhmei chun thu a nei lem a nih."
"Defraud ye not one the other, except it be by consent for a season, that ye may give yourselves unto prayer, and may be together again, that Satan tempt you not because of your incontinency.","Ṭawngṭai dinga in inpêk theina ding le in inpâwl nâwk theina dingin sâwt nawtê kâr dinga rem in ti ve ve chau naw chun atu tu khawm insukdâwng naw ro, chuong naw chun, in insûm zo naw leiin Setanin thlêm a ti cheu."
"But this I say by way of concession, not of commandment.","Nisienlakhawm, hi thu hi thupêk ang tienga ka hril a ni nawh a, phal tieng thua ka hril lem a nih."
"Yet I would that all men were even as I myself. Howbeit each man hath his own gift from God, one after this manner, and another after that.","Nisienlakhawm, mi po po keia angtak hin um vawng hai sien ka nuom a nih. Amiruokchu, mi tinin Pathien kuoma inthawkin thilpêk mâni hmu zâwng an nei seng a nih; pakhatin kawng dangin, a dangin kawng dangin."
"But I say to the unmarried and to widows, It is good for them if they abide even as I.","Nisienlakhawm, lêngṭulhai le hmeithaihai kuoma chun hi ka ti a nih; keia angtak hin um hai sien an ta dingin ṭhâng a tih."
"But if they have not continency, let them marry: for it is better to marry than to burn.","Insûm theina an nei naw chun innei el raw hai se, hur nêkin innei a ṭha lem sih a."
"But unto the married I give charge, yea not I, but the Lord, That the wife depart not from her husband","Chun, innei sahai kuoma chun thu ka pêk (Keia pêk ruok chu ni loin Lalpa pêk a ni lem): Nuhmei chun a pasal ṭhe naw raw se;"
"(but should she depart, let her remain unmarried, or else be reconciled to her husband); and that the husband leave not his wife.","nisienlakhawm, a ṭhe nghâl nghâl chun pasal nei ta loin um law law raw se, annawleh, a pasal le bawk inrem nâwk raw se; chun, pasal chun a nuhmei ma naw raw se."
"But to the rest say I, not the Lord: If any brother hath an unbelieving wife, and she is content to dwell with him, let him not leave her.","Mi dang kuoma ruok chun Lalpa ni loin keiin ka hril: Unau tûkhawmin nuhmei awilo mi nei sienla, ama chun a kuoma um zing a lungni phawt chun ma naw raw se."
"And the woman that hath an unbelieving husband, and he is content to dwell with her, let her not leave her husband.","Chun, nuhmei pasal awilo mi nei chun, a pasalin a kuoma um zing a lungni phawt chun, ṭhe naw raw se."
"For the unbelieving husband is sanctified in the wife, and the unbelieving wife is sanctified in the brother: else were your children unclean; but now are they holy.","Pasal awilo mi chu a nuhmei zârah sukthiengin a um a, nuhmei awilo mi khawm chu a pasal zâra sukthiengin a um bawk a nih; chuong ang chu ni naw sien chu in nauhai chu inthieng naw nihai; nisienla- khawm, an inthieng zing a nih."
"Yet if the unbelieving departeth, let him depart: the brother or the sister is not under bondage in such cases: but God hath called us in peace.","Nisienlakhawm, a awinaw lemin a ṭhe chun ṭhe el raw se, chuong anga chun chu unaupa amanih, farnu amanih hrên an ni ta nawh. Pathien ruok chun inremnaah a mi ko a nih."
"For how knowest thou, O wife, whether thou shalt save thy husband? or how knowest thou, O husband, whether thou shalt save thy wife?","Aw nuhmei, i pasal i sandam ding le ding naw iengtin am i hriet leh? Aw pasal, i nuhmei i sandam ding le ding naw iengtin am i hriet leh?"
"Only, as the Lord hath distributed to each man, as God hath called each, so let him walk. And so ordain I in all the churches.","Iengkhawm ni sienla, Lalpa chun mi tin kuoma a sem pângngai ang seng le, Pathienin mi tin a kona pângngai ang sengah um raw se. Chuong ang chun kohranhai po poah ka ruot hlak."
Was any man called being circumcised? let him not become uncircumcised. Hath any been called in uncircumcision? let him not be circumcised.,Sertan ta hnung ko an um am? Sertan naw mi ni naw raw se. Sertan loa um ko an um am? Ser intantir naw raw se.
"Circumcision is nothing, and uncircumcision is nothing; but the keeping of the commandments of God.","Pathien thupêkhai pawm chau naw chu sertan hi iengkhawm a ni nawh a, sertan naw khawm iengkhawm a ni chuong nawh."
Let each man abide in that calling wherein he was called.,Mi tin koa an um laia an chan pângngaia chun um zing seng raw se.
"Wast thou called being a bondservant? care not for it: nay, even if thou canst become free, use it rather.",Suoka i um ko am i nih? chu chu ngaituo nuom naw rawh; i suok thei si ruok chun hmang lem rawh.
"For he that was called in the Lord being a bondservant, is the Lord’s freedman: likewise he that was called being free, is Christ’s bondservant.","Suoka um Lalpaa ko chu Lalpa insuoktir suok a ni sih a, chuong ang bawk chun suok ni loa koa um chu Krista suok a nih."
Ye were bought with a price; become not bondservants of men.,Mana inchâwk in ni tah; mihriemhai suokah lût naw ro.
"Brethren, let each man, wherein he was called, therein abide with God.","Unauhai, mi tin koa in um laia in chan pângngaia chun Pathien kuomah um zing seng ro."
"Now concerning virgins I have no commandment of the Lord: but I give my judgment, as one that hath obtained mercy of the Lord to be trustworthy.","Chun, nunghâk inthieng tieng thua ruok chun Lalpa thupêk hrim ka nei nawh a; nisienlakhawm, ringuma um dinga Lalpa kuoma inthawka lunginsietna hmu ka ni leiin ka ngaituo ang hril ka tih."
"I think therefore that this is good by reason of the distress that is upon us, namely, that it is good for a man to be as he is.","Chuongchun, tulai rinumna lei hin hi hi ṭhain ka ring, mi a um ngaia a um zing hi."
Art thou bound unto a wife? seek not to be loosed. Art thou loosed from a wife? seek not a wife.,Nuhmeia khuopde i ni am a nih? Sûtna zawng naw rawh. Nuhmeia khuopde naw i ni am? Nuhmei zawng naw rawh.
"But shouldest thou marry, thou hast not sinned; and if a virgin marry, she hath not sinned. Yet such shall have tribulation in the flesh: and I would spare you.","Nisienlakhawm, nuhmei i nei chun thil i suksuol nawh, nunghâk inthieng khawma pasal a nei chun thil a suksuol chuong nawh. Amiruokchu, chuong ang mi chun tisaa chun rinum tuor a tih, nisienla- khawm, kei ruok chun intuortir naw cheu ka nuom a nih."
"But this I say, brethren, the time is shortened, that henceforth both those that have wives may be as though they had none;","Amiruokchu, unauhai, hi hi ka ti a nih; hun hi suktâwiin a um a nih, tuta hnung chu, nuhmei neihai chu neinaw anga an um theina ding le,"
"and those that weep, as though they wept not; and those that rejoice, as though they rejoiced not; and those that buy, as though they possessed not;","ṭaphai chu ṭapnawhai anga an um theina ding le, lâwmhai chu lâwmnaw anga an um theina ding le; inchawtuhai chu neinaw anga an um theina ding le,"
"and those that use the world, as not using it to the full: for the fashion of this world passeth away.",khawvêl hmangtuhai chu hmang taluo loa an um theina dingin; hi khawvêl umdan hi a bohmang mêk a nih.
"But I would have you to be free from cares. He that is unmarried is careful for the things of the Lord, how he may please the Lord:","Nisienlakhawm, lungkham nei loa in um ka nuom pêk cheu a nih, nuhmei neinaw chun Lalpa suklâwm theina ding zie ngaituoin Lalpa tieng thil chu a lungkham hlak."
"but he that is married is careful for the things of the world, how he may please his wife,",Nuhmei nei ruok chun a nuhmei suklâwm theina dingzie ngaituoin khawvêl tieng thil chu a lungkham lem hlak.
"and is divided. So also the woman that is unmarried and the virgin is careful for the things of the Lord, that she may be holy both in body and in spirit: but she that is married is careful for the things of the world, how she may please her husband.","Chun, pasal nei le nunghâk inthieng chu an inang bawk nawh a; pasal neinaw chun a taksa le a thla- raua inthiengtaka a um theina dingin Lalpa tieng thil chu a lungkham hlak a, pasal nei ruok chun a pasal suk- lâwm theina dingzie ngaituoin khawvêl tieng thil a lungkham lem hlak."
"And this I say for your own profit; not that I may cast a snare upon you, but for that which is seemly, and that ye may attend upon the Lord without distraction.","Chuong chu nangni ṭhatna dinga ka hril a nih; hruia ka khit theina ding cheua ka hril a ni nawh a, umdân mawi tâwka in um theina ding le, Lalpa rawng chu buoi loa in bâwl theina dingin ka hril lem a nih."
"But if any man thinketh that he behaveth himself unseemly toward his virgin daughter, if she be past the flower of her age, and if need so requireth, let him do what he will; he sinneth not; let them marry.","Amiruokchu, tûkhawmin a nau nunghâk inthieng ân lêng sâwttir kawnga a sukdik naw a ân hriet chun, ama chu a vânglai a na, a ṭul bawk si chun a thaw nuom chu thaw raw se, thil a suksuol nawh, inneitir el raw se."
"But he that standeth stedfast in his heart, having no necessity, but hath power as touching his own will, and hath determined this in his own heart, to keep his own virgin daughter, shall do well.","Nisienlakhawm, lungril dettak puta, ṭul ti loa, ama nuom zâwng ruok chu hlen theia, a nau nunghâk inthieng chu kawl zing a lungrila tum tlattu chun thaw ṭha lem a tih."
So then both he that giveth his own virgin daughter in marriage doeth well; and he that giveth her not in marriage shall do better.,"Chuongchun, pasal inneitirtu chun a thaw ṭha, nisienlakhawm ân neitir nawtu chun a thawṭha nâwk zuol a nih."
"A wife is bound for so long time as her husband liveth; but if the husband be dead, she is free to be married to whom she will; only in the Lord.","Nuhmei chu a pasal dam sûng po po chu phuor a na; nisienlakhawm, a pasal a thi ta chun a nuom nuom nei thei a tih; amiruokchu, Lalpaa um mi a ni ding a nih."
"But she is happier if she abide as she is, after my judgment: and I think that I also have the Spirit of God.","Nisienlakhawm, keia ngai chun, a um ngaia a um zing chun hamṭha lem a tih; kei khawm Pathien Thlarau chu nei ve bawkin kân ring a nih."
"Now concerning things sacrificed to idols: We know that we all have knowledge. Knowledge puffeth up, but love edifieth.","Chun, milimhai kuoma inthâwina thilhai thu kha chu: Ei rêngin hrietna ei nei seng ti ei inhriet a. Hrietna hin chu mi a sukuong hlak a, lunginsietna ruok chun mi a siem ṭha hlak."
"If any man thinketh that he knoweth anything, he knoweth not yet as he ought to know;","Tûkhawmin thil ieng amani hrea ân ngai chun, a hriet ding ang chu a la hriet nawh a;"
"but if any man loveth God, the same is known by him.","amiruokchu, mi tûkhawmin Pathien a hmangai chun, chu ngei chu ama ihriet a nih."
"Concerning therefore the eating of things sacrificed to idols, we know that no idol is anything in the world, and that there is no God but one.","Chuongchun, milimhai kuoma inthawina thil fâk kawnga chu, khawvêla hin milim hrim hrim chu iengkhawm an ni nawzie le, pakhat chau naw chu Pathien dang hrim an um naw chu ei hriet a."
"For though there be that are called gods, whether in heaven or on earth; as there are gods many, and lords many;","Vâna manih, hnuoia manih pathien hmingput um hai sien- khawm, (chuong ang pathien tamtak le lalpa tamtak an um sih a,)"
"yet to us there is one God, the Father, of whom are all things, and we unto him; and one Lord, Jesus Christ, through whom are all things, and we through him.","Eini ta ding chun Pathien pakhat chau (Pa chu) a um a, ama kuoma inthawkin tinrêng a suok a, eini khawm ama ta dinga um ei nih; Lalpa pakhat chau (Isu Krista chu) a um bawk a, ama leiin iengkim a um a, eini khawm ama lei bawka um ei nih."
"Howbeit there is not in all men that knowledge: but some, being used until now to the idol, eat as of a thing sacrificed to an idol; and their conscience being weak is defiled.","Amiruokchu, chu hrietna chu mi po po kuomah a um nawh, chuongchun, mi ṭhenkhatin tu chen hin milim be ṭhang an ni leiin, milim kuoma inthâwina thil angtaka ngaiin an fâk hlak; chuongchun, an sie le ṭha hrietna chu a hrât naw leiin a hung inthiengnaw hlak."
"But food will not commend us to God: neither, if we eat not, are we the worse; nor, if we eat, are we the better.","Nisienlakhawm, fâk ding hin Pathien mit mîn tlungtir chuong naw ni; fa naw inla khawm se chuong naw bawk ei tih; fa inla khawm ṭha chuong naw bawk ei tih."
But take heed lest by any means this liberty of yours become a stumblingblock to the weak.,"Nisienlakhawm, fîmkhur ro, chuong naw chun, nuom nuoma in tlat theina hi mi hrâtnawhai ta dingin tlûkna ni rawi a tih."
"For if a man see thee who hast knowledge sitting at meat in an idol’s temple, will not his conscience, if he is weak, be emboldened to eat things sacrificed to idols?","Nang hrietna nei mi, tûkhawm- in milim biekna ina thlaithlêng awta an hmu si che chun, anni chu mi hrâtnaw lo ni hai sienla an sie le ṭha hrietna chun milim kuoma inthâwina thil fâk a hung ngam ding a ni naw am a nih?"
"For through thy knowledge he that is weak perisheth, the brother for whose sake Christ died.","Chuongchun, i hrietna lei chun mi hrâtnaw (unau a thi ai Kristain a thipêk) chu suksietin um a tih."
"And thus, sinning against the brethren, and wounding their conscience when it is weak, ye sin against Christ.","Unauhai chungah chuong ang thil in suksuola, an sie le ṭha hrietna a hrât naw nâklai, in inhliem hlau chun, Krista chungah thil in suksuol a nih."
"Wherefore, if meat causeth my brother to stumble, I will eat no flesh for evermore, that I cause not my brother to stumble.","Chuleiin, fâk dingin ka unau a sukthlûk chun, ka unau ka sukthlûk nawna dingin kumkhuoin sa hrim hrim fa ta naw ning."
Am I not free? am I not an apostle? have I not seen Jesus our Lord? are not ye my work in the Lord?,Zalên ka ni naw am a nih? Tirko ka ni naw am a nih? Ei Lalpa Isu chu ka hmu ta naw am a nih? nangnirawi chu Lalpaa ka sinthaw in ni naw am a nih?
"If to others I am not an apostle, yet at least I am to you; for the seal of mine apostleship are ye in the Lord.","Mi danghai ta dingin tirko ni naw lang khawm, nangni ta ding bêk chun ka nih; Lalpaa ka tirko nina inchikna chu nangni hi in nih in sawnnaw."
My defence to them that examine me is this.,A mi suosaltuhai ka idawnna chu hi a nih.
Have we no right to eat and to drink?,Fa le dâwn dingin thu kan nei naw am a nih?
"Have we no right to lead about a wife that is a believer, even as the rest of the apostles, and the brethren of the Lord, and Cephas?","Tirko danghai le Lalpa unauhai le, Kipha ang khan ringtu nuhmei ṭhuoi vêl dingin"
"Or I only and Barnabas, have we not a right to forbear working?",kei le Barnabain thu kan nei naw bîk am a nih?
"What soldier ever serveth at his own charges? who planteth a vineyard, and eateth not the fruit thereof? or who feedeth a flock, and eateth not of the milk of the flock?","Sipai tu am mâni inchâwm fâwmin râl kâp hlak an um a? Tuin am a ra fa si loin Grêp huon a siem hlak leh? Annawleh, tuin am ranruol nênetui dâwn si loin ranruol a vai hlak a?"
Do I speak these things after the manner of men? or saith not the law also the same?,Chuong thu chu mihriem ang elin ka hril am a nih? Dân thu khawmin chuong ngei chu a hril tho ni lo am a nih?
"For it is written in the law of Moses, Thou shalt not muzzle the ox when he treadeth out the corn. Is it for the oxen that God careth,","Mosie Dân Lekhabua chun, “Sebâwng chalin bu a chîl lai chun a hmûr khit naw rawh,” ti ziek a ni sih a. Pathienin sebâwng chal am a ni a ngaituo tak chu?"
