en,hmr
"Paul, called to be an apostle of Jesus Christ through the will of God, and Sosthenes our brother,","Paula, Pathien ditzâwnga Isu Krista tirko dinga ko le unaupa Sosthen chun:"
"unto the church of God which is at Corinth, even them that are sanctified in Christ Jesus, called to be saints, with all that call upon the name of our Lord Jesus Christ in every place, their Lord and ours:","Korintha Pathien kohran umhai, Krista Isua sukthieng, mi inthieng ni dinga kohai kuomah, ram tina ei Lalpa (anni le eini Lalpa) Isu Krista hming lamtuhai po po kuoma leh."
Grace to you and peace from God our Father and the Lord Jesus Christ.,Pathien ei Pa le Lalpa Isu Krista kuoma inthawkin lunginsietna le inremna in kuomah um raw se.
"I thank my God always concerning you, for the grace of God which was given you in Christ Jesus;",Krista Isua Pathien lunginsietna in kuoma pêka um lei khan in chungthuah Pathien kuomah lâwm- thu ka hril rawp hlak a nih.
"that in everything ye were enriched in him, in all utterance and all knowledge;","Iengkimah, thu hril tinrêng le hrietna tinrêngah amaa chun suk- hausaa in um thua khan;"
even as the testimony of Christ was confirmed in you:,"chuongchun, Krista thu inhriet- tira um kha nangnia sukdetin a um kha;"
so that ye come behind in no gift; waiting for the revelation of our Lord Jesus Christ;,"chuongchun, ei Lalpa Isu Krista inlârna nghâkin thilpêk hrim hrimah in hlawtling naw nawh a."
"who shall also confirm you unto the end, that ye be unreproveable in the day of our Lord Jesus Christ.",Ama chun ei Lalpa Isu Krista niah sawisêlboa in um theina dingin a tâwp chenin sukdet bawk a ti cheu.
"God is faithful, through whom ye were called into the fellowship of his Son Jesus Christ our Lord.",Pathien a Naupa ei Lalpa Isu Krista pâwlnaa ko lûttu cheu kha ring a um a nih.
"Now I beseech you, brethren, through the name of our Lord Jesus Christ, that ye all speak the same thing, and that there be no divisions among you; but that ye be perfected together in the same mind and in the same judgment.","Chun, unauhai, in rênga thu hmunkhat in hril a, nangni lai inṭhena hrim a um nawna dingin, lungril hmunkhat le ngaituo hmunkhata feltaka in inzawm tlat lemna dingin ei Lalpa Isu Krista hmingin ka ngên cheu."
"For it hath been signified unto me concerning you, my brethren, by them that are of the household of Chloe, that there are contentions among you.","Ka unauhai, in chungchâng thu chu, nangni lai insêlnahai a um ti Kloi sûnghai chun an mi hril a nih."
"Now this I mean, that each one of you saith, I am of Paul; and I of Apollos; and I of Cephas; and I of Christ.","Hi hi a nih ka ti chu: Mi tinin, “Kei Paula pâwl ka nih,” “Kei Appolo pâwl ka nih,” “Kei chu Kipha pâwl ka nih,” “Kei chu Krista pâwl ka nih,” in ti tâwl hi."
Is Christ divided? was Paul crucified for you? or were ye baptized into the name of Paul?,"Krista chu ṭhein a um am a nih? Paula in aia hemdein a um am a nih? Annawleh, Paula hminga baptis- in in um am a nih?"
"I thank God that I baptized none of you, save Crispus and Gaius;","Krispa le Gaia naw chu nangni lai tûkhawm ka baptis naw leiin Pathien kuomah lâwmthu ka hril hlak a nih,"
lest any man should say that ye were baptized into my name.,"chuong naw chun, keima hminga baptis in nih ti hril rawi an tih."
"And I baptized also the household of Stephanas: besides, I know not whether I baptized any other.","Stephan sûnghai ruok chu ka baptis bawk a, chuonghai naw chu mi dang ka baptis am ka hriet nawh."
"For Christ sent me not to baptize, but to preach the gospel: not in wisdom of words, lest the cross of Christ should be made void.","Krista chun baptis dingin a mi tir si nawh, Chanchin Ṭha chu hril dingin a mi tir lem a nih; thu vara hril loin; chuong naw chun, Krista kraws chu iengkhawm ni loin inchangtir rawi an tih."
For the word of the cross is to them that perish foolishness; but unto us who are saved it is the power of God.,"Kraws thu chu bohmang zinghai ta ding chun invêtna a ni sih a, eini sandam zinghai ta ding ruok chun Pathien thilthawtheina a ni lem."
"For it is written, I will destroy the wisdom of the wise, And the discernment of the discerning will I bring to nought.","“Mi var varna chu sukbohmang ka ta, Remhre remhrietna chu peithlâng ka tih,” ti ziek a ni sih a."
Where is the wise? where is the scribe? where is the disputer of this world? hath not God made foolish the wisdom of the world?,Mi var chu khâwlai am a um a? Dân hre mi khawm chu khâwlai am a um a? Hi khawvêla sêltu chu khâwlai am a um a? Pathienin khawvêl varna hi invêtthlâk a nih ti ân hriettir naw am a nih?
"For seeing that in the wisdom of God the world through its wisdom knew not God, it was God’s good pleasure through the foolishness of the preaching to save them that believe.",Pathien varnaa chun khawvêlin varna hmanga Pathien an hmu thei naw hnungin thu hril invêt hmanga a ringtuhai sandam chu Pathienin ṭha a ti hle sih a.
"Seeing that Jews ask for signs, and Greeks seek after wisdom:","Judahai chun inchikna an phût hlak, Grik mihai khawma varna an zawng bawk hlak;"
"but we preach Christ crucified, unto Jews a stumblingblock, and unto Gentiles foolishness;","keini ruok chun Krista hemdea um thu chu kan hril lem hlak a ni hi; chu chu Judahai ta dingin tlûkna, Jentailhai ta dingin invêtna a nih."
"but unto them that are called, both Jews and Greeks, Christ the power of God, and the wisdom of God.","Amiruokchu, Judahai khawm ni sienla, Grikhai khawm ni sienla, kohai ta ding chun Krista Pathien thilthawtheina le Pathien varna chu a nih."
Because the foolishness of God is wiser than men; and the weakness of God is stronger than men.,"Pathien invêtna chu mihriem varna nêkin a var lem a, Pathien hrâtnawna khawm mihriem hrâtna nêkin a hrât lem sih a."
"For behold your calling, brethren, that not many wise after the flesh, not many mighty, not many noble, are called:","Unauhai, a kona cheu hi ngaituo ta u, tisa tienga mi var tamtakhai, mi hrât tamtakhai, mi ṭha tamtakhai ko an ni naw zie hi;"
"but God chose the foolish things of the world, that he might put to shame them that are wise; and God chose the weak things of the world, that he might put to shame the things that are strong;","nisienlakhawm, Pathienin khawvêl thil invêthai chu a thlang lem a, mi varhai chu a sukmuolpho theina dingin;"
"and the base things of the world, and the things that are despised, did God choose, yea and the things that are not, that he might bring to nought the things that are:","chun, khawvêl thil sie le hmusitumhai, thil umnawhai chenin a thlang a, thil umsahai chu ieng- khawm ni loa a siem theina dingin;"
that no flesh should glory before God.,"chuongchun, Pathien hmaah mi tûkhawm insuong thei naw ni hai."
"But of him are ye in Christ Jesus, who was made unto us wisdom from God, and righteousness and sanctification, and redemption:","Nangni ruok chu ama zârah, Krista Isua chun in um a nih; ama chu Pathien kuoma inthawka ei ta dinga varnaa siem a nih, felnaa dâm, inthiengnaa dâm, intlannaa dâm leh."
"that, according as it is written, He that glorieth, let him glory in the Lord.","Chuongchun, an ziek ang khan, “A suong taphawt chun Lalpa chu suong raw seh.”"
"For I would not, brethren, have you ignorant, that our fathers were all under the cloud, and all passed through the sea;","Unauhai, hieng hi in hriet naw ka nuom nawh ie, khânga ei thlatuhai po po sûm hnuoiah an um vawng a, an rênga tuisuoriet khawm an kai vawng a;"
and were all baptized unto Moses in the cloud and in the sea;,"an rênga sûma le tuisuorieta khawm Mosie bêl dinga baptisa an um vawng a,"
and did all eat the same spiritual food;,"an rêngin thlarau tieng bu hmunkhat khawm an fâk seng a,"
and did all drink the same spiritual drink: for they drank of a spiritual rock that followed them: and the rock was Christ.,an rêngin thlarau tieng dâwn ding hmunkhat khawm an dâwn seng kha; anni zuitu thlarau tieng lungpuia kha an dâwn seng kha; chu lungpui chu Krista a nih.
Howbeit with most of them God was not well pleased: for they were overthrown in the wilderness.,"Nisienlakhawm, anni laia mi tam lem chunga chun Pathien a lung- ni ta nawh a, thlalêra khan tluhlumin an um a."
"Now these things were our examples, to the intent we should not lust after evil things, as they also lusted.","Chun, chuong chu eini ta dingin inentirna a nih, thil suol an châk ang bawk khan ei châk ve nawna dingin."
"Neither be ye idolaters, as were some of them; as it is written, The people sat down to eat and drink, and rose up to play.","Anni laia mi ṭhenkhat milim betu an ni ang khan milim betu ni naw ro, “mipui chu fa le dâwn dingin an ṭhung tâwl a, infiem dingin an tho nâwk a,” ti ziek ang khan."
"Neither let us commit fornication, as some of them committed, and fell in one day three and twenty thousand.","Anni laia mi ṭhenkhatin nu- nghâk an dit a, ni khata sîng hni le sâng thumin an tlûkhlum pha ang khan, in dit ve nâwng ei tiu."
"Neither let us make trial of the Lord, as some of them made trial, and perished by the serpents.","Anni laia mi ṭhenkhatin Lalpa an fieh a, rûla sukbohmanga an um pha ang khan Lalpa chu fie nâwng ei tiu."
"Neither murmur ye, as some of them murmured, and perished by the destroyer.","Anni laia ṭhenkhat an chier a, sukbohmangtu sukbohmanga an um ang khan chier naw bawk ei tiu."
"Now these things happened unto them by way of example; and they were written for our admonition, upon whom the ends of the ages are come.","Chun, chuong chu inentirna dingin an chungah a hung tlung a ni kha; eini hun tâwp hung tlungnahai hi mi zil dingin an ziek a n i bawk a."
Wherefore let him that thinketh he standeth take heed lest he fall.,"Chuleiin, ngîra inring chu fimkhur raw se; chuong naw chun, tlu rawi a tih."
"There hath no temptation taken you but such as man can bear: but God is faithful, who will not suffer you to be tempted above that ye are able; but will with the temptation make also the way of escape, that ye may be able to endure it.",Mihriem ituor thei ang bâk chu thlêmna hrim hrim in chungah a tlung ngai nawh. Pathien chu a ringum a nih; ama chun in tuor thei bâk chu thlêmna in tuor phal naw ni; in tuor theina dingin thlêmna ruolin tlân suokna lampui siem nghâl lem a tih.
"Wherefore, my beloved, flee from idolatry.","Chuleichun, ka idittakhai, mi- lim biek hi tlânsan ro."
I speak as to wise men; judge ye what I say.,Mi varhai kuoma hril angin ka hril a nih; ka thu hril hi ngaituo ro.
"The cup of blessing which we bless, is it not a communion of the blood of Christ? The bread which we break, is it not a communion of the body of Christ?","Malsâwmna no mal ei isâwm hlak hi, Krista thisen inṭawmpuina a ni naw am a nih? Bei ei khawi hlak hi Krista taksa inṭawmpuina a ni naw am a nih?"
"seeing that we, who are many, are one bread, one body: for we all partake of the one bread.","Eini mi tamtak hi, bei tlang khat, taksa pumkhat ei ni hi; ei rêngin bei tlang khata inthawkin ei chang seng sih a."
Behold Israel after the flesh: have not they that eat the sacrifices communion with the altar?,Tisa tienga Israelhai chu en ta u; inthâwina sa fatuhai chun mâi- châm chu an inṭawmpui a ni naw am a nih?
"What say I then? that a thing sacrificed to idols is anything, or that an idol is anything?",Ieng am a na ka hril? Milim hmaa thil inhlân chu hlutna nei thil am a nih? Milim khawm chu thil tlâktlai am a ni?
"But I say, that the things which the Gentiles sacrifice, they sacrifice to demons, and not to God: and I would not that ye should have communion with demons.","Jentailhai inthâwina chu Pathien kuomah ni loin, khawhrihai kuomah an inthâwi hlak ti ka hril lem a nih; nangnirawi chu khawhrihai in inṭawmpui ka nuompêk naw cheu a ni hi."
"Ye cannot drink the cup of the Lord, and the cup of demons: ye cannot partake of the table of the Lord, and of the table of demons.","Lalpa no le khawhri no dâwn kawp thei naw ti niu, Lalpa dawkâna le khawhri dawkâna chu fa kawp thei naw bawk in tih."
Or do we provoke the Lord to jealousy? are we stronger than he?,"Annawleh, Lalpa chu thîk ding- in chawk tho ei tum a ni maw? Ama nêkin ei hrât lem am a nih?"
All things are lawful; but not all things are expedient. All things are lawful; but not all things edify.,"Thil iengkim thaw a thieng a; nisienlakhawm, thil iengkim thaw a ṭha kher nawh. Thil iengkim thaw a thieng a; nisienlakhawm, thil ieng- kim thawin a mi siem ṭha kher nawh."
"Let no man seek his own, but each his neighbor’s good.",Tûkhawmin mâni ṭhatna ding zawng loin mi dang ṭhatna ding zawng lem raw se.
"Whatsoever is sold in the shambles, eat, asking no question for conscience’ sake;",Sa dâwra an zawr taphawt chu sie le ṭha hrietna leia iengkhawm indawn loin fa el ro;
"for the earth is the Lord’s, and the fulness thereof.",hnuoi le a sûnga um po po hi Lalpa ta a ni sih a.
"If one of them that believe not biddeth you to a feast, and ye are disposed to go; whatsoever is set before you, eat, asking no question for conscience’ sake.","Awinaw laia mi tuin amanih a fiel cheu a, fe in nuom si chun, sie le ṭha hrietna leiin iengkhawm indawn chuong loin an pêkhai taphawt cheu chu fa el ro."
"But if any man say unto you, This hath been offered in sacrifice, eat not, for his sake that showed it, and for conscience’ sake:","Amiruokchu, tûin amanih, “Hi hi inthâwina a nih,” tiin a hril cheu chun, ân hriettirtu cheu lei le, a sie le ṭha hrietna leiin fa naw ro;"
"conscience, I say, not thine own, but the other’s; for why is my liberty judged by another conscience?","nang a sie le ṭha hrietna ka ti nawh a, mi dang sie le ṭha hrietna chu ka ti lem a nih. Iengdinga mi dang sie le ṭha hrietna chun ka zalênna a sawisêl am a na?"
"If I partake with thankfulness, why am I evil spoken of for that for which I give thanks?","Lâwmtaka ka chang chun, a chunga lâwmthu ka hrilna chunga hin, iengdinga hrilsieta um am ka na?"
"Whether therefore ye eat, or drink, or whatsoever ye do, do all to the glory of God.","Chuongchun, in fâk khawmin, in dâwn khawmin, in thaw taphawta chun Pathien ropuina ding ruokin thaw ro."
"Give no occasion of stumbling, either to Jews, or to Greeks, or to the church of God:","Judahai ta ding khawmin, Grik mihai ta ding khawmin, Pathien kohranhai ta ding khawmin an tlûk phâna ding hrim hrim iengkhawm thaw naw ro."
"even as I also please all men in all things, not seeking mine own profit, but the profit of the many, that they may be saved.","Keiin mâni ta dinga ṭangkaina zawng loa sandam an ni theina dinga mi tamtak ta dinga ṭangkaina zawng lemin, mi po po iengkimah ka suk- lâwm ang tak hin."
"Be ye imitators of me, even as I also am of Christ.","Keiin Krista ka entawn angtak hin, nangni khawmin mi entawn ve ro."
"Now I praise you that ye remember me in all things, and hold fast the traditions, even as I delivered them to you.","Iengkima in mi hriet zing lei le, thurosiehai ka hung hril angtaka in la vawng tlat leiin kân pâk cheu a nih."
"But I would have you know, that the head of every man is Christ; and the head of the woman is the man; and the head of Christ is God.","Nisienlakhawm, pasal taphawt lu chu Krista a na, nuhmei lu chu a pasal a na, chun Krista lu chu Pathien a nih, ti in hrietchieng ka nuom a nih."
"Every man praying or prophesying, having his head covered, dishonoreth his head.","Pasal tukhawm, lukhum khum puma ṭawngṭai amani, thuhril amani phawt chun, ama lu chu a sukmuolpho a nih."
But every woman praying or prophesying with her head unveiled dishonoreth her head; for it is one and the same thing as if she were shaven.,"Amiruokchu, nuhmei tukhawm, lu inkhum lova ṭawngṭai amani, thu a hril amani chun, a lu a sukmuolpho a nih, ama chu a lu mêt kawl leh thuhmun a nih."
"For if a woman is not veiled, let her also be shorn: but if it is a shame to a woman to be shorn or shaven, let her be veiled.","Nuhmeiin a lu ân khum si naw chun, a sam chu tan tâwi lem el raw se; nisienlakhawm, nuhmei ta dingin sam tan amani, mêt kawl amani chu thil inzakum a ni si leiin, a lu inkhum raw se."
"For a man indeed ought not to have his head veiled, forasmuch as he is the image and glory of God: but the woman is the glory of the man.","Pasal ruok chu Pathien angpui le a ropuina a ni leiin, a lu ân khum ding a ni nawh a, nuhmei ruok chu pasal ropuina suklangtu a nih."
For the man is not of the woman; but the woman of the man:,"Pasal hi nuhmeia inthawka siem a ni nawh a, nuhmei ruok chu pasala inthawka siem a ni lem sih a."
for neither was the man created for the woman; but the woman for the man:,"Pasal hi nuhmei ta dinga siem a ni nawh a, nuhmei ruok chu pasal ta dinga siem a nih."
"for this cause ought the woman to have a sign of authority on her head, because of the angels.","Vântirkohai leiin, nuhmei chu a pasal thuhnuoia um a nih ti inchikna dingin a lu ân khum ding a nih."
"Nevertheless, neither is the woman without the man, nor the man without the woman, in the Lord.","Nisienlakhawm, Lalpaa chun nuhmei hi pasal ṭhang lovin a um thei nawh a, pasal khawm nuhmei ṭhang lovin a um thei bawk nawh."
"For as the woman is of the man, so is the man also by the woman; but all things are of God.","Nuhmei hi pasala inthawka siem a ni ang bawk hin, pasal khawm chu nuhmeia inthawka pieng a ni sih a; nisienlakhawm, thil po po hi Pathiena inthawka suok vawng an nih."
Judge ye in yourselves: is it seemly that a woman pray unto God unveiled?,Nangni ngei khan ngaituo hman ro: Nuhmeiin a lu inkhum lova Pathien kuoma a ṭawngṭai hi a âwm rêng rêng am a ni?
"Doth not even nature itself teach you, that, if a man have long hair, it is a dishonor to him?","Pasalin sam sei a put chun, a ta dingin thil inzakum a nih ti in piengpui lungril khawmin ân hriettir naw cheu am a ni?"
"But if a woman have long hair, it is a glory to her: for her hair is given her for a covering.","Nuhmeiin a sam a hla sei ruok chun, chu chu ama ropuina a nih, a sam chu inkhumna dinga pêk a ni sih a."
"But if any man seemeth to be contentious, we have no such custom, neither the churches of God.","Tukhawmin, hi thu hi a lo sêl a ni khawmin, chuong thila chun keinîn thawdân kan nei nawh a, Pathien kohranhai khawma an nei bawk nawh."
"But in giving you this charge, I praise you not, that ye come together not for the better but for the worse.","Amiruokchu, hieng thil inchûktirnahaia hin chu kân pâk thei naw cheu a nih, in inkhâwm pha ṭhatpui nêkin in sietpui lem hlak leiin."
"For first of all, when ye come together in the church, I hear that divisions exist among you; and I partly believe it.","A hmasatakin, kohran anga in inkhâwm chângin nangni lai inṭhena a um hlak ti thu ka lo hriet sih a; iemani chenah ka ring deu bawk a nih."
"For there must be also factions among you, that they that are approved may be made manifest among you.",Nangni laia mi indiktakhai an inlang theina dingin pâwl tum tum an hung um ding hrim a nih.
"When therefore ye assemble yourselves together, it is not possible to eat the Lord’s supper:","In fe khâwm phaa in fâk hlak hi, Lalpa zânbu a ni naw tawp el."
"for in your eating each one taketh before other his own supper; and one is hungry, and another is drunken.","Fâk hun a tlung pha leh, mi tinin mani bu seng in lo fâk el hlak sih a, chuongchun pakhat phîngṭâmin a um a, pakhat ân rui hlak."
"What, have ye not houses to eat and to drink in? or despise ye the church of God, and put them to shame that have not? What shall I say to you? shall I praise you? In this I praise you not.","Ieng am an ta leh! Fâk le dâwnna dingin in in nei seng an naw am a ni? Annawleh, Pathien kohran hmusitin, iengkhawm nei nawhai chu in sukzak el hlak am a ni? In kuomah ieng am ka hril ding a na? Kân pâk ding cheu am a ni? Hi thila hin chun kân pâk thei naw cheu."
"For I received of the Lord that which also I delivered unto you, that the Lord Jesus in the night in which he was betrayed took bread;","Ka thu hril sâwng cheu kha Lalpa kuoma inthawka ka dawng a na; khânga inmantira a um zân khan, Lalpa Isûn, bei a lâk a,"
"and when he had given thanks, he brake it, and said, This is my body, which is for you: this do in remembrance of me.","lâwmthu a hril zovin, a khawi a, “Hi hi ka taksa, in ta ding chu a nih. In mi hriet zingna dingin hi hi thaw hlak ro,” a ti kha."
"In like manner also the cup, after supper, saying, This cup is the new covenant in my blood: this do, as often as ye drink it, in remembrance of me.","Chuong ang bawkin, zânbu fâk zovin, no khawm chu a lâk a, “Hi hi ka thisena Thuthlung Thar chu a nih. In dâwn povin in mi hriet zingna dingin thaw hlak ro,” a ti kha."
"For as often as ye eat this bread, and drink the cup, ye proclaim the Lord’s death till he come.","Chu bei chu in fâk a, no chu in dâwn zâtin, Lalpa hung nâwk hmakhat a thina chu in puong hlak a ni sih a."
"Wherefore whosoever shall eat the bread or drink the cup of the Lord in an unworthy manner, shall be guilty of the body and the blood of the Lord.","Chuleiin, tukhawm tlâklo puma bei chu faa, Lalpa no chu dâwn taphawt chun, Lalpa taksa le thisen chungah suol-maw phur a tih."
"But let a man prove himself, and so let him eat of the bread, and drink of the cup.","Mi tin mani infie seng sienla, chuong ang chun bei chu fain no chu dâwn raw se."
"For he that eateth and drinketh, eateth and drinketh judgment unto himself, if he discern not the body.","A fatu le a dâwntu chun, Lalpa taksa chîktaka a ngaituo si naw chun, ama chunga rorêlna intlun dingin a fâkin a dâwn a ni sih a."
"For this cause many among you are weak and sickly, and not a few sleep.","Hi lei hin nangni laia tamtak chu, in hrâtnawin in hrivawi a sie a nih, ṭhenkhat chu in thi tah a."
"But if we discerned ourselves, we should not be judged.","Amiruokchu, chîktakin inngaituo hlak unla chu, ro rêlpêkin ei um naw ding bah."
"But when we are judged, we are chastened of the Lord, that we may not be condemned with the world.","Rorêlpêka ei um khawmin, khawvêl mihai anga thiemnaw changa ei um nawna dingin Lalpa thununin ei um hlak a nih."
"Wherefore, my brethren, when ye come together to eat, wait one for another.","Chuleiin, ka unauhai, fa dinga in inkhâwm pha, innghâk tâwl hlak ro."
"If any man is hungry, let him eat at home; that your coming together be not unto judgment. And the rest will I set in order whensoever I come.","In inkhâwm chu thiemnaw in chang phana a ni nawna dingin, a phîngṭâm chun inah hung fa zet raw se. Thil danghai chungchâng chu ka hung pha leh la kâwkhmûng ka ti cheu."
"Now concerning spiritual gifts, brethren, I would not have you ignorant.","Chun, unauhai, thlarau tieng thilpêk thuhai chu in hriet naw ka nuom nawh."
"Ye know that when ye were Gentiles ye were led away unto those dumb idols, howsoever ye might be led.","Awinawhai in ni lai khan, ieng ang khawma an ṭhuoi ang pei cheu khan, khâng milim rawl neilo tienga khan ṭhuoihmangin in um ti in hriet a."
"Wherefore I make known unto you, that no man speaking in the Spirit of God saith, Jesus is anathema; and no man can say, Jesus is Lord, but in the Holy Spirit.","Chuleiin, tûkhawmin Pathien thlaraua thu hrilin, “Isu chu ṭawng- sephur a nih,” an ti ngai nawh; chun, tûkhawmin Thlarau Inthienga chau naw chun, “Isu chu Lalpa a nih,” an ti thei ngai nawh ti kân hriettir cheu."
"Now there are diversities of gifts, but the same Spirit.","Chun, thilpêk chu a tum tum a um a, Thlarau chu hmunkhat a nih."
"And there are diversities of ministrations, and the same Lord.","Rawngbâwl dân tum tum khawm a um a; nisienlakhawm, Lalpa chu hmunkhat a nih."
"And there are diversities of workings, but the same God, who worketh all things in all.","Sinthaw dân tum tum khawm a um a, Pathien ruok chu hmunkhat a nih, mi po poa iengkim thawtu chu."
But to each one is given the manifestation of the Spirit to profit withal.,"Chun, ṭhathnempui tlâng seng dingin Thlarau inhriettirna chu mi tin kuomah pêk seng a nih."
"For to one is given through the Spirit the word of wisdom; and to another the word of knowledge, according to the same Spirit:",Mi pakhat kuomah Thlaraua chun varna thu pêk a nih; mi dang kuomah chu Thlarau thu ma chun hrietna pêk a nih;
"to another faith, in the same Spirit; and to another gifts of healings, in the one Spirit;","chun, mi dang kuomah chu Thlaraua bawk chun, ringna pêk a nih; mi dang kuomah Thlarau thuhmuna chun sukdam theina pêk a nih;"
and to another workings of miracles; and to another prophecy; and to another discernings of spirits: to another divers kinds of tongues; and to another the interpretation of tongues:,"mi dang kuomah thilmak thaw- theina pêk a nih; mi dang kuomah thuhril theina pêk a nih; mi dang kuomah thlarauhai hriet dik theina pêk a nih; chun, mi dang kuomah ṭawng hrietlo chi dang danghaia thuhril theina pêk a nih; mi dang kuomah ṭawng hrietlohai hrilfie theina pêk a ni sih a;"
"but all these worketh the one and the same Spirit, dividing to each one severally even as he will.","nisienlakhawm, chuong po po chu Thlarau thuhmun bawk chun, mi tin kuomah a nuom ang peia semin sin a thaw hlak."
"For as the body is one, and hath many members, and all the members of the body, being many, are one body; so also is Christ.","Taksa hi pakhat a na, pêng tamtak a nei a, taksa pênghai po po chu tam hai sienkhawm taksa pum- khat an ni sih a; Krista chu chuong ang bawk chu a nih."
