en,hmr
"Awake to soberness righteously, and sin not; for some have no knowledge of God: I speak this to move you to shame.","Feltakin har unla, suksuol naw ro; ṭhenkhat chun Pathien hrietna hrim in nei naw hi; hi hi in inzakna dinga ka hril a nih."
"But some one will say, How are the dead raised? and with what manner of body do they come?","Nisienlakhawm, tuin amanih, “Mithi hai chu iengtin am keithoin um an ta? taksa ieng ang putin am hung an ta?” a ti a ni thei a."
"Thou foolish one, that which thou thyself sowest is not quickened except it die:","Nang mi invêt, nang ngeiin i tu hlak khawm hi, a thi zet naw chun sukhringin a um ngai lem,"
"and that which thou sowest, thou sowest not the body that shall be, but a bare grain, it may chance of wheat, or of some other kind;","chun, i tu hlak khawm hi a taksa la um ding chu i tu nawh a, a mal el i tu lem hlak a, bu mal amanih, chi dang mal amani khawm a ni thei a;"
"but God giveth it a body even as it pleased him, and to each seed a body of its own.","nisienlakhawm, Pathienin ama nuom ang peiin taksa a pêk hlak, a mal tin kuomah mani taksa seng chu."
"All flesh is not the same flesh: but there is one flesh of men, and another flesh of beasts, and another flesh of birds, and another of fishes.","Tisa po po hi tisa chi khat an ni nawh a; mihriem tisa a dang a, sa tisa a dang a, vate tisa a dang a, nga tisa a dang a nih."
"There are also celestial bodies, and bodies terrestrial: but the glory of the celestial is one, and the glory of the terrestrial is another.","Vân taksahai a um a, hnuoi taksahai khawm; nisienlakhawm, vân taksa ropuina chu a dang a, hnuoi taksa ropuina chu a dang a nih."
"There is one glory of the sun, and another glory of the moon, and another glory of the stars; for one star differeth from another star in glory.","Nisa ropuina chu a dang a, thla ropuina chu a dang a, arasihai ropui- na chu a dang a, arasi le arasi khawm ropuinaa chun an inang si nawh."
So also is the resurrection of the dead. It is sown in corruption; it is raised in incorruption:,"Mithi thonâwkna khawm hi chuong ang bawk chu a nih. Hmawn theia tuin a um a, hmawntheiloa keithoin a um;"
it is sown in dishonor; it is raised in glory: it is sown in weakness; it is raised in power:,"chawimawiloa tuin a um a, ropuitaka keithoin a um; hrâtloa tuin a um a, thilthawtheina neia keithoin a um;"
"it is sown a natural body; it is raised a spiritual body. If there is a natural body, there is also a spiritual body.","mihriem tieng taksaa tuin a um a, Thlarau tieng taksaa keithoin a um, mihriem tieng taksa a um chun thlarau tieng taksa khawm um a tih."
"So also it is written, The first man Adam became a living soul. The last Adam became a life-giving spirit.","Chuong ang bawkin, “Mihriem hmasatak Adam chu mi hring a hung nih,” ti ziek a nih; Adam nuhnung lem chu hringna petu thlarau a nih."
"Howbeit that is not first which is spiritual, but that which is natural; then that which is spiritual.","Nisienlakhawm, thlarau tieng chu a um hmasa nawh a, mihriem tieng chu a um hmasa lem; chu hnunga chun thlarau tieng chu a um."
"The first man is of the earth, earthy: the second man is of heaven.",Mihriem hmasatak chu hnuoia mi pila siem a nih; mihriem pahnina chu vâna mi a nih.
"As is the earthy, such are they also that are earthy: and as is the heavenly, such are they also that are heavenly.","Hnuoia siem mi ang kha, hnuoia siem mihai khawm hi an nih; vâna mi ang kha vân mihai khawm chu an nih."
"And as we have borne the image of the earthy, we shall also bear the image of the heavenly.","Chun, hnuoia siem mi puona kha ei nei ang bawkin vâna mi puona chu ei nei bawk ding a nih."
"Now this I say, brethren, that flesh and blood cannot inherit the kingdom of God; neither doth corruption inherit incorruption.","Unauhai, “Tisa le thisen hin Pathien ram hluo thei naw nih a, hmawn thei hin hmawntheilo chu hluo chuong bawk naw ni” ti ka hril a ni hi."
"Behold, I tell you a mystery: We all shall not sleep, but we shall all be changed,","Ngai ta u, thurûk ka hril ding cheu a ni hi; ei rêngin in kher nâwm ei nih a,"
"in a moment, in the twinkling of an eye, at the last trump: for the trumpet shall sound, and the dead shall be raised incorruptible, and we shall be changed.","nisienlakhawm, ei rêngin tawtawrâwt nuhnungtak inri pha chun sâwt nawtêa, mitkhap kâr loa sukdanglamin um vawng tâng ei tih; tawtawrâwt chu ân ri ding a ni sih a; chuongchun, mithihai chu hmawn- theiloa keithoin um an ta, eini khawm sukdanglamin um tâng ei tih."
"For this corruptible must put on incorruption, and this mortal must put on immortality.","Hi hmawnthei hin hmawntheilo a sil ding a na, hi thi thei khawm hin thi theinawna a sil bawk ding a nih."
"But when this corruptible shall have put on incorruption, and this mortal shall have put on immortality, then shall come to pass the saying that is written, Death is swallowed up in victory.","Chuongchun, hi hmawnthei hin hmawntheinawna a sila, hi thithei hin thitheinawna a sil pha chun, “Hnenain thina a lem zo tah,”"
"O death, where is thy victory? O death, where is thy sting?","“Aw thina, i hnena chu khâwlai am a um tah a? Aw thina, i tûr chu khâwlai am a um tah a?” ti thuziek hi hung tlung tâng a tih."
The sting of death is sin; and the power of sin is the law:,"Thina tûr chu suol a na, suol thilthawtheina chu dân thu chu a nih."
"but thanks be to God, who giveth us the victory through our Lord Jesus Christ.","Nisienlakhawm, ei Lalpa Isu Krista zâra hnena mi petu Pathien kuoma chun lawmthu um raw se."
"Wherefore, my beloved brethren, be ye stedfast, unmoveable, always abounding in the work of the Lord, forasmuch as ye know that your labor is not vain in the Lord.","Chuleichun, ka unau dittakhai, dettakin, sukchâng ruolloin Lalpa sin ṭhahnem ngaitaka thaw rawpin um ro, in inrimna chu Lalpaa chun a thlâwn ngai nawh ti in hriet sih a."
"Now concerning the collection for the saints, as I gave order to the churches of Galatia, so also do ye.","Chun, mi inthienghai ta dinga thawlâwm thu kha chu, Galati rama kohran hai kuomah thu ka pêk angin nangni khawmin lo thaw ve ro."
"Upon the first day of the week let each one of you lay by him in store, as he may prosper, that no collections be made when I come.","Ni saria ni hmasatak peia chun mi tinin, malsâwmna in hmu zie ang peiin siekhâwl seng unla, ka hung phaa thawlâwm dâwl hrim a um nawna dingin."
"And when I arrive, whomsoever ye shall approve, them will I send with letters to carry your bounty unto Jerusalem:","Chun, in lunginsietna thilpêk chu Jerusalema fepui dingin ka hung tlung phaleh tûkhawm ṭha in ti ti lekhahai chawiin tir ka tih."
"and if it be meet for me to go also, they shall go with me.","Chun, ka fe vena âwm a ni lem chun, kei leh fêng an tih."
"But I will come unto you, when I shall have passed through Macedonia; for I pass through Macedonia;","Chun, Makedonia ram ka fang suok hnungin in kuomah hung ka tih: Makedonia ram chu ka fang hrim hrim ding a ni sih a."
"but with you it may be that I shall abide, or even winter, that ye may set me forward on my journey whithersoever I go.","Nangni kuoma ruok chu ka châm zing a ni thei, thlasik sûng po khawm a ni el thei; khâwlai khawm ka fena taphawta nangniin in mîn thla theina dingin."
"For I do not wish to see you now by the way; for I hope to tarry a while with you, if the Lord permit.","Tuta fe malam ela hmu cheu ka nuom nawh a, Lalpain rem a ti chun in kuoma sâwt deu châm ka beisei sih a."
But I will tarry at Ephesus until Pentecost;,"Nisienlakhawm, Pentikost chen Ephesia hin châm zing ka tih,"
"for a great door and effectual is opened unto me, and there are many adversaries.","kawtkhâr lientak le ṭangkai tak chu ka ta dingin ân hawng sih a, dotuhai tamtak an um bawk."
"Now if Timothy come, see that he be with you without fear; for he worketh the work of the Lord, as I also do:","Chun, Timothe kha a hung tlung chun ṭi loa in kuoma a umna dingin fîmkhur ro; keiin ka thaw ang bawkin Lalpa sin chu a thaw sih a."
"let no man therefore despise him. But set him forward on his journey in peace, that he may come unto me: for I expect him with the brethren.","Chuleiin, tûkhawmin hmusit naw raw se; ka kuoma a hung theina dingin thlamuongtakin inthla lem ro, unauhai ruolin ama lo hmu ka beisei sih a."
"But as touching Apollos the brother, I besought him much to come unto you with the brethren: and it was not at all his will to come now; but he will come when he shall have opportunity.","Ei unau Appolo thu kha chu, unauhai ruola in kuoma hung dingin ka ngên rak a, ana chu, tuta ṭum chu hung a nuom naw tawp el; a remchâng pha ruok chu hung a tih."
"Watch ye, stand fast in the faith, quit you like men, be strong.","Invêng unla, ringnaa chun ngîr det unla, insukhuoi unla, hrâttakin um ro,"
Let all that ye do be done in love.,In thaw taphawt chu hmangai- naa thaw ni raw se.
"Now I beseech you, brethren (ye know the house of Stephanas, that it is the firstfruits of Achaia, and that they have set themselves to minister unto the saints),","Unauhai, ka ngên cheu a nih: Stephan sûnghai chu Akaia rama awihai hmaṭhuoitu an na, mi inthienghai rawng bâwl dingin an inpêk ti in hriet a,"
"that ye also be in subjection unto such, and to every one that helpeth in the work and laboreth.",chuong ang mihai kuoma le sinthawa ṭhangpui le sin inrim taphawt kuoma chun intuklût dingin.
And I rejoice at the coming of Stephanas and Fortunatus and Achaicus: for that which was lacking on your part they supplied.,"Chun, Stephan hai, Phortunata hai, Akaika hai an hung hi ka lâwm a nih, in um naw khawm inlang loa an mi siem lei hin."
For they refreshed my spirit and yours: acknowledge ye therefore them that are such.,"Anni hin ka lungril le nangni lungril an mi sukhar sih a; chuongchun, hieng ang mi hi lâwm ro."
"The churches of Asia salute you. Aquila and Prisca salute you much in the Lord, with the church that is in their house.","Asia ram kohranhai hin chibai an bûk cheu. Akuila le Priskilla, an ina kohran inkhawmhai le hin Lalpaa chun chibai tamtakin an bûk cheu."
All the brethren salute you. Salute one another with a holy kiss.,Unau po po hin chibai an bûk cheu. Infâwp inthiengin chibai inbûk seng ro.
The salutation of me Paul with mine own hand.,Kei Paulain keima kut ngeia chibai ka bûkna cheu a ni hi.
"If any man loveth not the Lord, let him be anathema. Maranatha.",Tûkhawmin Lalpa a hmangai naw chun ṭawngsephurin um raw se. Ei Lalpa chu a hung ie.
The grace of the Lord Jesus Christ be with you.,Lalpa Isu Krista lunginsietna chu in kuomah um raw se.
My love be with you all in Christ Jesus. Amen.,Krista Isua ka hmangaina hi in rênga kuomah um raw se. Amen.
"And I, brethren, when I came unto you, came not with excellency of speech or of wisdom, proclaiming to you the testimony of God.","Chun, kei chu unauhai, Pathien thurûk hril cheuva in kuoma ka hung lai khan ka thu hril ropui le varna ropui le hung ka ni nawh a,"
"For I determined not to know anything among you, save Jesus Christ, and him crucified.",Isu Krista ama ngei hemdea a um thu chau naw chu nangni lai ieng dang khawm hriet ka tum nawh kha.
"And I was with you in weakness, and in fear, and in much trembling.","Chun, hrâtnaw le ṭiin, nasataka inthin pumin in kuomah ka um a."
"And my speech and my preaching were not in persuasive words of wisdom, but in demonstration of the Spirit and of power:","Ka ṭawngbau suok le ka thu hrilhai chu thu vara thlêmna thu a ni nawh a, Thlarau le thilthawtheina inhriettirin a ni lem kha;"
"that your faith should not stand in the wisdom of men, but in the power of God.","in ringna chu mihriem varnaa innghat loa, Pathien thilthawtheinaa innghata a um lemna dingin."
"We speak wisdom, however, among them that are fullgrown: yet a wisdom not of this world, nor of the rulers of this world, who are coming to nought:","Amiruokchu, puitlinghai lai chu thu var kan hril hlak; nisien- lakhawm, hi khawvêl thu var chu a ni nawh, hi khawvêl rorêltu bohmang dinghai thu var chu a ni bawk nawh;"
"but we speak God’s wisdom in a mystery, even the wisdom that hath been hidden, which God foreordained before the worlds unto our glory:","Pathien thu var thurûk chu kan hril lem hlak a nih, thu var inthup, ei ropuina dinga Pathienin khawvêl um hmaa a ruot lâwk ta chu."
"which none of the rulers of this world hath known: for had they known it, they would not have crucified the Lord of glory:","Chu chu hi khawvêl rorêltuhai hrim hrimin an hriet nawh, hre hai sien chu ropuina Lalpa chu hemde naw ni hai."
"but as it is written, Things which eye saw not, and ear heard not, And which entered not into the heart of man, Whatsoever things God prepared for them that love him.","“Mita hmu ngai naw le naa hriet ngai naw, Mihriem lungrila lût ngai naw, Pathienin ama hmangaituhai ta dinga A buotsai taphawt chu,” ti ziek ang lem khan."
"But unto us God revealed them through the Spirit: for the Spirit searcheth all things, yea, the deep things of God.","Keini ruok chu chuong chu Pathienin Thlarauin a mîn hriettir tah a nih; Thlarau chun iengkim a suisuok hlak sih a; anih, Pathien thu inril khawm."
"For who among men knoweth the things of a man, save the spirit of the man, which is in him? even so the things of God none knoweth, save the Spirit of God.","Mihriem thuhai chu mihriem lungril, a sûnga um bawk naw chun tuin am hrieng a ta? Chuong ang bawkin Pathien thuhai chu Pathien Thlarau bawk naw chun tûkhawmin an hriet nawh."
"But we received, not the spirit of the world, but the spirit which is from God; that we might know the things that were freely given to us of God.","Chuongchun, a thlâwna Pa- thien thil mi pêkhai chu ei hriet theina dingin, eini chun khawvêl thlarau ni loin, Thlarau Pathien kuoma inthawk chu ei hmu lem a nih."
"Which things also we speak, not in words which man’s wisdom teacheth, but which the Spirit teacheth; combining spiritual things with spiritual words.","Mihriem varna inchûktir thua hril loin, Thlarau inchûktir thua hril lemin Thlarau tieng thuhai chu thlarau tieng mihai kuoma hrilfiein, chuong thil a mi pêkhai thu khawm chu kan hril hlak."
"Now the natural man receiveth not the things of the Spirit of God: for they are foolishness unto him; and he cannot know them, because they are spiritually judged.","Khawvêl mi chun Pathien Thlarau thil chu a lâwm ngai nawh, ama ngaia chun invêtthlâk a ni sih a; Thlaraua hriet chieng a ni leiin a hriet thei naw hrim a nih."
"But he that is spiritual judgeth all things, and he himself is judged of no man.","Thlarau mi ruok chun thil iengkim a hriet chieng hlak, ama hlak chu tûkhawmin an hriet chieng si nawh."
"For who hath known the mind of the Lord, that he should instruct him? But we have the mind of Christ.",Tûin am Lalpa lungril hre taa ama inchûktir thei ding? Eini ruok chun Krista lungril ei put a nih.
"And I, brethren, could not speak unto you as unto spiritual, but as unto carnal, as unto babes in Christ.","Chun, unauhai, Thlarau mi kuoma hril angin in kuomah thu ka hril thei nawh a, tisa mihai kuoma hril angin ka hril lem kha; Kristaa nautêhai kuoma hril ang elin."
"I fed you with milk, not with meat; for ye were not yet able to bear it: nay, not even now are ye able;","Bu ni loin, nênetuiin ka châwm cheu kha, bu in la fâk thei naw leiin; anih, tu khawm hin in la fâk thei naw rawp a nih, tisa mi in la ni rawp leiin."
"for ye are yet carnal: for whereas there is among you jealousy and strife, are ye not carnal, and do ye not walk after the manner of men?",Nangni laia inthîkna le insêlna a um hlak leiin tisa mi la niin mihriem angin in la um zing a ni naw am a nih?
"For when one saith, I am of Paul; and another, I am of Apollos; are ye not men?","Mi pakhatin, “Paula pâwl ka nih,” mi dangin, “kei chu Appolo pâwl ka nih,” in ti sûng chu mihriem in ni zing a ni naw am a ni?"
What then is Apollos? and what is Paul? Ministers through whom ye believed; and each as the Lord gave to him.,Appolo chu ieng am a ni leh? Paula khawm chu ieng am a na? Rawngbâwltu nangni inawitirtu cheu chau an nih in sawnnaw; chu khawm chu Lalpain a ipêk ang ve ve chau a nih.
"I planted, Apollos watered; but God gave the increase.","Keiin ka phun a, Appoloin tuiin a châwm a, nisienlakhawm, Pathienin ân ṭhangtir a nih."
"So then neither is he that planteth anything, neither he that watereth; but God that giveth the increase.","Chuongchun, ân ṭhangtirtu Pathien chau naw chu a phuntu chu iengkhawm a ni nawh a, tuia châwm- tu khawm chu iengkhawm a ni nawh."
Now he that planteth and he that watereth are one: but each shall receive his own reward according to his own labor.,"Chun, a phuntu le tuia châwmtu pumkhat an nih, nisienlakhawm, mâni sinthaw ang peiin lâwmman hmu ve vêng an tih."
"For we are God’s fellow-workers: ye are God’s husbandry, God’s building.","Keini chu Pathien sinthaw- puituhai kan ni sih a, nangni Pathien lohma chu in na, Pathien in bâwl chu in ni bawk a nih."
"According to the grace of God which was given unto me, as a wise masterbuilder I laid a foundation; and another buildeth thereon. But let each man take heed how he buildeth thereon.","Pathien lunginsietna ka kuoma pêka um ang peiin in bâwl hotu tak vartak angin keiin lungphûm ka rem a, mi dangin a chungah in an bâwl a, nisienlakhawm, mi tin a chunga bawl dingziea chun fimkhur seng raw hai se."
"For other foundation can no man lay than that which is laid, which is Jesus Christ.","Lungphûm rem tasa naw chu tûkhawma lungphûm dang an rem thei si naw a, chu lungphûm chu Isu Krista chu a nih."
"But if any man buildeth on the foundation gold, silver, costly stones, wood, hay, stubble;","Chun, lungphûm chunga chun tûkhawmin rângkachakin amanih, tangkain amanih, lungmantamin amanih, thingin amanih, sâwlhnain amanih, bupâwlin amanih bâwl sienla, mi tin sinthaw chu inlang a tih;"
"each man’s work shall be made manifest: for the day shall declare it, because it is revealed in fire; and the fire itself shall prove each man’s work of what sort it is.","ni chun a suklang ding a ni sih a, meiin ân lâr ding a ni leiin, mei ngei chun mi tin sinthaw chu ieng ang am a ni fie tâng a tih."
"If any man’s work shall abide which he built thereon, he shall receive a reward.","Tû sinthaw khawm a chunga a bâwl chu a um zing chun, ama chun lâwmman hmûng a tih."
"If any man’s work shall be burned, he shall suffer loss: but he himself shall be saved; yet so as through fire.","Tû sinthaw khawm a kâng chun, ama chun chân a tih, ama tak ruok chu sandamin um a tih, nisienlakhawm, meia fe thleng ang elin."
"Know ye not that ye are a temple of God, and that the Spirit of God dwelleth in you?",Pathien in in ni le Pathien Thlarau nangniah a um ti in hriet naw am a nih?
"If any man destroyeth the temple of God, him shall God destroy; for the temple of God is holy, and such are ye.","Tûkhawmin Pathien in chu a sukkhawhlo chun Pathienin ama chu sukkhawhlo vêng a tih, Pathien in chu ân thieng sih a, chu in chu nangni in nih."
"Let no man deceive himself. If any man thinketh that he is wise among you in this world, let him become a fool, that he may become wise.",Tûkhawmin ama le ama inhlêm naw raw se. Nangni laia tûkhawm hi khawvêla vara inngai chu a hung var theina dingin mi invêtah hung inchang phawt raw se.
"For the wisdom of this world is foolishness with God. For it is written, He that taketh the wise in their craftiness:","Hi khawvêl varna hi Pathien ngaiah invêtna a ni sih a. “Ama chun mi varhai chu anni var vervêknaah a âwk hlak,” ti ziek a ni sih a."
"and again, The Lord knoweth the reasonings of the wise, that they are vain.","“Lalpa chun mi varhai ngai- tuona chu a thlâwn a nih ti a hriet,” ti ziek a ni nâwk bawk a."
Wherefore let no one glory in men. For all things are yours;,"Chuleiin, tûkhawmin mihriem- hai suong naw raw se."
"whether Paul, or Apollos, or Cephas, or the world, or life, or death, or things present, or things to come; all are yours;","Iengkim hi in ta vawng a ni sih a: Paula amanih, Appolo amanih, Ki- pha amanih, khawvêl amanih, hring- na amanih, thina amanih, thil um tasahai amanih, a hung um dinghai le chun a rêngin in ta vawng a nih."
and ye are Christ’s; and Christ is God’s.,"Nangni khawm Krista ta in na, Krista khawm chu Pathien ta a nih."
"Let a man so account of us, as of ministers of Christ, and stewards of the mysteries of God.",Keinirawi hi Krista rawngbâwltu le Pathien thurûk enkawltuah miin mi ngai raw hai se.
"Here, moreover, it is required in stewards, that a man be found faithful.",Hitaka hin enkawltu chu mi ringum ni a ngai bawk a nih.
"But with me it is a very small thing that I should be judged of you, or of man’s judgment: yea, I judge not mine own self.","Nisienlakhawm, nangniin in mi fiena le, mihriem ngaituonain in mi fiena chu ka ta dingin thil chîterek ang a nih, kei le kei khawm kân fie ngai bawk nawh."
For I know nothing against myself; yet am I not hereby justified: but he that judgeth me is the Lord.,"Iengkhawm indemna ding kân hriet si nawh a, nisienlakhawm, chu chun thiem a mîn changtir chuong nawh, a mi fietu chu Lalpa a ni lem."
"Wherefore judge nothing before the time, until the Lord come, who will both bring to light the hidden things of darkness, and make manifest the counsels of the hearts; and then shall each man have his praise from God.","Chuongchun, a hun hma hin iengkhawm fie naw ro, Lalpa hung hmakhat chu, ama chun inthima thil thuphmanghai chu varah hung la suok a tih, lungrila tumhai khawm chu suklang bawk a tih; chu pha chun mi tinin Pathien kuoma chun an chantâwka inpâkna hlaw seng tâng an tih."
"Now these things, brethren, I have in a figure transferred to myself and Apollos for your sakes; that in us ye might learn not to go beyond the things which are written; that no one of you be puffed up for the one against the other.","Chun, unauhai, thu ziekhai chu in hmu khûm nawna dingin, keinia hin in inchûk theina dingin, chuong thuhai chu in ṭhatna dingin kei le Appolo kân bel a nih, nangni laia tûkhawmin pakhat suonga pakhat in uongkhum nawna dingin."
"For who maketh thee to differ? and what hast thou that thou didst not receive? but if thou didst receive it, why dost thou glory as if thou hadst not received it?",Nang tûin am a sukdanglam chuong cheh a? Dawng naw chu ieng am i nei leh? I dawng a ni si chun iengdinga i dawng ni lo anga i uongpui am a na?
"Already are ye filled, already ye are become rich, ye have come to reign without us: yea and I would that ye did reign, that we also might reign with you.","Tuta inthawkin in tlai tah a, tuta inthawkin in hausa tah a, kan ṭhang loin ro in rêl a ni ta hi! Anih, ro rêl tak tak unla kan nuom a nih, keini khawma nangni le ro kan rêl theina dingin."
"For, I think, God hath set forth us the apostles last of all, as men doomed to death: for we are made a spectacle unto the world, both to angels and men.",Pathienin keini tirkohai hi thi dinga ruot tasa angin a nu- hnungtakah a mi târsuok angah ka ngai a nih; khawvêl le vântirkohai le mihriemhai mithmuah ennuoma siemin kan um hi.
"We are fools for Christ’s sake, but ye are wise in Christ; we are weak, but ye are strong; ye have glory, but we have dishonor.","Keini chu Krista leiin mi invêt kan nih, nangni ruok chu Kristaa chun mi var in ni lem a nih! Keini chu kan hrât nawh a, nangni ruok chu in hrât a nih! Nangni chu mi inpâkin in um a, keini ruok chu mi hmusitin kan um a nih."
"Even unto this present hour we both hunger, and thirst, and are naked, and are buffeted, and have no certain dwelling-place;","Tu chen khawm hin, kan phîng a ṭâmin kan dang a châr a, silfên kan khawp nawh a, mi kut inthak nûlna kan na, umna bulbâl kan nei nawh a,"
"and we toil, working with our own hands: being reviled, we bless; being persecuted, we endure;","mâni kuta sin thawin kan inrim hle hlak a, miin an mi halin mal kan sâwmpêk a, miin an mi suknawmna leh kan tuor fan fan a;"
"being defamed, we entreat: we are made as the filth of the world, the offscouring of all things, even until now.","miin an mi hrilsiet leh zaidam- takin kan hril hlak, tu chen khawm hin khawvêl hnâwlhnawk, thil po po hmunhnawk angin an mi siem a nih."
"I write not these things to shame you, but to admonish you as my beloved children.","Sukzak ding cheuin hieng thu hi ka ziek nawh a, ka nau dittakhai anga infuina ding cheuin ka ziek lem a nih."
"For though ye have ten thousand tutors in Christ, yet have ye not many fathers; for in Christ Jesus I begat you through the gospel.",Kristaa chun inchûktirtu sîng khat nei unla khawm pa chu tamtak in nei si naw a nih; keiin Krista Isua chun Chanchin Ṭhain ka nei cheu a ni kha.
"I beseech you therefore, be ye imitators of me.","Chuongchun, mîn chûk dingin ka ngên cheu a nih."
"For this cause have I sent unto you Timothy, who is my beloved and faithful child in the Lord, who shall put you in remembrance of my ways which are in Christ, even as I teach everywhere in every church.","Chuleichun, Timothe, Lalpaa ka nau dittak le ringum chu in kuomah ka hung tir a nih, ama chun Kristaa ka umdân ram tina kohran tina ka închûktir hlak ang hi inhriettir nâwk a ti cheu."
"Now some are puffed up, as though I were not coming to you.","Chun, kei in kuoma hung nâwk ta naw ding ang elin ṭhenkhat in uong a nih."
"But I will come to you shortly, if the Lord will; and I will know, not the word of them that are puffed up, but the power.","Nisienlakhawm, Lalpain rem a ti chun, sâwtnawtê hnungah in kuomah hung ka tih; chuongchun, mi uonghai thu chu ni loin, an thil- thawtheina chu hre lem tâng ka tih."
"For the kingdom of God is not in word, but in power.","Pathien ram chu thuah a um nawh a, thilthawtheinaah a um lem a nih."
