en,hmr
"For in one Spirit were we all baptized into one body, whether Jews or Greeks, whether bond or free; and were all made to drink of one Spirit.","Ei rêngin, Judahai amanih, Grikhai amanih, suok amanih, suok nilo amanih taksa pumkhata um dingin, Thlarau pakhat chauah bap- tisin ei um seng sih a. Thlarau pakhat chau bawk a mîn dâwntir bawk a."
"For the body is not one member, but many.","Taksa hi pêng khat chau a ni si nawh a, pêng tamtak a ni lem."
"If the foot shall say, Because I am not the hand, I am not of the body; it is not therefore not of the body.","Kepha hin, “Kut ka ni naw leiin taksaa ṭhang ka ni nawh,” ti sienla, chu lei chun taksaa ṭhang naw a ni chuong nawh."
"And if the ear shall say, Because I am not the eye, I am not of the body; it is not therefore not of the body.","Chun, nakâwr hin, “Mit ka ni naw leiin taksaa ṭhang ka ni nawh” ti sienla, chu lei chun taksaa ṭhang naw a ni chuong nawh."
"If the whole body were an eye, where were the hearing? If the whole were hearing, where were the smelling?","Taksa pumpui hi mit ni vawng ta sienla, ri hrietna chu khâwlai am ni tâng a ti leh? A pumin ri hrietna ni vawng ta sienla, rim hriet theina chu khâwlai am ni tâng a ti leh?"
"But now hath God set the members each one of them in the body, even as it pleased him.","Nisienlakhawm, Pathienin pêng tin hi taksaah a nuomna poah ân umtir seng tah a nih."
"And if they were all one member, where were the body?","Chuongchun, chuong po po chu pêng khat chau ni sienla, taksa hi khâwlai am um a ta?"
"But now they are many members, but one body.","Amiruokchu, pêng tamtak an ni lem a; nisienlakhawm, taksa pum- khat chau a ni sih a."
"And the eye cannot say to the hand, I have no need of thee: or again the head to the feet, I have no need of you.","Chun, mit hin kut kuomah, “Ienga khawm hmangna ka nei naw che,” a ti thei nawh; lu khawm hin kephahai kuomah, “Ienga khawm hmangna ka nei naw cheu,” a ti thei bawk nawh."
"Nay, much rather, those members of the body which seem to be more feeble are necessary:","Anih, chuong nêk hmanin taksa pêng hrât âwm loa inlanghai hi an pawimaw lem bêk bêk a nih;"
"and those parts of the body, which we think to be less honorable, upon these we bestow more abundant honor; and our uncomely parts have more abundant comeliness;","chuongchun, taksa pêng chawi- mawi tlâk naw lema ei ruothai hi, chuong ngei chu ei chawimawi nasa lem hlak; chuongchun, ei pêng mawinawhai hin mawina nasa lem an hmu hlak;"
"whereas our comely parts have no need: but God tempered the body together, giving more abundant honor to that part which lacked;","ei pêng mawi lemhai ruok chun chuong anga thaw chu an ngai nawh; nisienlakhawm, Pathienin mawina neinaw pêng chu chawimawi nasa lemin taksa hi a rem khâwm a nih;"
that there should be no schism in the body; but that the members should have the same care one for another.,"taksaa hin inṭhena hrim um loa, pênghai hin inangtaka an inbuoipui tuo seng theina dingin."
"And whether one member suffereth, all the members suffer with it; or one member is honored, all the members rejoice with it.","Chuongchun, pêng khatin a tuor chun, pêng po poin an tuorpui hlak, pêng khat chawimawia a um chun, pêng po poin an lâwmpui hlak."
"Now ye are the body of Christ, and severally members thereof.","Chuongchun, nangnirawi hi Krista taksa chu in nih, a pênghai in ni seng bawk a."
"And God hath set some in the church, first apostles, secondly prophets, thirdly teachers, then miracles, then gifts of healings, helps, governments, divers kinds of tongues.","Chun, Pathienin ṭhenkhat chu kohran lai a sieh a, pakhatnaa chun tirkohai, a pahninaa chun thuhriltu- hai, a pathumnaa chun inchûktir- tuhai a sie a, chu hnunga chun thilmak thawhai an um a, chu zoa chun sukdam theina thilpêkhai, ṭhangpui theina thilpêkhai, rorêl thiemna thilpêkhai, ṭawng hrietlo chi tum tuma thuhril theina thilpêkhai a um nâwk a."
Are all apostles? are all prophets? are all teachers? are all workers of miracles?,An rêngin tirko an ni vawng am a nih? An rêngin thuhriltu an ni vawng am a nih? An rêngin inchûktirtu an ni vawng am a nih? An rêngin thilmak thawtu an ni vawng am a nih?
have all gifts of healings? do all speak with tongues? do all interpret?,An rêngin sukdam theina thilpêk chu an nei vawng am a nih? An rêngin ṭawng hrietlohaiin an hril vawng am a nih? An rêngin thu an hrilfie vawng am a nih?
But desire earnestly the greater gifts. And moreover a most excellent way show I unto you.,"Thilpêka ropuitakhai chu châk hle lem ro. Chun, tuhin kawng ṭha nâwk zuol inentir ka ti cheu."
"If I speak with the tongues of men and of angels, but have not love, I am become sounding brass, or a clanging cymbal.","Mihriem ṭawnghai le vântirko ṭawnghaiin thu hril lang khawm, hmangaina ka nei si naw chun dâr inri mei mei amanih, dârbenthek inri mei mei amanih lo nîng ka tih."
"And if I have the gift of prophecy, and know all mysteries and all knowledge; and if I have all faith, so as to remove mountains, but have not love, I am nothing.","Chun, thu hril theina neiin, thurûk po po le hrietna po po hre vawng lang khawm, tlâng sawn theina khawp hiel ringna famkim nei lang khawm, hmangaina ka nei si naw chun iengkhawm ni naw ning."
"And if I bestow all my goods to feed the poor, and if I give my body to be burned, but have not love, it profiteth me nothing.","Chun, mi rimsihai châwmna dingin ka sum po po khawm pe vawng lang, ka taksa khawm kâng dingin inpe lang hmangaina ka nei si naw chun, ka ta dingin iengkhawm ṭhahnem naw ni."
"Love suffereth long, and is kind; love envieth not; love vaunteth not itself, is not puffed up,","Hmangaina chu a dawthei a, ngil a nei a, hmangainain a îtthîk nawh a; hmangaina ama le ama ân pak ngai nawh a, a uong nawh a,"
"doth not behave itself unseemly, seeketh not its own, is not provoked, taketh not account of evil;","a châng mawinaw ngai nawh a, mâni hma a siel nawh a, a lunginsen nuom nawh a, suol tiengah a ngaituo nawh a,"
"rejoiceth not in unrighteousness, but rejoiceth with the truth;","felnawna a lâwm nawh a, thutak ruok chu a lâwmpui hlak;"
"beareth all things, believeth all things, hopeth all things, endureth all things.","iengkim a tuor hrâm hrâm a, iengkim a ring a, iengkim a beisei a, iengkim a tuor suo hlak."
"Love never faileth: but whether there be prophecies, they shall be done away; whether there be tongues, they shall cease; whether there be knowledge, it shall be done away.","Hmangaina hi iengtik khawm bo naw nih a; amiruokchu, thuhrilna dâm hi um sienla khawm sukbân la nîng a tih; ṭawng hrietlohai dâm hi um sien khawm la mâng a tih, hrietna hi um sienkhawm sukbân la nîng a tih."
"For we know in part, and we prophesy in part;","A kim loin ei hriet a, a kim loin thu ei hril bawk hlak a nih;"
"but when that which is perfect is come, that which is in part shall be done away.",a famkim a hung tlung pha ruok chun a kimnaw hi bân ni tâng a tih.
"When I was a child, I spake as a child, I felt as a child, I thought as a child: now that I am become a man, I have put away childish things.","Ka naupang laiin naupang angin ka ṭawng a, naupang hrietin ka hriet a, naupang ngaituo angin ka ngaituo hlak; tuta ka hung puitling hnung hin naupang thaw dân chu ka bân tah."
"For now we see in a mirror, darkly; but then face to face: now I know in part; but then shall I know fully even as also I was fully known.","Tuhin chu hlimenah ei hmu rei ruoi a nih, chu chu pha ruok chun inhmatuoin ni tâng a tih. Tuhin chu a kim loin ei hriet a, chu pha ruok chun hriet kim ka ni ang bawk hin hre kim tâng ka tih."
"But now abideth faith, hope, love, these three; and the greatest of these is love.","Chuongchun, hienghai pathum, ringna dâm, beiseina dâm, hmangaina dâm hi um zing a tih; chun, a hi poa a ropuitak chu hmangaina hi a nih."
"Follow after love; yet desire earnestly spiritual gifts, but rather that ye may prophesy.","Hmangaina hi hnawt pei unla, Thlarau tieng thilpêk chu châk hle ro; amiruokchu, thu in hril theina ding lem chun châk bîk ro."
"For he that speaketh in a tongue speaketh not unto men, but unto God; for no man understandeth; but in the spirit he speaketh mysteries.","Ṭawng hrietloa thuhril chun mihriem kâwla hril ni loin, Pathien kuomah a hril lem a ni sih a; tûkhawmin a thuhril chu an hriet si nawh a; nisienlakhawm, thlarau chun thurûk a hril a nih."
"But he that prophesieth speaketh unto men edification, and exhortation, and consolation.","Thuhriltu ruok chun mihriem kuomah siem ṭhatna thu dâm, infui- na thu dâm, thlamuongna thu dâm a hril lem hlak."
He that speaketh in a tongue edifieth himself; but he that prophesieth edifieth the church.,Ṭawng hrietloa thu hril chun ama chau ân siem ṭha hlak. Thuhriltu ruok chun kohran a siem ṭha hlak.
"Now I would have you all speak with tongues, but rather that ye should prophesy: and greater is he that prophesieth than he that speaketh with tongues, except he interpret, that the church may receive edifying.","Chun, in rênga ṭawng hrietlohaia thu in hril ka nuompêk cheu; nisien- lakhawm, thu in hril ka nuompêk nâwk zuol cheu a nih; kohranin insiemṭhatna an hmu theina dingin a hrilfie nâwk nghâl naw chun, thu hriltu chu ṭawng hrietloa thu hriltu nêk chun a ropui lem hrim hrim a nih."
"But now, brethren, if I come unto you speaking with tongues, what shall I profit you, unless I speak to you either by way of revelation, or of knowledge, or of prophesying, or of teaching?","Tuhin, unauhai, ṭawng hriet- lohaia thu hrilin in kuomah hung ta ang lang, inhriettirna tieng amanih, hrietna tieng amanih, thu hrilna tieng amanih, inchûktirna tieng ama- nih in kuomah ka hril si naw chun ieng am ka sukṭhathnemna ding cheu a um a?"
"Even things without life, giving a voice, whether pipe or harp, if they give not a distinction in the sounds, how shall it be known what is piped or harped?","Thil hringna neilo, inri theihai khawm theihle amanih, ṭingṭang amanih, a mumal neia ân ri naw chun, ieng hla inzuiin am an keia ti iengtin am inhriet thei a ti leh?"
"For if the trumpet give an uncertain voice, who shall prepare himself for war?",Tawtawrâwt hi mumal nei loa ân ri chun tu am râl kâp dingin inbuotsai an ta?
"So also ye, unless ye utter by the tongue speech easy to be understood, how shall it be known what is spoken? for ye will be speaking into the air.","Chuong ang bawkin nangni khawm lei hin ṭawng hriet awla in hril naw chun ieng ang thu am in hril a, ti iengtin am inhriet thei a ta? Boruoka ṭawng mei mei nîng in tih in sawnnaw."
"There are, it may be, so many kinds of voices in the world, and no kind is without signification.","Khawvêla hin ṭawng ri chi tum tamtak a um a ni thei a; nisien- lakhawm, umzie nei naw hrim hrim a um si nawh a."
"If then I know not the meaning of the voice, I shall be to him that speaketh a barbarian, and he that speaketh will be a barbarian unto me.","A ṭawng ri umzie ruok chu ka hriet naw chun, kei chu a hriltu ta ding chun ram dang mi nîng ka ta; a hriltu khawm chu ka ta dingin ram dang mi ni bawk a tih."
"So also ye, since ye are zealous of spiritual gifts, seek that ye may abound unto the edifying of the church.","Chuongchun, nangni khawmin, thlarau thilpêk chungah ṭhahnem in ngai leiin kohran siemṭhat theina dinga in hausak theina dingin zawng ro."
Wherefore let him that speaketh in a tongue pray that he may interpret.,"Chuleiin, ṭawng hrietloa thu hril chun, a hrilfie theina dingin ṭawngṭai raw se."
"For if I pray in a tongue, my spirit prayeth, but my understanding is unfruitful.","Ṭawng hrietloa ka ṭawngṭai chun ka thlarau chun chu a ṭawngṭai ngei a, ka hrietna ruok chu a hlâwk chuong nawh."
"What is it then? I will pray with the spirit, and I will pray with the understanding also: I will sing with the spirit, and I will sing with the understanding also.","Iengtin am ni tâng a ti leh? Thlarauin, ṭawngṭai ka ta, hrietthei- na khawmin ṭawngṭai bawk ka tih; thlarauin hla sak ka ta, hriettheina khawmin sak bawk ka tih."
"Else if thou bless with the spirit, how shall he that filleth the place of the unlearned say the Amen at thy giving of thanks, seeing he knoweth not what thou sayest?","Chuong naw chun, thlarauin malsâwmpêk la khawm, a hrenawhai umnaa um chun i lâwmthu hrila chun iengtin am “Amen” ti thei a ta, i thu hril chu hre thei naw sain?"
"For thou verily givest thanks well, but the other is not edified.","Nang chun chu lâwmthu i hril ṭha takzet a, mi dang ruok chu a siemṭha chuong si nawh."
"I thank God, I speak with tongues more than you all:","Nangni po po nêka ṭawng hrietloa thu ka hril rawn lem leiin, Pathien kuomah lawmthu ka hril a;"
"howbeit in the church I had rather speak five words with my understanding, that I might instruct others also, than ten thousand words in a tongue.","nisienlakhawm, kohran in- khâwmnaa chun, ṭawng hrietloa thu sîng khat hril nêk chun, mi danghai kân chûktir theina dingin ka hriettheinaa thu panga chau hril ka nuom lem."
"Brethren, be not children in mind: yet in malice be ye babes, but in mind be men.","Unauhai, lungril tieng naupang naw ro; nisienlakhawm, suol kawnga chu nautê ang ni unla, lungril tienga chun puitling ro."
"In the law it is written, By men of strange tongues and by the lips of strangers will I speak unto this people; and not even thus will they hear me, saith the Lord.","Dân Lekhabua chun, “ ‘ṭawng dang mihai bau le, ram dang mihai hmûrin, hieng mihai kuoma hin thu hril ka ta; chuong sa khawm chun mi ngainaw ni hai,’ Lalpain a tih,” ti ziek a nih."
"Wherefore tongues are for a sign, not to them that believe, but to the unbelieving: but prophesying is for a sign, not to the unbelieving, but to them that believe.","Chuleiin, ṭawng hrietlohai hi awihai ta ding chun inchikna a ni nawh a, awinawhai ta ding a ni lem; thu hril ruok hi chu, awinawhai ta dingin inchikna a ni nawh a, awihai ta dingin a ni lem."
"If therefore the whole church be assembled together and all speak with tongues, and there come in men unlearned or unbelieving, will they not say that ye are mad?","Chuleiin, kohran po po in- khâwm unla, in rênga ṭawng hriet- lohaia thu in hril chun a la hrenawhai amanih, awinawhai amani hung lût hai sienla, invêt an ti naw ding cheu am a nih?"
"But if all prophesy, and there come in one unbelieving or unlearned, he is reproved by all, he is judged by all;","In rêngin thu inhril ruok chun, awinaw amanih, la hrelo amanih hung lût sien la, a thiemnawzie in rênga suklang ni tâng a tih; in rênga suosal ni tâng a tih;"
"the secrets of his heart are made manifest; and so he will fall down on his face and worship God, declaring that God is among you indeed.","a lungril thurûk chu phawr nîng a ta, chuongchun, bawkkhupin Pathien chibai bûk a ta, Pathien nangni lai a um takzet ti hril a tih."
"What is it then, brethren? When ye come together, each one hath a psalm, hath a teaching, hath a revelation, hath a tongue, hath an interpretation. Let all things be done unto edifying.","Unauhai, iengtin am ni tâng a ta? In hung inkhâwmin inpâkna hla amanih, thu inchûktirna amanih, inhriettirna amanih, ṭawng hrietlo amanih, hrilfiena amanih in nei seng hlak. Iengkim siem ṭhatna dingin thaw ni raw se."
"If any man speaketh in a tongue, let it be by two, or at the most three, and that in turn; and let one interpret:","Tukhawmin ṭawng hrietloa thu an hril chun, pahniin amanih, a tam- takah pathumin amanih ni sienla, insâwk peiin ni bawk raw se; chun, mi pakhatin hrilfie raw se."
"but if there be no interpreter, let him keep silence in the church; and let him speak to himself, and to God.","Hrilfietu an um naw chun, kohran inkhâwmnaa chun to zingin um hai sienla, mâni le Pathien kuomah hril raw se."
"And let the prophets speak by two or three, and let the others discern.","Thuhriltuhai khawmin, pahniin amanih, pathumin amanih, hril sienla, mi danghai chun nguntakin ngaituo raw hai se."
"But if a revelation be made to another sitting by, let the first keep silence.","Amiruokchu, a kâwla ṭhung mi dang kuomah inhriettirna thu pêkin a hung um chun, a hmasa chu to el raw se."
"For ye all can prophesy one by one, that all may learn, and all may be exhorted;","Mi po poin an inchûk theina ding le, mi po po lungmuonga an um theina dingin pakhat peiin thu in hril thei sih a."
and the spirits of the prophets are subject to the prophets;,Thuhriltuhai thlarauhai chu thuhriltuhai thununin an um a nih.
"for God is not a God of confusion, but of peace. As in all the churches of the saints,","Pathien chu buoina Pathien a ni nawh a, inremna Pathien a ni lem sih a. Mi inthieng kohranhai po poa ang hin,"
"let the women keep silence in the churches: for it is not permitted unto them to speak; but let them be in subjection, as also saith the law.",kohran inkhâwmnahaia chun nuhmeihai chu to zingin um raw hai se; anni chu an thu hril phal a ni si nawh a; Dân Lekhabuin a hril ang bawk khan thu zâwmin um lem raw hai se.
"And if they would learn anything, let them ask their own husbands at home: for it is shameful for a woman to speak in the church.","Chun, iengkhawm inchûk an nuom chun, in tieng an pasalhai in- dawn raw hai se; kohran inkhâwm- naa nuhmei thu hril inzak a um sih a."
What? was it from you that the word of God went forth? or came it unto you alone?,"Pathien thu hi nangnia inthawk- a suok a ni maw? Annawleh, nangni kuom chaua hung tlung a ni maw?"
"If any man thinketh himself to be a prophet, or spiritual, let him take knowledge of the things which I write unto you, that they are the commandment of the Lord.","Tûkhawm thu hriltu amanih, thlarau mi amanih nia ân ngai chun in kuoma thu ka ziek hi Lalpa thupêk a ni ti lo hre raw se."
"But if any man is ignorant, let him be ignorant.","Nisienlakhawm, tûkhawmin hi hi a hriet nuom naw chun ama chu hriet loin um raw se."
"Wherefore, my brethren, desire earnestly to prophesy, and forbid not to speak with tongues.","Chuleiin, ka unauhai, thu hril hi inhâwk hle unla, ṭawng hrietlohaia thu hril khawm khap naw ro;"
But let all things be done decently and in order.,"nisienlakhawm, iengkim mawi- tak le feltaka thaw ni raw se."
"Now I make known unto you brethren, the gospel which I preached unto you, which also ye received, wherein also ye stand,","Chun, unauhai, Chanchin Ṭha ka hril cheu kha inhriettir nâwk ka ti cheu; chu Chanchin Ṭha chu in lâwm a, chutaka bawk chun in ngîr a;"
"by which also ye are saved, if ye hold fast the word which I preached unto you, except ye believed in vain.","ka thu hril cheu kha in awi mei mei a ni nawh a, in pawm tlat a ni chun, chutaka bawk chun sandam mêkin in um a nih."
For I delivered unto you first of all that which also I received: that Christ died for our sins according to the scriptures;,"A hmasatakin, ka ihmu ve bawk chu ka hril sâwng cheu kha; khânga Krista chu Pathien Lekha thu hril ang peia ei suolhai leia a thi a,"
and that he was buried; and that he hath been raised on the third day according to the scriptures;,"an phûm a, Pathien Lekha thu ang peiin ni thum nia keithoin a um a."
and that he appeared to Cephas; then to the twelve;,"Kipha kuomah a hung inlâr dâm kha; chun, sâwm le pahnihai kuomah ân lâr nâwk a."
"then he appeared to above five hundred brethren at once, of whom the greater part remain until now, but some are fallen asleep;",Chu hnunga chun unau za nga nêka tam lai ân lâr nawk a; chuhai laia mi tam lem chu tu chen hin an la dam rawp a; ṭhenkhat ruok chu an in tah a.
then he appeared to James; then to all the apostles;,"Chun, Jakob kuomah ân lâr nâwk a, chu hnung chun tirkohai po po kuomah;"
"and last of all, as to the child untimely born, he appeared to me also.","chun, a tâwptaka chun, a hun nawa pieng ang keima kuoma khawm ân lâr a."
"For I am the least of the apostles, that am not meet to be called an apostle, because I persecuted the church of God.","Kei chu tirko laia chîntak, Pathien kohranhai ka suknawmna leia tirkoa inbûk tlâklo ka ni sih a."
"But by the grace of God I am what I am: and his grace which was bestowed upon me was not found vain; but I labored more abundantly than they all: yet not I, but the grace of God which was with me.","Nisienlakhawm, Pathien lung- insietna leiin ka ni ni ka ni tah; chun, a lunginsietna a mi pêk chu a thlâwnin a um nawh a, chuong nêk hmanin anni po po nêkin ka thaw nasa lem kha; nisienlakhawm, keia khâtin ka thaw nawh a, Pathien lunginsietna ka kuoma um khan a thaw lem a nih."
"Whether then it be I or they, so we preach, and so ye believed.","Iengkhawm ni sienla, kei khawmin, anni khawmin khâng ang khan kan hril hlak a, nangniin khâng khan in awi bawk a."
"Now if Christ is preached that he hath been raised from the dead, how say some among you that there is no resurrection of the dead?","Chun, Krista thu: mithi laia inthawka keithoin a um ti an hril si chun, iengtiziea nangni laia ṭhen- khatin “Mithi thonâwkna hrim hrim a um nawh” in ti?"
"But if there is no resurrection of the dead, neither hath Christ been raised:",Mithi thonâwkna hrim hrim a um naw chun Krista khawm kha keithoin um naw ni;
"and if Christ hath not been raised, then is our preaching vain, your faith also is vain.","chun, Krista chu keithoa a um si naw chun, kan thu hril hi iengkhawm ni naw nih a, in awi khawm ieng- khawm ni naw ni."
"Yea, and we are found false witnesses of God; because we witnessed of God that he raised up Christ: whom he raised not up, if so be that the dead are not raised.","Anih, Krista a keitho ti Pathien kan hrietpui lei khan, Pathien tieng thuah hrietpuitu khelhlip lo ni bawk kan tih — Mithihai keithoa an um naw chun, ama khawm keitho da ni ie."
"For if the dead are not raised, neither hath Christ been raised:","Mithihai keithoin an um si naw chun, Krista khawm kha keithoin um si naw ni,"
"and if Christ hath not been raised, your faith is vain; ye are yet in your sins.","chun, Krista kha keithoa a um naw chun, in iâwi chu iengkhawm ni naw ni, in suolnaa chun in la um zing nîng a tih."
Then they also that are fallen asleep in Christ have perished.,"Chuong chu a ni chun, Kristaa in tahai kha an bohmang tah nîng a tih."
"If we have only hoped in Christ in this life, we are of all men most pitiable.",Tulai dam sûng chaua Krista chunga beiseina nei ei ni chun mi po poa lungsietumtak lo nîng ei tih.
"But now hath Christ been raised from the dead, the firstfruits of them that are asleep.","Nisienlakhawm, Krista chu mithi laia inthawkin keithoin a um tak zet a nih, a inhai tho hmaṭhuoitu a lo ni tah."
"For since by man came death, by man came also the resurrection of the dead.",Mihriem leia thina a lo um leiin mihriem lei bawkin mithi thonâwkna a lo um ta bawk a.
"For as in Adam all die, so also in Christ shall all be made alive.","Adama chun mi po po an thi hlak angin, Kristaa chun mi po po sukhringin um bawk an tih."
"But each in his own order: Christ the firstfruits; then they that are Christ’s, at his coming.","Nisienlakhawm, mâni hun seng peiah, keitho ning an tih: ahmasa takin Krista, tho hmathuoitu; chu hnungah, a hung phaleh Ama tahai po."
"Then cometh the end, when he shall deliver up the kingdom to God, even the Father; when he shall have abolished all rule and all authority and power.","Chu hnunga chun a tâwp chu la hung tlung a tih, chu pha chun rorêlnahai po po le thuneina thil- thawtheina po pohai a sukbo hnungin, Pathien kuomah, Pa kuoma ngei chun ram chu pêng a tih;"
"For he must reign, till he hath put all his enemies under his feet.",a hmêlmahai po po a ke hnuoia a sie hmakhat chu ama chu lala um ding hrim a ni sih a.
The last enemy that shall be abolished is death.,Hmêlma nuhnungtak sukboa um ding chu thina hi a nih.
"For, He put all things in subjection under his feet. But when he saith, All things are put in subjection, it is evident that he is excepted who did subject all things unto him.","“Ama chun a ke hnuoiah iengkim a sie sih a”; nisienlakhawm, “A hnuoiah iengkim siein a um”, ti hin, a hnuoia iengkim sietu chu a ṭhang ve nawh ti ân lang zing a nih."
"And when all things have been subjected unto him, then shall the Son also himself be subjected to him that did subject all things unto him, that God may be all in all.","Chun, a hnuoia iengkim siea a um pha chun, Naupa ngei khawm chu a hnuoia iengkim sietu hnuoia siein um bawk a tih, Pathien chu iengkima iengkim a ni theina dingin."
"Else what shall they do that are baptized for the dead? If the dead are not raised at all, why then are they baptized for them?","Chuong ang a ni naw chun, mithi puola baptisma changhai chu iengtin am thâwng an ta? Mithihai chu keithoa an um dêr si naw ding chun, iengdinga anni puola baptisma an chang hlak?"
why do we also stand in jeopardy every hour?,Iengleiin am eini khawm hi dârkâr tina inlaua ei um hlak am a na?
"I protest by that glorying in you, brethren, which I have in Christ Jesus our Lord, I die daily.","Unauhai, ei Lalpa Isu Kristaa ka suongna cheu chu sâlin, “Ni tinin ka thi hlak,” ka ti a nih."
"If after the manner of men I fought with beasts at Ephesus, what doth it profit me? If the dead are not raised, let us eat and drink, for to-morrow we die.","Mihriem thaw dân ang ringawt- a Ephesia sahrânghai kha insuolpui ka ni chun, ka ta dingin ieng am ṭhahnem a ta? mithi keithoa an um naw ding chun, fain dâwn ei tiu, zîngah ei thi el ding annâwm."
Be not deceived: Evil companionships corrupt good morals.,"Hlêmin um naw ro, “Ruol rilo- haiin nungchang ṭha an suk- khawhlo hlak.”"
