en,hmr
"I charge thee in the sight of God, who giveth life to all things, and of Christ Jesus, who before Pontius Pilate witnessed the good confession;","Pathien thil tinrêng sukhringtu le, Krista Isu, Pontia Pilat hmaa ṭanna ṭha ṭantu mithmua chun, thu ka pêk che;"
"that thou keep the commandment, without spot, without reproach, until the appearing of our Lord Jesus Christ:",ei Lalpa Isu hung inlar nâwk hmakhat chu thupêk kha sawisêlbo le inthiengtaka pawm dingin.
"which in its own times he shall show, who is the blessed and only Potentate, the King of kings, and Lord of lords;","Chu inlârna chu a hun taka chun inpâktlâk thuneitu tak chau, laltakhai laltak, lalhai lal chun inentir a ti che."
"who only hath immortality, dwelling in light unapproachable; whom no man hath seen, nor can see: to whom be honor and power eternal. Amen.","Ama chau chun thi thei nawna a nei a, var hnai thei ruol loa chun a um a, ama chu tûkhawmin an hmu ngai nawh a, hmu khawm an hmu thei naw bawk a, ama kuoma chun chatuona chawimawina le thilthawtheina chu um raw se. Amen."
"Charge them that are rich in this present world, that they be not highminded, nor have their hope set on the uncertainty of riches, but on God, who giveth us richly all things to enjoy;","Hi khawvêla hausahai hi chapo naw ding le sum ringum nawah an beiseina innghat loa, thil po po lâwm- na dinga mi petu Pathien chunga chun innghat lem dingin kâwk rawh."
"that they do good, that they be rich in good works, that they be ready to distribute, willing to communicate;","Thil ṭha thaw dingin, thil ṭha thaw hau dingin, tiktlaia thâwlâwm pe pei dingin,"
"laying up in store for themselves a good foundation against the time to come, that they may lay hold on the life which is life indeed.","hringna, hringna taktak chu an vawng theina dingin, hun hung tlung dinga ding chun lungphûm ṭhatak an ta dinga lo rem dingin infui rawh."
"O Timothy, guard that which is committed unto thee, turning away from the profane babblings and oppositions of the knowledge which is falsely so called;","Aw Timothe, i kuoma inkawltira um chu kawl ṭha rawh, Pathien inzâ naw tieng thu hril mei mei le, indik nawtaka, “Varna,” an iti insêlna hi nghat san rawh."
which some professing have erred concerning the faith. Grace be with you.,"Chu chu ṭhenkhathaiin nei amanih insâwnin, ringna chu an fe kawisan tah a. Lunginsietna in kuomah um raw se."
