en,hmr
"His prayer also, and how God was entreated of him, and all his sin and his trespass, and the places wherein he built high places, and set up the Asherim and the graven images, before he humbled himself, behold, they are written in the history of Hozai.","A ṭawngṭaina dâm, ama Pathienin a lo ngaisak dânhai dâm, a suolna po po le a bawsietna po po le, bâwlhmun a siemna hmunhai le, ama le ama ân sukhnuoi hmaa Asera a siem dâm le, milim ker a siemhai thu chu, ngai ta, Hozai chanchinbua chun ziek an nih."
"So Manasseh slept with his fathers, and they buried him in his own house: and Amon his son reigned in his stead.","Chuongchun, Manasse chu a thlatuhai lai a in tah a, ama ina ngei chun an phûm tah a, a naupa Amon chun ama aia chun ro a rêl tah a."
Amon was twenty and two years old when he began to reign; and he reigned two years in Jerusalem.,Amon chu ro a rêl ṭan chun kum sâwmhni pahnia upa a na; Jerusa- lema chun kum hni sûng ro a rêl a.
"And he did that which was evil in the sight of Jehovah, as did Manasseh his father; and Amon sacrificed unto all the graven images which Manasseh his father had made, and served them.","A pa Manasse ang bawk khan, LALPA mithmuah thil suol chu a thawh a; Amon chu a pa Manassein milim ker a lo siem tahai po po kuoma khan ân thawi a, an rawng a bâwl a."
"And he humbled not himself before Jehovah, as Manasseh his father had humbled himself; but this same Amon trespassed more and more.","A pa Manasse ân sukhnuoi ta ang khan ama hi chu LALPA hmaa chun ân sukhnuoi ve nawh a; chuong- chun, hi Amon hi chu a suol nasa deu deu tah a."
"And his servants conspired against him, and put him to death in his own house.","Chun, a siehlawhai chun ama chu an phierrûk a, ama in sûnga ngei chun an that tah a."
But the people of the land slew all them that had conspired against king Amon; and the people of the land made Josiah his son king in his stead.,"Amiruokchu, chu rama mihai chun lal Amon phierrutuhai po po an that a; chun, chu rama mipuihai chun a naupa Josia chu ama aia chun lalah an siem tah a."
Josiah was eight years old when he began to reign; and he reigned thirty and one years in Jerusalem.,"Rorêl a ṭan chun Josia chu kum rieta upa a na, Jerusa- lema chun kum sâwmthum pakhat sûng ro a rêl a."
"And he did that which was right in the eyes of Jehovah, and walked in the ways of David his father, and turned not aside to the right hand or to the left.","LALPA mithmuah thil indik chu a thawh a, a thlatu David lampuihai chu a hrawh a, changtienga manih, vawitienga manih khawm a pêthmang nawh a."
"For in the eighth year of his reign, while he was yet young, he began to seek after the God of David his father; and in the twelfth year he began to purge Judah and Jerusalem from the high places, and the Asherim, and the graven images, and the molten images.","Naupang a la ni laiin, a rorêl a kum rietnaa inthawk chun a thlatu David Pathien chu a zawng ṭan a; chun, kum sâwmpahninaa chun Juda ram le Jerusalem chu Asera dâm, milim a kera kerhai dâm, milim a sunga sunghai dâm le bâwlhmun po poa inthawk chun a sukthieng ṭan tah a."
"And they brake down the altars of the Baalim in his presence; and the sun-images that were on high above them he hewed down; and the Asherim, and the graven images, and the molten images, he brake in pieces, and made dust of them, and strewed it upon the graves of them that had sacrificed unto them.","Ama hmaihmaa ngei chun Baal mâichâmhai chu a sukchim a; nisa milimhai, chuonghai chung daia um- hai chu a phûr thlûk a; Asera le milim a kera kerhai le a sunga sunghai chu a vuok nâwi vawng a, pilvutin a siem a, an kuoma lo inthâwi hlaktuhai thlân chungahai chun a phul a."
"And he burnt the bones of the priests upon their altars, and purged Judah and Jerusalem.","Chun, thiempuhai ruhai chu an mâichâmhai chunga chun a rawh a, Juda ram le Jerusalem chu a suk- thieng a."
"And so did he in the cities of Manasseh and Ephraim and Simeon, even unto Naphtali, in their ruins round about.","Chun, Manasse le Ephraim le Simeon khawpuihaia, Naphtali chen- in, an sietna hmun vêlahai chun chuong ang chun a thaw bawk a."
"And he brake down the altars, and beat the Asherim and the graven images into powder, and hewed down all the sun-images throughout all the land of Israel, and returned to Jerusalem.","Chun, mâichâmhai chu a suk- chim a, Asera chu, milim a kera kerhai le chun a vuok nâwi vawng a, Israel ram po poa inthawk chun nisa milimhai po po chu a phûr thlûk vawng a, Jerusalema chun a kîr nâwk tah a."
"Now in the eighteenth year of his reign, when he had purged the land and the house, he sent Shaphan the son of Azaliah, and Maaseiah the governor of the city, and Joah the son of Joahaz the recorder, to repair the house of Jehovah his God.","Chun, chuonga ram le in chu a sukthieng laia a rorêlna a kum sâwm pariet kum chun, Azalia naupa Saphan hai, khawpui sûng rorêltu Maaseia hai, Joahaz naupa Joa, thil inchiktuhai chu a Pathien LALPA in chu siem ṭha dingin a tir tah a."
"And they came to Hilkiah the high priest, and delivered the money that was brought into the house of God, which the Levites, the keepers of the threshold, had gathered of the hand of Manasseh and Ephraim, and of all the remnant of Israel, and of all Judah and Benjamin, and of the inhabitants of Jerusalem.","Thiempu laltak Hilkia kuoma chun an hung a, Levi mi kawtkhâr vêngtuhaiin Manasse le Ephraim mihai kuta inthawk le, Israel mi a la um sun po poa inthawk dâm, Juda le Benjamin mi po poa inthawk dâm, Jerusalema chêngtuhaia inthawka an lâk khâwmhai, Pathien ina sum hung lâka umhai kha, an hung pêk a."
And they delivered it into the hand of the workmen that had the oversight of the house of Jehovah; and the workmen that wrought in the house of Jehovah gave it to mend and repair the house:,"Chun, chu chu LALPA in en- kawlna sin thawtuhai kuta chun an pêk a; chun, LALPA ina sinthawtuhai chu in siem ṭhatna ding le bâwl ṭhatna ding chun an pêk a,"
"even to the carpenters and to the builders gave they it, to buy hewn stone, and timber for couplings, and to make beams for the houses which the kings of Judah had destroyed.","in bâwltuhai le thingrem siem- tuhai kuoma lung saksahai, thing a zawmna dinghai inchâwkna ding le, Juda lalin a lo suksiet tah in bâwlna dinga thingtumhai siemna dingin."
"And the men did the work faithfully: and the overseers of them were Jahath and Obadiah, the Levites, of the sons of Merari; and Zechariah and Meshullam, of the sons of the Kohathites, to set it forward; and others of the Levites, all that were skilful with instruments of music.","Mihai chun sin chu ringumtak- in an thawh a; annihai enkawltuhai chu Merari naupasalhai, Levi mi Jahath le Obadia hai; Kohath mi naupasalhai Zekaria le Mesullam hai chu an nih; Levi mihai, thil ri sutna thilhaia themthiem taphawthai chu."
"Also they were over the bearers of burdens, and set forward all that did the work in every manner of service: and of the Levites there were scribes, and officers, and porters.","Chun, phurrik phurtuhai en- kawltuhai khawm an ni bawk a, rawngbâwlna sin chu kawng ieng anga khawm an enkawl pei a; chun, Levi mihai chu ziektuhai, hotuhai le kawtkhâr vêngtuahai an um a."
"And when they brought out the money that was brought into the house of Jehovah, Hilkiah the priest found the book of the law of Jehovah given by Moses.","Chun, LALPA ina tangka lâk lûta um chu an hung lâk suok chun, Hilkia chun Mosien a pêk, LALPA dân lekhabu chu a hmusuok a."
"And Hilkiah answered and said to Shaphan the scribe, I have found the book of the law in the house of Jehovah. And Hilkiah delivered the book to Shaphan.","Chun, Hilkia chun a dawn a, lekhaziektu Saphan kuoma chun, “LALPA ina chun dân lekhabu chu kan hmusuok tah,” a ta. Chuongchun, Hilkia chun lekhabu chu Saphan kuoma chun a pêk tah a."
"And Shaphan carried the book to the king, and moreover brought back word to the king, saying, All that was committed to thy servants, they are doing.","Saphan chun lekha chu lal kuoma chun a chawi a; Saphan chun lal kuoma chun thu a hung intlun nâwk a, “I siehlaw hai kuoma thaw dinga pêk ang khan an thaw a;"
"And they have emptied out the money that was found in the house of Jehovah, and have delivered it into the hand of the overseers, and into the hand of the workmen.","LALPA ina tangka hmua um kha an bun suok a, sinthawtuhai kuta le a enkawltuhai kuta chun an pêk suok tah a,” tiin."
"And Shaphan the scribe told the king, saying, Hilkiah the priest hath delivered me a book. And Shaphan read therein before the king.","Chun, ziektu Saphan chun lal kuoma chun, “Thiempu Hilkia chun lekhabu a mi lo pêk a,” a ta. Chun, chutaka chun Saphan chun lal hmaa chun a tiem tah a."
"And it came to pass, when the king had heard the words of the law, that he rent his clothes.","Chun, lal chun dân thuhai chu a hriet chun a puonhai a keithlêr a."
"And the king commanded Hilkiah, and Ahikam the son of Shaphan, and Abdon the son of Micah, and Shaphan the scribe, and Asaiah the king’s servant, saying,","Chun, lal chun Hilkia hai, Saphan naupa Ahikam hai, Mika naupa Abdon hai le lekhaziektu Saphan le lal siehlaw Asaia chu thu a pêk a,"
"Go ye, inquire of Jehovah for me, and for them that are left in Israel and in Judah, concerning the words of the book that is found; for great is the wrath of Jehovah that is poured out upon us, because our fathers have not kept the word of Jehovah, to do according unto all that is written in this book.","“Fe unla, kei le, Juda le Israel rama mâksana la umhai ta ding hin lekhabu hmu suoka um thu ang khan LALPA mi hung râwnpêk ta u; lekha- bua ziek po po, ang taka thaw dinga, ei thlatuhai chun LALPA thu chu an lo pawm ta naw lei khan, LALPA lunginsenna ei chunga bunthlâka um hi a nasa a nih,” tiin."
"So Hilkiah, and they whom the king had commanded, went to Huldah the prophetess, the wife of Shallum the son of Tokhath, the son of Hasrah, keeper of the wardrobe (now she dwelt in Jerusalem in the second quarter); and they spake to her to that effect.","Chuongchun, Hilkia le lalin a tirhai po po chu, silfên vêngtu Hasra naupa Tokath naupa Sallum nuhmei, zâwlneinu Hulda kuoma chun an fe tah a, (chuong lai chun Jerusalema vêng pahninaa chun a um a nih), a kuoma chun chuong thua chun thu an hril tah a."
"And she said unto them, Thus saith Jehovah, the God of Israel: Tell ye the man that sent you unto me,","Ama chun an kuomah, “Israel Pathien LALPA chun hieng hin a tih, ‘Ka kuoma nangni hung tirtu cheu kuoma chun hieng hin hril ro,"
"Thus saith Jehovah, Behold, I will bring evil upon this place, and upon the inhabitants thereof, even all the curses that are written in the book which they have read before the king of Judah.","LALPA chun hieng hin a tih, Ngai ta u, hi hmuna le hi hmun hluotuhai chunga chun thil ṭha naw ka hung intlungtir ding a nih; Juda ram lal hmaa an tiem tah lekhabua khâng ṭawngsiehai po po kha,"
"Because they have forsaken me, and have burned incense unto other gods, that they might provoke me to anger with all the works of their hands; therefore is my wrath poured out upon this place, and it shall not be quenched.","kei an mi lo nghatsan tah a; an kut sinthawhaia lunginsen dinga an mi chawktho theina dingin pathien danghai kuoma chun riminhnikhai an rawh a; chuleiin, ka lunginsenna chu hi hmun chunga hin bunthlâk a ni tah a, sukre el ni ta naw nih,’ tiin."
"But unto the king of Judah, who sent you to inquire of Jehovah, thus shall ye say to him, Thus saith Jehovah, the God of Israel: As touching the words which thou hast heard,","Amiruokchu, Juda lal, LALPA chu thu indawn dinga tirtu cheu kuoma chun hieng hin hril in ta, Israel Pathien LALPA chun hieng hin a tih, ‘Thu i lo hriet ta chungthua chun,"
"because thy heart was tender, and thou didst humble thyself before God, when thou heardest his words against this place, and against the inhabitants thereof, and hast humbled thyself before me, and hast rent thy clothes, and wept before me; I also have heard thee, saith Jehovah.","hi hmun le a sûnga chênghai chungthua, thuhai chu i hriet phinga i lungril ân nêm a, nangma le nangma chu Pathien hmaa chun în sukhnuoi leiin le, i puonhai i keithlêr a, ka hmaa chun i ṭap leiin kei khawma ka hung hriet ve che a nih."
"Behold, I will gather thee to thy fathers, and thou shalt be gathered to thy grave in peace, neither shall thine eyes see all the evil that I will bring upon this place, and upon the inhabitants thereof. And they brought back word to the king.","Ngai ta, i thlatuhai kuomah infetir ka ti cheh a, i thlâna chun thlamuongtakin fêng i ta, hi hmun le a sûnga umhai chunga thil ṭha naw ka hung intlungtir dinghai po po chu i mithaiin hmu naw nih a tih,’ ti ro,” a ta. Chuongchun, lal chu, thu chu an hung intlun nâwk a."
Then the king sent and gathered together all the elders of Judah and Jerusalem.,"Chun, lal chun mi a tir a, Jerusalem le Juda rama upahai po po chu a ko khâwm tah a."
"And the king went up to the house of Jehovah, and all the men of Judah and the inhabitants of Jerusalem, and the priests, and the Levites, and all the people, both great and small: and he read in their ears all the words of the book of the covenant that was found in the house of Jehovah.","Chun, lal chu LALPA ina chun a hang feh a; Juda rama mi po pohai le Jerusalema chêngtuhai le, thiem- puhai le Levi mihai le, mi po po a chîn a lienin an hang fe veh a; LALPA ina thuthlungna lekhabu hmua um sûnga thuhai po po an na hrieta chun a tiem tah a."
"And the king stood in his place, and made a covenant before Jehovah, to walk after Jehovah, and to keep his commandments, and his testimonies, and his statutes, with all his heart, and with all his soul, to perform the words of the covenant that were written in this book.","Chun, lal chu a hmuna chun a ngîr a, LALPA chu zui a, a thupêkhai, a thuinhriettirhai, a thuruothai chu a lungril po po le a lungvar po poa zâwm a, lekhabua thuthlung thu zieka umhai po po chu thaw dingin LALPA hmaa chun thuthlung a siem tah a."
"And he caused all that were found in Jerusalem and Benjamin to stand to it. And the inhabitants of Jerusalem did according to the covenant of God, the God of their fathers.","Chun, Benjamin le Jerusalema umhai po po chu chuong anga um dingin a tih a. Jerusalema chênghai chun an thlatu Pathien, Pathien thuthlung ang chun an thawh a."
"And Josiah took away all the abominations out of all the countries that pertained to the children of Israel, and made all that were found in Israel to serve, even to serve Jehovah their God. All his days they departed not from following Jehovah, the God of their fathers.","Chun, Josia chun Israel thlahai ihluo ram po poa inthawk chun tirdakumna po po chu a lâk hmang a, Israel rama umhai po po LALPA an Pathien rawng chu ân bâwltir a. A dam sûng po po chun an thlatuhai Pathien LALPA zuinaa inthawk chun an pêthmang nawh a."
And Josiah kept a passover unto Jehovah in Jerusalem: and they killed the passover on the fourteenth day of the first month.,Josia chun LALPA kuoma fekân ruoiṭhe chu Jerusalema chun a hmang a; thla hmasa tak ni sâwmpali ni chun fekân ruoiṭhena ding chu an that a.
"And he set the priests in their offices, and encouraged them to the service of the house of Jehovah.","Thiempuhai chu an sinthawahai chun a ruot a, LALPA in rawngbâwl- naa ding chun ân fui tâwl a."
"And he said unto the Levites that taught all Israel, that were holy unto Jehovah, Put the holy ark in the house which Solomon the son of David king of Israel did build; there shall no more be a burden upon your shoulders. Now serve Jehovah your God, and his people Israel;","LALPA ta dinga inthieng Israel po po inchûktir hlak Levi mihai kuom a chun, “Israel lal David naupa Solomonin in a bâwla khan Thu- thlungna bâwm inthieng chu sie ro; in liengkoahai zâwn ngâi ta naw nih a; tuhin in Pathien LALPA le a mi Israelhai rawng chu bâwl ro."
"and prepare yourselves after your fathers’ houses by your courses, according to the writing of David king of Israel, and according to the writing of Solomon his son.","Nangni khawm Israel lal David ziek ang le, a naupa Solomon ziek ang tak khan an pahnam ang peiin in pâwl bi chu insiem unla."
"And stand in the holy place according to the divisions of the fathers’ houses of your brethren the children of the people, and let there be for each a portion of a father’s house of the Levites.","Chun, Levi hnam inṭhe dân ang pei le, in unau mipuihai pahnam in- ṭhe dân ang pei chun hmun inthienga chun ngîr unla."
"And kill the passover, and sanctify yourselves, and prepare for your brethren, to do according to the word of Jehovah by Moses.","Chun, fekân ruoiṭhena ding chu that unla, nangni le nangni chu in- hlân thieng ro; Mosie hmanga LALPA thu ang tak kha thaw dingin in unauhai ta ding khawm chun buotsai bawk unla,” a ta."
"And Josiah gave to the children of the people, of the flock, lambs and kids, all of them for the passover-offerings, unto all that were present, to the number of thirty thousand, and three thousand bullocks: these were of the king’s substance.","Chun, Josia chun chu hnam thlahai, a umhai po kuoma chun ran ruol laia mi berâmte dâm, kêlte dâm sîng thum le bâwngchal sâng thum fekân ruoiṭhenaa inhlân dingin a pêk a; hi hi lal suma mi a nih."
"And his princes gave for a freewill-offering unto the people, to the priests, and to the Levites. Hilkiah and Zechariah and Jehiel, the rulers of the house of God, gave unto the priests for the passover-offerings two thousand and six hundred small cattle, and three hundred oxen.","Chun, a hotuhai chun Levi mihai le thiempuhai le mipui kuoma chun nuom thua thilinhlân dinghai chu an pêk bawk a. Hilkia le Zekaria le Jehiel, Pathien in rorêltuhai chun thiempuhai kuoma chun fekân ruoi- ṭhena dingin ran chîn sâng hni le za ruk le, bâwngchal za thum an pêk a."
"Conaniah also, and Shemaiah and Nethanel, his brethren, and Hashabiah and Jeiel and Jozabad, the chiefs of the Levites, gave unto the Levites for the passover-offerings five thousand small cattle, and five hundred oxen.","Konania le a unauhai Semaia le Nethanel le, Levi mihai hotuhai Hasabia le, Jeiel le, Jozabad chun Levi mihai kuomah fekân ruoiṭhenaa thilinhlân dingin ran ruol chîn sâng nga le bâwngchal za nga an pêk bawk a."
"So the service was prepared, and the priests stood in their place, and the Levites by their courses, according to the king’s commandment.","Chuongchun, rawngbâwlna chu buotsai a ni tah a, lal thupêk ang tak chun thiempuhai chu an hmuna chun an ngîr a, Levi mihai chu an pâwl dân ang peiin an thaw tah a."
"And they killed the passover, and the priests sprinkled the blood which they received of their hand, and the Levites flayed them.","Chun, fekân ruoiṭhena ding chu an that a, thiempuhai chun an kutin thisen chu an theh a, Levi mihai chun an inhlip a."
"And they removed the burnt-offerings, that they might give them according to the divisions of the fathers’ houses of the children of the people, to offer unto Jehovah, as it is written in the book of Moses. And so did they with the oxen.","Chun, pumrawhmang thilin- hlânhai chu an sie hmang a, Mosie lekhabua ziek anga LALPA kuoma inhlân dinga, chu hnam thlahai pahnam inṭhe dân ang peia an pêk suok theina dingin. Chuongchun, bâwngchalhai khawm chu chuong ang bawk chun an thawh a."
"And they roasted the passover with fire according to the ordinance: and the holy offerings boiled they in pots, and in caldrons, and in pans, and carried them quickly to all the children of the people.","Chun, fekân ruoiṭhena ding chu dân ang peiin meiah an em hmin a, chun, thilinhlân inthienghai sa kha chu bêlhai le, bêl bau ûmhai le, bêl indarhaiin an suong a, mi po pohai kuoma chun inhmâwtakin an fepui tah a."
"And afterward they prepared for themselves, and for the priests, because the priests the sons of Aaron were busied in offering the burnt-offerings and the fat until night: therefore the Levites prepared for themselves, and for the priests the sons of Aaron.","Chun, chu hnunga chun anni ta ding le thiempuhai ta ding chun an buotsai tah a; Aron naupasalhai thiempuhai chun pumrawhmang thilinhlân le a thâuhai chu zân chen- in an buoipui tah a; chuleiin, Levi mihai chun anni le Aron naupasal thiempuhai ta ding chun an buotsai el a nih."
"And the singers the sons of Asaph were in their place, according to the commandment of David, and Asaph, and Heman, and Jeduthun the king’s seer; and the porters were at every gate: they needed not to depart from their service; for their brethren the Levites prepared for them.","Chun, David le Asaph le Heman le lal zâwlnei Jeduthun thupêk angin hlasaktuhai, Asaph naupasalhai chu an hmuna chun an um a; chun, kawtkhâr vêngtuhai chu dâi kawt- khâr tina chun an um bawk a; an sinthawhai chu an mâksan a ṭûl nawh a, an unau Levi mihai chun an ta dingin an buotsaipêk leiin."
"So all the service of Jehovah was prepared the same day, to keep the passover, and to offer burnt-offerings upon the altar of Jehovah, according to the commandment of king Josiah.","Chuongchun, lal Josia thupêk angin, LALPA rawngbâwlna po po chu ni khat sûngin, fekân ruoiṭhe hmang ding le LALPA mâichâm chunga pumrawhmang thilinhlân inhlân ding chu, buotsai vawng a ni tah a."
"And the children of Israel that were present kept the passover at that time, and the feast of unleavened bread seven days.","Chun, Israel thlahai chutaka umhai chun chu nia chun fekân ruoi- ṭhe chu an hmang a, chawlṭhanglo bei ruoiṭhe chu ni sari an hmang bawk a."
"And there was no passover like to that kept in Israel from the days of Samuel the prophet; neither did any of the kings of Israel keep such a passover as Josiah kept, and the priests, and the Levites, and all Judah and Israel that were present, and the inhabitants of Jerusalem.","Zâwlnei Samuel hun laia inthawk ta khan chuonga fekân ruoi- ṭhe chu Israel rama lal tu khawma Josiain a hmang ang hin an hmang ngai nawh a, thiempuhai le Levi mihai le, Israel le Juda chutaka umhai po po le, Jerusalema chênghai khawma an hmang ngai nawh a."
In the eighteenth year of the reign of Josiah was this passover kept.,Josia rorêl a kum sâwmpariet- naa chun a nih a hi fekân ruoiṭhe hi hmanga a um chu.
"After all this, when Josiah had prepared the temple, Neco king of Egypt went up to fight against Carchemish by the Euphrates: and Josiah went out against him.","Hieng po po hnunga hin, Josia chun biekin chu a siem ṭha zo chun Aigupta lal Neko chu Euphrates vadung panga Karkemis chu rûn dingin a hang feh a; Josia chu ama tuok ding chun a fe suok tah a."
"But he sent ambassadors to him, saying, What have I to do with thee, thou king of Judah? I come not against thee this day, but against the house wherewith I have war; and God hath commanded me to make haste: forbear thee from meddling with God, who is with me, that he destroy thee not.","Nisienlakhawm, ama chun aiâwtuhai a hung tir a, a kuomah, “Nang Juda lal, nang hi iengtin am ka thaw ding che a na? Vawisûn hi nang do ding chein ka hung nawh a, amiruokchu, indona ka neipuihai chu do dingin a ni lem ka hung; chun, Pathien chun inhmaw dingin thu a mi pêk a, Pathien chu sukbuoi lo dingin insûm hrâm la, ama chu ka kuomah a um a, sukbohmang rawi a ti che,” tiin."
"Nevertheless Josiah would not turn his face from him, but disguised himself, that he might fight with him, and hearkened not unto the words of Neco from the mouth of God, and came to fight in the valley of Megiddo.","Nisienlakhawm, Josia chun ama chu a kîrsan chuong nawh a, ama chu a do ngei theina dingin, ân sukdanglam a; Pathien baua in- thawka Neko thu chu a ngaisak nawh a, ama chu Megiddo ruoma do ding chun a suok tah a."
"And the archers shot at king Josiah; and the king said to his servants, Have me away; for I am sore wounded.","Chun, thal kâp mihai chun Josia chu an kâp a, chun, lal chun a siehlaw kuoma chun, “Ka hliem nasa hle el sih a, mi sie hmang ro khai,” a ta."
"So his servants took him out of the chariot, and put him in the second chariot that he had, and brought him to Jerusalem; and he died, and was buried in the sepulchres of his fathers. And all Judah and Jerusalem mourned for Josiah.","Chuongchun, a siehlawhai chun sakawr tawlailîra inthawk chun an lâk suok a, a sakawr tawlailîr danga chun an sieh a, Jerusalemah an hung ṭhuoi tah a; a thih a, a thlatuhai thlân ina chun phûmin a um tah a, Juda le Jerusalem po poin Josia chu an sûn a."
"And Jeremiah lamented for Josiah: and all the singing men and singing women spake of Josiah in their lamentations unto this day; and they made them an ordinance in Israel: and, behold, they are written in the lamentations.","Chun, Jeremia khawm chun Josia chu a sûn a; vawisûn ni chen hin, hlasaktu pasal le hlasaktu nuhmeihai khawm chun Josia an sûnna hla chu an lân sam a; Israel rama chun thupêkhaiah an siem a, chuong chu, ngai ta, sûnnaa chun ziek an nih."
"Now the rest of the acts of Josiah, and his good deeds, according to that which is written in the law of Jehovah,","Josia thilthaw danghai le, a thilthaw ṭhathai chu, LALPA dâna ziek ang tak chun,"
"and his acts, first and last, behold, they are written in the book of the kings of Israel and Judah.","a thilthawhai a hmasatak le a nuhnungtak chu, ngai ta, Juda le Israel ram lalhai lekhabua chun ziek a nih."
"Then the people of the land took Jehoahaz the son of Josiah, and made him king in his father’s stead in Jerusalem.","Chun, chu ram mipuihai chun Josia naupa Jehoahaz chu an ṭhuoi a, a pa aia chun Jerusalema lalah an siem tah a."
