en,hmr
"And Solomon the son of David was strengthened in his kingdom, and Jehovah his God was with him, and magnified him exceedingly.","Chun, David naupa Solomon chu a rama chun sukdet a ni tah a, LALPA a Pathien chu a kuomah a um a, ama chu nasatakin a chawimawi a."
"And Solomon spake unto all Israel, to the captains of thousands and of hundreds, and to the judges, and to every prince in all Israel, the heads of the fathers’ houses.","Solomon chun, Israel mi po pohai le, sipai za khat pâwl le sâng khat pâwl hotuhai kuoma le, rorêltuhai kuoma le, Israel rama lalhai po po kuoma le, pahnam luhai kuoma chun thu a hril a."
"So Solomon, and all the assembly with him, went to the high place that was at Gibeon; for there was the tent of meeting of God, which Moses the servant of Jehovah had made in the wilderness.","Chuongchun, Solomon le a kuoma mipui inkhâwmhai po po chu Gibeona bâwlhmuna chun an hang fe tah a; LALPA siehlaw Mosien thla- lêra Pathien ta dinga intuokna in a siem chu chutaka chun a um sih a."
But the ark of God had David brought up from Kiriath-jearim to the place that David had prepared for it; for he had pitched a tent for it at Jerusalem.,"Nisienlakhawm, Pathien bâwm chu David chun Kiriath-jearima in- thawk khan a hung lâk a, Davidin a siena dinga a buotsai hmuna khan a lo sie tah a; Jerusalema khan, chu hmun ding chun puon in a lo zâr ta sih a."
"Moreover the brazen altar, that Bezalel the son of Uri, the son of Hur, had made, was there before the tabernacle of Jehovah: and Solomon and the assembly sought unto it.","Chunawa khawm, dârsen mâi- châm Hur naupa, Uri naupa Bezalel- in a lo siem ta chu LALPA biekbûk hmaa chun a um bawk a; Solomon le mipui chun an va pan a."
"And Solomon went up thither to the brazen altar before Jehovah, which was at the tent of meeting, and offered a thousand burnt-offerings upon it.","Chun, Solomon chu LALPA hmaa dârsen mâichâm intuokna ina uma chun a hang feh a, a chunga chun pumrawhmang thilinhlân sâng khat lai ân hlân a."
"In that night did God appear unto Solomon, and said unto him, Ask what I shall give thee.","Chu zân chun Solomon kuomah LALPA chu a hung inlâr a, a kuomah, “Ieng am a na ka pêk ding che, mi hni rawh,” a ta."
"And Solomon said unto God, Thou hast showed great lovingkindness unto David my father, and hast made me king in his stead.","Solomon chun Pathien kuoma chun, “Ka pa David kuoma chun lung- insietna nasatak i lo inentir tah a, ama aia chun tuhin lalah i mi siem tah a."
"Now, O Jehovah God, let thy promise unto David my father be established; for thou hast made me king over a people like the dust of the earth in multitude.","Tuhin, Aw LALPA Pathien, ka pa David kuoma i thutiem chu suk- puitling ni raw se; tam tienga hnuoia pilvut zât rau ang mipui chunga hin lalah i mi siem ta sih a."
"Give me now wisdom and knowledge, that I may go out and come in before this people; for who can judge this thy people, that is so great?","Hi mipuihai hmaa hin ka lûta ka suok theina dingin tuhin varna le hrietthiem theina nangin mi pe la; chuong naw chun, hi i mihai hieng zât lâwm lâwm hi tuin am ro rêlpêk thei an ta?” a ta."
"And God said to Solomon, Because this was in thy heart, and thou hast not asked riches, wealth, or honor, nor the life of them that hate thee, neither yet hast asked long life; but hast asked wisdom and knowledge for thyself, that thou mayest judge my people, over whom I have made thee king:","Pathien chun Solomon kuomah, “Hi hi i lungrilah a um a, hausak- nahai, neinungnahai le inzaumnahai amanih, nangma theidatuhai che hringna amanih, i hni nawh a, dam sâwtna khawm i hni bawk nawh a, amiruokchu, ka mihai, an chunga lala ka siemnahai che chu ro i rêl- pêk theina dinga nangma ta dinga varna le hrietthiem theina i hni lem leiin;"
"wisdom and knowledge is granted unto thee; and I will give thee riches, and wealth, and honor, such as none of the kings have had that have been before thee; neither shall there any after thee have the like.","varna le hrietthiem theina chu i kuoma pêk a ni tah a; i hmaa lalhai tukhawma an nei dêr lo le, nangma hnunga tukhawma chuong anga an nei dêr lo ding hausaknahai le, nei- nungnahai le, inzâkaina pêng ka ti che,” a ta."
"So Solomon came from the high place that was at Gibeon, from before the tent of meeting, unto Jerusalem; and he reigned over Israel.","Chuongchun, Solomon chu a vân zinna Gibeona bâwlhmun, in- tuokna puon in hmaa inthawk chun Jerusalema chun a hung tah a; chuongchun, Israel chunga chun ro a rêl tah a."
"And Solomon gathered chariots and horsemen: and he had a thousand and four hundred chariots, and twelve thousand horsemen, that he placed in the chariot cities, and with the king at Jerusalem.","Chun, Solomon chun sakawr tawlailîrhai le sakawr chung chuong mihai chu a kei khâwm a, sakawr tawlailîr sâng khat le za li le, sakawr chung chuong mi sîng khat le sâng hni a nei a; chuong chu sakawr tawlailîr khawpuiahai le lal kuomah Jerusalema chun a sieh a."
"And the king made silver and gold to be in Jerusalem as stones, and cedars made he to be as the sycomore-trees that are in the lowland, for abundance.","Chun, lal chun tangka le râng- kachak chu Jerusalema chun lung ang el le, Sidar thing chu phai rama theichang kûng ang ela tama intiengin a sieh a."
"And the horses which Solomon had were brought out of Egypt; the king’s merchants received them in droves, each drove at a price.","Chun, Solomonin sakawr a neihai chu Aigupta rama inthawka inchâwk suok vawng an nih; lal sumdâwng mihai chun a ruol ruolin an lo khâr hlak a, a ruola inchâwk pei a nih;"
"And they fetched up and brought out of Egypt a chariot for six hundred shekels of silver, and a horse for a hundred and fifty: and so for all the kings of the Hittites, and the kings of Syria, did they bring them out by their means.","chuongchun, an hung lâk a, Aiguptaa inthawkin sakawr tawlailîr chu tangkaruo shekel za ruk peiin an intlungtir bawk a; chun, sakawrhai chu Hit mi lalhai le Suria lalhai ta ding khawmin an suktlungpêk hlak a; sakawrhai chu tangkaruo shekel za le sâwmnga peiin an intlungtir a nih."
And Rehoboam went to Shechem; for all Israel were come to Shechem to make him king.,Rehoboam chu Sekema chun a feh a; Israelhai po po chu ama chu lala siem dingin Sekema chun an hung sih a.
"And it came to pass, when Jeroboam the son of Nebat heard of it (for he was in Egypt, whither he had fled from the presence of king Solomon), that Jeroboam returned out of Egypt.","Chun, Nebat naupa Jeroboam chun chu chu a lo hriet chun, (Solomon hmaa inthawka a tlân- hmangna Aigupta rama chun a la um a ni sih a.) Jeroboam chu Aigupta rama inthawk chun a hung kîr tah a."
"And they sent and called him; and Jeroboam and all Israel came, and they spake to Rehoboam, saying,","Chun, mi an tir a, ama chu an ko tah a; chuongchun, Jeroboam le Israelhai po po chu an hung a, Rehoboam kuoma chun an hril a,"
"Thy father made our yoke grievous: now therefore make thou the grievous service of thy father, and his heavy yoke which he put upon us, lighter, and we will serve thee.","“I pa khan kan rîngkawl chu riktakin a lo siem tah a; chuleiin, tuhin i pa rawngbâwlna riktak le, kan chunga rîngkawl rik ân nghat hi mi sukzâng pêk la, chuongchun, i rawngbâwl kan tih,” an ta."
"And he said unto them, Come again unto me after three days. And the people departed.","Anni kuoma chun, “Ni thum hnungah ka kuomah hung nâwk ro,” a lo tih a, chuongchun, mipui chu an fe tah a."
"And king Rehoboam took counsel with the old men, that had stood before Solomon his father while he yet lived, saying, What counsel give ye me to return answer to this people?","Chun, Rehoboam chun mi upa- hai, a pa Solomon damlaia a hmaa ngîr hlakhai chu, “Hi mipuihai hi dawn kirna dingin ieng thurâwn am in mi pêk a,” tiin, a râwn a."
"And they spake unto him, saying, If thou be kind to this people, and please them, and speak good words to them, then they will be thy servants for ever.","Anni chun a kuomah, “Hi mipui chunga hin za i ngai a, anni hi i suklungawi a, an kuomah thu ṭha i hril chun kumkhuoin i siehlawhai nîng an tih,” an ta."
"But he forsook the counsel of the old men which they had given him, and took counsel with the young men that were grown up with him, that stood before him.","Nisienlakhawm, upahai thurâwn ama an pêk ta chu a nghatsan a, ama hmaa ngîr hlak, ama ruolpuihai tlangvâlhai chu a rawn tah a."
"And he said unto them, What counsel give ye, that we may return answer to this people, who have spoken to me, saying, Make the yoke that thy father did put upon us lighter?","An kuoma chun, “Hieng mipui, ‘I pain kan chunga rîngkawl a innghat hi mi sukzângpêk rawh,’ tituhai hi ieng dawnna am ei inkîr thei ding ieng am thurâwn in nei a?” a ta."
"And the young men that were grown up with him spake unto him, saying, Thus shalt thou say unto the people that spake unto thee, saying, Thy father made our yoke heavy, but make thou it lighter unto us; thus shalt thou say unto them, My little finger is thicker than my father’s loins.","Tlangvâlhai, ama ruolpuihai chun an hril a, a kuomah, “ ‘I pain kan rîngkawl a sukrik êm a, nangin keini mi sukzângpêk rawh,’ i kuoma tituhai mipui kuoma chun hieng ang hin ti la, hieng ang hin an kuoma chun hril rawh, ‘Ka kutte chu ka pa kâwng- bâwr nêkin a lien lem a."
"And now whereas my father did lade you with a heavy yoke, I will add to your yoke: my father chastised you with whips, but I will chastise you with scorpions.","Tuhin ka pain rîngkawl rik a lo inphurtir ta cheu a; kei chun in rîng- kawl chu belsâng ka tih; ka pain vuoknain a lo hrem cheu a ni chun, kei chun ainuvêtin hrem ka ti cheu,’ tiin,” an tih a."
"So Jeroboam and all the people came to Rehoboam the third day, as the king bade, saying, Come to me again the third day.","Chuongchun, Jeroboam le mi- puihai po po chu ni thum ni chun lalin, Ni thum niah ka kuomah hung nâwk ro, tia a lo inthla ang khan a kuomah an hung tah a."
"And the king answered them roughly; and king Rehoboam forsook the counsel of the old men,","Lal chun vîntakin a lo dawn a; lal Rehoboam chun mi upahai thurâwn chu a nghatsan a,"
"and spake to them after the counsel of the young men, saying, My father made your yoke heavy, but I will add thereto: my father chastised you with whips, but I will chastise you with scorpions.","tlangvâlhai thurâwn angin, “Ka pa chun in rîngkawl chu a lo sukrik hle tah a, keiin chu chu belsâng ka ta; ka pain vuoknain a lo hrem cheu a ni chun, kei chun chu ainuvêtin hrem ka ti cheu,” tiin a lo hril a."
"So the king hearkened not unto the people; for it was brought about of God, that Jehovah might establish his word, which he spake by Ahijah the Shilonite to Jeroboam the son of Nebat.","Chuongchun, lal chun mipuihai thu chu a ngai nawh a; Silon mi Ahija hmanga Nebat naupa Jeroboam kuoma a thu lo hril tah, a thu chu LALPAIN ân tlungtir theina ding- in, Pathienin a hung intlungtir a ni sih a."
"And when all Israel saw that the king hearkened not unto them, the people answered the king, saying, What portion have we in David? neither have we inheritance in the son of Jesse: every man to your tents, O Israel: now see to thine own house, David. So all Israel departed unto their tents.","Chuonga Israel po po chun lal chun an thu a ngai nawh ti an hriet chun mipuihai chun an dawn a, “David a hin chanvo ieng am ei nei hrim luoh a? Jesai naupaa hin rochan ieng khawm ei nei bawk nawh; mi tin mâni puon in sengah fe ro, Aw Israel- hai: David, tuhin nangma insûng ngei chu inngaituo ta,” tiin."
"But as for the children of Israel that dwelt in the cities of Judah, Rehoboam reigned over them.","Chuongchun, Israelhai po po chu an puon inhaia chun an ṭin tâwl tah a. Amiruokchu, Judai ram khaw- puihaia umhai Israel thlahai chunga khan chu Rehoboam chun ro a rêl zing a."
"Then king Rehoboam sent Hadoram, who was over the men subject to taskwork; and the children of Israel stoned him to death with stones. And king Rehoboam made speed to get him up to his chariot, to flee to Jerusalem.","Chun, lal Rehoboam chun Hadoram, leiman hotu chu a tir a, Israel thlahai chun ama chu lungin an lo dêng a, a thi tah a. Chun, lal Rehoboam chu a sakawr tawlailîrah a chuong a, inhmâwtakin Jerusalemah a tlânse tah a."
So Israel rebelled against the house of David unto this day.,"Chuongchun, Israel sûngkuo chu David sûngkuo chunga chun, vawisûn ni chen hin an hel tah a."
"And when Rehoboam was come to Jerusalem, he assembled the house of Judah and Benjamin, a hundred and fourscore thousand chosen men, that were warriors, to fight against Israel, to bring the kingdom again to Rehoboam.","Rehoboam chu Jerusalem a hung tlung chun Benjamin le Juda sûngkuo, nuoi khat le sîng riet, thlang ṭhieu, Israelhai do dinga indo mi, Rehoboam ta dinga ram chu hung la kîr nâwk dingin a ko khâwm tawl a."
"But the word of Jehovah came to Shemaiah the man of God, saying,","Nisienlakhawm, Pathien mi Semaia kuoma chun LALPA thu chu a hung tlung a,"
"Speak unto Rehoboam the son of Solomon, king of Judah, and to all Israel in Judah and Benjamin, saying,","“Judai ram lal Solomon naupa Rehoboam le, Judai rama Benjamin mihai le Israel mi po pohai kuoma chun thu hril la,"
"Thus saith Jehovah, Ye shall not go up, nor fight against your brethren: return every man to his house; for this thing is of me. So they hearkened unto the words of Jehovah, and returned from going against Jeroboam.","LALPAIN hieng hin a tih ti rawh, ‘Hang fe nâwng in ta, in unauhai chu indopui bawk nâwng in tih: mi tin chu mâni in sengah kîr nâwk el ro: hi thil hi keima thaw a ni sih a,’ tiin,” a ta. Chuongchun, LALPA thu chu an zâwm a, Jeroboam hang do tumnaa inthawk chun an kîr tah a."
"And Rehoboam dwelt in Jerusalem, and built cities for defence in Judah.","Rehoboam chu Jerusalema chun a um a, Judai rama inhumhimna dingin khawpuihai a bâwl a."
"He built Beth-lehem, and Etam, and Tekoa,","Bethlehem dâm, Etam dâm, Tekoa dâm,"
"And Beth-zur, and Soco, and Adullam,","Beth-zur dâm, Soko dâm, Adullam dâm,"
"and Gath, and Mareshah, and Ziph,","Gath dâm, Maresah dâm, Ziph dâm,"
"and Adoraim, and Lachish, and Azekah,","Adoraim dâm, Lakis dâm, Azeka dâm,"
"and Zorah, and Aijalon, and Hebron, which are in Judah and in Benjamin, fortified cities.","Zora dâm, Aijalon dâm, Hebron dâm, chuong chu Judai rama umhai le, Benjamin rama khawpui kul neihai a nih."
"And he fortified the strongholds, and put captains in them, and stores of victuals, and oil and wine.","Chun, kul dettakhai chu a sukdet nâwk zuol a, chuonga chun hotuhai a sieh a, fâk ding le hriek le uoin dâm ân khâwl bawk a."
"And in every city he put shields and spears, and made them exceeding strong. And Judah and Benjamin belonged to him.","Khaw tin hmun tamtaka chun feihai, phâwhai a sieh a, nasatak- in a sukhrât a. Judai hnam le Benjamin hnam chu ama tieng an ṭhang a."
And the priests and the Levites that were in all Israel resorted to him out of all their border.,Levi mihai le thiempuhai chu an umna sûnga inthawk chun ama kuomah Israel ram sûng po poa chun an hung pakai a.
"For the Levites left their suburbs and their possession, and came to Judah and Jerusalem: for Jeroboam and his sons cast them off, that they should not execute the priest’s office unto Jehovah;","Levi mihai chun an ram le an khuohai chu an mâksan a, Jerusalem le Judai rama chun an hung a; Jeroboam le a naupasalhai chun anni chu LALPA ta dinga thiempu sinhai chu thaw lo dingin an hnawt suok sih a,"
"and he appointed him priests for the high places, and for the he-goats, and for the calves which he had made.","chuongchun, ama siem bâwng- têhai, kêlchalhai le bâwlhmunhaia ding chun thiempuhai a ruot fâwm tah a."
"And after them, out of all the tribes of Israel, such as set their hearts to seek Jehovah, the God of Israel, came to Jerusalem to sacrifice unto Jehovah, the God of their fathers.","Chun, an hnunga khawm chun, Israel hnamhai lai po poa mi, Israel Pathien LALPA chu lungrila zawng- tuhai chun an zui a; an thlatuhai Pathien LALPA kuoma inthâwi ding chun Jerusalemah an hung hlak a."
"So they strengthened the kingdom of Judah, and made Rehoboam the son of Solomon strong, three years; for they walked three years in the way of David and Solomon.","Chuongchun, kum thum sûng chun Judai lalram chu an sukdet tiel tiel a, Solomon naupa Rehoboam chu ân sukdet hle el tah a; kum thum sûng chu David le Solomon lampui chu an hraw sih a."
"And Rehoboam took him a wife, Mahalath the daughter of Jerimoth the son of David, and of Abihail the daughter of Eliab the son of Jesse;","Chun, Rehoboam chun David naupa Jerimoth le Jesai naupa Eliab naunu Abihail naunu Mahalath chu nuhmeiah a nei a;"
"and she bare him sons: Jeush, and Shemariah, and Zaham.",amanu chun naupasalhai a neipêk a; Jeus le Semaria le Zaham.
"And after her he took Maacah the daughter of Absalom; and she bare him Abijah, and Attai, and Ziza, and Shelomith.","Ama hnunga chun Absalom naunu Maaka chu a nei a; ama chun Abija, Attai, Ziza le Selomith a nei- pêk a."
"And Rehoboam loved Maacah the daughter of Absalom above all his wives and his concubines (for he took eighteen wives, and threescore concubines, and begat twenty and eight sons and threescore daughters).","Chun, Rehoboam chun a nu- hmeihai le a thaikêmhai po po nêkin Absalom naunu Maaka chu a hmangai lem a, (nuhmei chu sâwm- pariet a nei a, thaikêm sâwmruk leh; chun, naupasal sâwmhni pariet le naunuhmei sâwmruk a nei bawk sih a)."
"And Rehoboam appointed Abijah the son of Maacah to be chief, even the prince among his brethren; for he was minded to make him king.","Chun, Rehoboam chun Maaka naupa Abija chu lalah, a unauhai laia hotutakah a ruot a; ama chu lala siem a lungril sih a."
"And he dealt wisely, and dispersed of all his sons throughout all the lands of Judah and Benjamin, unto every fortified city: and he gave them victuals in abundance. And he sought for them many wives.","Chun, vartakin a thawh a, Juda le Benjamin ram po poa chun a nau- pasalhai chu a semdar rak a, khaw- pui kul neihai po poa chun; fâk ding khawm tam tâwk takin a pêk bawk a. An ta dingin nuhmeihai khawm tamtak a zawngpêk bawk a."
"And it came to pass, when the kingdom of Rehoboam was established, and he was strong, that he forsook the law of Jehovah, and all Israel with him.","Rehoboam ram chu sukdet a hung na, a hung hrât phing chun, LALPA dân chu a nghatsan tah a, Israelhai po po khawm chun ama an zui veh a."
"And it came to pass in the fifth year of king Rehoboam, that Shishak king of Egypt came up against Jerusalem, because they had trespassed against Jehovah,","Chun, Rehoboam inlal kum nganaa chun Aigupta rama lal Sisak chun Jerusalem a hung rûn a, LALPA chungah an lo bawsiet ta leiin;"
"with twelve hundred chariots, and threescore thousand horsemen. And the people were without number that came with him out of Egypt: the Lubim, the Sukkiim, and the Ethiopians.","sakawr tawlailîr sâng le za hni le sakawr chung chuong mi sîng ruk leh; Aigupta rama inthawka ama hung zuitu Lubim mihai, Sukkiim mihai, Ethiopia mihai le chu tiem sêng ruol lo an nih."
"And he took the fortified cities which pertained to Judah, and came unto Jerusalem.","Chun, Judai rama khawpui kul neihai chu a lâk a, chuongchun, Jerusalema chun a hung pei a."
"Now Shemaiah the prophet came to Rehoboam, and to the princes of Judah, that were gathered together to Jerusalem because of Shishak, and said unto them, Thus saith Jehovah, Ye have forsaken me, therefore have I also left you in the hand of Shishak.","Chun, zâwlnei Semaia chu Rehoboam le hotu, Judai ram Sisak leia Jerusalema hung khâwmhai kuoma chun a hung a, an kuoma chun, “LALPA chun hieng ang hin a tih, ‘Kei in mi nghatsan tah, kei khawma Sisak kutah ka mâksan ding cheu a nih,’ tiin,” a ta."
"Then the princes of Israel and the king humbled themselves; and they said, Jehovah is righteous.","Chun, lal tak le Israel upahai chu an insukhnuoi a, “LALPA chu a fel a nih,” an tih a."
"And when Jehovah saw that they humbled themselves, the word of Jehovah came to Shemaiah, saying, They have humbled themselves: I will not destroy them; but I will grant them some deliverance, and my wrath shall not be poured out upon Jerusalem by the hand of Shishak.","LALPA chun anni chu an insuk- hnuoi ti a hmu phing chun, Semaia kuoma chun LALPA thu chu a hung tlung tah a, “Anni le anni chu an insukhnuoi a, anni chu sukbohmang vawng naw ning a, amiruokchu, ṭhenkhat sansuokna chu phalpêk ka ta, Sisak kuta hin, Jerusalem chunga ka lungsenna chu bunthlâk ni naw ni."
"Nevertheless they shall be his servants, that they may know my service, and the service of the kingdoms of the countries.","Amiruokchu, a siehlawhai hung nîng an ta, hieng ramhaia lalram rawngbâwlna le ka rawngbâwlna chu an hriet theina dingin,” tiin."
"So Shishak king of Egypt came up against Jerusalem, and took away the treasures of the house of Jehovah, and the treasures of the king’s house: he took all away: he took away also the shields of gold which Solomon had made.","Chuongchun, Aigupta lal Sisak chun Jerusalem chu a hung rûn a, lal in rothilhai le LALPA in rothilhai chu a lâk hmang a; chuong chu a lâk hmang vawng a, Solomonin rângka- chak phaw a siemhai khawm kha a lâk hmang vawng a."
"And king Rehoboam made in their stead shields of brass, and committed them to the hands of the captains of the guard, that kept the door of the king’s house.","Chun, lal Rehoboam chun chuong aia chun dârsen phâwhai a siem a, lal in kawtkhâr vêngtu, vêng- tu pâwl hotu kuoma chun ân kawl- tir a."
"And it was so, that, as oft as the king entered into the house of Jehovah, the guard came and bare them, and brought them back into the guard-chamber.","LALPA ina chun lal chu a lût po leh, vêngtu chu a hung a, chuong phâwhai chu a chawi hlak a; chun, vêngtu pindana chun a sie kîr nâwk hlak a nih."
"And when he humbled himself, the wrath of Jehovah turned from him, so as not to destroy him altogether: and moreover in Judah there were good things found.","Chun, ama chu ân sukhnuoi tâk lei chun LALPA lunginsenna chu ama sukbohmang let dêr lo dingin lâk- kieng a lo ni tah a; chunawa khawm, Judai ram chu a la ṭha zing bawk a."
"So king Rehoboam strengthened himself in Jerusalem, and reigned: for Rehoboam was forty and one years old when he began to reign, and he reigned seventeen years in Jerusalem, the city which Jehovah had chosen out of all the tribes of Israel, to put his name there: and his mother’s name was Naamah the Ammonitess.","Chuongchun, lal Rehoboam chu Jerusalema chun ân sukdet a, ro a rêl tah a, ro a rêl ṭan tir chun Rehoboam chu kum sâwmli le kum khat a ni tah a, chun, Jerusalemah, Israel hnam po po laia inthawka a hming um zingna dinga LALPAIN a thlang suok khaw- puia chun kum sâwmpasari a rêl bawk a; a nu hming chu Ammon mi Naama a nih."
"And he did that which was evil, because he set not his heart to seek Jehovah.",LALPA chu zawng dinga a lungril a hmang naw leiin thil ṭha naw chu a thaw tah a.
"Now the acts of Rehoboam, first and last, are they not written in the histories of Shemaiah the prophet and of Iddo the seer, after the manner of genealogies? And there were wars between Rehoboam and Jeroboam continually.","Chuongchun, Rehoboam thil- thawhai, a hmasa le nuhnunghai khawm, thla thu sui dân ang peiin zâwlnei Iddo le zâwlnei Semaia chanchinbuhaia chun ziek an ni naw am a nih? Chun, Rehoboam le Jero- boam inkâra hin indonahai a um zing zing bawk a."
"And Rehoboam slept with his fathers, and was buried in the city of David: and Abijah his son reigned in his stead.","Chun, Rehoboam chu a thla- tuhai kuomah a in tah a, David khawpuia chun phûmin a um a; chun, a naupa Abija chun ama aia chun ro a rêl tah a."
In the eighteenth year of king Jeroboam began Abijah to reign over Judah.,Jeroboam inlal kum sâwm- parietnaa chun Abija chun Juda rama chun ro a rêl ṭan a.
Three years reigned he in Jerusalem: and his mother’s name was Micaiah the daughter of Uriel of Gibeah. And there was war between Abijah and Jeroboam.,"Ama chun kum thum lai Jerusalemah ro a rêl a; a nu hming chu Mikaia, Gibea mi, Uriel naunu kha a nih. Chun, Jeroboam le Abija inkâra khawm chun indona a um a."
"And Abijah joined battle with an army of valiant men of war, even four hundred thousand chosen men: and Jeroboam set the battle in array against him with eight hundred thousand chosen men, who were mighty men of valor.",Abija chun indonaa mi hrât ruol sipai pâwl thlang ṭhieu nuoi li lai chun indonaa chun a hang thaw a; Jeroboam khawm chun mi hrât khawkhêng thlang ṭhieu nuoi riet leh indonaa chun ama chu a hung ep ve bawk a.
"And Abijah stood up upon mount Zemaraim, which is in the hill-country of Ephraim, and said, Hear me, O Jeroboam and all Israel:","Abija chu Ephraim tlâng rama Zemaraim tlâng chunga chun a ngîr a. “Aw Jeroboam le Israel mi po pohai, mi lo ngai ta u;"
"Ought ye not to know that Jehovah, the God of Israel, gave the kingdom over Israel to David for ever, even to him and to his sons by a covenant of salt?","LALPA Israelhai Pathienin David le a thlahai kuomah Israel ram chu kumkhuoa dingin machi thuthlung hmangin a pêk a nih, ti in hriet naw am a ni?"
"Yet Jeroboam the son of Nebat, the servant of Solomon the son of David, rose up, and rebelled against his lord.","David naupa Solomon siehlaw, Nebat naupa Jeroboam hi thoin, a pu chungah a lo hel el hi."
