en,hmr
"and he said, O Jehovah, the God of our fathers, art not thou God in heaven? and art not thou ruler over all the kingdoms of the nations? and in thy hand is power and might, so that none is able to withstand thee.","A hril a, “Aw LALPA, kan thlatu- hai Pathien, nang chu vân Pathien i ni naw am a nih? Hnamhai lalram po pohai chunga rorêltu chu nang i ni naw am a nih? I kuta chun hrâtna le thilthawtheina a um a, chuleiin, tukhawma dang thei naw ni hai che."
"Didst not thou, O our God, drive out the inhabitants of this land before thy people Israel, and give it to the seed of Abraham thy friend for ever?","Aw kan Pathien, i mi Israelhai hmaah hi ram hluotuhai hi i hnawt suokin, i ruolpa Abraham thlahai kuomah kumkhuoa dingin i pêk a ni naw am a nih?"
"And they dwelt therein, and have built thee a sanctuary therein for thy name, saying,","Chuongchun, chutaka chun an um a, i ta dingin i hmingin hmun inthieng chutaka chun an bâwlpêk che a,"
"If evil come upon us, the sword, judgment, or pestilence, or famine, we will stand before this house, and before thee (for thy name is in this house), and cry unto thee in our affliction, and thou wilt hear and save.","‘Thil ṭha naw dâm, kâwlhnâm dâm, rorêlna dâm, hri amanih, ṭâm amanih kan chungah a hung tlung chun nangma hmaa le hi in hmaa hin ngîr kan ta, (i hming chu hi ina hin a um sih a,) kan rimsiknaa chun nang hung ko kan ti cheh a, nang chun mi lo sandam i tih,’ tiin."
"And now, behold, the children of Ammon and Moab and mount Seir, whom thou wouldest not let Israel invade, when they came out of the land of Egypt, but they turned aside from them, and destroyed them not;","Tuhin, ngai ta, Ammon le Moab thlahai le Seir tlâng Aigupta rama inthawka an hung suok laia nangin Israel mihai inrûntir lo le, insuk- siettir lo a i în umtirhai khan,"
"behold, how they reward us, to come to cast us out of thy possession, which thou hast given us to inherit.","ngai ta, nangin hluo dinga i mi pêk, i chana inthawka hunga mi hnawt suok dinga an mi hung thaw- zie hi lo hre la."
"O our God, wilt thou not judge them? for we have no might against this great company that cometh against us; neither know we what to do: but our eyes are upon thee.","Aw kan Pathien, nangin an chungah ro i rêl ding a ni naw am a nih? Hieng keini mi hung thaw tum pâwl nasatak el chunga hin hrâtna kan nei si nawh a; ieng am thaw ding a na ti khawm kan hriet bawk nawh; nangma tieng kan hung ngha a nih,” tiin."
"And all Judah stood before Jehovah, with their little ones, their wives, and their children.","Chuongchun, Juda mihai po po chu LALPA hmaa chun an nauhai leh an nuhmeihai le an nautêhai rawi le chun an ngîr a."
"Then upon Jahaziel the son of Zechariah, the son of Benaiah, the son of Jeiel, the son of Mattaniah, the Levite, of the sons of Asaph, came the Spirit of Jehovah in the midst of the assembly;","Chun, Asaph naupasalhai Levi mi, Mattania naupa, Jeiel naupa, Benaia naupa, Zekaria naupa, Jaha- ziel chunga chun mipui inkhâwmhai laia chun LALPA thlarau a hung tlung a;"
"and he said, Hearken ye, all Judah, and ye inhabitants of Jerusalem, and thou king Jehoshaphat: Thus saith Jehovah unto you, Fear not ye, neither be dismayed by reason of this great multitude; for the battle is not yours, but God’s.","ama chun a hril a, “Nangni Juda mi po pohai, Jerusalem hluotu po pohai le nang lal Jehosaphat, lo ngai ta u, LALPA chun hieng ang hin in kuomah a ti a nih, ‘Hi mipui tamtak lei hin beidawng naw unla, ṭit khawm ṭi bawk naw ro; indona chu in ta a ni nawh a, Pathien ta a ni lem sih a."
"To-morrow go ye down against them: behold, they come up by the ascent of Ziz; and ye shall find them at the end of the valley, before the wilderness of Jeruel.","Zînga hin anni chu zuk thaw unla, ngai ta u, Ziz lam tunga khan an hung a nih; Jeruel thlalêr tlung hmaa phairuom tâwpa khan anni chu hmûng in tih."
"Ye shall not need to fight in this battle: set yourselves, stand ye still, and see the salvation of Jehovah with you, O Judah and Jerusalem; fear not, nor be dismayed: to-morrow go out against them; for Jehovah is with you.","Hi indonaa hin in do ngai kher naw nih, intlar phawt unla, ngîr ṭawk ṭawk ro; LALPA sandamna chu en zing el ro; aw Juda mihai le Jerusalem mihai, ṭi naw unla, beidawng bawk naw ro; zingah anni chu hang thaw unla, LALPA chu in kuomah a um sih a,’” tiin."
"And Jehoshaphat bowed his head with his face to the ground; and all Judah and the inhabitants of Jerusalem fell down before Jehovah, worshipping Jehovah.","Chun, Jehosaphat chu a hmaia hnuoi sikin a lu a kûn a, chun, Juda mi po po le Jerusalema chêngtuhai chu LALPA hmaa chun an bawkkhup a, LALPA chibai an bûk a."
"And the Levites, of the children of the Kohathites and of the children of the Korahites, stood up to praise Jehovah, the God of Israel, with an exceeding loud voice.","Chun, Kohath thlahai le Kora thla Levi mihai chu râwl nasataka inringa Israel Pathien LALPA chu inpâk dingin an ngir tah a."
"And they rose early in the morning, and went forth into the wilderness of Tekoa: and as they went forth, Jehoshaphat stood and said, Hear me, O Judah, and ye inhabitants of Jerusalem: believe in Jehovah your God, so shall ye be established; believe his prophets, so shall ye prosper.","Chun, zîngkâr inhmatakin an tho a, Tekoa thlalêra chun an hang feh a, chun, chuonga an fe suok lai chun Jehosaphat chu a ngîr a, “Aw Juda le Jerusalema chêngtuhai, mi lo ngai ta u; LALPA in Pathien chu ring unla, chuongchun, sukdetin um in tih; a zâwlneihai chu ring unla, chuongchun, hlawtling in tih,” a ta."
"And when he had taken counsel with the people, he appointed them that should sing unto Jehovah, and give praise in holy array, as they went out before the army, and say, Give thanks unto Jehovah; for his lovingkindness endureth for ever.","Chun, mipuihai chu ân fui zo hnung chun, sipaihai hmaa an fe suok phaa inthieng mawina chu inpâka LALPA kuoma hla sak dingin mi a ruot a: “LALPA kuomah lâwmthu hril ro, a zângaina chu kumkhuoin a um zing sih a, ti ro” a ta."
"And when they began to sing and to praise, Jehovah set liers-in-wait against the children of Ammon, Moab, and mount Seir, that were come against Judah; and they were smitten.","Chun, an inpâk a, hla an hang sak ṭan phing chun Juda ram hung rûntuhai Seir tlâng le, Moab le Ammon thlahai chunga chun inchân rutuhai LALPA chun ân chân tir tah a; chuongchun, hnein an um tah a."
"For the children of Ammon and Moab stood up against the inhabitants of mount Seir, utterly to slay and destroy them: and when they had made an end of the inhabitants of Seir, every one helped to destroy another.","Moab le Ammon thlahai chu Seir tlâng khuo deltuhai chu that vawng a, anni sukbohmang dingin an hung tho tah a; chun, Seir tlâng hluotuhai an hung sukrêm hnunga khawm chun, mi tin chu mi dang dang insukbohmangtuo an tum seng tah a."
"And when Judah came to the watch-tower of the wilderness, they looked upon the multitude; and, behold, they were dead bodies fallen to the earth, and there were none that escaped.","Chun, Juda mihai chu thlalêra vêngna in insânga an hang tlung chun; mipuihai chu an hei en a; chun, ngai ta, mithi ruong hnuoia tluhai chu an hmu a; tukhawm a damsuok hrim an um dêr nawh a."
"And when Jehoshaphat and his people came to take the spoil of them, they found among them in abundance both riches and dead bodies, and precious jewels, which they stripped off for themselves, more than they could carry away: and they were three days in taking the spoil, it was so much.","Chun, Jehosaphat le a mihai chu an thuom hlîppêk dinga an hung chun lunghluhai, silfênhai, hausakna nasatak elhai chu anni lai chun an hmusuok a, chuonghai chu an phur sêng lo rauin an lâk a; chuong ang lâwm chun a tam a, ni thum sûng zet chu râllâk thilhai chu an lâk a."
And on the fourth day they assembled themselves in the valley of Beracah; for there they blessed Jehovah: therefore the name of that place was called The valley of Beracah unto this day.,"Chun, a ni li ni chun anni chu Beraka ruoma chun an inkhâwm a, chutaka chun LALPA chu an chawi- mawi a, chuleiin, a hmun hming chu tu chen hin “Malsâwmna ruom” ti a ni tah a."
"Then they returned, every man of Judah and Jerusalem, and Jehoshaphat in the forefront of them, to go again to Jerusalem with joy; for Jehovah had made them to rejoice over their enemies.","Chun, Juda rama mi po po le Jerusalema mihai chu an kîr nâwk tah a; Jehosaphat chu anni rawi hmaa chun hlimtakin Jerusalema fe ding chun a kîr tah a; LALPA chun an hmêlmahai chunga hlim dingin anni chu a lo siem ta sih a."
And they came to Jerusalem with psalteries and harps and trumpets unto the house of Jehovah.,"Chun, Jerusalema chun LALPA inah perkhuonghai, ṭingṭanghai, taw- tawrâwthai leh an hung lût a."
"And the fear of God was on all the kingdoms of the countries, when they heard that Jehovah fought against the enemies of Israel.","Chun, Israelhai hmêlmahai chu LALPA chun a dopui ti an hriet chun chuong ramhaia lalramhai po po chunga chun LALPA ṭina chu a um a."
So the realm of Jehoshaphat was quiet; for his God gave him rest round about.,"Chuongchun, Jehosaphat ram huop sûng chu a re ṭawk ṭawk a; a Pathien chun a vêl po poa chun râl- muongna a pêk sih a."
And Jehoshaphat reigned over Judah: he was thirty and five years old when he began to reign; and he reigned twenty and five years in Jerusalem: and his mother’s name was Azubah the daughter of Shilhi.,"Jehosaphat chun Juda ram chunga chun ro a rêl a, a rorêl ṭan chun kum sâwmthum panga a na; Jerusalema chun kum sâwmhni panga a rêl a; a nu hming chu Azuba, Silhi naunu kha a nih."
"And he walked in the way of Asa his father, and turned not aside from it, doing that which was right in the eyes of Jehovah.","A pa Asa lampui kha a hraw a, LALPA mithmua ân dik chu thawin a pêtsan ngai nawh a."
Howbeit the high places were not taken away; neither as yet had the people set their hearts unto the God of their fathers.,"Amiruokchu, bâwlhmunhai chu lâk hmang a ni nawh a; mihai khawm chun an thlatuhai Pathien tienga chun an lungrilhai an lân nghat chie nawh a."
"Now the rest of the acts of Jehoshaphat, first and last, behold, they are written in the history of Jehu the son of Hanani, which is inserted in the book of the kings of Israel.","Jehosaphat thilthaw, a hmasa le a nuhnunghai chu, ngai ta, Hanani naupa Jehu chanchin bu, Israel lalhai lekhabua chun ziek a nih."
And after this did Jehoshaphat king of Judah join himself with Ahaziah king of Israel; the same did very wickedly:,"Chun, hi hnunga hin Juda ram lal Jehosaphat chu Israel ram lal Ahazia le chun an inzawm a; ama chun khawhlotakin a thawh a;"
and he joined himself with him to make ships to go to Tarshish; and they made the ships in Ezion-geber.,"lawnghai siema, Tarsisa fe dingin ama chu ân zawmpui a; chuong chun, Ezion-gebera chun lawnghai chu an siem tah a."
"Then Eliezer the son of Dodavahu of Mareshah prophesied against Jehoshaphat, saying, Because thou hast joined thyself with Ahaziah, Jehovah hath destroyed thy works. And the ships were broken, so that they were not able to go to Tarshish.","Chun, Maresaa Dodavahu naupa Eliezer chun Jehosaphat chunga chun a hrillâwk a, “Ahazia chu în zawmpui leiin, LALPA chun i sinthawhai chu a suksiet tah,” a ta. Chuongchun, lawnghai chu an kawiseh a, Tarsisa chun an fe thei ta nawh a."
"And Jehoshaphat slept with his fathers, and was buried with his fathers in the city of David: and Jehoram his son reigned in his stead.",Jehosaphat chu a thlatuhai kuoma chun a in tah a; David khawpuiah a thlatuhai kuoma chun phûmin a um tah a; a naupa Jehoram chun ama aia chun ro a rêl tah a;
"And he had brethren, the sons of Jehoshaphat: Azariah, and Jehiel, and Zechariah, and Azariah, and Michael, and Shephatiah; all these were the sons of Jehoshaphat king of Israel.","chun, unauhai, Jehosaphat nau- pasalhai a nei a: Azaria, Jehiel, Zekaria, Azaria, Mikael, Sephatia; hienghai po po hi Israel ram lal Jehosaphat naupasalhai an nih."
"And their father gave them great gifts, of silver, and of gold, and of precious things, with fortified cities in Judah: but the kingdom gave he to Jehoram, because he was the first-born.","Chun, an pa chun an kuoma chun thilpêk nasatak elhai, tangka dâm, rângkachak dâm, thil hlutakhai dâm le Juda rama khawpui kul nei- hai leh a pêk a; amiruokchu, Jehoram chu nau lutîr a ni leiin lalram chu a pêk a."
"Now when Jehoram was risen up over the kingdom of his father, and had strengthened himself, he slew all his brethren with the sword, and divers also of the princes of Israel.","Chuonga Jehoram chu a pa ram chunga chun a hung inlal a, a hung insukhrât phing chun a unauhai po po le Israel rama lal tamtak chu kâwlhnâmin a that tâwl tah a."
Jehoram was thirty and two years old when he began to reign; and he reigned eight years in Jerusalem.,Rorêl a ṭan chun Jehoram chu kum sâwmthum pahni a na; Jerusa- lema chun kum riet sûng ro a rêl a.
"And he walked in the way of the kings of Israel, as did the house of Ahab; for he had the daughter of Ahab to wife: and he did that which was evil in the sight of Jehovah.","Ama chun Ahab sûngkuoin an thaw ang khan, Israel ram lalhai lampuia bawk khan a feh a; Ahab naunu nuhmeiah a nei a; LALPA mithmua thil ṭha lo chu a thawh a."
"Howbeit Jehovah would not destroy the house of David, because of the covenant that he had made with David, and as he promised to give a lamp to him and to his children alway.","Nisienlakhawm, LALPA chun David sûngkuo chu a sukbohmang nawh a, David kuoma thuthlung a lo siem ta lei le, ama le a thlahai kuoma khâwnvar pêk zing zing dinga a lo tiem ta leiin."
"In his days Edom revolted from under the hand of Judah, and made a king over themselves.","Ama hun laia chun Edom ram chu Judahai chunga chun an hel a, anni chunga chun lal an siem tah a."
"Then Jehoram passed over with his captains, and all his chariots with him: and he rose up by night, and smote the Edomites that compassed him about, and the captains of the chariots.","Chun, Jehoram chu ama le a sakawr tawlailîr po pohai le a hotuhai le chun ân thawk a, zân lai a hang ṭhâwng a, sakawr tawlailîr hotuhai le ama inhuoltu Edom mihai chu a thaw tah a."
"So Edom revolted from under the hand of Judah unto this day: then did Libnah revolt at the same time from under his hand, because he had forsaken Jehovah, the God of his fathers.","Chuongchun, vawisûn ni chen hin Edom mihai chu Judahai chunga chun an hel ta zing a; chu huna bawk chun Libna khuo khawm chu an lo hel veh a; a thlatuhai Pathien LALPA chu a lo nghatsan tâk leiin."
"Moreover he made high places in the mountains of Judah, and made the inhabitants of Jerusalem to play the harlot, and led Judah astray.","Chunawa khawm chun Juda ram tlângahai chun bâwlhmunhai a siem a, Jerusalema umhai chu ân uirettir a, chuongchun, Juda ram chu an lo ṭhuoi hmang tah a."
"And there came a writing to him from Elijah the prophet, saying, Thus saith Jehovah, the God of David thy father, Because thou hast not walked in the ways of Jehoshaphat thy father, nor in the ways of Asa king of Judah,","Chun, a kuoma chun zâwlnei Elija kuoma inthawkin lekha ziek a hung a, “I pu David Pathien LALPA chun hieng ang hin a ti a nih, ‘I pa Jehosaphat lampuihai chu i hraw nawh a, Juda ram lal Asa lampuihai khawm chu i hraw bawk nawh a;"
"but hast walked in the way of the kings of Israel, and hast made Judah and the inhabitants of Jerusalem to play the harlot, like as the house of Ahab did, and also hast slain thy brethren of thy father’s house, who were better than thyself:","Israel lalhai lampuihai chu i hraw lem a. Ahab sûngkuoin an lo thaw ta angin, Jerusalema umhai le Juda rama mihai chu i lo inuirettir tah a; chun, i pahnama mi i unauhai nanga nêka ṭha lemhai chu i that bawk a,"
"behold, Jehovah will smite with a great plague thy people, and thy children, and thy wives, and all thy substance;","ngai ta, LALPA chun i mihai, i nauhai, i nuhmeihai le i thilnei po pohai chu hripuiin nasatakin a hrem ding a nih;"
"and thou shalt have great sickness by disease of thy bowels, until thy bowels fall out by reason of the sickness, day by day.","i phîng natna leiin nang khawma natna nasatak nei i ta; ni tin tinin, chu natna leia i rîlhai a suok zo vawng hmakhat chun nei i tih,’” tiin."
"And Jehovah stirred up against Jehoram the spirit of the Philistines, and of the Arabians that are beside the Ethiopians:","Chun, Ethiopia mihai kâwla um Arabia le Philistin mihai lungril chu Jehoram chunga chun LALPAIN a chawktho a;"
"and they came up against Judah, and brake into it, and carried away all the substance that was found in the king’s house, and his sons also, and his wives; so that there was never a son left him, save Jehoahaz, the youngest of his sons.","Juda ram chu an hung rûn a, an hung lût a; lal ina thil hmua umhai po po an lâk vawng a; a naupasalhai le naunuhmeihai leh, chuongchun, a naupasalhai laia a naupang tak Jehoahaz ti chau naw chu a naupa- sal hrim hrim mâksanpêk a ni nawh a."
And after all this Jehovah smote him in his bowels with an incurable disease.,"chun, hieng thilhai po po hnunga hin LALPA chun a phîngah natna dam thei loin a hrem a."
"And it came to pass, in process of time, at the end of two years, that his bowels fell out by reason of his sickness, and he died of sore diseases. And his people made no burning for him, like the burning of his fathers.","Chuong anga kum hni ân vawi hnung chun, a natna lei chun a rîl chu a suok a, natna natakin a thi tah a. Chun, a mihai chun a thlatuhai chawimawinaa meipui an sêm ang khan, ama ta dingin meichawk an siempêk nawh a."
"Thirty and two years old was he when he began to reign, and he reigned in Jerusalem eight years: and he departed without being desired; and they buried him in the city of David, but not in the sepulchres of the kings.","Rorêl a ṭan chun kum sâwm- thum pahni mi a na, Jerusalema chun kum riet ro a rêl a; ama chu ngainatna um loin a thi tah a; David khawpuia chun an phûm a, lalhai thlân ina khan ni loin."
And the inhabitants of Jerusalem made Ahaziah his youngest son king in his stead; for the band of men that came with the Arabians to the camp had slain all the eldest. So Ahaziah the son of Jehoram king of Judah reigned.,"Jerusalema chênghai chun a naupa naupang tak Ahazia chu ama aia chun lalin an siem a; Arabia mihai le pâwl ruol bûka hunghai khan a upahai po chu an that vawng ta sih a. Chuongchun, Judai ram lal Jehoram naupa Ahazia chun ro a rêl tah a."
Forty and two years old was Ahaziah when he began to reign; and he reigned one year in Jerusalem: and his mother’s name was Athaliah the daughter of Omri.,"Ro a rêl ṭan chun Ahazia chu kum sâwmli pahni mi a na, Jerusalema chun kum khat sûng ro a rêl a, a nu hming chu Athalia, Omri naunu a nih."
He also walked in the ways of the house of Ahab; for his mother was his counsellor to do wickedly.,Ama khawma Ahab sûngkaw lampuihai kha a hraw ve a; a nu chu khawhlotaka khawsa dinga a thu rawtpuitu a ni sih a.
"And he did that which was evil in the sight of Jehovah, as did the house of Ahab; for they were his counsellors after the death of his father, to his destruction.",Ahab sûngkuoin an thaw ang khan LALPA mithmuah thil ṭha naw chu a thaw a; a pa a thi hnung chun anni chu a sietna ding chena a thu rawtpuituhai an ni sih a.
"He walked also after their counsel, and went with Jehoram the son of Ahab king of Israel to war against Hazael king of Syria at Ramoth-gilead: and the Syrians wounded Joram.","An thu rawt ang pei chun a fe a, Suria ram lal Hazael chu do dingin Ramoth-gileada chun Israel ram lal Ahab naupa Jehoram le chun a hang fe veh a; Suria mihai chun Joram chu an lo inhliem a."
"And he returned to be healed in Jezreel of the wounds which they had given him at Ramah, when he fought against Hazael king of Syria. And Azariah the son of Jehoram king of Judah went down to see Jehoram the son of Ahab in Jezreel, because he was sick.","Chun, Suria ram lal Hazael a donaa Ramaa ama an inhliemnahai chu insukdam dingin Jezreela chun a kîr tah a. Chun, Judai ram lal Jeho- ram naupa Azaria chu, Ahab naupa Jehoram chu a damnaw leia Jezreela en dingin a zu feh a."
"Now the destruction of Ahaziah was of God, in that he went unto Joram: for when he was come, he went out with Jehoram against Jehu the son of Nimshi, whom Jehovah had anointed to cut off the house of Ahab.","Chuongchun, Ahazia bohmangna chu Pathiena inthawk a na, Joram kuoma a hang fe lei tak chu a nih; chuonga a hung lai chun, Ahab sûng- kuo chu sât thlatu dinga LALPAIN hriek a lo nâl tah Nimsi naupa Jehu chu do dingin Joram le khan a hang fe ve sih a."
"And it came to pass, when Jehu was executing judgment upon the house of Ahab, that he found the princes of Judah, and the sons of the brethren of Ahaziah, ministering to Ahaziah, and slew them.","Chun, Jehu chun thupêk Ahab sûngkaw ta dinga a pêk suok lai chun Juda ram lalhai le Ahazia unauhai naupasalhai chu Ahazia rawngbâwl- in a hmuh a, anni chu a that tâwl tah a."
"And he sought Ahaziah, and they caught him (now he was hiding in Samaria), and they brought him to Jehu, and slew him; and they buried him, for they said, He is the son of Jehoshaphat, who sought Jehovah with all his heart. And the house of Ahaziah had no power to hold the kingdom.","Chun, Ahazia chu a zawng a, an man a, (Samariaa chun a lo in bihmang a na) Jehu kuoma chun an hung ṭhuoi a, an that tah a; chun, an phûm a, “A lungril po poa LALPA zawngtu Jehosaphat naupa chu a ni ngei,” an tih a. Chuongchun, Ahazia sûngkuoa chun lalram chunga rorêl thei ding mi pakhat khawm an um ta nawh a."
"Now when Athaliah the mother of Ahaziah saw that her son was dead, she arose and destroyed all the seed royal of the house of Judah.","Chun, Ahazia nu Athalia chun a naupa chu a thi tah ti a hriet chun, a tho a, Juda sûngkuo lal chi po chu a rawt ta vawng a."
"But Jehoshabeath, the daughter of the king, took Joash the son of Ahaziah, and stole him away from among the king’s sons that were slain, and put him and his nurse in the bedchamber. So Jehoshabeath, the daughter of king Jehoram, the wife of Jehoiada the priest (for she was the sister of Ahaziah), hid him from Athaliah, so that she slew him not.","Amiruokchu, lal naunu Jehosa- beath chun Ahazia naupa Joas chu a lâk a, lal nauhai thata umhai laia inthawk chun ân rûkhmang a, khum pindanah ama dawntu le chun a sie tah a. Chuongchun, lal Jehoram nau- nu Jehosabeath, thiempu Jehoiada nuhmei chun (ama chu Ahazia farnu a ni sih a,) Athaliaa inthawk chun a thuphmang a, chuongchun, a suk- hlum ve nawh a."
And he was with them hid in the house of God six years: and Athaliah reigned over the land.,"Pathien ina chun anni leh kum ruk sûng thupin a um a, chun, Athalia chun ram chunga chun ro a rêl a."
"And in the seventh year Jehoiada strengthened himself, and took the captains of hundreds, Azariah the son of Jeroham, and Ishmael the son of Jehohanan, and Azariah the son of Obed, and Maaseiah the son of Adaiah, and Elishaphat the son of Zichri, into covenant with him.","Chun, a kum sari kum chun Jehoiada chu ân sukhrât a, sipai za pâwl chunga hotuhai, Jeho- ram naupa Azaria hai, Jehohanan naupa Ismael hai, Obed naupa Azaria hai, Adaia naupa Maaseia hai, Zikri naupa Elisaphat hai le chun thu a thlung a."
"And they went about in Judah, and gathered the Levites out of all the cities of Judah, and the heads of fathers’ houses of Israel, and they came to Jerusalem.","Chun, Juda ram sûnga chun a fe vêl a, Juda khawpui po poa inthawk chu Levi mihai le, Israel pahnam ṭhuoituhai le chun a lâk khâwm a, Jerusalema chun an fe tah a."
"And all the assembly made a covenant with the king in the house of God. And he said unto them, Behold, the king’s son shall reign, as Jehovah hath spoken concerning the sons of David.","Chun, mipui inkhâwmhai po po chun Pathien ina chun lal le thutiem an siem tah a. Chun, an kuomah a hril a, “David naupasalhai chungthu LALPAIN a hril ta angin, en ta u lal naupa hin ro a rêl ding a na."
"This is the thing that ye shall do: a third part of you, that come in on the sabbath, of the priests and of the Levites, shall be porters of the thresholds;","Hi hi thil in thaw ding chu hung nîng a tih: Châwlnia hung hlak, thiempuhai le Levi mihai hmun thuma ṭhea hmun khat chu kawtkhâr vêngtuhai nîng in ta;"
and a third part shall be at the king’s house; and a third part at the gate of the foundation: and all the people shall be in the courts of the house of Jehovah.,"a hmun thuma ṭhea hmun khat dang chu lal inah um an ta, a hmun thuma ṭhea hmun khat dang chu lungphûmna dai kawtkhâr bulah um an ta; chun, mipui po po chu LALPA in inhuonna tuol sûnglaia chun um an tih."
"But let none come into the house of Jehovah, save the priests, and they that minister of the Levites; they shall come in, for they are holy: but all the people shall keep the charge of Jehovah.","Amiruokchu, thiempuhai ti chau naw chu mi tukhawm LALPA ina chun fe naw raw hai se; Levi mi rawngbâwltuhai le chau chun anni chu hung lût an tih, an inthieng sih a; amiruokchu, mipuihai po po chun LALPA chu an nghâk seng ding a nih."
"And the Levites shall compass the king round about, every man with his weapons in his hand; and whosoever cometh into the house, let him be slain: and be ye with the king when he cometh in, and when he goeth out.","Levi mihai chun, mi tin an râlthuomhai chawi sengin lal chu ngîr huol an ta; amiruokchu, mi tukhawm LALPA ina hung lût chu that ni raw se; nangni chu lal a hung lût le a fe suok huna chun a kâwla chun um zing in tih,” tiin."
