en,hmr
Howbeit what saith the scripture? Cast out the handmaid and her son: for the son of the handmaid shall not inherit with the son of the freewoman.,"Nisienlakhawm, Pathien Lekha thuin iengtin am a hril a? “Suoknu chu, a naupa leh hnawtdawk rawh, suoknu naupa chun suoknawnu naupa chu ro a hluopui âwm si nawh a,” a tih a."
"Wherefore, brethren, we are not children of a handmaid, but of the freewoman.","Chuongchun, unauhai, suoknu nauhai ei ni nawh a, suoknawnu le nauhai ei ni lem."
"For freedom did Christ set us free: stand fast therefore, and be not entangled again in a yoke of bondage.","Suok ni lo dingin Krista chun a mîn suoktir kha; chuongchun, ngir det unla, suok ringkawla chun intâng nâwk ta naw ro."
"Behold, I Paul say unto you, that, if ye receive circumcision, Christ will profit you nothing.","Ngai ta u, kei Paulain in kuomah ka hril hi, ser in intantir chun Krista chu in ta dingin iengkhawm ṭhahnemna ni naw ni."
"Yea, I testify again to every man that receiveth circumcision, that he is a debtor to do the whole law.","Anih, Dân thu po po zâwm dinga battu an nih ti, ser intantir taphawt kuomah kân hriettir nâwk a nih."
"Ye are severed from Christ, ye who would be justified by the law; ye are fallen away from grace.","Nangni Dâna thiem chang tumtuhai, Krista leh in inṭhe tah a, lunginsietna chu in tlûksan tah."
For we through the Spirit by faith wait for the hope of righteousness.,Keini chun Thlarau zârah ring- nain felna beiseina kan nghâk sih a.
"For in Christ Jesus neither circumcision availeth anything, nor uncircumcision; but faith working through love.","Krista Isua chun sertan ieng- khawm a ṭhahnem nawh a, sertan- naw khawm iengkhawm a ṭhahnem chuong nawh, ringna hmangainaa thaw ruok chu a ṭhahnem a nih."
Ye were running well; who hindered you that ye should not obey the truth?,"Ṭhatakin in tlân hlak kha, thutak chu in zâwm nawna dingin tuin am a hluo ta cheu a?"
This persuasion came not of him that calleth you.,Hi thlêmna hi a kotu cheua inthawk a ni nawh.
A little leaven leaveneth the whole lump.,Chawl tlâwmtêin bei tlang chu a pumin a fang suok hlak.
"I have confidence to you-ward in the Lord, that ye will be none otherwise minded: but he that troubleth you shall bear his judgment, whosoever he be.","Ngaituo danglam naw ti niu ti Lalpaa chun kei chun nangni tieng ka ring cheu a nih; nisienlakhawm, a sukbuoitu cheu chu, tûkhawm ni sien la, a chunga rorêlna chu la tuor a tih."
"But I, brethren, if I still preach circumcision, why am I still persecuted? then hath the stumbling-block of the cross been done away.","Unauhai, keiin sertan thu ka la hril rawp si chun, ieng dinga suknawmnata la um rawp am ka na? Chuong ang a ni si chun kraws insuina chu sukbo ni tâng a tih."
I would that they that unsettle you would even go beyond circumcision.,A sukbuoitu cheu chu intan thla law law sien ka nuom a nih.
"For ye, brethren, were called for freedom; only use not your freedom for an occasion to the flesh, but through love be servants one to another.","Nangni, unauhai, suok ni lo dinga ko in ni sih a; nisienlakhawm, suok in ni nawna chu tisa ta dinga remchângah hmang naw unla, hmangainain rawng inbâwl tuo pêk seng lem ro,"
"For the whole law is fulfilled in one word, even in this: Thou shalt love thy neighbor as thyself.","“Nangma în hmangai angin i vênghai i hmangai ding a nih,” ti thu baukhata hin Dân thu po po chu a famkim tah a ni sih a."
"But if ye bite and devour one another, take heed that ye be not consumed one of another.","Nisienlakhawm, in inseh a, in infâk tuo si chun, in insukbohmang tuo nawna dingin fîmkhur ro."
"But I say, Walk by the Spirit, and ye shall not fulfil the lust of the flesh.","Chuongchun, hi hi ka ti a nih: Thlarauah um ro; chuongchun, tisa châkna chu in zâwm naw ding annâwm."
"For the flesh lusteth against the Spirit, and the Spirit against the flesh; for these are contrary the one to the other; that ye may not do the things that ye would.","Tisa hin Thlarau dona tieng ân hâwk hlak, Thlarau khawmin tisa dona tieng ân hâwk bawk si hlak a, thil thaw in itumhai chu in thaw thei nawna dingin chuonghai chu an inkal sih a."
"But if ye are led by the Spirit, ye are not under the law.","Nisienlakhawm, Thlarau ṭhuoia in um chun, Dân hnuoia chun in um nawh."
"Now the works of the flesh are manifest, which are these: fornication, uncleanness, lasciviousness,","Chun, tisa thilthawhai chu ân lang fel a nih; chuong chu hieng hi an nih: inditna dâm, inthiengnawna dâm, hurna dâm,"
"idolatry, sorcery, enmities, strife, jealousies, wraths, factions, divisions, parties,","milim biekna dâm, dawithiem- na dâm, theidâna dâm, inhalna dâm, thîkna dâm, lungsenna dâm, mani- hmasielna dâm, insuktumna dâm, ring tumna dâm,"
"envyings, drunkenness, revellings, and such like; of which I forewarn you, even as I did forewarn you, that they who practise such things shall not inherit the kingdom of God.","thîkthusietna dâm, zu inruina dâm, zu hmun hlimna dâm, chuong anghai chu, chuong kawnga chun kha hmaa, “Chuong ang thil thawtuhai chun Pathien ram hluo naw ni hai,” tia ka hril lâwk cheu ang khan, ka hril nâwk cheu hi."
"But the fruit of the Spirit is love, joy, peace, longsuffering, kindness, goodness, faithfulness,","Thlarau ra ruok chu hmangaina dâm, hlimna dâm, inremna dâm, dawtheina dâm, ngilneina dâm, ṭhatna dâm, ringumna dâm,"
"meekness, self-control; against such there is no law.","thuhnuoirawlna dâm, insûm- thei na dâm a ni lem: chuong ang kal zâwngin Dân thupêk hrim a um nawh."
And they that are of Christ Jesus have crucified the flesh with the passions and the lusts thereof.,"Chun, Krista Isu mihai chun tisa chu a suol ngaituona le a châknahai pumin an hemde tah."
"If we live by the Spirit, by the Spirit let us also walk.","Thlaraua hring ei ni chun, Thlaraua vêk um ei tiu."
"Let us not become vainglorious, provoking one another, envying one another.","Inchotuoin, in itthîktuoin inngaihlu nâwng ei tiu."
"Brethren, even if a man be overtaken in any trespass, ye who are spiritual, restore such a one in a spirit of gentleness; looking to thyself, lest thou also be tempted.","Unauhai, mi suol iengkhawm a thaw laia phâwkin um sien la, nangni thlarau mihai, “Thlemna tuok ve rawi ka tih,” tia invêng ṭha pumin chuong ang mi chu thuhnuoirawl- takin tungding nâwk ro."
"Bear ye one another’s burdens, and so fulfil the law of Christ.","In rikphurhai chu insâwngtuo ro; chuongchun, Krista dân chu in zâwm nîng a tih."
"For if a man thinketh himself to be something when he is nothing, he deceiveth himself.","Mi iengkhawm ni si loin, mi lien deua ân ngai chun, ân hlêm fâwm el a ni sih a."
"But let each man prove his own work, and then shall he have his glorying in regard of himself alone, and not of his neighbor.","Mi tinin mani thilthaw infie seng lem raw hai se, chu hnunga chun, mi dang chungah ni loin, mani chung chauah suong ding nei an tih."
For each man shall bear his own burden.,Mi tinin mani phur an phur seng ding a ni sih a.
But let him that is taught in the word communicate unto him that teacheth in all good things.,"Chun, thu inchûktir dawngtu chun, thilṭha po po inchûktirtu kuomah pe ve raw se."
"Be not deceived; God is not mocked: for whatsoever a man soweth, that shall he also reap.","Hlêmin um naw ro; Pathien chu hmusit zie a ni nawh; miin a ithe ang ang, chu bawk chu a sîk ding a ni sih a."
For he that soweth unto his own flesh shall of the flesh reap corruption; but he that soweth unto the Spirit shall of the Spirit reap eternal life.,Mani tisa tienga thetu chun tisaa sietna chu sîk a tih; Thlarau tienga thetu ruok chun Thlaraua chatuona hringna a sîk ding a nih.
"And let us not be weary in well-doing: for in due season we shall reap, if we faint not.","Chuongchun, thil ṭha thaw chu nghawk nâwng ei tiu, ei inhlêmsan naw chun a hun taka chun ei sîk ngei ding a nih."
"So then, as we have opportunity, let us work that which is good toward all men, and especially toward them that are of the household of the faith.","Chuongchun, remchâng hun ei nei ang peiin mi po po kuomah thil ṭha chu thâwng ei tiu, ringna sûnghai laia mi chungah thaw bîk tak ei tiu."
See with how large letters I write unto you with mine own hand.,Keima kut ngeiin in kuomah lekha inhrawl pherphura ka ziek hi en ta u.
"As many as desire to make a fair show in the flesh, they compel you to be circumcised; only that they may not be persecuted for the cross of Christ.","Tisaa hmêl insukmawi nuomhai poin sertana um dingin an tir lui hlak cheu a nih; ieng dang lei khawm a ni nawh a, Krista kraws leia suk- nawmnatna an tuor nawna ding chau a nih."
"For not even they who receive circumcision do themselves keep the law; but they desire to have you circumcised, that they may glory in your flesh.",Sertanhai meu khawm chun Dân thu an zâwm chuong si nawh a; in tisaa chun suong ding an nei theina dingin ser intantir cheu an nuom el a nih.
"But far be it from me to glory, save in the cross of our Lord Jesus Christ, through which the world hath been crucified unto me, and I unto the world.","Kei ruok chun ei Lalpa Isu Krista kraws naw chu ka suong naw ding zie chu, chu zâra chun khawvêl hi ka ta dinga hemdein a um tah, kei khawm khawvêl ta dinga hemdein ka um a nih."
"For neither is circumcision anything, nor uncircumcision, but a new creature.","Siem thar nâwkna naw chu sertan hi iengkhawm a ni nawh a, sertannaw khawm iengkhawm a ni chuong bawk nawh."
"And as many as shall walk by this rule, peace be upon them, and mercy, and upon the Israel of God.","Chun, chu dân anga um taphawthai chunga chun inremna le lunginsietna um raw se, Pathien Israelhai chunga khawm."
Henceforth let no man trouble me; for I bear branded on my body the marks of Jesus.,"Tuta chen chu tûkhawmin mi sukbuoi ta naw raw hai se, ka tisaa hin Isu inchiknahai ka put sih a."
"The grace of our Lord Jesus Christ be with your spirit, brethren. Amen.","Unauhai, Lalpa Isu Krista lunginsietna in thlarau kuomah um raw se. Amen."
