en,hmr
"The vision of Isaiah the son of Amoz, which he saw concerning Judah and Jerusalem, in the days of Uzziah, Jotham, Ahaz, and Hezekiah, kings of Judah.","Amoz naupa Isaiin Judahai lal Uzzia, Jotham, Ahaz le Hezekia hai inlal laia Judahai le Jerusalem chungchâng thua inlârna a hmu chu."
"Hear, O heavens, and give ear, O earth; for Jehovah hath spoken: I have nourished and brought up children, and they have rebelled against me.","Aw vânhai, ngai unla, aw lei- hnuoi, na sit rawh, LALPA chun thu a hril ie: “Nauhai chu ka châwm puitling a, ka chungah an hel ta sih a."
"The ox knoweth his owner, and the ass his master’s crib; but Israel doth not know, my people doth not consider.","Bâwngchal chun a pu a hriet a, sabengtung khawma a pu bupêkna a hriet bawk a, Israelhai ruok chun an hriet si nawh a; ka mihai chun an ngaituo naw a nih,” tiin."
"Ah sinful nation, a people laden with iniquity, a seed of evil-doers, children that deal corruptly! they have forsaken Jehovah, they have despised the Holy One of Israel, they are estranged and gone backward.","A! hnam suol, khawhlona riktak phur mihai, chithla thil ṭha naw thaw- tuhai, nau rilotaka khawsa hlakhai an nih. LALPA chu an mâksan a, Israelhai Mi Inthieng chu an hmusit a, insuktumin an hnungtawl tah."
"Why will ye be still stricken, that ye revolt more and more? the whole head is sick, and the whole heart faint.","Iengdinga hel zuol deu deu a, vuoka la um rawp ding am in nih a? Lu chu a pumin a nah a, lungril khawm chu a pumin a châu tah."
"From the sole of the foot even unto the head there is no soundness in it; but wounds, and bruises, and fresh stripes: they have not been closed, neither bound up, neither mollified with oil.","Kepha hnuoia inthawka lu chenin a dam lai hrim a um nawh; pawp dâm, vuok duk chur dâm, pânna hnâi la ruok an nih; chuong chu an hmetping nawh a, an tuom bawk nawh a, sahriek khawm an nâl bawk nawh."
"Your country is desolate; your cities are burned with fire; your land, strangers devour it in your presence, and it is desolate, as overthrown by strangers.","In ram chu rausanin a um zo a, in khuohai chu meiin a kâng zo a, in ram chu ram dang mihaiin in mithmu ngeiah an nei zo a, ram dang mihai suksiet angin a se zo tah."
"And the daughter of Zion is left as a booth in a vineyard, as a lodge in a garden of cucumbers, as a besieged city.","Zion naunu chu grêp huona vêngbûk ang le, fanghma huona ṭu ang le, khawpui inhuolvêl anga mâksanin a um tah."
"Except Jehovah of hosts had left unto us a very small remnant, we should have been as Sodom, we should have been like unto Gomorrah.","Sipaihai LALPA chun hlabîkhai tlâwmte mi lo hlapêk naw sienla chu Sodom ang khan um dai tâng ei ta, Gomorra ang el khan um tâng ei tih."
"Hear the word of Jehovah, ye rulers of Sodom; give ear unto the law of our God, ye people of Gomorrah.","Sodom rorêltuhai, LALPA thu hi hre unla, Gomorra mihai, ei Pathien dân thua hin na sit ro!"
"What unto me is the multitude of your sacrifices? saith Jehovah: I have had enough of the burnt-offerings of rams, and the fat of fed beasts; and I delight not in the blood of bullocks, or of lambs, or of he-goats.","LALPA chun, “In inthâwina zozai hi ka ta dingin ieng am a ṭhang- kaina a um a? Berâmchal pumraw- hmanga inhlân le, ran châwm thâu- hai thâu chu ka nghawk tah; bâwng- chalhai le berâmte le kêlchalhai thisena hin ka lâwm ta nawh."
"When ye come to appear before me, who hath required this at your hand, to trample my courts?","Ka hmaa hin inlang dinga in hung hin, ka biekin inhuon sûng tuollai hi sir dingin tuin am a phût cheu a?"
"Bring no more vain oblations; incense is an abomination unto me; new moon and sabbath, the calling of assemblies,—I cannot away with iniquity and the solemn meeting.","Thilpêk mei meihai chu hung chawi ta ngai naw ro; thil riminhnik khawm chu ka ta dingin thil tirdak- umtak a nih; thla thar dâm, châwlni dâm inkhâwmpuia infiel khâwm dâm mei mei chu ka ngai thei naw tawp el; khawhlona mei mei a nih, inkhâwm ropuitak khawm hi."
Your new moons and your appointed feasts my soul hateth; they are a trouble unto me; I am weary of bearing them.,"In thla tharhai le in hunbi nei ruoiṭhehai chu ka lungril chun a theida a nih; ka ta dinga thil hnawk- saktak a nih, tuor ka nghawk tah a nih."
"And when ye spread forth your hands, I will hide mine eyes from you; yea, when ye make many prayers, I will not hear: your hands are full of blood.","Chuongchun, in kut in phar pha khawm in tienga chun ka hmai hip tâng ka ta, anih, vawi tamtak in ṭawngṭai hnung khawmin ngai ta naw ningah; in kuthai chu thisenin a sip sih a."
"Wash you, make you clean; put away the evil of your doings from before mine eyes; cease to do evil;","Insâwp unla, insukfai ro, ka mithmu phâk nawah in thilthawhai hi a suolna chu sie hmang ro; suol thaw thaw el hi ma ta unla, thil ṭha thaw inchûk ta ro;"
"learn to do well; seek justice, relieve the oppressed, judge the fatherless, plead for the widow.","rorêlna fel zawng unla, nêk- sâwrna tuorhai chu ṭhangpui unla, pa bohai chu ro rêlpêk unla, hmeithaihai chu hrilpui ro,” ti hi."
"Come now, and let us reason together, saith Jehovah: though your sins be as scarlet, they shall be as white as snow; though they be red like crimson, they shall be as wool.","LALPA chun, “Hung ta u, ngaituo tlâng ei tiu! In suolhai chu sen inlâr angin um ta sienla khawm, vûr angin vâr a tih; sen duk angin sen ta sienla khawm, berâm hmul angin um a tih."
"If ye be willing and obedient, ye shall eat the good of the land:","Tiâwitak le thuâwitaka in um chun, in rama thil ṭhahai hi fâng in ta;"
"but if ye refuse and rebel, ye shall be devoured with the sword; for the mouth of Jehovah hath spoken it.","nisienlakhawm, in nuom nawh a, in hel chun kâwlhnâmin fa zo a ti cheu; LALPA bau chun chu chu a hril tah a nih,” a ta."
"How is the faithful city become a harlot! she that was full of justice! righteousness lodged in her, but now murderers.","Iengtiziea khawpui ringumtak chu nawchizawra inchang el am a ni le aw! Rorêl felnaa sipnu a ni hlak vei leh! Amaa chun felna a um hlak a, tu ruok hin chu tuolthattuhai an um lem ta hi."
"Thy silver is become dross, thy wine mixed with water.","I tangka chu a êksiein ân chang tah a, i uoin chu tui le pawl a ni tah a."
"Thy princes are rebellious, and companions of thieves; every one loveth bribes, and followeth after rewards: they judge not the fatherless, neither doth the cause of the widow come unto them.","I mi lienhai chu mi hel hmang, inru hmanghai ruolhai an nih, mi tinin tham an nuom a, lâwmman an hnawt hlak; pa bohai ro an rêlpêk ngai nawh a, hmeithai thu hlak an kuom a tlung ngai nawh."
"Therefore saith the Lord, Jehovah of hosts, the Mighty One of Israel, Ah, I will ease me of mine adversaries, and avenge me of mine enemies;","Chuleiin, LALPA, Sipaihai LALPA, Israelhai Mi Hrât chun, hieng ang hin a hril a nih: “A! A mi dotuhai hi sukfithla el ka ta, ka hmêl- mahai chungah phuba lâng ka tih:"
"and I will turn my hand upon thee, and thoroughly purge away thy dross, and will take away all thy tin;","chun, i chungah ka kut thlâk nâwk ka ta, i êksie chu faitakin sukbo ka ta, i suon po po chu la hmang vawng ka tih:"
"and I will restore thy judges as at the first, and thy counsellors as at the beginning: afterward thou shalt be called The city of righteousness, a faithful town.","chun, i chungah rorêltuhai chu a tîra an um ang khan inumtir nâwk ka ta, i sûnga remruottuhai chu a hmasa taka an um ang khan inumtir nâwk bawk ka tih; chu hnunga chun, ‘Felna khawpui, khawpui ringumtak,’ la tîng an ti che."
"Zion shall be redeemed with justice, and her converts with righteousness.","Zion chu rorêlna fela sansuok ni tâng a ta, a sûnga mi nghakîr nâwkhai khawm felnaa sansuok nîng an tih."
"But the destruction of transgressors and sinners shall be together, and they that forsake Jehovah shall be consumed.","Nisienlakhawm, bawsetuhai le mi suolhai suksietna chu um inruol a ta, LALPA mâksantuhai khawm sukbohmangin um an tih."
"For they shall be ashamed of the oaks which ye have desired, and ye shall be confounded for the gardens that ye have chosen.","In thingsaisuo dittakhai chu inzâpui tâng an ta, in huon thlanghai lei chun inzaktakin in um ta ding a nih."
"For ye shall be as an oak whose leaf fadeth, and as a garden that hath no water.","Thingsaisuo a hna vuoi ta le, huon tui hmu naw ang el hi in ni ding a nih."
"And the strong shall be as tow, and his work as a spark; and they shall both burn together, and none shall quench them.","Chun, mi hrâttak chu ziza pawn ang ni tâng a ta, a sinthaw chu meisi ang ni tâng a tih; chuongchun, kâng rêl an ta, tukhawma sukrêm naw ni hai,” tiin."
"Woe unto them that decree unrighteous decrees, and to the writers that write perverseness;",Fel nawtaka thu ruottuhai le indik nawtaka ziektuhai chu an chung a rik ie!
"to turn aside the needy from justice, and to rob the poor of my people of their right, that widows may be their spoil, and that they may make the fatherless their prey!","Pasiehai chu rorêlna fel inkhêltir ding le ka mihai laia pasiehai hmu thei ding âwm hrim hrim lâkpêk dinga, hmeithaihai chu an râllâk anga an um theina dingin le pa nei nawhai chu an thil lâkpêk anga an siem theina dinga thawtuhai chu."
"And what will ye do in the day of visitation, and in the desolation which shall come from far? to whom will ye flee for help? and where will ye leave your glory?","Chuongchun, an hung kan nia cheu le hlataka inthawka râusanna hung tlung dinga inthawk ieng am thaw tâng in ta le? Ṭhangpuina hniin tu kuom âm tlân tâng in ta le? In ropuina chu khâw lai am mâksan tâng in ta le?"
"They shall only bow down under the prisoners, and shall fall under the slain. For all this his anger is not turned away, but his hand is stretched out still.","Salhai hnuoiahai chun kûn an ta, thata umhai hnuoiahai chun tlûng an tih, chu chau chu an chan ni tâng a tih. Chuong ang lâwma a thaw khawm chun a lunginsen chu a la bo chuong si nawh a, a kut chu a lân let ta rawp a."
"Ho Assyrian, the rod of mine anger, the staff in whose hand is mine indignation!","Hung ta, Assuria mi, ka lungin- senna hembâwk, ka lungninawna chawitu hmawl!"
"I will send him against a profane nation, and against the people of my wrath will I give him a charge, to take the spoil, and to take the prey, and to tread them down like the mire of the streets.","Râllâk la ding le, thil lâkpêk la ding le kawtthlêr chirhak anga sir dingin ama chu Pathien inza naw hnam do dingin tir ka ta, ka lunginsenna mihai chu thaw dingin thu pêng ka tih."
"Howbeit he meaneth not so, neither doth his heart think so; but it is in his heart to destroy, and to cut off nations not a few.","Nisienlakhawm, ama chun chu chuong ang chu a tum a ni nawh a, chuong ang chu a lungril khawma a ngaituo bawk nawh; hnam tam namêna tam lo suksiet le sukbo- hmang a nih a lungril lem chu."
"For he saith, Are not my princes all of them kings?",“Ka mi lien po pohai hi lal vawng an ni naw am a nih? Kalno khuo chu Karkemis khuo ang el a ni tah a ni naw am a
Is not Calno as Carchemish? is not Hamath as Arpad? is not Samaria as Damascus?,Hamath khuo chu Arpad khuo ang el a ni tah a ni naw am a nih? Samari khuo chu Damaska khuo ang el a ni tah a ni naw am a nih?
"As my hand hath found the kingdoms of the idols, whose graven images did excel them of Jerusalem and of Samaria;","Ka kut hin milimhai ram, Jerusalem khuo le Samari khuoa mi nêka milim siem fâwm ṭha lem neihai khawm, a zawng suok ta sih a,"
"shall I not, as I have done unto Samaria and her idols, so do to Jerusalem and her idols?",Samari khuo le a milimhai chunga ka thaw ang khan Jerusalem le a milimhai chunga khawm hin ka thaw ve naw ding am a nih?” a ti sih a.
"Wherefore it shall come to pass, that, when the Lord hath performed his whole work upon mount Zion and on Jerusalem, I will punish the fruit of the stout heart of the king of Assyria, and the glory of his high looks.","Chu lei chun Lalpa chun, Zion tlâng le Jerusalem chunga sinthaw ding po po a thaw zo pha chun, Assuria lal a lungril chapo ra le a mit chapo ropuina chu la hrem ka tih."
"For he hath said, By the strength of my hand I have done it, and by my wisdom; for I have understanding: and I have removed the bounds of the peoples, and have robbed their treasures, and like a valiant man I have brought down them that sit on thrones:","Ama chun, “Ka kut hrâtnain ka thaw tah a nih, ka varna le hin; ka bengvâr sih a: chi tin ramrihai hlak chu ka sawn a; an rohai hlak ka lâkpêk a, lalṭhungphaa ṭhunghai hlak chu mi huoitak thaw angin ka hnûk thlâk tah a;"
"and my hand hath found as a nest the riches of the peoples; and as one gathereth eggs that are forsaken, have I gathered all the earth: and there was none that moved the wing, or that opened the mouth, or chirped.","ka kut hin chi tin hausaknahai hlak chu vate bu angin a zawng suok a; miin vate tui a pui râusan hnung- hai an lâk angin, leihnuoi hluotuhai po po hi ka lâk vawng tah a nih; thla zâp amanih, bâu ka amanih, inhrâm hrim hrim khawm an um dêr si nawh a,” a ti a nih."
"Shall the axe boast itself against him that heweth therewith? shall the saw magnify itself against him that wieldeth it? as if a rod should wield them that lift it up, or as if a staff should lift up him that is not wood.","Hreipui hin thil chêkna dinga a hmangtu chu a uongkhum ding am a nih? Thingâtna hin a âttu chu a hnuoisie ding am a nih? Hembâwkin ân lettuhai chu ân let vêl lem ang amanih, hmawlin thing ni si lo ân let lem ang el hi a nih!"
"Therefore will the Lord, Jehovah of hosts, send among his fat ones leanness; and under his glory there shall be kindled a burning like the burning of fire.","Chuleiin, LALPA, sipaihai LAL- PA chun, a mi thauhai laia chun chêrna tir a ta, a ropuina hnuoia chun meichawk lai zing ang hin mei sêmin um a tih."
"And the light of Israel will be for a fire, and his Holy One for a flame; and it will burn and devour his thorns and his briers in one day.","Chun, Israelhai êntu chu mei dingin nîng a ta, an Mi Inthieng chu meichawk dingin ni bawk a tih: chu chun ni khat thilah a hlohlingneihai le a buorhai chu sukkângin sukbo- hmang a tih, hmawlin thing ni lo mihriem ân let lem ang elin maw!"
"And he will consume the glory of his forest, and of his fruitful field, both soul and body: and it shall be as when a standard-bearer fainteth.","A rampui le a hnuoi ṭha hmun ropuina khawm chu, thlarau le taksa chenin sukbohmang a tih, chuong- chun, inchikna chawitu a châu hun lai ang nîng a tih."
"And the remnant of the trees of his forest shall be few, so that a child may write them.",A rampuia thing la um sunhai chu naupang ziek khawp chaua tlâwm ni tâng a tih.
"And it shall come to pass in that day, that the remnant of Israel, and they that are escaped of the house of Jacob, shall no more again lean upon him that smote them, but shall lean upon Jehovah, the Holy One of Israel, in truth.","Chun, chu ni chun, Israelhai hlabîkhai le Jakob sûnghai laia a la dam sunhai chun anni thattu chu ring nâwk ta naw ni hai a; LALPA Israelhai Mi Inthieng chu, titakzetin ring lem tâng an tih."
"A remnant shall return, even the remnant of Jacob, unto the mighty God.","Hlabîkhai, Jakobhai laia a la dam sunhai chu, Pathien hrâttak kuoma chun la kîr nâwk an tih."
"For though thy people, Israel, be as the sand of the sea, only a remnant of them shall return: a destruction is determined, overflowing with righteousness.","I mi Israelhai chu tuisuoriet phaiphin zâtin um hai sien khawm, a la um sunhai chau chu an kîr nâwk ding a ni sih a; felna luong liemna suksietna chu tlung dinga ruot tlat a nih."
"For a full end, and that determined, will the Lord, Jehovah of hosts, make in the midst of all the earth.","Lalpa sipaihai LALPA chun, tâwpna, tâwpna tlung ngei dinga ruot tlat chu, hnuoi chung po po lailia chun a la siem ding a ni sih a."
"Therefore thus saith the Lord, Jehovah of hosts, O my people that dwellest in Zion, be not afraid of the Assyrian, though he smite thee with the rod, and lift up his staff against thee, after the manner of Egypt.","Chuleiin, Lalpa Sipaihai LAL- PA chun hieng ang hin a tih, “Aw ka mi, Ziona umhai, Aigupta rama an thaw ang khan hembâwka vaw cheuin a hmawl chu in chungah inlet sien khawm Assuria mi chu ṭi naw ro."
"For yet a very little while, and the indignation against thee shall be accomplished, and mine anger shall be directed to his destruction.","Sâwt nawtêa chun lungni- nawna chu hrîkthlâkin um tâng a ta, ka lunginsenna khawm anni sukbo- hmangnain hrîkthlâkin um tâng a tih."
"And Jehovah of hosts will stir up against him a scourge, as in the slaughter of Midian at the rock of Oreb: and his rod will be over the sea, and he will lift it up after the manner of Egypt.","Oreb lungpuia Midian mihai an that lai ang khan, sipaihai LALPA chun ama thaw dingin vuokna chu chawktho a ta, a hmawl chu tuisuo- riet chungtieng um a ta; Aigupta rama ân let ang khan inlet a tih."
"And it shall come to pass in that day, that his burden shall depart from off thy shoulder, and his yoke from off thy neck, and the yoke shall be destroyed by reason of fatness.","Chu nia chun a rikphur chu i liengkoa inthawka lâk hmangin um a ta, a rîngkawl chu i rînga inthawka lâk hmangin um bawk a tih; hriek nâl lei chun rîngkawl chu suksietin um tâng a tih,” tiin."
"He is come to Aiath, he is passed through Migron; at Michmash he layeth up his baggage;","Aiath khuo a tlung tah, Migron khuo a fe thleng tah; Mikmas khuoa chun a thuomhnaw a sie tah:"
they are gone over the pass; they have taken up their lodging at Geba; Ramah trembleth; Gibeah of Saul is fled.,"kâwnah an liem tah, Geba khuoah an riek tah; Rama khuohai chu an inthin an inthin el tah. Saula Gibea khuohai chu an tlânse tah."
"Cry aloud with thy voice, O daughter of Gallim! hearken, O Laishah! O thou poor Anathoth!","Aw Gallim khaw naunu, i râwlin inringtakin ko rawh; aw Laisa khuo! ngai ta! aw Anathoth, lungsiet i va um ngei de!"
Madmenah is a fugitive; the inhabitants of Gebim flee for safety.,Madmena khuohai chu tlân hmangin an um tah; Gebim khuoa umhai chu tlân hmang tumin an inhâwrkhâwm luoi luoi a.
"This very day shall he halt at Nob: he shaketh his hand at the mount of the daughter of Zion, the hill of Jerusalem.","Vawisûn ngei hin Nob khuoah a châm ding a nih; Zion naunu tlâng, Jerusalem muol pâwng chu a kut a thin khum ie."
"Behold, the Lord, Jehovah of hosts, will lop the boughs with terror: and the high of stature shall be hewn down, and the lofty shall be brought low.","Ngai ta, Lalpa, Sipaihai LALPA chun, thil râpthlâktakin a kâuhai chu sât thlâng a ta, insângtak takhai chu phûrin um a tih, a dâwk bîkhai khawm chu râwt hnuoiin um a tih."
"And he will cut down the thickets of the forest with iron, and Lebanon shall fall by a mighty one.","Thîrin ramhnuoi thing bittak- hai chu phûr a ta, Lebanon Sidar thinghai chu mi ropui phûrin tlu dur dur a tih."
"And there shall come forth a shoot out of the stock of Jesse, and a branch out of his roots shall bear fruit.","Jessai a bula inthawkin a dâwn hung suok a ta, a zunga inthawka kak suokhai chu râng a tih;"
"And the Spirit of Jehovah shall rest upon him, the spirit of wisdom and understanding, the spirit of counsel and might, the spirit of knowledge and of the fear of Jehovah.","chun, LALPA thlarau-varna le hriet theina thlarau, remruotna le hrâtna thlarau, hrietna le LALPA ṭina thlarau chu-a chungah fûng a tih."
"And his delight shall be in the fear of Jehovah; and he shall not judge after the sight of his eyes, neither decide after the hearing of his ears;","Chuongchun, a lâwmna chu LALPA a ṭinaah nîng a ta, a mita a hmu angin ro rêl naw nih a, a naa a hriet angin kâwk el bawk naw nih a;"
"but with righteousness shall he judge the poor, and decide with equity for the meek of the earth; and he shall smite the earth with the rod of his mouth; and with the breath of his lips shall he slay the wicked.","rimsihai chu feltakin ro rêlpêk lem a ta, hnuoia mi thuhnuoirawlhai ta ding chun thlierbîk nei loin kâwkpêk bawk a tih; a bau hembâwk chun hnuoi hi vuong a ta, a hmûra thuok chun mi rilohai chu that a tih."
"And righteousness shall be the girdle of his waist, and faithfulness the girdle of his loins.","Felna hi a kâwnghrên nîng a ta, ringumna hi a kâwngkhi nîng a tih."
"And the wolf shall dwell with the lamb, and the leopard shall lie down with the kid; and the calf and the young lion and the fatling together; and a little child shall lead them.","Chun, satene chu berâmte leh um hmunkhat tâng an ta, keite chu kelte leh bawk hmunkhat tâng an tih; bâwngte le sakeibaknei vânglai le ran châwmthâuhai chu um hmunkhat tâng an ta; naupangtêin ṭhuoi dup dup a tih."
And the cow and the bear shall feed; their young ones shall lie down together; and the lion shall eat straw like the ox.,"Chun, sebâwng le savawm chu tlâng an ta, an têhai chu bawk hmunkhat diel diel tâng an tih; chun, sakeibaknei chun bâwngchal angin bupâwl fa tâng a tih."
"And the sucking child shall play on the hole of the asp, and the weaned child shall put his hand on the adder’s den.","Chun, nau nêne ne lai chu rûlriel kuo khotlângah inhnel tâng a ta, nau nêne nêk bân ta chun rûlhmuk intawmkûk kuo khotlânga chun a kut innghat a tih."
"They shall not hurt nor destroy in all my holy mountain; for the earth shall be full of the knowledge of Jehovah, as the waters cover the sea.","Ka tlâng inthienga hrim hrim chun insuknat um ta naw nih a, insuksiet um bawk ta naw ni; tuihai hin tuisuoriet ân khum zing angin, leihnuoi hi LALPA hrietnain a sip zo vawng ta ding a nih."
"And it shall come to pass in that day, that the root of Jesse, that standeth for an ensign of the peoples, unto him shall the nations seek; and his resting-place shall be glorious.","Chun, chu nia chun, Jessai zung, mi tin inchikna dinga ngîr chu ama ngei chu hnam tinin râwn an ta, a châwlna hmun chu ropui a tih."
"And it shall come to pass in that day, that the Lord will set his hand again the second time to recover the remnant of his people, that shall remain, from Assyria, and from Egypt, and from Pathros, and from Cush, and from Elam, and from Shinar, and from Hamath, and from the islands of the sea.","Chun, chu nia chun LALPA chun a mihai, a thi mahla la um sun, Assuria rama inthawk dâmin, Aigup- ta rama inthawk dâmin, Pathros rama inthawk dâmin, Kus rama inthawk dâmin, Elam rama inthawk dâmin, Sinar rama inthawk dâmin, Hamath khuoa inthawk dâmin, tuisuoriet thlierkâra inthawk dâma la nâwk dingin a vawi hninaa chun a kut la phar nâwk a tih."
"And he will set up an ensign for the nations, and will assemble the outcasts of Israel, and gather together the dispersed of Judah from the four corners of the earth.","Chun, hnam tin ta dingin inchikna târ suok a ta, Israel hnawt suoka umhai chu ṭhuoi khâwm a ta, Juda indarhai kâwl kil lia inthawkin ṭhuoi khâwm a tih."
"The envy also of Ephraim shall depart, and they that vex Judah shall be cut off: Ephraim shall not envy Judah, and Judah shall not vex Ephraim.","Chuongchun, Ephraim hai îtthîkna chu bo tâng a ta, Juda hai sukbuoituhai chu sukbohmangin um tâng an tih; Ephraim hai chun Juda hai chu îtthîk ta naw ni hai a, Juda hai khawma Ephraim hai chu sukbuoi ta naw ni hai."
And they shall fly down upon the shoulder of the Philistines on the west; together shall they despoil the children of the east: they shall put forth their hand upon Edom and Moab; and the children of Ammon shall obey them.,"Chuongchun, annihai chu thlangtienga Philistin mihai liengkoa chun zuk vuongin zu fûng an ta; khawsak nauhai chu rawk hmunkhat an tih; Edom le Moab mihai chungah an kut thlâk an ta; Ammon thlahai chun an thu awi tâng an tih."
"And Jehovah will utterly destroy the tongue of the Egyptian sea; and with his scorching wind will he wave his hand over the River, and will smite it into seven streams, and cause men to march over dryshod.","Chun, LALPA chun Aigupta tuisuoriet kilkawi chu sukse vawng a ta; Vadungpui khawm chu a thli lum vut vut chun a kut thin khum a tih; vadungtê pasaria siem khawp rauin vuong a ta, mihai chu kepha khawm hu loin infekaitir a tih."
"And there shall be a highway for the remnant of his people, that shall remain, from Assyria; like as there was for Israel in the day that he came up out of the land of Egypt.","Chuongchun, Aigupta rama inthawka an suok nia, Israelhai ta dinga lamlien a lo um ang khan a mihai thi mahla la um sunhai ta ding chun Assuria rama inthawkin lamlien hung um a tih."
"And in that day thou shalt say, I will give thanks unto thee, O Jehovah; for though thou wast angry with me, thine anger is turned away and thou comfortest me.","Chu nia chun hieng ang hin la hril i tih, “Aw LALPA, lâwm- thu hril ka ti che; ka chungah lo lunginsen ta la khawm, i lunginsen chu a bo tah a, nangin i mi thlamuon ta a ni hi."
"Behold, God is my salvation; I will trust, and will not be afraid: for Jehovah, even Jehovah, is my strength and song; and he is become my salvation.","Ngai ta, Pathien chu ka san- damna a na, ring ka ta, ṭiin um naw ning ah; LALPA Jehova chu ka hrâtna le ka hla a ni sih a; a mi sandamtu a lo ni ta bawk a,” tiin."
Therefore with joy shall ye draw water out of the wells of salvation.,"Chuleiin, sandamna tuikhura inthawk chun hlimtakin tui la chawi in tih."
