en,hmr
"For he hath brought down them that dwell on high, the lofty city: he layeth it low, he layeth it low even to the ground; he bringeth it even to the dust.","Ama chun insângtaka umhai chu a suktlâwm ta sih a, khawpui insângtak chu; chu chu a sie hnuoi a, hnuoi tlung rakin a sie hnuoi a, pilvut tlung rakin a sukthlûk a."
"The foot shall tread it down; even the feet of the poor, and the steps of the needy.","Ke chun sirdêng a ta, rimsihai ke le pasiehai kalchawi ngei chun."
The way of the just is uprightness: thou that art upright dost direct the path of the just.,"Mi fel lampui chu indikna a na, nang lungril indiktak put chun mi fel lampui chu i sukruol hlak."
"Yea, in the way of thy judgments, O Jehovah, have we waited for thee; to thy name, even to thy memorial name, is the desire of our soul.","Anih, Aw LALPA, i rorêlna lam- puia chun kan nghâk zing cheh a, kan hringna dit zâwng chu i hming tieng le i hriet zingna tieng hi a nih."
"With my soul have I desired thee in the night; yea, with my spirit within me will I seek thee earnestly: for when thy judgments are in the earth, the inhabitants of the world learn righteousness.","Ka hringna hin zâna chun a ngai cheh a; anih, ka sûnga thlarau um hin zîngkâr chun ka zawng che; i rorêl- nahai chu hnuoiah a um po leh khawvêla umhai chun felna chu an inchûk hlak sih a."
"Let favor be showed to the wicked, yet will he not learn righteousness; in the land of uprightness will he deal wrongfully, and will not behold the majesty of Jehovah.","Mi rilo chu ditsakin um sienla khawm, felna inchûk chuong naw nih: indikna rama chun indik naw- takin thâwng a ta, LALPA ropuina hmu chuong naw ni."
"Jehovah, thy hand is lifted up, yet they see not: but they shall see thy zeal for the people, and be put to shame; yea, fire shall devour thine adversaries.","“LALPA, i kut chu pharin a um a, nisienlakhawm, an hmu si nawh; amiruokchu, mihai ta dinga i ṭha- hnemngaina chu hmûng an ta, inzak tâng an tih; anih, nangma dotuhai chu meiin kâng hmang a tih."
"Jehovah, thou wilt ordain peace for us; for thou hast also wrought all our works for us.","LALPA, nangin inremna mi ruotpêk i ta; nangin kan sin po po khawm i mi thawpêk sih a."
"O Jehovah our God, other lords besides thee have had dominion over us; but by thee only will we make mention of thy name.","Aw LALPA kan Pathien, nang chau ni loin, lal dang khawma kan chungah thu an nei ta hlak a, nisien- lakhawm, nangma ṭhangpui ngeiin i hming hi lam tâng kan tih."
"They are dead, they shall not live; they are deceased, they shall not rise: therefore hast thou visited and destroyed them, and made all remembrance of them to perish.","Anni chu an thi tah a, hring nâwk ta naw ni hai, an bo tah a, tho nâwk ta naw ni hai; chuleiin, nangin anni chu hremin i suksiet a, an hriet zingna po po khawm i sukbohmang tah."
"Thou hast increased the nation, O Jehovah, thou hast increased the nation; thou art glorified; thou hast enlarged all the borders of the land.","Hi hnam hi i sukpung tah a, aw LALPA, hi hnam hi i sukpung tah; nang chu chawimawiin i um tah a, hi ram hi a ramri po po chu i suklien tah."
"Jehovah, in trouble have they visited thee; they poured out a prayer when thy chastening was upon them.","“LALPA, an lunginzîng lai chun an sir hlak cheh a, i hremna chu an chunga a tlâk lai chun an ṭawngṭai zawmzawt a."
"Like as a woman with child, that draweth near the time of her delivery, is in pain and crieth out in her pangs; so we have been before thee, O Jehovah.","Nuhmei nau vawn, nei hun ta chu, a na hlak a, nauhasea a khêk rawng rawng hlak ang hin, aw LALPA, keini khawm i hmaah kan um hlak kha."
"We have been with child, we have been in pain, we have as it were brought forth wind; we have not wrought any deliverance in the earth; neither have the inhabitants of the world fallen.","Nau kan vawn a, kan nah a, thli ang chau el kan nei kha, hnuoia hin sansuokna kawng hrim kan sukkaw nawh a, khawvêla umhai hlak an tlu bawk nawh."
"Thy dead shall live; my dead bodies shall arise. Awake and sing, ye that dwell in the dust; for thy dew is as the dew of herbs, and the earth shall cast forth the dead.","I mithihai chu hring nâwk an ta, an ruonghai chu tho nâwk an tih. Pilvuta umhai, har unla, hlimtakin hla sak ro, i daidâw chu thlaihai daidâw ang a na, hnuoi hin mithihai chu a pei suok ding a ni sih a,” ti hi."
"Come, my people, enter thou into thy chambers, and shut thy doors about thee: hide thyself for a little moment, until the indignation be overpast.","Hung ta u, ka mihai, in pindan sûngahai lût unla, in kawthai chu inkhâr khum ro, lungninawna hi ân kieng hmakhat chun mitkhapkâr chau bêk inbihmang ro."
"For, behold, Jehovah cometh forth out of his place to punish the inhabitants of the earth for their iniquity: the earth also shall disclose her blood, and shall no more cover her slain.","Ngai ta u, LALPA chu, an suolna leia hnuoia umhai hrem dingin a umnaa inthawk chun a hung ṭum ding a nih; hnuoi khawm hin a thisenhai chu suklang a ta, mi an thathai chu inkhum ta naw ni."
"In that day Jehovah with his hard and great and strong sword will punish leviathan the swift serpent, and leviathan the crooked serpent; and he will slay the monster that is in the sea.","Chu nia chun LALPA chun a kâwlhnâm ngei ṭhatak, lien- tak, ringumtak chun leviathan rûlpui hrâttak le leviathan rûlpui kâwi ngul chu hrem a ta, tuipuia dragon um chu that bawk a tih."
"In that day: A vineyard of wine, sing ye unto it.","Chu nia chun, “Uoin grêp huon pakhat chu, chu chu chawimawiin hla sak ro."
"I Jehovah am its keeper; I will water it every moment: lest any hurt it, I will keep it night and day.","Kei LALPA hi a vêngtu ka nih; mitkhapkâr tinin tui buok ka ta, tukhawma an tâwk nawna dingin a sûn a zânin vêng ka tih."
"Wrath is not in me: would that the briers and thorns were against me in battle! I would march upon them, I would burn them together.","Keimaa hin lunginsenna a um nawh ie; buor le hlohlingneihai chun mi doin mi hung thaw hrim hai sien aw! anni chu thaw dingin fêng ka ta, hmun khatah ka raw hlut hlut ding bah."
"Or else let him take hold of my strength, that he may make peace with me; yea, let him make peace with me.","An naw vêk leh, keima le inremna dingin ka hrâtna hi chel raw se; anih, mîn rempui ro.”"
In days to come shall Jacob take root; Israel shall blossom and bud; and they shall fill the face of the world with fruit.,"Hun la hung tlung dinga chun Jakobhai chun zung kei an ta; Israelhai chu kumûmin pâr an tih; chuongchun, hnuoi chung hi rain suksip an tih."
Hath he smitten them as he smote those that smote them? or are they slain according to the slaughter of them that were slain by them?,"Ama vawtuhai a vuok ang takin ama chu a vuok vêm a nih? annawleh, ama thathai that ang takin ama chu thatin a um vêm a nih?"
"In measure, when thou sendest them away, thou dost contend with them; he hath removed them with his rough blast in the day of the east wind.",Ama chu în fe hmangtir laiin a hun charin ama chu i sêl a; khawsak thli hrâng ni chun ân thli natak chun ama chu a lên sawn tah a.
"Therefore by this shall the iniquity of Jacob be forgiven, and this is all the fruit of taking away his sin: that he maketh all the stones of the altar as chalkstones that are beaten in sunder, so that the Asherim and the sun-images shall rise no more.","Chuleiin, hi hin Jakobhai rîtlona chu sâwpfai nîng a ta, hi hi an suol fe hmangpuina ra ruok a nih; Aserahai le nisa limhai chu tho nâwk ta lo ding khawpin mâichâm lung po po chu tlak lung suknawi rem rum ang elin an siem hi."
"For the fortified city is solitary, a habitation deserted and forsaken, like the wilderness: there shall the calf feed, and there shall he lie down, and consume the branches thereof.","Khuo kulpui nei chu a khaw- sâwt a, umna, mi hnungsawn le fesan hnung a ni ta sih a, thlalêr ang elin; chutaka chun bâwngtê tlâng a ta, chutaka bawk chun bawk a ta, a kauhai chu fâng a tih."
"When the boughs thereof are withered, they shall be broken off; the women shall come, and set them on fire; for it is a people of no understanding: therefore he that made them will not have compassion upon them, and he that formed them will show them no favor.","A kauhai chu a vuoi pha chun thliekin um a ta, nuhmeihai hung an ta, raw el an tih; hriet theina hrim hrim nei naw mihai an ni sih a; chuleiin, anni siemtu chun anni chu lunginsiet naw nih a, anni inngîrtu chun anni chu a ditin ditsak hrim hrim bawk naw nih."
"And it shall come to pass in that day, that Jehovah will beat off his fruit from the flood of the River unto the brook of Egypt; and ye shall be gathered one by one, O ye children of Israel.","Chu nia chun LALPA chun Vadung a kuong sipa luong dûl dûla inthawkin, Aigupta vadungtê chenin a ra vaw thlâng a ta; chuongchun, aw Israel thlahai, a khât khâta rûtin um in tih."
"And it shall come to pass in that day, that a great trumpet shall be blown; and they shall come that were ready to perish in the land of Assyria, and they that were outcasts in the land of Egypt; and they shall worship Jehovah in the holy mountain at Jerusalem.","Chu nia chun tawtawrâwt lientak mût an ta; chuongchun, Assuria rama bohmang vâng vânghai le, Aigupta rama hnawtdawka umhai chu hung an ta; Jerusalem khuoa tlâng inthienga chun, LALPA chu chibai bûk an tih."
"Woe to the crown of pride of the drunkards of Ephraim, and to the fading flower of his glorious beauty, which is on the head of the fat valley of them that are overcome with wine!","Ephraimhai zu inruihmanghai chapona lallukhum chung le, an mawina ropui pâr ṭuoi mêk, uoin inchie hnea umhai ruom ṭhatakin a khum chung chu a rik ie!"
"Behold, the Lord hath a mighty and strong one; as a tempest of hail, a destroying storm, as a tempest of mighty waters overflowing, will he cast down to the earth with the hand.","Ngai ta, LALPA chun mi hrât thilthawtheitak a nei a; ama chun riel nasatak tla dur dur, thlipui thil sukse rem rum ang le, tuilien nasatak lien zur zur ang elin, hnuoiah pei chawr a tih."
The crown of pride of the drunkards of Ephraim shall be trodden under foot:,Ephraimhai zu inruihmang chapona lallukhum chu sirdein um a ta;
"and the fading flower of his glorious beauty, which is on the head of the fat valley, shall be as the first-ripe fig before the summer; which when he that looketh upon it seeth, while it is yet in his hand he eateth it up.","an mawina ropui pâr ṭuoi mêk, ruom ṭhatakin a khum chu, nipui hmaa theichang hmin hmasa tak, a entuin a hmuh a, a kuta a um phinga a fâk zo el hlak ang chu nîng a tih."
"In that day will Jehovah of hosts become a crown of glory, and a diadem of beauty, unto the residue of his people;","Chu nia chun sipaihai LALPA chu, a mi la um sunhai ta dingin ropuina lallukhum dâm, mawina lukhum dâm,"
"and a spirit of justice to him that sitteth in judgment, and strength to them that turn back the battle at the gate.","rorêl dinga ṭhung ta dinga rorêlna thlarau dâm, kul kawtkhâr bula hung thawtuhai dangkîrtuhai ta dinga hrâtna nîng a tih."
"And even these reel with wine, and stagger with strong drink; the priest and the prophet reel with strong drink, they are swallowed up of wine, they stagger with strong drink; they err in vision, they stumble in judgment.","Nisienlakhawm, chuonghai khawm chu uoin leiin an thle an thle a, zu leiin an pêm an pêm a, thiempuhai le zâwlneihai chu zu leiin an thle a, uoin lem zoin an um a, zu leiin an pêm an pêm a; inlârna thuah an thle an thle hlak a, rorêlna thuah an pêm an pêm hlak."
"For all tables are full of vomit and filthiness, so that there is no place clean.",Hmun fai hrim hrim um naw khawpin dawkân po po chu luok le thil pawrchein a sip a nih.
"Whom will he teach knowledge? and whom will he make to understand the message? them that are weaned from the milk, and drawn from the breasts?",Hrietna tieng chu tu hîm ân chûktir ding a ni leh? Thucha chu tu hîm ân hriettir ding a ni leh? Nene nêk bân chauhai le nêne innêktir ta lohai hîm an ni ding?
"For it is precept upon precept, precept upon precept; line upon line, line upon line; here a little, there a little.","Thununna thu chunga thu- nunna thu inchuon a, thununna thu chunga thununna thu inchuon a, dân chunga dân inchuon a, dân chunga dân inchuon a; hitakah tlâwmte, sawtakah tlâwmte, ti ruok a ni sih a."
"Nay, but by men of strange lips and with another tongue will he speak to this people;","Anih, nisienlakhawm, hmûr danglam put mi hmangin, ṭawng dangin hieng mihai kuoma hin thu hril lem tâng a tih:"
"to whom he said, This is the rest, give ye rest to him that is weary; and this is the refreshing: yet they would not hear.","“Hi hi a nih châwlna chu, sâwl- hai chu inchâwltir ro; hi hi a nih insukharna chu,” a tihai chu: nisien- lakhawm, an ngai nuom si nawh."
"Therefore shall the word of Jehovah be unto them precept upon precept, precept upon precept; line upon line, line upon line; here a little, there a little; that they may go, and fall backward, and be broken, and snared, and taken.","Chuleiin, an feh a, an thala an tlûk a, an kawinawi a, chânga an âwk a, mana an um theina dingin, LALPA thu chu annirawi ta ding chun, thu- nunna thu chunga thununna inchuon a, thununna thu chunga thununna inchuon a, dân chunga dân inchuon a, dân chunga dân inchuon a; sawtakah tlawmte, hitakah tlâwmte ti ruok ni el a tih."
"Wherefore hear the word of Jehovah, ye scoffers, that rule this people that is in Jerusalem:","Chuleichun, mi hmusit hmang- hai, hieng mihai, Jerusalema umhai ro rêlpêktuhai, LALPA thu hi hre ro."
"Because ye have said, We have made a covenant with death, and with Sheol are we at agreement; when the overflowing scourge shall pass through, it shall not come unto us; for we have made lies our refuge, and under falsehood have we hid ourselves:","“Thina kuomah thu kan thlung tah, Seol leh thu kan intiem tah; vuokna tui lien liem chu a luong tlang pha khawm keini chen chun luong naw nih; khêl thu dâm kan inhumhim- na dingin kan hmang a, khêl hnuoi- ah kan inbihmang ta sih a,” in ti leiin;"
"therefore thus saith the Lord Jehovah, Behold, I lay in Zion for a foundation a stone, a tried stone, a precious corner-stone of sure foundation: he that believeth shall not be in haste.","chuleiin, Lalpa Pathien chun hieng ang hin a hril, “Ngai ta, lung, lung fie hnung, a kia lung hlutak ka phûm, dettak chu, Ziona chun lung- phûm dingin ka rem hi; ama ringtu chu inhmaw naw nih."
"And I will make justice the line, and righteousness the plummet; and the hail shall sweep away the refuge of lies, and the waters shall overflow the hiding-place.","Rorêlna fel chu a suktlûnna hruiin hmang ka ta, felna chu a dârmûmkhaiah hmang ka tih, riel chun inhumhimna khêl thuhai chu dêng hmang vawng a ta, tuihai chun inbîkhmangna chu chîm tlum a tih."
"And your covenant with death shall be annulled, and your agreement with Sheol shall not stand; when the overflowing scourge shall pass through, then ye shall be trodden down by it.","Chun, thina kuoma in thu- thlung chu sûtin um a ta, Seol le in thutiem khawm chu ngir suok naw ni, vuokna tui lien liem chu a luong tlang pha chun, chu pha chun sirdein um in tih."
"As often as it passeth through, it shall take you; for morning by morning shall it pass through, by day and by night: and it shall be nought but terror to understand the message.","A luong tlang po leh la pei a ti cheu a; tûk tin tûk tinin, a sûn a zânin, a luong tlang âwm sih a; thu incha umze hriet chu thil râpthlâk ruok nîng a tih,” tiin."
For the bed is shorter than that a man can stretch himself on it; and the covering narrower than that he can wrap himself in it.,Khum chu inthluongna dingin a tawi ta law sih a; puonthuo chu inkhumna dingin a chîn talaw bawk si.
"For Jehovah will rise up as in mount Perazim, he will be wroth as in the valley of Gibeon; that he may do his work, his strange work, and bring to pass his act, his strange act.","A sin, a sin danglam chu, a thaw theina ding le, a thilthaw, a thilthaw danglam chu a muolsuo theina dingin, LALPA chu Perazim tlânga a tho ang khan a tho ding a ni sih a, Gibeon ruoma a lunginsen ang khan a lunginsen ding a ni sih a."
"Now therefore be ye not scoffers, lest your bonds be made strong; for a decree of destruction have I heard from the Lord, Jehovah of hosts, upon the whole earth.","Chuongchun, mi hmusit hmang- tuhai ni ta naw ro, chuong naw chun, in kawl bunhai chu ringumtakin siem rawi an tih; tâwpna, tâwpna tlung ngei dinga ruot tlat chu, hnuoi pum- pui chunga a tlung ding thu, Lalpa, sipaihai LALPA kuoma inthawk chun ka hriet sih a."
"Give ye ear, and hear my voice; hearken, and hear my speech.","Na sit unla, ka râwl hi hre ro, ngai unla, ka thu hril hi hre ro."
Doth he that ploweth to sow plow continually? doth he continually open and harrow his ground?,Hnuoi inlettu chun chi thena dingin hnuoi chu ân let ân let el hlak am a nih? a hnuoi tlanghai chu a suknawiin a sukphit zing hlak am a nih?
"When he hath levelled the face thereof, doth he not cast abroad the fitches, and scatter the cummin, and put in the wheat in rows, and the barley in the appointed place, and the spelt in the border thereof?","A chung chu a chawkruol zoin Mohuri chu a thedar ni lo am a nih? Zira dâm khawm a the ni lo am a nih? Bu dâm chu a tlarin, buṭei  dâm chu hmun ruotah, mimhai khawm chu a hnâwm hrûlah a tû hlak ni lo am a nih?"
"For his God doth instruct him aright, and doth teach him.",A Pathien chun ama chu feltak- in a thununin ân chûktir hlak sih a.
"For the fitches are not threshed with a sharp threshing instrument, neither is a cart wheel turned about upon the cummin; but the fitches are beaten out with a staff, and the cummin with a rod.","Mohuri chu bu chîlna khâwl ngeiin an chil ngai si nawh a, zira chungahai chun tawlailîr kehai chu an inhlumtir ngai bawk nawh; mohu- ri chu hmawlin an vuok lem hlak."
"Bread grain is ground; for he will not be always threshing it: and though the wheel of his cart and his horses scatter it, he doth not grind it.","Beiphit bu chu râwtnawiin a um hlak, kumkhuoin a vuok zing âwm si nawh a, tawlailîr ke le a sakawr chun sukdar sienla khawm, ân râwt- nawitir ngai nawh."
"This also cometh forth from Jehovah of hosts, who is wonderful in counsel, and excellent in wisdom.","Chuong khawm chu sipaihai LALPA, inrâwnna kawnga mi mak- tak le, varna kawnga mi ṭhatak kuoma chu a suok a nih."
"Ho Ariel, Ariel, the city where David encamped! add ye year to year; let the feasts come round:","E Ariel, Ariel, David umhmun khuorna khuo! kumah kum bel ro; ruoiṭhe hunhai chu hung tlung nâwk raw se;"
"then will I distress Ariel, and there shall be mourning and lamentation; and she shall be unto me as Ariel.","chu pha chun Ariel hi suklung- zîng ka ta; chuongchun, sûnna le ṭapna um a tih; chun, ama chu ka ta dingin Ariel ang chu nîng a tih."
"And I will encamp against thee round about, and will lay siege against thee with posted troops, and I will raise siege works against thee.","Chun, nang chu thaw tumin i vêla chun ep ka ti cheh a, kul siemin inhuol vêl bawk ka ti cheh a, thaw ding chein inhuol vêlna kulbînghai siem bawk ka tih."
"And thou shalt be brought down, and shalt speak out of the ground, and thy speech shall be low out of the dust; and thy voice shall be as of one that hath a familiar spirit, out of the ground, and thy speech shall whisper out of the dust.","Chuongchun, sukthlûkin um i ta, hnuoi hnuoia inthawkin thu hril i ta; i ṭawng chu pilvut lai chun damtein inri suok a tih: i râwl chu khawhri aisânthiem râwl ri ang chauin hnuoi hnuoia inthawk chun hung suok a tih; i ṭawng chu pilvut laia inthawk chun hung suok sê sêng a tih."
"But the multitude of thy foes shall be like small dust, and the multitude of the terrible ones as chaff that passeth away: yea, it shall be in an instant suddenly.","Nisienlakhawm, nanga dotu mipuihai chu pilvut inditak angin um an ta, mi ṭiumhai mipuihai chu busi bohmang hlak ang hin um bawk an tih; anih, chu chu mitkhapkâr loin um thut a tih."
"She shall be visited of Jehovah of hosts with thunder, and with earthquake, and great noise, with whirlwind and tempest, and the flame of a devouring fire.","Vâninrûm dâm, simkhawleihnuoi inhnîng dâm, ri nasatak dâm, thlivir dâm, thlipui dâm, thil kâng hmang thei meichawk dâmin ama chu sipaihai LALPA hremin um a tih."
"And the multitude of all the nations that fight against Ariel, even all that fight against her and her stronghold, and that distress her, shall be as a dream, a vision of the night.","Chuongchun, Ariel dotu hnam po po mipuihai, ama le a kulbîng thaw- tuhai po po leh ama suklungzîng- tuhai po po chu mang ang chau nîng an ta, zâna inlâr ang chau el hi."
"And it shall be as when a hungry man dreameth, and, behold, he eateth; but he awaketh, and his soul is empty: or as when a thirsty man dreameth, and, behold, he drinketh; but he awaketh, and, behold, he is faint, and his soul hath appetite: so shall the multitude of all the nations be, that fight against mount Zion.","Mi phîngṭâmin mang a nei chun bu a lo fâk hlak a; nisienlakhawm, a hang har a, a phîng chu a lo la ruok zing ang hi nîng a tih; annawleh, mi dangchârin mang a nei chun tui a lo dâwn hlak a, nisienlakhawm, a hung har a, a lo la châu zingin, tui a la du rawp ang hi nîng a tih; Zion tlâng thawtu hnam po po mipuihai chu, chuong ang chu an ni ding a nih."
"Tarry ye and wonder; take your pleasure and be blind: they are drunken, but not with wine; they stagger, but not with strong drink.","Ngîr zing unla, makti ro, nuom- tâwl unla, mitdelin um ro; an inrui a, nisienlakhawm, uoin lei a ni nawh; an pêm an pêm a, nisienlakhawm, zu lei a ni nawh."
"For Jehovah hath poured out upon you the spirit of deep sleep, and hath closed your eyes, the prophets; and your heads, the seers, hath he covered.","LALPA chun îmu hêna thlarau chu in chungah a buok a, in mit, zâwlneihai chu, ân sîmtir a; in lu, hmutheituhai chu, ân khum ta sih a."
"And all vision is become unto you as the words of a book that is sealed, which men deliver to one that is learned, saying, Read this, I pray thee; and he saith, I cannot, for it is sealed:","Chuongchun, inlârna hrim hrim in ta dingin lekhabu châr tlata thu ang a ni tah a, chu chu mihaiin lekha thiem mi kuomah, “Lunginsiettakin hi hi tiem rawh,” tiin an pêk hlak a; chun, ama chun, “Ka tiem thei nawh, châr tlat a ni hi,” a ti hlak;"
"and the book is delivered to him that is not learned, saying, Read this, I pray thee; and he saith, I am not learned.","chun, lekhabu chu lekha thiem naw mi kuomah, “Lunginsiettakin hi hi tiem rawh,” tiin a pêk hlak a; chun, ama chun, “Lekha ka thiem nawh,” a ti hlak."
"And the Lord said, Forasmuch as this people draw nigh unto me, and with their mouth and with their lips do honor me, but have removed their heart far from me, and their fear of me is a commandment of men which hath been taught them;","Chun, LALPA chun, “Hieng mihai hin an mi hung hnai a, an bau le an hmûr hin an mi chawimawi hlak deha chu, an lungril chu keia hlatah an sawn hlak a, an mi ṭina chu mihriemhai thupêk miin an inchûktir el chu a nih;"
"therefore, behold, I will proceed to do a marvellous work among this people, even a marvellous work and a wonder; and the wisdom of their wise men shall perish, and the understanding of their prudent men shall be hid.","chuleiin, ngai ta, hienghai lai hin thilmak thaw nâwk nghâl ka ta, thilmak, thilmaktak el chu; chuong- chun, an mi varhai varna chu bohmang tâng a tih, an mi bengvârhai hrietna chu thupin um tâng a tih,” a ta."
"Woe unto them that hide deep their counsel from Jehovah, and whose works are in the dark, and that say, Who seeth us? and who knoweth us?","An remruot chu LALPA kuoma thup dinga inthûktaka zawngtuhai chu an chung a rik ie! an thilthawhai chu inthim hnuoiah a um a, “Tuin am mi hmûng a ta? Tuin am hriet khawm mi hrieng a ta?” an ta."
"Ye turn things upside down! Shall the potter be esteemed as clay; that the thing made should say of him that made it, He made me not; or the thing formed say of him that formed it, He hath no understanding?","Thilhai hi in suklinglet vawng hlak de aw! Bêlhemtu chu bepil ang chaua ngaiin a um ding am a nih? Thilsiem chun a siemtu chu, “Ama mi siem ka ni hlak lêm” a ti el chu? annawleh, thil inngîra um chun ân ngîrtu chu, “Hrietna hrim a nei nawh,” ti am a ni leh?"
"Is it not yet a very little while, and Lebanon shall be turned into a fruitful field, and the fruitful field shall be esteemed as a forest?","Sâwt nawte hnungah ni lo am a ni, Lebanon chu hnuoi ṭhatak hmuna inchangtira uma, hnuoi ṭhatak hmun chu ramhnuoia ngaia a um ding chu?"
"And in that day shall the deaf hear the words of the book, and the eyes of the blind shall see out of obscurity and out of darkness.","Chu nia chun nasêthai chun lekhabu thu chu nain hre tâng an ta, mitdelhai mithai chun inthim hnuoi le inthim laia inthawkin hmu tâng an tih."
"The meek also shall increase their joy in Jehovah, and the poor among men shall rejoice in the Holy One of Israel.","Thuhnuoirawlhai khawmin LALPAA chun an hlimna chu sukpung tâng an ta, mihriem laia rimsihai chu Israelhai Mi Inthienga chun lâwm tâng an tih."
"For the terrible one is brought to nought, and the scoffer ceaseth, and all they that watch for iniquity are cut off;","Mi ṭium chu iengkhawm ni loa siemin um tâng a ta, hmusittu chu a bo tah a, khawhlona nghâkhlatuhai po po chu sukbohmangin an um ta sih a,"
