en,hmr
"Behold, my servant shall deal wisely, he shall be exalted and lifted up, and shall be very high.","Ngai ta, ka siehlaw chun vartakin thâwng a ta, chawimawi le chawisângin um a ta, insângtakin um a tih."
"Like as many were astonished at thee (his visage was so marred more than any man, and his form more than the sons of men),","Mi tamtakin mak an ti hle che angin, (a hmêl chu mihriem hmêl nêk hmana suksietin a um a, a pienken chu mihriem nauhai pienken nêk hmana suksietin a um a),"
so shall he sprinkle many nations; kings shall shut their mouths at him: for that which had not been told them shall they see; and that which they had not heard shall they understand.,"hnam tamtakin maktîng an tih; lalhaiin a kuoma chun an bau lân chîp an ta, an kuoma hril ngai lo chu la hmûng an ta, naa an hriet ngai naw chu an ngaithiem ding a nih."
Who hath believed our message? and to whom hath the arm of Jehovah been revealed?,Kan thuhril tuin am a ring a? LALPA kut chu tu kuom am ân lang a?
"For he grew up before him as a tender plant, and as a root out of a dry ground: he hath no form nor comeliness; and when we see him, there is no beauty that we should desire him.","A hmaa chun thil ṭo innotak angin ama chu ân dâwn suok sih a, hnuoi ṭâwla zung angin a hung kak suok bawk a nih; pienken ṭhatna le hmêl mawina hrim hrim a nei nawh a, ama ei hmuin ama ei ditna dingin mawina hrim hrim a nei nawh."
"He was despised, and rejected of men; a man of sorrows, and acquainted with grief: and as one from whom men hide their face he was despised; and we esteemed him not.","Ama chu mihriemhai hmusit le dit nawin a um a; lungngainahai nei mi le natna hre mi a na, mihaiin an hmai an hipsan ang ang chun ama chu hmusitin a um a, eini hlak chun ama chu ei ngaisâng si nawh."
"Surely he hath borne our griefs, and carried our sorrows; yet we did esteem him stricken, smitten of God, and afflicted.","Ama chun ei natnahai phurin, ei lungngainahai khawm a phur ngei a; nisienlakhawm,eini chun lungngaina ivurkhumah, Pathien vuokah, suk- rinumah, ei ngai sih a."
"But he was wounded for our transgressions, he was bruised for our iniquities; the chastisement of our peace was upon him; and with his stripes we are healed.","Nisienlakhawm, ama chu ei bawsietnahai leiin inhliemin a um a, ei khawhlonahai leiin vuok thidukin a um a; ei thlamuongna dinga thu- nunna chu a chungah a tlah a, a vuokna invuolhaia sukdamin ei um tah."
All we like sheep have gone astray; we have turned every one to his own way; and Jehovah hath laid on him the iniquity of us all.,"Ei rêng hin berâm angin ei invâk hmang a, mâni lampui sengah ei pêt a; LALPA chun ama chunga chun ei rênga khawhlona chu ân nghat tah a."
"He was oppressed, yet when he was afflicted he opened not his mouth; as a lamb that is led to the slaughter, and as a sheep that before its shearers is dumb, so he opened not his mouth.","Ama chu nêksawr le sukrinumin a um a, nisienlakhawm, ân ngaitlâwm a, a bau khawm a ka nawh; berâmte that dinga an ṭhuoi ang le berâm a hmul vâwtu hmaa to zinga a um ang elin, anih, a bau a ka nawh."
"By oppression and judgment he was taken away; and as for his generation, who among them considered that he was cut off out of the land of the living for the transgression of my people to whom the stroke was due?",Nêksâwrna le rorêlna lâk hmangin a um a; a dam ruolpuihai lem chun tuin am mi hring rama inthawka sukbohmanga a um chu ngaituo hrim an ta? Ka mihai baw- sietna leiin lungngaina invurkhumin a um a nih.
"And they made his grave with the wicked, and with a rich man in his death; although he had done no violence, neither was any deceit in his mouth.","Chun, thil nunsetaka thaw ngai loin, a bauah hlêmna hrim hrim um ngai naw sien khawm, a thlân chu mi suolhai kuomah an ruotpêk a, a thi hnung chun mi hausa kuom tieng a um a."
"Yet it pleased Jehovah to bruise him; he hath put him to grief: when thou shalt make his soul an offering for sin, he shall see his seed, he shall prolong his days, and the pleasure of Jehovah shall prosper in his hand.","Nisienlakhawm, LALPAIN ama chu vuok thiduk a nuom hrim a nih; a sukna ta ngei a; a hringna chu suol ta dinga thilinhlâna a hmang pha chun, a chithla chu hmu tâng a ta, a dam sûng nihai chu suksei a ta, LALPA dit zâwng chu a kuta hlawtlingin um a tih."
"He shall see of the travail of his soul, and shall be satisfied: by the knowledge of himself shall my righteous servant justify many; and he shall bear their iniquities.","A hringna sininrim ra chu hmûng a ta, lungawi tâng a tih; ka siehlaw feltak chun a hrietnain mi tamtak chu thiem inchangtir a ta, an khawhlonahai chu phurpêk a tih."
"Therefore will I divide him a portion with the great, and he shall divide the spoil with the strong; because he poured out his soul unto death, and was numbered with the transgressors: yet he bare the sin of many, and made intercession for the transgressors.","Chuleiin, ama chu mi lienhai chanvo ang sem vêng ka ta, ama chun râllâk sumhai chu mi hrâthai sem vêng a tih; a hringna chu thi khawp raka a bunthlâk a, bawsetuhai laia tiemsaa a um leiin; nisienlakhawm, mi tamtak suolna chu a phur a, baw- setuhai ta ding chun a ṭawngṭaipêk a."
"Sing, O barren, thou that didst not bear; break forth into singing, and cry aloud, thou that didst not travail with child: for more are the children of the desolate than the children of the married wife, saith Jehovah.","“Aw ching, nau nei lo, nang, hlimtakin hla sak rawh; nang, nauhase ngai naw, hla sak suok phut la, khêk suok rawh: pasal nei mi nauhai nêk chun khawsâwtnu nau- hai an tam lem sih a,” LALPAIN a tih."
"Enlarge the place of thy tent, and let them stretch forth the curtains of thy habitations; spare not: lengthen thy cords, and strengthen thy stakes.","I puon in hmun chu zau rawh, i umnahai puon in chung chu keiphar- in um raw se; ret naw rawh, i hruihai chu suksei la, i keimarna hembûrhai chu sukdet rawh."
"For thou shalt spread abroad on the right hand and on the left; and thy seed shall possess the nations, and make the desolate cities to be inhabited.","Changtieng le vawitienga khawm în dar lien ding a ni sih a; chuong- chun, i chithlahai chun hnam tin chu roin hluong an ta, khawpui râusan hnungahai chun mîn umtir nâwk an tih."
Fear not; for thou shalt not be ashamed: neither be thou confounded; for thou shalt not be put to shame: for thou shalt forget the shame of thy youth; and the reproach of thy widowhood shalt thou remember no more.,"Ṭi naw, i muolpho âwm si nawh a; beidawng bawk naw, muolphoin i um âwm bawk si nawh a, i tleirâwl lai muolphona chu i theinghil tain, i hmeithaina hmingsietna khawm chu i hriet zing ta âwm si nawh a."
For thy Maker is thy husband; Jehovah of hosts is his name: and the Holy One of Israel is thy Redeemer; the God of the whole earth shall he be called.,Nangma siemtu chu i pasal a ni sih a; a hming chu sipaihai LALPA a nih; Israelhai Mi Inthieng chu nang- ma intlantu a ni bawk a nih; ama chu khawvêl po po Pathien tîng an tih.
"For Jehovah hath called thee as a wife forsaken and grieved in spirit, even a wife of youth, when she is cast off, saith thy God.","Nuhmei mâk, lungrila lungngai- tak, tlangvâl laia nuhmei tah, pei hnung ko nâwk angin LALPAIN a ko che a ni hi, i Pathienin a tih."
For a small moment have I forsaken thee; but with great mercies will I gather thee.,"Mitkhapkâr chau el ka mâk cheh a; nisienlakhawm, lunginsietna nasa- takin ṭhuoi nâwk ka ti che."
"In overflowing wrath I hid my face from thee for a moment; but with everlasting lovingkindness will I have mercy on thee, saith Jehovah thy Redeemer.","Ka lunginsen luotin mitkhapkâr nanga tieng ka hmai ka thup a; nisienlakhawm, kumkhawtluong zai- nêmnain lunginsiet ka ti che, LALPA nangma intlantu chun a tih."
"For this is as the waters of Noah unto me; for as I have sworn that the waters of Noah shall no more go over the earth, so have I sworn that I will not be wroth with thee, nor rebuke thee.","Chu chu ka ta dingin Noa tuihai ang kha a ni sih a; “Noa tuihai chun hnuoi chîm tlum nâwk ta naw ni,” tia ṭawng kân khâm ang khan, “I chungah lunginsen nâwk ta naw ning a, kâwk nâwk ta naw bawk ka ti che,” tiin ṭawng kân khâm tah a nih."
"For the mountains may depart, and the hills be removed; but my lovingkindness shall not depart from thee, neither shall my covenant of peace be removed, saith Jehovah that hath mercy on thee.","Tlâng lienhai chu fe hmang an ta, tlâng chînhai chu sawnin um bawk an tih; ka zainêmna ruok hi chu i kuoma inthawkin fe hmang naw nih a, ka remna thuthlung chu sawnin um bawk naw ni, LALPA a lungin- siettu che chun a tih."
"O thou afflicted, tossed with tempest, and not comforted, behold, I will set thy stones in fair colors, and lay thy foundations with sapphires.","Aw nang sukrimsik, tuifâwn vawr vawra um, lungmuongna nei lo, ngai ta, i lunghai chu zie mawitak- haiin rem ka ta, i lungphûmhai chu sapphir lunghaiin rem bawk ka tih."
"And I will make thy pinnacles of rubies, and thy gates of carbuncles, and all thy border of precious stones.","I sîp zumhai chu rubi lungin, i kawtkhârhai chu karbankle lungin, i kul po po chu lung mawihaiin siem ka tih."
And all thy children shall be taught of Jehovah; and great shall be the peace of thy children.,"I nauhai po po chu LALPA in- chûktirin um an ta, i nauhai lung- muongna chu nasatak nîng a tih."
"In righteousness shalt thou be established: thou shalt be far from oppression, for thou shalt not fear; and from terror, for it shall not come near thee.","Felnaa sukdetin um i ta, nêk- sâwrnaa inthawka hlatakah um i tih; i ṭi ta naw ding a nih; thil râpthlâka inthawka hlatakah um bawk i ta; a hnai naw ding che a nih."
"Behold, they may gather together, but not by me: whosoever shall gather together against thee shall fall because of thee.","Ngai ta, an la pung khâwm a ni thei, nisienlakhawm, ka thu ni naw ni; nangma thaw dinga pung khâwm ta- phawt chu nangma leiin tlûng an tih."
"Behold, I have created the smith that bloweth the fire of coals, and bringeth forth a weapon for his work; and I have created the waster to destroy.","Ngai ta, kei chun thirsu pûm zâpa a sinthawna ding hriem sut hlaktu chu ka siem a; keima bawkin sukse dingin suksetu ka siem a nih."
"No weapon that is formed against thee shall prosper; and every tongue that shall rise against thee in judgment thou shalt condemn. This is the heritage of the servants of Jehovah, and their righteousness which is of me, saith Jehovah.","Nangma thawna dinga hriem sut hrim hrim ṭhahnem naw nih a, lei tinrêng thupawia nangma hung khing- tuhai che chu thiemnaw inchangtir i tih. Chu chu LALPA siehlawhai ro- chan chu a na, an felna chu ka kuoma inthawk a nih, LALPAIN a tih."
"Ho, every one that thirsteth, come ye to the waters, and he that hath no money; come ye, buy, and eat; yea, come, buy wine and milk without money and without price.","Hung ta u, dangchâr taphawthai, tuiahai hin hung ro, tangka nei nawhai khawm hung unla, inchaw unla, fa ro; anih, hung unla, uoin le nênetui tangka pe loin, a man khawm pe loin inchaw ro."
"Wherefore do ye spend money for that which is not bread? and your labor for that which satisfieth not? hearken diligently unto me, and eat ye that which is good, and let your soul delight itself in fatness.","Bu ni si loah ieng dinga tangka in sêng am a na? Khawp le tlaina ni si loah ieng dinga in tha in sêng am a na? Ka thu nguntakin ngai unla, thil ṭha chu fa ro, in hringna chu thil thau chun hlim raw se."
"Incline your ear, and come unto me; hear, and your soul shall live: and I will make an everlasting covenant with you, even the sure mercies of David.","In na hung sit unla, ka kuomah hung ro; ngai unla, chuongchun, in hringna chu hring a tih; chun, in kuomah kumkhaw thu thlung ka tih; David kuoma lunginsietna tiem tlat tahai chu."
"Behold, I have given him for a witness to the peoples, a leader and commander to the peoples.","Ngai ta, ama chu mi tin ta dinga hretuah ka ruot a, mi tin ta dingin hotua le ṭhuoituah ka ruot a nih."
"Behold, thou shalt call a nation that thou knowest not; and a nation that knew not thee shall run unto thee, because of Jehovah thy God, and for the Holy One of Israel; for he hath glorified thee.","Ngai ta, i hriet naw hnam chu ko i ta, nangma hre ngailo hnam chu i kuomah hung tlân an ta; LALPA i Pathien lei le, Israelhai Mi Inthieng lei chun; ama chun a chawimawi si cheh a."
Seek ye Jehovah while he may be found; call ye upon him while he is near:,"Hmu awla a um lai hin LALPA chu zawng unla, a hnâi lai hin ko ro;"
"let the wicked forsake his way, and the unrighteous man his thoughts; and let him return unto Jehovah, and he will have mercy upon him; and to our God, for he will abundantly pardon.","mi rilo chun a um dân chu bânsan sienla, mi fel naw chun a ngai- tuonahai chu bânsan bawk raw se; LALPA kuomah kîr nâwk raw se; chuongchun, ama chun lo lunginsiet a ta; ei Pathien kuomah kîr nâwk raw se, ama chun a lo ngaidam nasa khawp âwm sih a."
"For my thoughts are not your thoughts, neither are your ways my ways, saith Jehovah.","Ka ngaituohai hi i ngaituohai a ni si nawh a, i um dânhai chu ka um dân a ni bawk nawh, LALPAIN a tih."
"For as the heavens are higher than the earth, so are my ways higher than your ways, and my thoughts than your thoughts.","Vân khi hnuoi nêka ân sâng lem angin, ka um dânhai hi i um dânhai nêkin ân sâng lem sih a, ka ngai- tuohai khawm hi i ngaituohai nêkin ân sâng lem a nih."
"For as the rain cometh down and the snow from heaven, and returneth not thither, but watereth the earth, and maketh it bring forth and bud, and giveth seed to the sower and bread to the eater;","Ruo le vûr chu vâna inthawkin a sûr hlak a, khitienga khin a kîr nâwk ngai nawh a, hnuoi hi a châwm lem a, thil ân mâwngtirin ân dertir a, bu chi thetu kuoma chun bu chi a pêk a, fatu kuoma chun fâk ding a pêk hlak a."
"so shall my word be that goeth forth out of my mouth: it shall not return unto me void, but it shall accomplish that which I please, and it shall prosper in the thing whereto I sent it.","chuong ang bawkin ka baua inthawka ka thu suok chu um a tih: iengkhawm thaw nei loin ka kuomah hung kîr nâwk naw nih a, ka dit ang chu thaw lem a ta, thil thaw dinga ka tirnaa chun hlawtling bawk a tih."
"For ye shall go out with joy, and be led forth with peace: the mountains and the hills shall break forth before you into singing; and all the trees of the fields shall clap their hands.","Hlimtaka suokin, lungmuong- taka ṭhuoi suokin in um ding a ni sih a, tlâng lienhai le tlâng chînhai chun in hmaah hla sak suok phut an tih, phûl thing po pohai chun an kut ben bawk an tih."
"Instead of the thorn shall come up the fir-tree; and instead of the brier shall come up the myrtle-tree: and it shall be to Jehovah for a name, for an everlasting sign that shall not be cut off.","Hlohlingnei nêk chun fâr mâwng lem a ta, buor nêk chun inhmui mâwng lem a tih; chu chu LALPA ta dinga hmingṭhatna ding le, kum- khawtluonga inchikna sukbohmanga um lo ding nîng a tih."
"Thus saith Jehovah, Keep ye justice, and do righteousness; for my salvation is near to come, and my righteousness to be revealed.","LALPA chun hieng ang hin a tih, “Rorêl zâwm unla, feltakin thaw ro, ka sandamna chu a hung tlung vâng vângin, ka felna chu a hung inlang ṭêp ta sih a."
"Blessed is the man that doeth this, and the son of man that holdeth it fast; that keepeth the sabbath from profaning it, and keepeth his hand from doing any evil.","Chuong ang thaw mi le, chu chu pawm tlattu mihriem naupa chu, a hamṭha ie; châwlni bawse loa inser hlaktu le, thil ṭha naw hrim thaw lo dinga a kut vêng ṭha hlaktu chu."
"Neither let the foreigner, that hath joined himself to Jehovah, speak, saying, Jehovah will surely separate me from his people; neither let the eunuch say, Behold, I am a dry tree.","Chun, ram dang mi, LALPA zâwmtu chun, “LALPAIN a mihaia inthawk hin mi suktum ngei a tih,” ti naw raw se; mitillâk chun, “En ta thing ṭâwl el ka ni hi,” ti bawk naw raw se."
"For thus saith Jehovah of the eunuchs that keep my sabbaths, and choose the things that please me, and hold fast my covenant:","LALPA chun hieng ang hin a tih, “Ka châwlnihai inser a, ka lâwm zâwng thilhai thlang a, ka thuthlung pawm tlattu mitillâkhai chungchâng thua chun,"
"Unto them will I give in my house and within my walls a memorial and a name better than of sons and of daughters; I will give them an everlasting name, that shall not be cut off.","an kuomah ka in sûnga le ka kul sûnghaia chun naupasalhai le naunu- hmeihai neituhai nêk chun hriet zingna ṭha lem le hming ṭha lem pêng ka tih; an kuomah kumkhaw hming, sukbohmang nâwk ta naw ding pêng ka tih."
"Also the foreigners that join themselves to Jehovah, to minister unto him, and to love the name of Jehovah, to be his servants, every one that keepeth the sabbath from profaning it, and holdeth fast my covenant;","Ram dang mi khawm, châwlni bawse loa, inser hlakhai le, ka thuthlung pawm tlat taphawt chu, LALPA rawng bâwl ding le, LALPA hming hmangai ding le, a siehlawa- hai um dinga LALPA zâwm taphawt- hai;"
"even them will I bring to my holy mountain, and make them joyful in my house of prayer: their burnt-offerings and their sacrifices shall be accepted upon mine altar; for my house shall be called a house of prayer for all peoples.","anni ngei chu ka tlâng inthienga chun ṭhuoi ka ta, ka ṭawngṭâina inah sukhlim ka tih; pumrawhmanga an thilinhlânhai le an inthâwinahai chu ka mâichâma chun lâwmin um a tih; ka in chu mi tinrêng ta dingin ṭawngṭaina in an ti ding a ni sih a,” tiin."
"The Lord Jehovah, who gathereth the outcasts of Israel, saith, Yet will I gather others to him, besides his own that are gathered.","LALPA Pathien, Israelhai hnawt suoka umhai ṭhuoi khâwmtu chun, “Ama ta ṭhuoi khâwma umhai naw khawm hnam danghai a kuomah la ṭhuoi khâwm ka tih,” a ta."
"All ye beasts of the field, come to devour, yea, all ye beasts in the forest.","Ram sa po pohai, anih, ram- hnuoia sa um po pohai, fa dingin hung ro."
"His watchmen are blind, they are all without knowledge; they are all dumb dogs, they cannot bark; dreaming, lying down, loving to slumber.","A râl vêngtuhai chu an mit ân del a, hrietna nei naw ruok an na; ui râwl nei lo ruok an na, an inngak thei nawh; mang nei a, zâl zing a, imu hêmi an nih."
"Yea, the dogs are greedy, they can never have enough; and these are shepherds that cannot understand: they have all turned to their own way, each one to his gain, from every quarter.","Anih, uihai chu duâmtak an na, huntâwk ti hrim an nei ngai nawh; chuong chu berâm vêngtu thil hre theilohai an na, mâni lampui pei, mâni hlâwkna tieng seng, an ngha vawng tâwl, an rêng elin."
"Come ye, say they, I will fetch wine, and we will fill ourselves with strong drink; and to-morrow shall be as this day, a day great beyond measure.","“Hung ro khai, uoin lâng ka ta, chuongchun, zuin ei inthun sip ding annâwm; zînga chun vawisûn ang hi ni nâwk a ta, ni ropui nasa deu el nîng a tih,” an ti seng a."
"The righteous perisheth, and no man layeth it to heart; and merciful men are taken away, none considering that the righteous is taken away from the evil to come.","Mi fel chu an bohmang hlak a, tukhawma an lungrilin an ngaituo ngai nawh a, Pathien ngaisak mihai khawm lâk hmangin an um hlak a; mi fel chu thil ṭha lo hung tlung dinga inthawka lâk hmang an ni hlak ti tukhawma an ngaituo bawk nawh a."
"He entereth into peace; they rest in their beds, each one that walketh in his uprightness.","Lungmuongnaa chun an lût hlak a; an khumahai chun an zâl sâwldam hlak, indiktaka fe taphawthai chu."
"But draw near hither, ye sons of the sorceress, the seed of the adulterer and the harlot.","Nisienlakhawm, nangni dawi- thiemnu naupasal, uire le nawchi- zawr thlahai, hitaka hin hung hnai ro."
"Against whom do ye sport yourselves? against whom make ye a wide mouth, and put out the tongue? are ye not children of transgression, a seed of falsehood,","Tu am nuiza siemna dingin in hmang hlak a? Tu am in hner in phen khum a, in lei in thlâk khum hlak a? Bawsietna nau, khêlinhlipna thlahai ni lo am in nih?"
"ye that inflame yourselves among the oaks, under every green tree; that slay the children in the valleys, under the clefts of the rocks?","Nangni thingsaisuo laia, thing buk hnuoi tina insukthafâna, ruom sûnghaia lung kak bula dâm naupang thattuhai."
"Among the smooth stones of the valley is thy portion; they, they are thy lot; even to them hast thou poured a drink-offering, thou hast offered an oblation. Shall I be appeased for these things?","Vadung ruom lung innâm lai chun i chanvo a um a; chuong, chuonghai ngei chu; i chanpuol chu a nih, chuonghai ta ding ngei chun thil inhlân dâwn mi i buok a, thilpêk khawm în hlân kha. Chuong thila chun suklungawiin ka um ding am a nih?"
Upon a high and lofty mountain hast thou set thy bed; thither also wentest thou up to offer sacrifice.,"Tlâng insâng inzotak chunga chun i khum chu i sieh a, chutaka bawk chun inthâwina inhlân dingin i fe hlak."
"And behind the doors and the posts hast thou set up thy memorial: for thou hast uncovered thyself to another than me, and art gone up; thou hast enlarged thy bed, and made thee a covenant with them: thou lovedst their bed where thou sawest it.","Kawtkhârhai le kawtkhâr bieng phênahai chun i hriet zingnahai chu în tung a, keia kuomah ni loin, mi dang kuomah în hlîp a, i hang fe sih a; i khum i zau a, an kuomah thu i thlung a; an khum chu i hmûnaa chun i hmangai a, an saruokna chu i en a."
"And thou wentest to the king with oil, and didst increase thy perfumes, and didst send thine ambassadors far off, and didst debase thyself even unto Sheol.","Chun, hriek leh lal kuomah i feh a, i riminhnikhai chu i thaw nasa zuol a, i palaihai chu hlatakah i tir a, Seol tlung rakin în sukhnuoi kha."
"Thou wast wearied with the length of thy way; yet saidst thou not, It is in vain: thou didst find a quickening of thy strength; therefore thou wast not faint.","I fena lampui hlat leiin i sâwl a, nisienlakhawm, “Beiseina hrim hrim a um nawh,” i ti si nawh a; i hrâtna sukharna i hmuh a; chuleiin, i châu ta naw kha."
"And of whom hast thou been afraid and in fear, that thou liest, and hast not remembered me, nor laid it to thy heart? have not I held my peace even of long time, and thou fearest me not?","Tu am i ṭih a, în lau a, khêl i hril hlak a, kei i mi hriet ta nawh a, i lungrila i ngaituo ta naw hi? Sâwttak ka to zing an nâwm a nih? Ṭi khawm i mi ṭi naw hi."
"I will declare thy righteousness; and as for thy works, they shall not profit thee.","I felna thu hi hril ka ta, i thil- thawhai chu i ta dingin ienga ṭha- hnem ni naw nih."
"When thou criest, let them that thou hast gathered deliver thee; but the wind shall take them, a breath shall carry them all away: but he that taketh refuge in me shall possess the land, and shall inherit my holy mountain.","I khêk pha chun i lâk khâwmhai chun sanhim raw se che; nisien- lakhawm, anni rawi chu thliin lâng a ta, thuokin lên hmang vawng a tih; kei mi ringtu ruok chun ram hi nei a ta, ka tlâng inthieng hi hluong a tih."
"And he will say, Cast ye up, cast ye up, prepare the way, take up the stumbling-block out of the way of my people.","Chun, ama chun, “Sung pâwng ro, sung pâwng ro, lampui buotsai ro, ka mihai lampuia an tlûkna ding chu pei ro,” tîng a tih."
"For thus saith the high and lofty One that inhabiteth eternity, whose name is Holy: I dwell in the high and holy place, with him also that is of a contrite and humble spirit, to revive the spirit of the humble, and to revive the heart of the contrite.","Mi chunghnung, chawisâng, chatuona um, a hming inthieng chun hieng ang hin a ti sih a; “Kei hmun chunghnung le inthiengah ka um a, mi thuhnuoirawlhai lungril sukhar ding le insîr ngawi ngawihai lungril sukhar dingin mi lungrila insîr ngawi ngawia thuhnuoirawltak kuoma khawm ka um a nih."
"For I will not contend for ever, neither will I be always wroth; for the spirit would faint before me, and the souls that I have made.","Kumkhuoin ka do âwm si nawh a, lunginsen rawp bawk naw ning ah; chuong naw chun, mi lungril ka hmaah châu a ta, hringna ka siemhai khawm chu châu bawk an tih."
"For the iniquity of his covetousness was I wroth, and smote him; I hid my face and was wroth; and he went on backsliding in the way of his heart.","A duâm khawhlona leiin ka lunginsen a, ka vuok a, ka hmai ka hip a, ka lung a sen a nih; ama hlak chu a lungril um dân pângngaihaiah kâwmâwtakin a um pei a."
"I have seen his ways, and will heal him: I will lead him also, and restore comforts unto him and to his mourners.","A um dânhai chu ka hmuh a, ama chu sukdam ka tih; ṭhuoi bawk ka ta, ama le a sûnpuituhai kuomah lungmuongnahai pe nâwk ka tih."
"I create the fruit of the lips: Peace, peace, to him that is far off and to him that is near, saith Jehovah; and I will heal him.","Kei chun hmûrhai ra ka siem hlak a, ‘Inremna, inremna, hlataka um kuoma le hnaitaka um kuoma chun um raw se,’ LALPAIN a tih, ama chu sukdam ka tih."
"But the wicked are like the troubled sea; for it cannot rest, and its waters cast up mire and dirt.","Mi rilohai ruok chu tuisuoriet fâwn fâwn hlakhai ang chu an na; an um ṭawk ṭawk thei si nawh a, a tuihai chun hmunhnawk le chirhak a vawr suok hlak,” tiin."
"There is no peace, saith my God, to the wicked.","Ka Pathien chun, “Mi rilohai ta ding chun lungmuongna hrim hrim a um nawh,” a tih."
