en,hmr
"and he gave him authority to execute judgment, because he is a son of man.","chun, Mihriem Naupa a ni leiin a kuomah rorêl ding thu a pêk."
"Marvel not at this: for the hour cometh, in which all that are in the tombs shall hear his voice,","Hieng hi mak ti naw ro, a hun a tlung ding a ni tah, chu pha chun thlâna um po poin a râwl hrieng an ta,"
"and shall come forth; they that have done good, unto the resurrection of life; and they that have done evil, unto the resurrection of judgment.","suok vawng an tih; thil ṭha thawtuhai chu hringna changin tho nâwk an ta, thil suol thawtuhai chu inthiemnawna changin tho nâwk an tih."
"I can of myself do nothing: as I hear, I judge: and my judgment is righteous; because I seek not mine own will, but the will of him that sent me.","“Keia khâtin iengkhawm ka thaw thei nawh; naa ka hriet ang peiin ro ka rêl hlak; ka rorêl chu indiktak a nih, keia thu thuin um ka tum nawh a, a mi tirtu thu thua um ka tum lem hlak leiin."
"If I bear witness of myself, my witness is not true.","Mâni chanchin inhriettir lang, ka thu inhriettir indik naw ni."
It is another that beareth witness of me; and I know that the witness which he witnesseth of me is true.,Ka chanchin inhriettirtu chu mi dang a nih; ama chun ka chanchin ân hriettir chu ân dik ti ka hriet.
"Ye have sent unto John, and he hath borne witness unto the truth.","“Nangnîn Johan kuomah mi in tir a, ama chun, thutak chanchin a lo inhriettir kha;"
"But the witness which I receive is not from man: howbeit I say these things, that ye may be saved.","Thu inhriettir ka ipawm ruok chu mihriem thu a ni nawh, nisien- lakhawm, in damna dingin hieng thu hi ka hril a ni hi."
He was the lamp that burneth and shineth; and ye were willing to rejoice for a season in his light.,"Chu Johan chu khâwnvar chawktak le var tak a nih, a varah lân sukhlim in nuom kha."
"But the witness which I have is greater than that of John; for the works which the Father hath given me to accomplish, the very works that I do, bear witness of me, that the Father hath sent me.","“Nisienlakhawm, inhriettirna ka nei hi Johan inhriettirna nêk khan a ropui lem a nih; Pain thil thaw zo dinga a mi pêk, ka thilthaw ngei hin Pain a mi tir a ni ti ka chanchin ân hriettir a nih."
"And the Father that sent me, he hath borne witness of me. Ye have neither heard his voice at any time, nor seen his form.","Pa a mi tirtu khawm chun ka chanchin ân hriettir tah. Nangnîn iengtik khawm a râwl in hriet ngai nawh, a hmêl khawm in hmu ngai nawh."
"And ye have not his word abiding in you: for whom he sent, him ye believe not.",A thu khawm in lungrilah in pai zing ngai nawh; a itir hi in ring naw leiin.
"Ye search the scriptures, because ye think that in them ye have eternal life; and these are they which bear witness of me;","Pathien Lekha in tiem ngun hlak a, a sûnga chatuona hringna um dinga in ring leiin; chuong Lekha chu ka chanchin inhriettirna chu a ni sih a."
"and ye will not come to me, that ye may have life.","Nisienlakhawm, hringna nei dingin ka kuomah in hung nuom si nawh."
I receive not glory from men.,“Mihriem ichawimawina ka pawm nawh.
"But I know you, that ye have not the love of God in yourselves.","Nangni ka hriet cheu, Pathien hmangaina in lungrilah in nei nawh ie."
"I am come in my Father’s name, and ye receive me not: if another shall come in his own name, him ye will receive.","Ka Pa hmingin ka hung a, nangnîn in mi lâwm si nawh; mi dang mâni hmingin hung sienla, ama chu lâwm in tih."
"How can ye believe, who receive glory one of another, and the glory that cometh from the only God ye seek not?","“Nangni inchawimawituo lâwm- hai, iengtin am ring thei in ta? Pathien tak chaua suok chawi- mawina chu in zawng si nawh."
"Think not that I will accuse you to the Father: there is one that accuseth you, even Moses, on whom ye have set your hope.","Keiin Pa kuoma ka hêk cheu ring naw ro, nangni hêktu cheu chu pakhat a um, in iring Mosie hi."
"For if ye believed Moses, ye would believe me; for he wrote of me.","Mosie in ring chun, kei khawm mi ring ta ding in nih; ama chun keia chanchin in sawnnaw a ziek."
"But if ye believe not his writings, how shall ye believe my words?","Nisienlakhawm, a thu ziek chu in ring si naw chun, iengtin am ka thu ring in ta?” a ta."
"After these things Jesus went away to the other side of the sea of Galilee, which is the sea of Tiberias.","Chuong thil hnunga chun Isu chu Galili dîl, Tiberi dîl an ti râlkhing tieng chun a fe tah a."
"And a great multitude followed him, because they beheld the signs which he did on them that were sick.","Chun, damnaw chunga thilmak a thawhai chu an hmu leiin mipui tamtakin ama an zui a."
"And Jesus went up into the mountain, and there he sat with his disciples.","Chun, Isu chu tlânga chun a hang feh a, chutaka chun a închûktirhai lai a ṭhung a."
"Now the passover, the feast of the Jews, was at hand.",Fekân Ruoiṭhe (Judahai Ruoiṭhe chu) a hnai tah a.
"Jesus therefore lifting up his eyes, and seeing that a great multitude cometh unto him, saith unto Philip, Whence are we to buy bread, that these may eat?","Chun, Isu a dâk a, mipui tamtakin a kuom tieng hung panin a hmuh a, Philip kuomah, “Hienghai fâk ding bei khâwlai am inchâwng ei ta?” a ta."
And this he said to prove him: for he himself knew what he would do.,Chuong thu chu ama infiena dingin a hril a nih; a thaw ding chu amân a hriet zing sih a.
"Philip answered him, Two hundred shillings’ worth of bread is not sufficient for them, that every one may take a little.","Philip chun a kuomah, “Mi tinin tlâwmtêa an chang seng ding khawm bei duli za hni manin dai naw ni,” a ta, a dawn a."
"One of his disciples, Andrew, Simon Peter’s brother, saith unto him,","Chun, a închûktirhai laia mi pakhat Simon Peter unau Andri chun a kuomah,"
"There is a lad here, who hath five barley loaves, and two fishes: but what are these among so many?","“Buṭei beiphêk panga le nga pahni nei pasaltê pakhat hitaka hin a um; nisienlakhawm, mi hieng zozai lai hin chu chu ieng khawp am nîng a ta?” a ta."
"Jesus said, Make the people sit down. Now there was much grass in the place. So the men sat down, in number about five thousand.","Chun, Isûn “Mihai chu inṭhung- tir ro,” a ta. Chu hmuna chun hlobet tamtak a um a. Chuongchun, patlinghai chu an ṭhung a; an tamzie chu sâng nga lai an nih."
"Jesus therefore took the loaves; and having given thanks, he distributed to them that were set down; likewise also of the fishes as much as they would.","Chun, Isûn beiphêkhai chu a lâk a, lâwmthu a hril zoin a ṭhunghai lai chun a sem a, chuong ang bawkin ngahai khawm chu an dit tâwkin a sem bawk a."
"And when they were filled, he saith unto his disciples, Gather up the broken pieces which remain over, that nothing be lost.","Chun, an khawp hnungin, a inchûktirhai kuoma chun, “Ieng khawm inhmang lo dingin a mahla nawihai kha rût ro,” a ta."
"So they gathered them up, and filled twelve baskets with broken pieces from the five barley loaves, which remained over unto them that had eaten.","Chuongchun, an rût a, buṭei bei- phêk panga fatuhai fâk mahla chun bâwm sâwm le pahni an suksip a."
"When therefore the people saw the sign which he did, they said, This is of a truth the prophet that cometh into the world.","Chun, mihai chun thilmak a thaw chu an hmu phingleh, “Hi mipa hi zâwlnei, khawvêla hung ding kha a ni ngei hi,” an ta."
"Jesus therefore perceiving that they were about to come and take him by force, to make him king, withdrew again into the mountain himself alone.","Chuongchun, ama chu lala siem dinga man el tumin an hung ding a nih ti Isûn a hriet a, tlângah ama khât chauin a tumin a fe nâwk tah a."
"And when evening came, his disciples went down unto the sea;","Chun, khuo a hung inhnu chun, a închûktirhai chu dîla chun an zu feh a."
"and they entered into a boat, and were going over the sea unto Capernaum. And it was now dark, and Jesus had not yet come to them.","Lawngah an chuong a, dîla chun Kapernaum an pan a. Khuo a hung inthim tah a, Isu hlak chu an kuom a la tlung si nawh."
And the sea was rising by reason of a great wind that blew.,Thlipui nasatak a hrâng leiin tui chu a fâwn insâng deu deu a.
"When therefore they had rowed about five and twenty or thirty furlongs, they behold Jesus walking on the sea, and drawing nigh unto the boat: and they were afraid.","Chun, fîng sâwmhni panga amanih, fîng sâwmthum amanih an kar chun, Isu chu dîl chunga chun kea lâwna, lawng hung hnaiin an hmuh a, an ṭih a."
"But he saith unto them, It is I; be not afraid.","Nisienlakhawm, ama chun an kuomah, “Kei ka nih annâwm, ṭi naw ro,” a ta."
They were willing therefore to receive him into the boat: and straightway the boat was at the land whither they were going.,"Chuongchun, lawnga chun inchuongtir an nuom tah a; chun, kârloin lawng chun an pan khawmuol chu a tlung nghâl tah a."
"On the morrow the multitude that stood on the other side of the sea saw that there was no other boat there, save one, and that Jesus entered not with his disciples into the boat, but that his disciples went away alone","A zînga chun dîl râl khing tienga mipui ngîrhai chun, lawng pakhat naw chu lawng dang a um nawh a, Isu chu a închûktirhai lai lawnga chun a chuong ve nawh a, a închûktirhai anni khât chauin an fe ti an hriet a."
(howbeit there came boats from Tiberias nigh unto the place where they ate the bread after the Lord had given thanks):,"(Nisienlakhawm, Lalpain lâwm- thu a hril hnunga, bei an fâkna hmun kâwla khan Tiberi khuoa in- thawkin lawng chînhai a hung tlung sih a)."
"when the multitude therefore saw that Jesus was not there, neither his disciples, they themselves got into the boats, and came to Capernaum, seeking Jesus.","Chuongchun, mipui chun Isu le a închûktirhai chu an um ta nawh ti an hrietin, anni khawm lawng chîn- haia chun an chuong a, Isu zawngin Kapernaum an hung tlung a."
"And when they found him on the other side of the sea, they said unto him, Rabbi, when camest thou hither?","Chun, dîl râla an hung hmu chun a kuomah, “Rabbi, iengtik am hi tieng i lo tlung a?” an tih a."
"Jesus answered them and said, Verily, verily, I say unto you, Ye seek me, not because ye saw signs, but because ye ate of the loaves, and were filled.","Isûn an kuomah, “Titakzetin, titakzetin ka hril cheu hi, thilmakhai in hmu leia mi zawng in ni nawh a, bei in fâk khawp leia mi zawng in ni lem hi."
"Work not for the food which perisheth, but for the food which abideth unto eternal life, which the Son of man shall give unto you: for him the Father, even God, hath sealed.","Bu bohmang nâwk el hlak zawng hin inlap rak rak naw ro, chatuona hringna chena um zing ding bu, Mihriem Naupain a pêk ding cheu chu zawng lem ro; Pa Pathien chun ama chu ân chik ta sih a,” a ta, a dawn a"
"They said therefore unto him, What must we do, that we may work the works of God?","Chun, anni chun a kuomah, “Pathien sin kan thaw theina dingin ieng am thâwng kan ta?” an ta."
"Jesus answered and said unto them, This is the work of God, that ye believe on him whom he hath sent.","Isu chun an kuomah, “Pathien sin thaw chu hi hi a nih, a mi tir hi ring unla,” a ta, a dawn a."
"They said therefore unto him, What then doest thou for a sign, that we may see, and believe thee? what workest thou?","Anni chun a kuomah, “Inchikna ieng am thâwng i ta, kan hmua kan ring theina ding chein? Thil ieng am thâwng i ta?"
"Our fathers ate the manna in the wilderness; as it is written, He gave them bread out of heaven to eat.","Kan thlatuhaiin thlalêrah man- na kha an fâk hlak, ‘Vâna inthawk chun an kuomah bei fâk ding a pêk,’ ti ziek ang khan,” an ta."
"Jesus therefore said unto them, Verily, verily, I say unto you, It was not Moses that gave you the bread out of heaven; but my Father giveth you the true bread out of heaven.","Chun, Isûn an kuomah, “titakzetin ka hril cheu hi, vâna inthawka bei in hmu kha Mosie pêk cheu a ni nawh, ka Pa ruok chun vâna inthawkin bei tak tak a pêk cheu a ni hi."
"For the bread of God is that which cometh down out of heaven, and giveth life unto the world.","Pathien bei chu vâna inthawka hung ṭuma, khawvêl kuoma hringna petu hi a nih,” a ta."
"They said therefore unto him, Lord, evermore give us this bread.","Chun, anni chun a kuomah, “Lalpa, chu bei chu kumkhuoin mi pe rawh,” an ta."
"Jesus said unto them, I am the bread of life: he that cometh to me shall not hunger, and he that believeth on me shall never thirst.","Chun, Isûn an kuomah, “Kei hi hringna bei chu ka nih, tûkhawm ka kuoma hung chu phîngṭâm naw ni, tûkhawm a mi ring chu iengtika khawm dangchâr naw ni."
"But I said unto you, that ye have seen me, and yet believe not.","Nisienlakhawm, nangnîn in mi hmu khawma in mi ring si nawh ti ka hril cheu kha."
All that which the Father giveth me shall come unto me; and him that cometh to me I will in no wise cast out.,Pain a mi pêkhai po po ka kuomah hung vawng an tih; tûkhawm ka kuoma hung chu hnawt suok naw tawp ka tih.
"For I am come down from heaven, not to do mine own will, but the will of him that sent me.","Mâni nuom zâwng thaw dinga vâna inthawka hung ka ni nawh a, a mi tirtu dit zâwng thaw dinga hung ṭum ka ni lem."
"And this is the will of him that sent me, that of all that which he hath given me I should lose nothing, but should raise it up at the last day.","Hi hi a mi tirtu dit zâwng chu a nih, amân a mi pêk po po iengkhawm inhmang naw lang, ni kin nia chun keitho lem lang."
"For this is the will of my Father, that every one that beholdeth the Son, and believeth on him, should have eternal life; and I will raise him up at the last day.","Chun, hi hi ka Pa dit zâwng a nih, tûkhawm Nau hmua ring taphawt chun chatuona hringna nei sienla; chun, keiin ni kin nia chun ama chu kei tho lang,” a ta."
"The Jews therefore murmured concerning him, because he said, I am the bread which came down out of heaven.","Chun, “Vâna inthawka bei hung ṭum chu ka nih,” a ti leiin, Judahai chu a chungah an chier a."
"And they said, Is not this Jesus, the son of Joseph, whose father and mother we know? how doth he now say, I am come down out of heaven?","“Hi mipa hi Josef nau Isu a ni naw am a nih? A nu le Pa khawm ei hriet hi. ‘Vâna inthawka hung ṭum ka nih,’ iengti tia ti am a ni leh?” an ta."
"Jesus answered and said unto them, Murmur not among yourselves.","Chun, Isûn an kuomah, “Chier chier naw ro."
"No man can come to me, except the Father that sent me draw him: and I will raise him up in the last day.","Pa a mi tirtuin a hîp naw chun tukhawm ka kuomah hung thei naw ni hai; chun, keiin ni kin nia chun a hung chu keitho ka tih."
"It is written in the prophets, And they shall all be taught of God. Every one that hath heard from the Father, and hath learned, cometh unto me.","Zâwlneihai Lekhabuah, ‘Pa- thien inchûktirin um vawng an tih,’ ti ziek a nih. Mi tin Pa thu hrea inchûk taphawt chu ka kuomah an hung hlak."
"Not that any man hath seen the Father, save he that is from God, he hath seen the Father.","Tukhawmin Pa an hmu hlak ka ti nawh, Pathien kuoma inthawka hung suok chau naw hin chu; ama chun Pa chu a hmuh."
"Verily, verily, I say unto you, He that believeth hath eternal life.","Titakzetin, titakzetin ka hril cheu hi, tûkhawm a ring chun chatuona hringna a nei tah a nih."
I am the bread of life.,Kei hi hringna bei chu ka nih.
"Your fathers ate the manna in the wilderness, and they died.","“In thlatuhaiin thlalêrah man- na kha an fâk a, an thi tho a."
"This is the bread which cometh down out of heaven, that a man may eat thereof, and not die.","Hi hi vâna inthawka bei hung ṭum chu a nih, mîn a fâka a thi nawna dingin."
"I am the living bread which came down out of heaven: if any man eat of this bread, he shall live for ever: yea and the bread which I will give is my flesh, for the life of the world.","Kei hi vâna inthawka bei hring hung ṭum chu ka nih, tûkhawmin hi bei hi a fâk chun chatuonin hring zing a tih, anih, khawvêl hringna dinga ka ipêk ding bei chu, ka taksa hi a nih,” a ta."
"The Jews therefore strove one with another, saying, How can this man give us his flesh to eat?","Chuongchun, Judahai an insêl a, “Hi mipa hin iengtin am a taksa fâk dingin mi pe thei a ta?” an ta."
"Jesus therefore said unto them, Verily, verily, I say unto you, Except ye eat the flesh of the Son of man and drink his blood, ye have not life in yourselves.","Chun, Isûn an kuomah, “Titakzetin, titakzetin ka hril cheu hi, Mihriem Naupa taksa in fâka, a thisen in dâwn bawk naw chun, nangni khâtin hringna nei nghâl lo cheu."
He that eateth my flesh and drinketh my blood hath eternal life; and I will raise him up at the last day.,"Tûkhawm, ka taksa faa, ka thisen dâwn chun, chatuona hringna a nei tah, chun, ni kin nia chun ama chu keitho ka tih."
"For my flesh is meat indeed, and my blood is drink indeed.","Ka taksa hi bu tak a na, ka thisen hi dâwn ding tak a ni sih a."
"He that eateth my flesh and drinketh my blood abideth in me, and I in him.","Tûkhawm ka taksa faa, ka thisen dâwn chu, keimaah a um zing hlak, kei khawm amaah ka um zing hlak."
"As the living Father sent me, and I live because of the Father; so he that eateth me, he also shall live because of me.","Pa hring chun a mi tir a, Pa zâra hring ka ni ang bawkin, tûkhawm a mi fa chu keia zârin hring vêng a tih."
"This is the bread which came down out of heaven: not as the fathers ate, and died; he that eateth this bread shall live for ever.","Hi hi vâna inthawka bei hung ṭum chu a nih, chi thlatuhaiin bei an fâk ang kha a ni nawh, anni chun an fâka, an thi tah a; tûkhawm hi bei hi fa chu chatuonin hring zing a tih,” a ta."
"These things said he in the synagogue, as he taught in Capernaum.","Chuong thu chu inkhâwmna inah a hril a, Kapernauma ân chûktir lai khan."
"Many therefore of his disciples, when they heard this, said, This is a hard saying; who can hear it?","Chuongchun, a închûktirhai tamtakin chuongchu an hrietin, “Hi hi thu khir tak a nih, tuin am ngai phâk an ta?” an ta."
"But Jesus knowing in himself that his disciples murmured at this, said unto them, Doth this cause you to stumble?","Chuongchun, chu thua chun a închûktirhai an chier ti Isûn a lungrilin a hriet a, an kuomah, “Hi thu hin a suklungninaw cheu am a nih?"
What then if ye should behold the Son of man ascending where he was before?,Mihriem Naupa hi inhmaa a umna ngaia hang lâwna in hmu chun ieng am lâwng in ta?
"It is the spirit that giveth life; the flesh profiteth nothing: the words that I have spoken unto you are spirit, and are life.","Sukhringtu chu thlarau a nih, tisa chu ienga ṭhangkai a ni nawh; in kuoma thu ka hrilhai hi thlarau a nih, hringna khawm a nih."
"But there are some of you that believe not. For Jesus knew from the beginning who they were that believed not, and who it was that should betray him.","Nisienlakhawm, nangni laia a ṭhen ring naw in um,” a ta. Isûn a ring nawtu le ama inmantirtu ding chu a tîra inthawkin a hriet zing sih a."
"And he said, For this cause have I said unto you, that no man can come unto me, except it be given unto him of the Father.","Chun, ama bawkin, “Chu lei chun a nih in kuomah, ‘Pain a ṭhang- pui naw chun, tukhawm ka kuomah hung thei naw ni hai,’ ka ti kha,” a ta."
"Upon this many of his disciples went back, and walked no more with him.","Chu phingle chun a închûk- tirhai tamtak an fe hmang a, ama an pâwl nâwk ta nawh a."
"Jesus said therefore unto the twelve, Would ye also go away?","Chuongchun, Isûn sâwm le pa- hnihai kuoma chun, “Nangni khawm fe hmang in nuom ve am?” a ta."
"Simon Peter answered him, Lord, to whom shall we go? thou hast the words of eternal life.","Simon Peterin a kuomah, “Lal- pa, tu kuom am fêng kan ta? Nangin chatuona hringna thu i nei annâwm;"
And we have believed and know that thou art the Holy One of God.,"Nang Pathien mi inthieng chu i nih ti kan awi tah a, hriet khawm kan hriet ie,” a ta, a dawn a."
"Jesus answered them, Did not I choose you the twelve, and one of you is a devil?","Chun, Isûn an kuomah, “Nangni sâwm le pahnihai hi keia thlang in ni naw am a nih? Nangni laia pakhat diebol a ni nâwk nghâl si,” a ta."
"Now he spake of Judas the son of Simon Iscariot, for he it was that should betray him, being one of the twelve.","(Simon Iskariot naupa Juda, sâwm le pahnihai laia ṭhang ve thu kha a hril a nih, ama chu ân mantirtu ding chu a ni sih a.)"
"And after these things Jesus walked in Galilee: for he would not walk in Judæa, because the Jews sought to kill him.","Chu zoa chun Isûn Galili ram a fang a, Judahaiin ama sukhlum an tum leiin Judai ram chu a fang nuom nawh a."
"Now the feast of the Jews, the feast of tabernacles, was at hand.","Chun, Judahai Bâwktê Ruoiṭhe chu a hnai tah a."
"His brethren therefore said unto him, Depart hence, and go into Judæa, that thy disciples also may behold thy works which thou doest.","Chuongchun, a unauhaiin a kuomah, “Hitaka inthawkin Judai ramah va fe rawh, i închûktirhai khawmin i thilthaw hi an hmu theina dingin."
"For no man doeth anything in secret, and himself seeketh to be known openly. If thou doest these things, manifest thyself to the world.","Tûkhawmin mâni hming inthang nuom siin arûkin thil iengkhawm an thaw nawh. Hieng thilhai hi i thaw tak zet chun, khawvêl kâwlah inentir rawh,” an ta."
For even his brethren did not believe on him.,(A unauhai khawm chun ama an ring si nawh a).
"Jesus therefore saith unto them, My time is not yet come; but your time is always ready.","Chun, Isûn an kuomah, “Ka hun a la tlung nawh; nangni hun ruok chu a tlung zing a nih."
"The world cannot hate you; but me it hateth, because I testify of it, that its works are evil.","Khawvêlin nangni an theida thei naw cheu, kei ruok chu an mi theida hlak, an thilthawhai a suol ti ka hrilfie hlak leiin."
Go ye up unto the feast: I go not up unto this feast; because my time is not yet fulfilled.,"Nangni ruoiṭhenaah hang fe ro, kei chu hi ruoiṭhea hin la fe hri naw ning, ka hun a la tlung naw leiin,” a ta."
"And having said these things unto them, he abode still in Galilee.","Chun, chuong thu chu an kuomah a hril a, Galili ramah a la um zing a."
"But when his brethren were gone up unto the feast, then went he also up, not publicly, but as it were in secret.","Nisienlakhawm, a unauhai chu ruoiṭhenaa an hang fe hnung chun, ama khawm vântlâng ihriet loin, inrûkin a hang fe veh a."
"The Jews therefore sought him at the feast, and said, Where is he?","Chun, Judahaiin ruoiṭhenaa chun ama chu an zawng a, “Khâwlai am a um a?” an tih a."
"And there was much murmuring among the multitudes concerning him: some said, He is a good man; others said, Not so, but he leadeth the multitude astray.","A chungah mipuihai laia mi an chier sup sup a, a ṭhenin, “Mi ṭha a nih ie,” an tih a; ṭhenkhatin, “Teu lo e, mipui a hlêm lem hlak a nih,” an ta."
Yet no man spake openly of him for fear of the Jews.,"Nisienlakhawm, Judahai an ṭi leiin tûkhawmin a chungchâng thu an hril lang nawh."
"But when it was now the midst of the feast Jesus went up into the temple, and taught.","Chun, ruoiṭhe ṭhat lai takin, Isu Pathien biekinah a hang feh a, ân chûktir a."
"The Jews therefore marvelled, saying, How knoweth this man letters, having never learned?","Chun, Judahaiin, “Hi mipa hin inchûk ngai loin iengtin am lekha a hriet a?” an ta, mak an ti hleh a."
"Jesus therefore answered them, and said, My teaching is not mine, but his that sent me.","Chun, Isûn anni chu a dawn a, “Ka thu inchûktir hi ka ta a ni nawh a, a mi tirtu ta a ni lem."
"If any man willeth to do his will, he shall know of the teaching, whether it is of God, or whether I speak from myself.","Tûkhawm ama dit zâwng thaw nuom chun, thu inchûktir hi Pathien suksuok am a ni, keia phuokfâwma ka hril, hrieng a tih."
"He that speaketh from himself seeketh his own glory: but he that seeketh the glory of him that sent him, the same is true, and no unrighteousness is in him.","Tûkhawm mâni phuokfâwm thu hril chu mâni mawina zawng a nih; a tirtu mawina zawng ruok chu, ama chu mi tak zet a nih, amaa chun indik nawna hrim a um nawh."
"Did not Moses give you the law, and yet none of you doeth the law? Why seek ye to kill me?","Mosiein Dân chu a pêk naw cheu am a nih? Nisienlakhawm, nangni lai tukhawmin Dân chu in hraw si nawh. Nangnîn iengdinga mi sukhlum in tum am?” a ta."
"The multitude answered, Thou hast a demon: who seeketh to kill thee?","Chun, mipui chun, “Khawhri zâwl i ni hi, tuin am sukhlum a tum che leh?” an ta, an dawn a."
"Jesus answered and said unto them, I did one work, and ye all marvel because thereof.","Isu chun a dawn a, an kuomah, “Thil pakhat ka thaw kha nangni po poin mak in ti kha."
"Moses hath given you circumcision (not that it is of Moses, but of the fathers); and on the sabbath ye circumcise a man.","Mosiein sertan thu kha a pêk cheu a, chu chu Mosie suksuok ni loin, thlâtuhai suksuok a ni lem. Chu lei chun a nih Châwlni khawma mi ser in tan hlak chu."
"If a man receiveth circumcision on the sabbath, that the law of Moses may not be broken; are ye wroth with me, because I made a man every whit whole on the sabbath?","Mosie Dân bawsiet nawna dingin Châwlnia khawm pasalin ser ân tantir si chun, keiin Châwlnia mi ka sukdam hieu leiin ka chungah in lunginsen bîk maw?"
"Judge not according to appearance, but judge righteous judgment.","ân lang angin ngaituo naw unla, feltakin ngaituo lem ro,” a ta."
