en,hmr
"In the beginning was the Word, and the Word was with God, and the Word was God.","A tîrin thu a um, Thu chu Pathien kuomah a um, Thu chu Pathien a nih."
The same was in the beginning with God.,Chu chu a tîrin Pathien kuomah a um.
All things were made through him; and without him was not anything made that hath been made.,Iengkim a rêngin ama siem a nih; thil siem po po hi ama siem naw iengkhawm a um nawh.
In him was life; and the life was the light of men.,Amaa chun hringna a um; chu hringna chu mihriemhai var a nih.
And the light shineth in the darkness; and the darkness apprehended it not.,"Var chu inthim lai a hung var a, inthimin chu chu a hriet nawh."
"There came a man, sent from God, whose name was John.","Pathien tir mi pakhat a lo um a, a hming chu Johan a nih."
"The same came for witness, that he might bear witness of the light, that all might believe through him.","Ama chu inhriettir dingin a hung a, var thu chu inhriettir dingin; ama leia mi po poin an awina dingin."
"He was not the light, but came that he might bear witness of the light.","Ama chu var chu a ni nawh, var thu chu inhriettir dinga hung a ni lem."
"There was the true light, even the light which lighteth every man, coming into the world.","Var indik tak mi tin sukvar hlak kha a um a, khawvêlah a hung zing a nih."
"He was in the world, and the world was made through him, and the world knew him not.","Ama chu khawvêlah a um a, khawvêl ama siem a na, khawvêlin ama a hriet si nawh."
"He came unto his own, and they that were his own received him not.","Ama mihai kuomah a hung a, ama mihaiin an lo lâwm si nawh."
"But as many as received him, to them gave he the right to become children of God, even to them that believe on his name:","Nisienlakhawm, ama lâwm taphawt chu, an kuomah Pathien nauhai ni theina ding a pêk, a hming ringtuhai chu."
"who were born, not of blood, nor of the will of the flesh, nor of the will of man, but of God.","Chuong mihai chu thisena nei an ni nawh a, tisa dit zâwnga nei an ni bawk nawh a, pasal dit zâwnga nei khawm an ni nawh a, Pathien inei an ni lem."
"And the Word became flesh, and dwelt among us (and we beheld his glory, glory as of the only begotten from the Father), full of grace and truth.","Chun, Thu chu tisain a hung inchang a, eini lai a hung um tah a, (Pa nau khât nei ropui angin a ropuizie ei hmuh), lunginsietna le thutakin a sip."
"John beareth witness of him, and crieth, saying, This was he of whom I said, He that cometh after me is become before me: for he was before me.","Johan chun a thu ân hriettir a, a khêk a, “ ‘Ka hnunga hung ding chu ka nêka ropui lem a nih, ka um hmaa um ta hrim a ni leiin,’ tia a thu ka hril kha ama hi a nih,” a ta."
"For of his fulness we all received, and grace for grace.","A famkimna ei chang seng, lunginsietna chunga lunginsiet nâwksâwnna leh."
For the law was given through Moses; grace and truth came through Jesus Christ.,"Dân chu Mosie hmanga pêk a na, lunginsietna le thutak chu Isu Krista leiin a hung um."
"No man hath seen God at any time; the only begotten Son, who is in the bosom of the Father, he hath declared him.","Tukhawmin ienglai khawmin Pathien an hmu nawh; a Naupa khât nei sun, Pa ângsûnga um ngei khan a chanchin a hril tah a nih."
"And this is the witness of John, when the Jews sent unto him from Jerusalem priests and Levites to ask him, Who art thou?","Chun, Judahaiin, “Tû am i na?” tia indawn dingin Jerusalema inthawkin a kuomah thiempuhai le Levi chia mihai an tir lai khan, hieng hi Johan thu lo inhriettir chu a nih:"
"And he confessed, and denied not; and he confessed, I am not the Christ.",“Kei chu Krista chu ka ni nawh” tiin inphat loin ân phuong a.
"And they asked him, What then? Art thou Elijah? And he saith, I am not. Art thou the prophet? And he answered, No.","Chun, anni chun a kuomah, “Tû am i ni leh? Elija i ni?” an ta, an indawn a. Ama chun, “Ka ni nawh,” a ta. “Zâwlnei kha i ni?” an ta, ama chun, “Ni lo e,” a ta, a dawn a."
"They said therefore unto him, Who art thou? that we may give an answer to them that sent us. What sayest thou of thyself?","Chun, anni chun a kuomah, “Anleh, tû am i na? a mi tirtuhai kan dawn theina dingin mi hril ta la. I chanchin hrim ieng am i hril ding a na?” an ta."
"He said, I am the voice of one crying in the wilderness, Make straight the way of the Lord, as said Isaiah the prophet.","Ama chun, “ ‘Lalpa lampui suk- ruol ro,’ tia thlalêra khêktu râwl chu ka nih; zâwlnei Isai hril ang khan,” a ta."
And they had been sent from the Pharisees.,Mi tirhai chu Pharisaihai kuoma mi an nih.
"And they asked him, and said unto him, Why then baptizest thou, if thou art not the Christ, neither Elijah, neither the prophet?","Anni chun a kuomah, “Krista bêk, Elija bêk, zâwlnei amani bêk i ni si naw chun, iengdinga i baptis hlak am a na?” an ta, an indawn a."
"John answered them, saying, I baptize in water: in the midst of you standeth one whom ye know not,","Chun, Johan chun an kuomah, “Keiin tuiin ka baptis hlak, nangni lai in hriet naw mi pakhat a ngîr a nih,"
"even he that cometh after me, the latchet of whose shoe I am not worthy to unloose.","ama chu ka hnunga hung ding chu a na, a kekawk hrui sût tlâk khawm ka ni nawh,” a ta, a dawn a."
"These things were done in Bethany beyond the Jordan, where John was baptizing.",Chuong thil chu Jordan râla Bethania Johanin a baptisnaa kha thaw an nih.
"On the morrow he seeth Jesus coming unto him, and saith, Behold, the Lamb of God, that taketh away the sin of the world!","Chun, a zînga chun Johanin Isu a kuoma hung ding a hmuh a. Chun, a hril a, “En ta u, Pathien Berâmte khawvêl suol fepuitu ding saw!"
"This is he of whom I said, After me cometh a man who is become before me: for he was before me.","Saw saw a nih, ‘mi pakhat ka nêka ropui lem, ka hnunga hung ding a um, ama chu ka um hmaa um ta hrim a nih,’ ka ti kha."
"And I knew him not; but that he should be made manifest to Israel, for this cause came I baptizing in water.","Ama chu ka lo hriet si nawh; nisienlakhawm, Israelhai kuoma a hung inlangna dingin, tuia baptis-in ka hung a nih,” a ta."
"And John bare witness, saying, I have beheld the Spirit descending as a dove out of heaven; and it abode upon him.","Chun, Johanin a thu ân hriettir a, a hril a, “Thlarau chu vaṭhu angin vâna inthawka ṭum ka hmuh a, a chungah a fu zing a."
"And I knew him not: but he that sent me to baptize in water, he said unto me, Upon whomsoever thou shalt see the Spirit descending, and abiding upon him, the same is he that baptizeth in the Holy Spirit.","Ama chu ka hriet si nawh a, nisienlakhawm, tuia baptis dinga a mi tirtu khan ka kuomah, ‘Tû chunga khawm Thlarau zu fua, a chunga um zing i hmu chun, ama chu Thlarau Inthienga baptistu ding chu nîng a tih,’ a tih a."
"And I have seen, and have borne witness that this is the Son of God.","Chu chu ka hmu tah a, ama hi Pathien Naupa a nih ti kân hriettir tah,” a ta."
"Again on the morrow John was standing, and two of his disciples;","Chun, a zîng nâwk chun Johan a ngîr a, a închûktirhai pahni leh;"
"and he looked upon Jesus as he walked, and saith, Behold, the Lamb of God!","chun, Isu invâk vêl lai chu an en a, “En ta u, Pathien Berâmte saw,” a ta."
"And the two disciples heard him speak, and they followed Jesus.","Chun, a închûktirhai pahni chun a thu hril chu an hriet a, Isu an zui tah a."
"And Jesus turned, and beheld them following, and saith unto them, What seek ye? And they said unto him, Rabbi (which is to say, being interpreted, Teacher), where abidest thou?","Chun, Isu a nghah a, an hung zui chu a hmuh a, an kuomah, “Ieng am in zawng a?” a ta. Anni chun, “Rabbi, (chu chu inchûktirtu tina a nih), khâwlai am i um a?” an ta."
"He saith unto them, Come, and ye shall see. They came therefore and saw where he abode; and they abode with him that day: it was about the tenth hour.","Ama chun an kuomah, “Hung unla, hmûng in tih,” a ta. Chuong- chun, an feh a, a umna chu an hmuh a, chu ni chun a kuomah an um zing a; zânbu suong pha vêl a nih."
"One of the two that heard John speak, and followed him, was Andrew, Simon Peter’s brother.","Johan thu hril hrea Isu zuihai pahni chu, a pakhat lem chu Andri, Simon Peter unau a nih."
"He findeth first his own brother Simon, and saith unto him, We have found the Messiah (which is, being interpreted, Christ).","Ama chun a hmasatakin ama unau Simon a hmuh a, a kuomah “Messie kan hmu tah,” a ta, (chu chu Krista tina a nih.)"
"He brought him unto Jesus. Jesus looked upon him, and said, Thou art Simon the son of John: thou shalt be called Cephas (which is by interpretation, Peter).","Chuongchun, Isu kuomah a hung ṭhuoi a, Isûn ama chu a lo en a, “Johan naupa Simon i nih, Kipha tîng an ti che,” a ta, (chu chu Peter tina a nih.)"
"On the morrow he was minded to go forth into Galilee, and he findeth Philip: and Jesus saith unto him, Follow me.","Chun, a zînga chun Isu Galili ramah fe a tum a, Philip a hmuh a, “Mi zui rawh,” a ta."
"Now Philip was from Bethsaida, of the city of Andrew and Peter.","Philip chu Bethsaida khuoa mi a nih, chu chu Andri le Peter umna khuo bawk a nih."
"Philip findeth Nathanael, and saith unto him, We have found him, of whom Moses in the law, and the prophets, wrote, Jesus of Nazareth, the son of Joseph.","Philip chun Nathanael a hmuh a, a kuomah, “A chanchin Mosiein Dân lekhabua a ziek le, zâwlneihaiin an ziek kha, ama chu kan hmu tah, Nazareth Isu, Josef naupa chu,” a ta."
"And Nathanael said unto him, Can any good thing come out of Nazareth? Philip saith unto him, Come and see.","Chun, Nathanael chun a kuomah, “Nazareth khuoah thil ṭha a suok thei am a nih?” a ta. Philip chun a kuomah, “Hung la, en rawh,” a ta."
"Jesus saw Nathanael coming to him, and saith of him, Behold, an Israelite indeed, in whom is no guile!","Isûn Nathanael a kuoma hung ding chu a hmuh a, a chanchin a lo hril a, “En ta u, Israel mi tak, rîtlona hrim hrim nei lo saw,” a ta."
"Nathanael saith unto him, Whence knowest thou me? Jesus answered and said unto him, Before Philip called thee, when thou wast under the fig tree, I saw thee.","Nathanael chun a kuomah, “Nangin iengtin am i mi hriet a?” a ta. Isûn a kuomah, “Philipin a ko hma cheh a, theichang bula i um lai khan ka hmu che annâwm,” a ta, a dawn a."
"Nathanael answered him, Rabbi, thou art the Son of God; thou art King of Israel.","Nathanaelin a kuomah, “Rabbi, Pathien Naupa i nih, Israelhai Laltak i nih,” tiin a dawn a."
"Jesus answered and said unto him, Because I said unto thee, I saw thee underneath the fig tree, believest thou? thou shalt see greater things than these.","Isûn a kuomah, “ ‘Theichang bulah ka hmu che,’ i kuoma ka ti leiin i ring a ni maw? Hieng nêka thil ropui lem la hmûng i tih,” a ta, a dawn a."
"And he saith unto him, Verily, verily, I say unto you, Ye shall see the heaven opened, and the angels of God ascending and descending upon the Son of man.","Chun, Isu bawkin a kuomah, “Titakzetin, titakzetin ka hril cheu hi, vân inhawngah, Pathien vântir- kohai Mihriem Naupa chunga hin a lâwn le a ṭum la hmûng in tih,” a ta."
"Verily, verily, I say unto you, He that entereth not by the door into the fold of the sheep, but climbeth up some other way, the same is a thief and a robber.","“Titakzetin, titakzetin ka hril cheu hi, tûkhawm berâm huona kawtkhâra lût loa, a dang tienga lâwn lût chu ama chu iengkhat inruhmang le suomhmang a nih."
But he that entereth in by the door is the shepherd of the sheep.,"Tûkhawm kawtkhâra lût ruok chu, berâm vêngtu a nih."
"To him the porter openeth; and the sheep hear his voice: and he calleth his own sheep by name, and leadeth them out.","Kawtkhâr vêngtuin ama chu a lo hawng pêk hlak a; berâmhaiin a râwl an hriet hlak a; ama berâmhai chu an hmingin a ko seng a, a ṭhuoi suok hlak a."
"When he hath put forth all his own, he goeth before them, and the sheep follow him: for they know his voice.","A ta po po ân suoktir phingleh, an hma a ṭhuoi a, berâmhaiin ama an zu i hlak a, a râwl an hriet sih a."
"And a stranger will they not follow, but will flee from him: for they know not the voice of strangers.","Mi dang chu zui naw ni hai a, tlân hmang san lem an tih; mi danghai râwl chu an hriet naw leiin,” a ta."
This parable spake Jesus unto them: but they understood not what things they were which he spake unto them.,"Chu tekhithu chu Isûn an kuomah a hril a; nisienlakhawm, ieng thu am a na an kuomah a hril an hriet si nawh a."
"Jesus therefore said unto them again, Verily, verily, I say unto you, I am the door of the sheep.","Chuongchun, Isûn an kuomah a hril nâwk a, “Titakzetin, titakzetin ka hril cheu hi, kei hi berâm kawtkhâr chu ka nih,"
All that came before me are thieves and robbers: but the sheep did not hear them.,"ka hmaa hunghai po po kha inruhmanghai, suomhmanghai an ni vawng a; nisienlakhawm, berâmhai chun an thu an awi nawh."
"I am the door; by me if any man enter in, he shall be saved, and shall go in and go out, and shall find pasture.","Kei kawtkhâr chu ka nih; tûkhawm keimaah a lût chun, humhimin um a ta, lûtin suok a ta, fâk ding hmu bawk a tih."
"The thief cometh not, but that he may steal, and kill, and destroy: I came that they may have life, and may have it abundantly.","Inruhmang chu, inru ding le, sukhlum ding le sukse ding naw chun a hung nawh; kei chu hringna an neina dingin, tamtaka an neina dinga hung ka nih."
I am the good shepherd: the good shepherd layeth down his life for the sheep.,Kei bêram vêngtu ṭha chu ka nih; berâm vêngtu ṭha chun berâmhai ta dingin a hringna a pêk hlak.
"He that is a hireling, and not a shepherd, whose own the sheep are not, beholdeth the wolf coming, and leaveth the sheep, and fleeth, and the wolf snatcheth them, and scattereth them:","Inhlawfa, berâm vêngtu tak ni loa, berâmhai a ta ni lo chun satene hung a hmu chun berâmhai a tlânsan hlak; chun, satene chun berâmhai a seh a, a sukdar hlak;"
"he fleeth because he is a hireling, and careth not for the sheep.","inhlawfa a na, berâmhai a ngai- sak naw leiin a tlânsan hlak a nih."
"I am the good shepherd; and I know mine own, and mine own know me,","Kei chu berâm vêngtu ṭha ka nih; ka ta chu ka hriet a, ka ta khawmin an mi hriet a nih,"
"even as the Father knoweth me, and I know the Father; and I lay down my life for the sheep.","Pain a mi hriet a, kei khawmin Pa ka hriet ang hin; chun, berâmhai ta ding chun ka hringna ka pêk."
"And other sheep I have, which are not of this fold: them also I must bring, and they shall hear my voice; and they shall become one flock, one shepherd.","Chun, hi berâm huona mi naw khawm hi, berâm dang ka nei; anni khawm ka la hung ṭhuoi ding a nih, ka râwl khawm hrieng an tih, chuongchun, pâwl khatin um an ta, a vêngtu pakhat leh."
"Therefore doth the Father love me, because I lay down my life, that I may take it again.","“Hi lei hin Pain a mi hmangai a nih, lâk nâwk dinga ka hringna ka pêk ding leiin."
"No one taketh it away from me, but I lay it down of myself. I have power to lay it down, and I have power to take it again. This commandment received I from my Father.","Tûkhawmin mi lâkpêk naw ni hai, keima thu thuin ka pêk lem ding a nih; pe thei ka nih, la nâwk thei khawm ka nih. Hi thupêk hi ka Pa kuoma inthawka ka hmu a nih,” a ta."
There arose a division again among the Jews because of these words.,"Chuong thu lei chun Judahai an inṭheh a, an inkhing nâwk a."
"And many of them said, He hath a demon, and is mad; why hear ye him?","A ṭhen tamtakin, “Khawhri a zâwl a, ân vêt a ni hi; iengdinga a thu in ngai am a na?” an ta."
"Others said, These are not the sayings of one possessed with a demon. Can a demon open the eyes of the blind?","A ṭhenin, “Hieng thu hi khawhri zâwl thuhril a ni nawh ie. Khawhri chun mitdel mit a sukvar thei am a nih?” an ta."
And it was the feast of the dedication at Jerusalem:,"Chun, Jerusalema Inpumpêk Ruoiṭhe lai a na; chu chu thlasik lai a nih."
it was winter; and Jesus was walking in the temple in Solomon’s porch.,"Chun, Isu Pathien biekinah, Solomon tuolpûka chun ân lawn ân lawn a."
"The Jews therefore came round about him, and said unto him, How long dost thou hold us in suspense? If thou art the Christ, tell us plainly.","Chun, Judahai a kâwlah an hung a, a kuomah, “Ieng chen am lungâwpinkaiin i mi sie ding a na? Krista i ni chun feltakin mi hril rawh,” an ta."
"Jesus answered them, I told you, and ye believe not: the works that I do in my Father’s name, these bear witness of me.","Isûn an kuomah, “Ka hril ta cheu kha in awi si nawh; ka Pa hminga thil ka thaw hi, hieng hin ka chanchin ân hriettir a ni hi."
"But ye believe not, because ye are not of my sheep.","Nisienlakhawm, in awi si nawh, ka berâm laia mi in ni naw leiin."
"My sheep hear my voice, and I know them, and they follow me:","Ka berâmhaiin ka râwl an hriet hlak, kei khawmin anni chu ka hriet, anni chun an mi zui hlak."
"and I give unto them eternal life; and they shall never perish, and no one shall snatch them out of my hand.","An kuomah chatuona hringna ka pêk hlak; kumkhuoin bohmang naw ni hai a, tukhawmin ka kuta inthawkin mi lâkpêk bawk naw ni hai."
"My Father, who hath given them unto me, is greater than all; and no one is able to snatch them out of the Father’s hand.","Anni mi petu ka Pa chu mi po po nêka ropui a nih, tukhawmin Pa kuta inthawk chu lâkpêk thei naw ni hai."
I and the Father are one.,"Kei le Pa chu pumkhat kan nih,” tiin a dawn a."
The Jews took up stones again to stone him.,"Chun, Judahai chun a dêngna dingin lung an rût nâwk a."
"Jesus answered them, Many good works have I showed you from the Father; for which of those works do ye stone me?","Chun, Isûn anni chu a biek a, “Pa kuoma inthawka suok sinthaw ṭha tamtak kân entir cheu a, khâng sinthawhai laia ieng sinthaw lei khan am a ni lunga in mi dêng ding hi?” a ta."
"The Jews answered him, For a good work we stone thee not, but for blasphemy; and because that thou, being a man, makest thyself God.","Judahai chun a kuomah, “Sin ṭha chunga lunga dêng ding che kan ni nawh a; Pathien i hrilsietna chunga le, nang mihriem ni sih a, Pathiena în siem lei hin a ni lem a nih,” tiin an dawn a."
"Jesus answered them, Is it not written in your law, I said, Ye are gods?","Isûn an kuomah, “In Dân lekhabuah, ‘Pathienhai in nih ka tih,’ ti ziek a ni naw am a nih?"
"If he called them gods, unto whom the word of God came (and the scripture cannot be broken),","Pathien thu tlungnahai hman pathienhai an ti chun, (Pathien Lekha thu bân thei a ni si nawh a)"
"say ye of him, whom the Father sanctified and sent into the world, Thou blasphemest; because I said, I am the Son of God?","Pain a iruot, khawvêla a itir chunga hin, ‘Pathien Naupa ka nih,’ ka ti leiin, ‘Pathien i hrilsiet,’ in ti a ni maw?"
"If I do not the works of my Father, believe me not.",Ka pa sinthaw ka ni naw chun mi ring naw ro.
"But if I do them, though ye believe not me, believe the works: that ye may know and understand that the Father is in me, and I in the Father.","Amiruokchu, thaw ka ni chun, kei mi ring naw unla khawm, sin- thawhai bêk hi ring ro; Pa keimaah a um ti le, kei Paah ka um ti in hriet a, in ringna dingin,” a ta, a dawn a."
They sought again to take him: and he went forth out of their hand.,"Chuongchun, ama chu man an tum nâwk a, nisienlakhawm, an kuta inthawkin a suok a."
And he went away again beyond the Jordan into the place where John was at the first baptizing; and there he abode.,"Jordan vadung râlah, Johanin a tîra mi a baptisna hmun tieng khan a fe hmang nâwk tah a, chutaka chun a um ta zing a."
"And many came unto him; and they said, John indeed did no sign: but all things whatsoever John spake of this man were true.","Chun, mi tamtak a kuomah an hung a, “Johanin thilmak iengkhawm chu a thaw nawh a; nisienlakhawm, Johanin hi mipa chungchâng thu a hril taphawt kha chu ân dik hle hi,” an ta."
And many believed on him there.,"Chun, chutaka chun mi tam- takin ama an ring tah a."
"Now a certain man was sick, Lazarus of Bethany, of the village of Mary and her sister Martha.","Chun, mi pakhat, Mari le a zuorpuinu Martha umna khuo Bethania mi, Lazar damnaw a um a."
"And it was that Mary who anointed the Lord with ointment, and wiped his feet with her hair, whose brother Lazarus was sick.","(Mari, hriek rim inhnik Lal chu nâla, a sama a ke hrutu kha, kha minu ṭapa Lazar a nih dam naw chu.)"
"The sisters therefore sent unto him, saying, Lord, behold, he whom thou lovest is sick.","Chun, a farnuhaiin Isu kuomah, “Lalpa, ngai ta, i hmangai kha a damnaw ie,” tiin mi an tir a."
"But when Jesus heard it, he said, This sickness is not unto death, but for the glory of God, that the Son of God may be glorified thereby.","Isûn chu chu a hriet a, “Hi natna hi thina ding a ni nawh, Pathien ropuina ding a ni lem, Pathien Naupa chu hi lei hin a la mawina dingin,” a ta."
"Now Jesus loved Martha, and her sister, and Lazarus.","Chun, Isûn Martha hai, a zuor- puinu hai, Lazar hai a hmangai a."
"When therefore he heard that he was sick, he abode at that time two days in the place where he was.","Chuleiin, a damnaw ti a hrietin a umna ngaiah ni hni a la um ta rawp a."
"Then after this he saith to the disciples, Let us go into Judæa again.","Chun, chu hnunga chun a închûktirhai kuomah, “Judai ramah fe nâwk ei tiu,” a ta."
"The disciples say unto him, Rabbi, the Jews were but now seeking to stone thee; and goest thou thither again?","Chun, inchûktirhai chun a kuomah, “Rabbi, kha hma el khan Judahaiin lunga dêng an tum che kha; chuong sa sa chun chutaka chun i la fe rawp ding am a nih?” an ta."
"Jesus answered, Are there not twelve hours in the day? If a man walk in the day, he stumbleth not, because he seeth the light of this world.","Isûn, “Sûnah dârkâr sâwm le pahni a um naw am a nih? Mi sûnah a lêng chun a pêm ngai nawh, hi khawvêl var hi a hmu leiin."
"But if a man walk in the night, he stumbleth, because the light is not in him.","Amiruokchu, mi zânah a lêng chun a pêm hlak, amaa chun var a um naw leiin,” a ta, a dawn a."
"These things spake he: and after this he saith unto them, Our friend Lazarus is fallen asleep; but I go, that I may awake him out of sleep.","Chuong thu chu a hril a; chun, chu hnunga chun an kuomah, “Ei ruolpa Lazar chu a ininnghil tah a; a ininnghil keihar dingin ka fe ding a nih,” a ta."
"The disciples therefore said unto him, Lord, if he is fallen asleep, he will recover.","Chuongchun, inchûktirhai chun a kuomah, “Lalpa a ininnghil a ni chun dam nâwk el a tih,” an ta."
Now Jesus had spoken of his death: but they thought that he spake of taking rest in sleep.,"(Isûn a thi thu a hril a nih; nisienlakhawm, anni chun a châwl sûnga a ininnghil thu a hril amanih an ta.)"
"Then Jesus therefore said unto them plainly, Lazarus is dead.","Chuongchun, Isûn fietakin an kuomah a hril a, “Lazar a thi a nih."
"And I am glad for your sakes that I was not there, to the intent ye may believe; nevertheless let us go unto him.","Chutaka ka um naw chu ka lâwm pêk cheu, in ring theina dingin; nisienlakhawm, a kuomah fêng ei tiu,” a ta."
"Thomas therefore, who is called Didymus, said unto his fellow-disciples, Let us also go, that we may die with him.","Chun, Thoma (Didum an ti bawk) chun, ân chûktir chanpuihai kuomah, “A thinaa thi ve dingin fe vêng ei tiu,” a ta."
"So when Jesus came, he found that he had been in the tomb four days already.","Chuongchun, Isûn a tlung chun, ni li thlânah a lo um tah ti a hriet a,"
"Now Bethany was nigh unto Jerusalem, about fifteen furlongs off;","Bethani chu Jerusalem kâwl a na, fing sâwmpanga laia hla a nih;"
"and many of the Jews had come to Martha and Mary, to console them concerning their brother.","chuongchun, an ṭapa thi chunga sukthlamuong dingin Judahai rawi tamtak Martha le Mari kuomah an hung a."
"Martha therefore, when she heard that Jesus was coming, went and met him: but Mary still sat in the house.",Martha chun Isu a hung ding a nih ti a hriet phingleh a va tuok a; Mari ruok chu inah a la ṭhung zing a.
"Martha therefore said unto Jesus, Lord, if thou hadst been here, my brother had not died.","Chun, Martha chun Isu kuomah, “Lalpa hitaka um ni la chu, ka ṭapa a thi naw ding bah."
"And even now I know that, whatsoever thou shalt ask of God, God will give thee.","Tukhawm hin Pathien kuoma i ngên taphawt chu Pathienin pêng a ti che ti ka hriet,” a ta."
"Jesus saith unto her, Thy brother shall rise again.","Isûn a kuomah, “I ṭapa tho nâwk a tih,” a ta."
"Martha saith unto him, I know that he shall rise again in the resurrection at the last day.","Martha chun a kuomah, “Ni kin nia, thonâwknaa chun thonâwk a tih ti ka hriet,” a ta."
"Jesus said unto her, I am the resurrection, and the life: he that believeth on me, though he die, yet shall he live;","Chun, Isûn a kuomah, “Kei hi thonâwkna le hringna chu ka nih; tûkhawm a mi ring chu thi sienla khawm hring zing a tih;"
and whosoever liveth and believeth on me shall never die. Believest thou this?,tukhawm a hring taphawt a mi ring chu kumkhuoin thi naw nih; chu thu chu i ring am?” a ta.
"She saith unto him, Yea, Lord: I have believed that thou art the Christ, the Son of God, even he that cometh into the world.","Ama chun a kuomah, “Ring e Lalpa, Krista, Pathien Naupa, khawvêla hung ding chu i ni ti ka ring ie,” a ta."
