en,hmr
"And when the sixth hour was come, there was darkness over the whole land until the ninth hour.","Chun, nisa inding huna chun, zânbu suong pha chenin khawvêl a hung inthim ta vawng a."
"And at the ninth hour Jesus cried with a loud voice, Eloi, Eloi, lama sabachthani? which is, being interpreted, My God, my God, why hast thou forsaken me?","Chun, zânbu suong phâ chun Isu chu râwl inringtakin, “Eloi, Eloi, lama sabakthani?” tiin a khêk suok a. (Chu chu “Ka Pathien, ka Pathien, iengdinga i mi mâksan?” tina a nih)."
"And some of them that stood by, when they heard it, said, Behold, he calleth Elijah.","Chun, a kuoma ngîr ṭhenkhat chun chu chu an hrietin, “Ngai ta u, Elija a ko a nih,” an ta."
"And one ran, and filling a sponge full of vinegar, put it on a reed, and gave him to drink, saying, Let be; let us see whether Elijah cometh to take him down.","Chun, mi pakhat a tlân a, sponj uoin thûra inchie sipin, hmawl lêrah a târ a, a hang indâwntir a. “Hun raw se, ama la thla dingin Elija a hung am en ei tiu,” an ta."
"And Jesus uttered a loud voice, and gave up the ghost.","Chun, Isu chu râwl inringtakin a khêk a, a thlarau ân thla tah a."
And the veil of the temple was rent in two from the top to the bottom.,"Chun, Pathien biekina puonzâr chu a chungtienga inthawkin a mawng tlung rakin a lo inthlêr suo tah a."
"And when the centurion, who stood by over against him, saw that he so gave up the ghost, he said, Truly this man was the Son of God.","Chun, a hmaa sipai za hotu ngîr chun, a thlarau chuonga ân thla a hmu chun, “Hi mipa hi Pathien Naupa a ni ngei el,” a ta."
"And there were also women beholding from afar: among whom were both Mary Magdalene, and Mary the mother of James the less and of Joses, and Salome;","Chun, nuhmeihai khawm hlataka thlîrin an um a; chuhai lai chun, Mari Magdalin hai, Mari, Jakob chîn le Jose nu hai dâm, le Salomi hai an ṭhang a, (chuonghai chu Galili rama a um laia ama zuia a rawng bâwlpêk hlak hai chu an nih);"
"who, when he was in Galilee, followed him, and ministered unto him; and many other women that came up with him unto Jerusalem.",nuhmei dang tamtak Jeru- salema ama ruola hang fe vehai chu an ṭhang bawk a.
"And when even was now come, because it was the Preparation, that is, the day before the sabbath,","Chun, zântieng a hung ni chun Inringlâwk ni a ni leiin (chu chu Châwlni hmaa ni hi a nih),"
"there came Joseph of Arimathæa, a councillor of honorable estate, who also himself was looking for the kingdom of God; and he boldly went in unto Pilate, and asked for the body of Jesus.","Josef Arimathaia mi, rorêltu inzaum, Pathien ram beisei ve mi bawk, a hung a, huoitakin Pilat kuomah a lût a, Isu ruong chu a hni tah a."
"And Pilate marvelled if he were already dead: and calling unto him the centurion, he asked him whether he had been any while dead.","Chuongchun, Pilatin a thi vak chu mak a ti hle a; sipai za hotu chu a ko a, a thina a sâwt ta amanih ti ân dawn a."
"And when he learned it of the centurion, he granted the corpse to Joseph.","Chun, sipai za hotu baua thu a hriet phing chun a ruong chu Josef kuomah a pêk a."
"And he bought a linen cloth, and taking him down, wound him in the linen cloth, and laid him in a tomb which had been hewn out of a rock; and he rolled a stone against the door of the tomb.","Chun, ama chun puon innêm ân châwk a, ama chu a lâk thlâk a, puon innêm chun a tuom a, thlân, lung inkerkuoah ân zâl a, thlân kawtkhâr chu lungin ân del a."
And Mary Magdalene and Mary the mother of Joses beheld where he was laid.,"Chun, Mari Magdalin le Josef nu Mari chun an inzâlna chu an hmu zing a."
"And when the sabbath was past, Mary Magdalene, and Mary the mother of James, and Salome, bought spices, that they might come and anoint him.","Chun, Châwlni a hung bo chun Mari Magdalin hai, Mari Jakob nu hai, Salomi hai chun ama nâl dinga an va fe theina ding chun thil riminhnik an inchâwk a."
"And very early on the first day of the week, they come to the tomb when the sun was risen.","Chuongchun, ni saria ni hma- sataka, zîngkâr nisa suok hnungin, thlân chu an va tlung a."
"And they were saying among themselves, Who shall roll us away the stone from the door of the tomb?","Chun, “Thlân kawta lung chu tuin am mîn hlum hmangpêk a ta?” an inti lai zingin,"
"and looking up, they see that the stone is rolled back: for it was exceeding great.","an hang nghah a, lung chu inhlum hmang sain an hang hmu tah a, a lien hle sih a."
"And entering into the tomb, they saw a young man sitting on the right side, arrayed in a white robe; and they were amazed.","Chun, thlân sûngah an lût a, tlangvâl pakhat puon vâr silin changtieng panga ṭhung an hmuh a; an lunginzîng tah a."
"And he saith unto them, Be not amazed: ye seek Jesus, the Nazarene, who hath been crucified: he is risen; he is not here: behold, the place where they laid him!","Chuongchun, ama chun an kuomah, “Lunginzing naw ro, Isu Nazareth mi, an hemde kha in zawng a ni âwm a, a thonâwk tah a, hi hin a um ta nawh; en ta u, an inzâlna hi."
"But go, tell his disciples and Peter, He goeth before you into Galilee: there shall ye see him, as he said unto you.","Nisienlakhawm, fe unla a închûktirhai le Peter kuoma chun, ‘Galili ramah in hmaa a fe ding a na; in kuoma a hril ang ngei khan chu chun hmûng in tih,’ tiin hril ro,” a ta."
"And they went out, and fled from the tomb; for trembling and astonishment had come upon them: and they said nothing to any one; for they were afraid.","Chuongchun, an inthin a, an lunginzîng hle lai chun, an suok a, thlâna inthawk chun an tlân ta vang vang a, an ṭi luotin tu kuoma khawm iengkhawm an hril nawh a."
"Now when he was risen early on the first day of the week, he appeared first to Mary Magdalene, from whom he had cast out seven demons.","[Chun, ni saria ni hmasatak, zîngkâra a thonâwk chun, Mari Magdalin, a sûnga inthawka khawhri pasari a hnawt suokpêk kuoma khan ân lâr hmasatak a."
"She went and told them that had been with him, as they mourned and wept.","Chun, ama chu Isu umpui hlakhai kuomah a va feh a, mithi ngaia an ṭaplai chu a hril tah a."
"And they, when they heard that he was alive, and had been seen of her, disbelieved.","Nisienlakhawm, anni chun, a hring nâwk a, hmu khawm a hmu ti chu an hriet dea chu an awi si nawh a."
"And after these things he was manifested in another form unto two of them, as they walked, on their way into the country.","Chun, chu hnunga chun anni laia pahni ram tieng pana an fe laiin hmêl danglam putin an kuomah ân lâr nâwk a."
And they went away and told it unto the rest: neither believed they them.,"Chun, anni chun inchûktir danghai kuomah an va hril a, anni thu khawm chu an awi chuong nawh a."
"And afterward he was manifested unto the eleven themselves as they sat at meat; and he upbraided them with their unbelief and hardness of heart, because they believed not them that had seen him after he was risen.","Chun, chu hnung nâwka chun buthlêng an awt laiin sâwm le pakhat hai kuom ngeiah ân lâr nâwk a, a thonâwk hnunga a hmutuhai thu chu an awi naw leiin an awi nawna le an lungril ngar kawnga chun a kâwk tâwl a."
"And he said unto them, Go ye into all the world, and preach the gospel to the whole creation.","Chun, an kuomah, “Khawvêl po poah fe unla, thilsiemhai po po kuomah Chanchin Ṭha hi hril ro."
He that believeth and is baptized shall be saved; but he that disbelieveth shall be condemned.,"Awia, baptisma chang chu sandamin um an tih; a awi naw ruok chu thiemnaw changin um an tih."
And these signs shall accompany them that believe: in my name shall they cast out demons; they shall speak with new tongues;,"Chun, hieng inchiknahai hin a awituhai chu zui pei a tih: Ka hmingin khawhrihai hnawt dawk an ta, ṭawng tharhaiin ṭawng an tih."
"they shall take up serpents, and if they drink any deadly thing, it shall in no wise hurt them; they shall lay hands on the sick, and they shall recover.","Rûlhai kut chungah dawm an ta, thina tûr iengang khawm dâwn hai sienla iengkhawm ti naw ni hai; damnawhai chungah an kut innghat an ta, dam pei an tih,” a ta."
"So then the Lord Jesus, after he had spoken unto them, was received up into heaven, and sat down at the right hand of God.","Chuongchun, Lal Isu chu an kuoma thu a hril zo chun vâna zuk ṭhuoiin a um tah a, Pathien changtieng a hang ṭhung tah a."
"And they went forth, and preached everywhere, the Lord working with them, and confirming the word by the signs that followed. Amen.","Chuongchun, anni chu an fe suok a, ram tinah thu an hril tah a; Lalpain anni ân thlawppui a, a zuitu inchiknahai chun an thu chu a sukdet pei a, Amen]."
"And when he entered again into Capernaum after some days, it was noised that he was in the house.","Chun, ni ieng zât amani hnunga Kapernaum a hung lût nâwkin, inah ama a um ti thu ân thang tah a."
"And many were gathered together, so that there was no longer room for them, no, not even about the door: and he spake the word unto them.","Chuongchun, kawt bula khawm umna um naw khawp rakin, mi tamtak an hung khâwm a; an kuoma chun thu a hril tah a."
"And they come, bringing unto him a man sick of the palsy, borne of four.","Chun, mi zeng pakhat, mi palia zâwn a kuomah an hung ṭhuoi a."
"And when they could not come nigh unto him for the crowd, they uncovered the roof where he was: and when they had broken it up, they let down the bed whereon the sick of the palsy lay.","Chun, mipui leia Isu kâwl hnai an tlung thei naw leiin, a umna in chung chu an ṭhiek tah a; chuonga an ṭhiek zo phing chun mi zeng chu a puonpha pum chun an zuk thlâk tah a."
"And Jesus seeing their faith saith unto the sick of the palsy, Son, thy sins are forgiven.","Chuongchun, Isûn an ringzie chu a lo hmuh a, mi zeng kuoma chun, “Naupa, i suolhai ngaidam a ni tah,” a ta."
"But there were certain of the scribes sitting there, and reasoning in their hearts,","Chun, Dân inchûktirtu ṭhenkhat chutaka chun an ṭhung a, an lungril chun hieng hin an ngaituoh a,"
"Why doth this man thus speak? he blasphemeth: who can forgive sins but one, even God?","“Hi mipa hin ieng dinga hieng thu hi hril am a ni leh? Pathien a hrilsiet a ni hi. Mi pakhat, Pathien chau naw chun tuin am suolhai a ngaidam thei a?” tiin."
"And straightway Jesus, perceiving in his spirit that they so reasoned within themselves, saith unto them, Why reason ye these things in your hearts?","Chun, chuong thu chu an ngaituo a ni ti Isûn a lungrilin a hriet nghâl tah a, an kuomah, “Chuong thu chu iengdinga in lungrila in ngaituo am a na?"
"Which is easier, to say to the sick of the palsy, Thy sins are forgiven; or to say, Arise, and take up thy bed, and walk?","Zeng kuoma chun, ‘I suol ngai- dam a ni tah,’ ti le, ‘I puonpha la la, kein fe ta rawh,’ ti hi a ieng am hril a awl lem a?"
"But that ye may know that the Son of man hath authority on earth to forgive sins (he saith to the sick of the palsy),","Iengkhawm ni sienla, khawvêla hin, Mihriem Naupan suol ngaidam theina a nei ti in hrietna dingin,” (Zeng kuoma chun)"
"I say unto thee, Arise, take up thy bed, and go unto thy house.","“Tho la, i puonpha la la, i inah fe ta rawh, ka ti che,” a ta."
"And he arose, and straightway took up the bed, and went forth before them all; insomuch that they were all amazed, and glorified God, saying, We never saw it on this fashion.","Chuongchun, ama chu a tho a, a puonpha chu a lâk a, an rênga mithmu ngei chun a suok tah a; chuongchun, an rêngin mak an ti hle a, “Hieng ang hrim hrim hi ei la hmu ngai nawh,” tîn Pathien an inpâk tah a."
"And he went forth again by the sea side; and all the multitude resorted unto him, and he taught them.","Chun, a suok nâwk a, dîl panga chun a fe tah a; chun mipui po po chu a kuomah an va feh a, a lo inchûktir tah a."
"And as he passed by, he saw Levi the son of Alphæus sitting at the place of toll, and he saith unto him, Follow me. And he arose and followed him.","Chun, a fe malamin, Levi, Alphai naupa chu siechawina hmuna ṭhung a hmuh a, a kuomah, “Mi hung zui rawh,” a ta. Ama chu a tho a, a zui tah a."
"And it came to pass, that he was sitting at meat in his house, and many publicans and sinners sat down with Jesus and his disciples: for there were many, and they followed him.","Chun, Isu chun Levi inah thlaithlêng a awt a; siedâwltuhai le mi suol tamtakin a închûktirhai chu an awtpui tâwl a, tamtak el an na, ama chu an zui ve bawk hlak."
"And the scribes of the Pharisees, when they saw that he was eating with the sinners and publicans, said unto his disciples, How is it that he eateth and drinketh with publicans and sinners?","Chun, Pharisaihai laia Dân inchûktirtuhaiin Isûn mi suol le siedâwltuhai a awtpui an hmuin, a închûktirhai kuoma chun, “Iengtiziea siedâwltuhai lai a fâkin a dâwn am a na?” an ta."
"And when Jesus heard it, he saith unto them, They that are whole have no need of a physician, but they that are sick: I came not to call the righteous, but sinners.","Chun, Isûn chu chu a lo hriet a, “Mi hrâthai chun dâktawr an ngai nawh a, mi hrivawisiehai lemin an ngai a nih; mi feltakhai indawn dinga hung ka ni nawh a, mi suolhai lem indawn dinga hung ka nih,” a ta."
"And John’s disciples and the Pharisees were fasting: and they come and say unto him, Why do John’s disciples and the disciples of the Pharisees fast, but thy disciples fast not?","Chun, Pharisai le Johan in- chûktirhai chun bu an nghei a; chun, “Ieng dinga Johan inchûktirhai le Pharisai inchûktir haiin bu an nghei hlak a, i închûktirhai hlakin an nghei ve ngai naw?” an ta."
"And Jesus said unto them, Can the sons of the bridechamber fast, while the bridegroom is with them? as long as they have the bridegroom with them, they cannot fast.","Isûn an kuomah, “Mo ṭhuoitu- hai kuoma a pasal ding chu a um sûng po chu mo ṭhuoituhai chun bu nghei thei naw ni hai,"
"But the days will come, when the bridegroom shall be taken away from them, and then will they fast in that day.","nisienlakhawm, a pasal ding chu an kuoma inthawka ṭhuoi hmang ni la hung tlung a ta, chu nia ruok chun la nghei an tih."
"No man seweth a piece of undressed cloth on an old garment: else that which should fill it up taketh from it, the new from the old, and a worse rent is made.","Tukhawmin puon hlui puon la rin mar lo hlekin an phâwk ngai nawh; phâwk ang sienla, a phâwkna chun keiek lem a tih, a thar chun a hlui chu keiek a ta, inek nasa det lem a tih."
"And no man putteth new wine into old wine-skins; else the wine will burst the skins, and the wine perisheth, and the skins: but they put new wine into fresh wine-skins.","Chun, tukhawmin uoin thar savun uoin peng hluiahai an thun ngai nawh; thun ang sienla, uoin chun savun peng chu mawrdar a ta, uoin le savun peng chu bo hmang ve vêng a tih, uoin thar chu savun uoin peng tharahai an thun lem hlak a nih,” a ta."
"And it came to pass, that he was going on the sabbath day through the grainfields; and his disciples began, as they went, to pluck the ears.","Chun, Isu chu châwlniin bu bilahai a fe thleng a, chuongchun, a închûktirhai chun an fe malamin buvûihai chu an thliek tah a."
"And the Pharisees said unto him, Behold, why do they on the sabbath day that which is not lawful?","Chun, Pharisaihai chun a kuomah, “En ta, iengdinga châwlnia thaw thieng naw chu an thaw am a na?” an ta."
"And he said unto them, Did ye never read what David did, when he had need, and was hungry, he, and they that were with him?","Chun, ama chun an kuomah, “David le a ruolhai an tlâksama, an phîng a ṭâm laia an thil thaw kha in tiem naw am a nih?"
"How he entered into the house of God when Abiathar was high priest, and ate the showbread, which it is not lawful to eat save for the priests, and gave also to them that were with him?","Khânga Abiathar Thiempu Laltak a ni laia Pathien inah a lût a, Thiempuhai chau naw chun fâk thieng lo bei chu a fâk a, a ruolhai khawm a pêk ve thu kha?” a ta."
"And he said unto them, The sabbath was made for man, and not man for the sabbath:","Chun, ama bâwkin an kuoma chun, “Châwlni hi mihriem ta dinga siem a na, mihriem hi Châwlni ta dinga siem a ni nawh;"
so that the Son of man is lord even of the sabbath.,"chuongchun, Mihriem Naupa hi Châwlni chunga chen khawm Lal a nih,” a ta."
And he entered again into the synagogue; and there was a man there who had his hand withered.,"Chun, inkhâwmna ina chun a lût nâwk a, chutaka chun mi pakhat kutzeng hi a lo um a."
"And they watched him, whether he would heal him on the sabbath day; that they might accuse him.","Chun, ama an hêk theina dingin Châwlnin a sukdam ding le sukdam naw ding an enthlit a."
"And he saith unto the man that had his hand withered, Stand forth.","Ama chun kutzeng kuoma chun, “Hung ngîr dawk rawh,” a ta."
"And he saith unto them, Is it lawful on the sabbath day to do good, or to do harm? to save a life, or to kill? But they held their peace.","Chun, an kuoma chun, “Châwlni hin sukṭhat am a thieng, suksiet? sandam am a thieng sukhlum?” tiin ân dawn a. Nisienlakhawm, an to zing a."
"And when he had looked round about on them with anger, being grieved at the hardening of their heart, he saith unto the man, Stretch forth thy hand. And he stretched it forth; and his hand was restored.","Chun, an lungril ngar zie chu pawitipêk bêk bêkin, lungsen puma anni a en vêl hnungin, chu mipa kuoma chun, “I kut phar rawh,” a ta. Chun, a hang phar dawk a, a kut chu a dam tah a."
"And the Pharisees went out, and straightway with the Herodians took counsel against him, how they might destroy him.","Chun, Pharisaihai chu an suok a, ama an sukhlum theinazie ding ngaituoin Herod pâwla mihai le chun an inrâwn nghâl tah a."
"And Jesus with his disciples withdrew to the sea: and a great multitude from Galilee followed; and from Judæa,","Chun, Isu chu a inchûktirhai le chun dîl tieng an fe hmang tah a, chuongchun, Galili rama inthawkin mipui nasatakin an zui tah a."
"and from Jerusalem, and from Idumæa, and beyond the Jordan, and about Tyre and Sidon, a great multitude, hearing what great things he did, came unto him.","Chun, a thil thaw ropuizie chu an hrietin, Judai rama inthawk dâmin, Jerusalema inthawk dâmin, Idumai rama inthawk dâmin, Tura le Sidon khuo vêla inthawk dâmin mipui nasatak a kuomah an hung veh a."
"And he spake to his disciples, that a little boat should wait on him because of the crowd, lest they should throng him:","Chun, mipui lei chun a ta dinga lawnglêng pakhat lo siemrêlpêk dingin a închûktirhai a hril a. “Chuong naw chun mi hneng hut hut rawi an tih,” a ta."
for he had healed many; insomuch that as many as had plagues pressed upon him that they might touch him.,"Mi tamtak a sukdam nghâl tah a; chuongchun, natna nei po po chun ama an them theina dingin an bûm tul tul a."
"And the unclean spirits, whensoever they beheld him, fell down before him, and cried, saying, Thou art the Son of God.","Khawhri inthieng nawhai khawmin ama an hmu po leh a hmaa bawkkhupin, “Nang Pathien Naupa chu i nih,” tiin an khêk hlak a."
And he charged them much that they should not make him known.,"Chun, ama chun a chanchin chu phuong lo dingin an kuomah a ti tlat pei a."
"And he goeth up into the mountain, and calleth unto him whom he himself would; and they went unto him.","Chun, tlânga chun a hang feh a, amain a dit pohai chu a ko a, chuongchun, anni chu a kuomah an hang feh a."
"And he appointed twelve, that they might be with him, and that he might send them forth to preach,","Chun, sâwm le pahni a ruot a, a kuoma an um theina dingin le thu hril dinga a tir dawk theina ding le,"
and to have authority to cast out demons:,khawhrihai hnawt dawkna thu nei dinga a tir dawk theina dingin.
and Simon he surnamed Peter;,"Chuonghai chu, Simon, Peter a înbûk hai;"
"and James the son of Zebedee, and John the brother of James; and them he surnamed Boanerges, which is, Sons of thunder:","Zebedai naupa Jakob le Jakob unaupa Johan hai dâm, (chuonghai chu “Boanerges” ân bûk a, chu chu “Vâninrûm Nauhai,” tina a nih.)"
"and Andrew, and Philip, and Bartholomew, and Matthew, and Thomas, and James the son of Alphæus, and Thaddæus, and Simon the Cananæan,","Andri hai, Philip hai, Bartholomai hai, Matthai hai, Thoma hai, Alphai naupa Jakob hai, Thaddai hai, Kanaana Simon hai;"
"and Judas Iscariot, who also betrayed him. And he cometh into a house.",a înmantirtu Juda Iskariot hai dâm kha an nih.
"And the multitude cometh together again, so that they could not so much as eat bread.","Chun, inah a va lût a. Chun, mipui chu an hung khâwm nâwk a, chuongchun, bei takngiel khawm an fâk thei ta nawh a."
"And when his friends heard it, they went out to lay hold on him: for they said, He is beside himself.","Chun, a sûnghai chun chu chu an hriet a, “ân vêt a ni chu tie,” tiin, ama man tumin an inthawk a."
"And the scribes that came down from Jerusalem said, He hath Beelzebub, and, By the prince of the demons casteth he out the demons.","Chun, Dân Inchûktirtuhai Jeru- salema inthawka hung thlahai chun, “Beelzebub a zâwl a ni hi,” an tih a. “Khawhri lal lei annâwm khawhrihai a hnawt dawk hlak hi,” an ti bawk a."
"And he called them unto him, and said unto them in parables, How can Satan cast out Satan?","Chun, Isu chun Dân inchûk- tirtuhai chu a ko a, tekhithuin an kuomah, “Setanin Setan bawk ieng- tin am hnawt dawk thei a ta?"
"And if a kingdom be divided against itself, that kingdom cannot stand.","Ram khawm ama le ama ân do chun, chu ram chu ngîr suok thei naw ni."
"And if a house be divided against itself, that house will not be able to stand.","Sûng khat khawm anni le anni an indo chun, chuhai sûng chu ngîr suok thei naw ni hai."
"And if Satan hath risen up against himself, and is divided, he cannot stand, but hath an end.","Setan khawm ama le ama indo a, ân khing si chun, ngîr suok thei naw nih a, bohmang el lem a tih."
"But no one can enter into the house of the strong man, and spoil his goods, except he first bind the strong man; and then he will spoil his house.","Tukhawm mi hrât ina lûtin a sum chu a lâkpêk thei ngai nawh, mi hrât chu an phier hmasa zet naw chun; chu hnunga ruok chun a in chu inrampêk el an tih."
"Verily I say unto you, All their sins shall be forgiven unto the sons of men, and their blasphemies wherewith soever they shall blaspheme:","Titakzetin ka hril cheu hi, mihriem nauhai hi an suolna po poa le, Pathien hrilsietna kawng tinrênga an hrilsietnahaia khawm chun ngaidam nîng an tih;"
"but whosoever shall blaspheme against the Holy Spirit hath never forgiveness, but is guilty of an eternal sin:","tukhawm Thlarau Inthieng meu hrilsetu ruok chun ienglai khawmin ngaidamna hmu naw ni, kumkhaw- tluonga suolna kawnga chun inthiem loin um ta lem a tih,” a tih a."
"because they said, He hath an unclean spirit.","(“Khawhri inthieng naw a zâwl a nih,” an ti lei khan chu chu a hril a nih.)"
"And there come his mother and his brethren; and, standing without, they sent unto him, calling him.","Chun, a nu le a unauhai chu an hung a, tuolah an ngîr a, ama ko dingin mi an tir a."
"And a multitude was sitting about him; and they say unto him, Behold, thy mother and thy brethren without seek for thee.","Chun, a sîr vêl lai chun mipui an lo ṭhung tâwl a; chun, a kuoma chun, “Ngai ta, tuola sawn i nu le i unauhaiin an zawng che,” an ta."
"And he answereth them, and saith, Who is my mother and my brethren?","Chun, ama chun an kuomah, “Ka nu le ka unauhai chu tuhai am an na?” tiin an dawn a."
"And looking round on them that sat round about him, he saith, Behold, my mother and my brethren!","Chun, a kâwla ṭhunghai chu a hei en vêl a, “En ta u, ka nu le ka unauhai hi!"
"For whosoever shall do the will of God, the same is my brother, and sister, and mother.","Tukhawm Pathien dit zâwng thawtu phawt chu, chuonghai ngei chu ka unauhai, ka farnuhai, ka nuhai an nih annâwm,” a ta."
"And again he began to teach by the sea side. And there is gathered unto him a very great multitude, so that he entered into a boat, and sat in the sea; and all the multitude were by the sea on the land.","Chun, dîl panga chun ân chûktir nâwk tah a. Chun, mipui nasatak el a kuomah an hung inkhâwm a; chuongchun, dîla chun lawngah a chuong a, a ṭhung a; mipuihai po po chu dîl panga khawmuola chun an um a."
"And he taught them many things in parables, and said unto them in his teaching,","Chun, tekhithuin thu tamtak ân chûktir a, ân chûktirnaa chun,"
"Hearken: Behold, the sower went forth to sow:","“Ngai unla en ta u, bu chi thetu bu chi thein a feh a,"
"and it came to pass, as he sowed, some seed fell by the way side, and the birds came and devoured it.","chun, a the laiin a ṭhen lampui sîrah a tlah a, vatehaiin an hung tlân zo tah a."
"And other fell on the rocky ground, where it had not much earth; and straightway it sprang up, because it had no deepness of earth:","Chun, a ṭhen chu pielthlêng chung, hnuoi inphânna lai a tlah a, hnuoi a sa naw leiin a mâwng nghâl tah a,"
"and when the sun was risen, it was scorched; and because it had no root, it withered away.","nisienlakhawm, nisa a hung insâng pha em vuoiin a um a, zung a nei naw leiin a rawp ta el a."
"And other fell among the thorns, and the thorns grew up, and choked it, and it yielded no fruit.","Chun, a ṭhen chu hlohlingnei lai a tlah a, hlo chu a hung mâwng sâng a, a dîp hmang tah a, ra hrim hrim a ra ta nawh a."
