en,hmr
"The words of Nehemiah the son of Hacaliah. Now it came to pass in the month Chislev, in the twentieth year, as I was in Shushan the palace,","Hakalia naupa Nehemia thuhai chu: Hieng ang hi a hung na, kum sâwmhnina, Kisleu thlaa, Susa khawpuia ka um laiin,"
"that Hanani, one of my brethren, came, he and certain men out of Judah; and I asked them concerning the Jews that had escaped, that were left of the captivity, and concerning Jerusalem.","ka unaupa pakhat Hanani le Juda rama inthawka mi ṭhenkhat an hung a; chun, Judahai sala intâng suok tahai chanchin le Jerusalem chanchin kân dawn a."
"And they said unto me, The remnant that are left of the captivity there in the province are in great affliction and reproach: the wall of Jerusalem also is broken down, and the gates thereof are burned with fire.","Ka kuoma chun, “Sala intâng suok tah, chu rama dama la umhai chu chan setak le hrilsietin an um a; chun, Jerusalem kul chu a chim rem rum tah a, a kawtkhârhai khawm a kâng a,” an tih a."
"And it came to pass, when I heard these words, that I sat down and wept, and mourned certain days; and I fasted and prayed before the God of heaven,","Chuong thu chu ka hriet chun ka ṭhung chawt a, ka ṭap a; ni ieng zât amani chu lungngaiin ka um a; chun, bu ka nghei a, vân Pathien hmaa chun ka ṭawngṭai a;"
"and said, I beseech thee, O Jehovah, the God of heaven, the great and terrible God, that keepeth covenant and lovingkindness with them that love him and keep his commandments:","“Aw LALPA, vân Pathien, Pathien ropui le ṭium, nangma hma- ngaia i thupêk pawmtuhai chunga thuthlung hlena lunginsietna suk- langtu,"
"let thine ear now be attentive, and thine eyes open, that thou mayest hearken unto the prayer of thy servant, which I pray before thee at this time, day and night, for the children of Israel thy servants, while I confess the sins of the children of Israel, which we have sinned against thee. Yea, I and my father’s house have sinned:","Israel thlahai suolna, i chunga kan suolna thupha ka chawi sûng hin i na lo sit la; i mit lo meng la, i siehlaw ṭawngṭaina, i kuoma a sûn a zâna i siehlaw Israel thlahai ka ngênpêkna hi lo ngaithlapêk la; kei le ka pa sûnghai chu kan lo suol ta sih a."
"we have dealt very corruptly against thee, and have not kept the commandments, nor the statutes, nor the ordinances, which thou commandedst thy servant Moses.","I chungah ṭha lotakin thil kan lo thaw tah a, i siehlaw Mosie kuoma i pêk, thupêkhai, dânhai, rorêlhai chu kan lo zâwm ta si nawh a."
"Remember, I beseech thee, the word that thou commandedst thy servant Moses, saying, If ye trespass, I will scatter you abroad among the peoples:","I siehlaw Mosie kuoma, ‘In baw- siet chun hnam tin laia chun sukdar ka ti cheu a;"
"but if ye return unto me, and keep my commandments and do them, though your outcasts were in the uttermost part of the heavens, yet will I gather them from thence, and will bring them unto the place that I have chosen, to cause my name to dwell there.","amiruokchu, keia tieng in hung ngha nâwk a, ka thupêkhai in pawm a, in zâwm chun, nangni laia mi kâwlkawdawng chena hnawt suoka um khawm um hai sienla, chutaka inthawk khawm chun kei khâwm nâwk ka ti cheu a, ka hming ka înumtirna ding hmuna ka ruota chun ṭhuoi nâwk ka tih,’ tiha thu i pêk kha lunginsiettakin hre zing rawh."
"Now these are thy servants and thy people, whom thou hast redeemed by thy great power, and by thy strong hand.","Chun, hienghai hi i siehlawhai le i mihai, i thilthawtheina nasatak le i kut thahrâta în tlan suokhai an na."
"O Lord, I beseech thee, let now thine ear be attentive to the prayer of thy servant, and to the prayer of thy servants, who delight to fear thy name; and prosper, I pray thee, thy servant this day, and grant him mercy in the sight of this man. Now I was cupbearer to the king.","Aw LALPA, lunginsiettakin i siehlaw ṭawngṭaina le i hming ṭi lâwm zâwnga nei, i siehlawhai ṭawngṭainaa hin i na lo sit ta; chun, vawisûn hin i siehlaw hi mîn hlawtlingtir la, hi mi mithmua hin lunginsiettakin zângaina indawngtir rawh,” ka tih a. Kei chu lal no inhlântu ka ni sih a."
"Now those that sealed were: Nehemiah the governor, the son of Hacaliah, and Zedekiah,","Chuongchun, a mi namdet- puituhai chu Hakalia naupa, ram awptu Nehemia le Zedekia,"
"Seraiah, Azariah, Jeremiah,","Seraia, Azaria, Jeremia,"
"Pashhur, Amariah, Malchijah,","Pas-hur, Amaria, Malkija,"
"Hattush, Shebaniah, Malluch,","Hattus, Sebania, Malluk,"
"Harim, Meremoth, Obadiah,","Harim, Meremoth, Obadia,"
"Daniel, Ginnethon, Baruch,","Daniel, Ginnethon, Baruk,"
"Meshullam, Abijah, Mijamin,","Mesullam, Abija, Mijamin,"
"Maaziah, Bilgai, Shemaiah; these were the priests.","Maazia, Bilgai le Semaia hai: hienghai hi thiempuhai an nih."
"And the Levites: namely, Jeshua the son of Azaniah, Binnui of the sons of Henadad, Kadmiel;","Chun, Levi mihai chu: Azania naupa Jesua, Henadad naupahai laia mi Bennui, Kadmiel,"
"and their brethren, Shebaniah, Hodiah, Kelita, Pelaiah, Hanan,","chun, an unau Sebania, Hodia, Kelita, Pelaia, Hanan,"
"Mica, Rehob, Hashabiah,","Mika, Rehob, Hasabia,"
"Zaccur, Sherebiah, Shebaniah,","Zakkur, Serebia, Sebania,"
"Hodiah, Bani, Beninu.","Hodia, Bani le Beninu hai."
"The chiefs of the people: Parosh, Pahath-moab, Elam, Zattu, Bani,","Mipui hotuhai chu: Paros, Pahath-moab, Elam, Zattu, Bani,"
"Bunni, Azgad, Bebai,","Bunni, Azgad, Bebai,"
"Adonijah, Bigvai, Adin,","Adonija, Bigvai, Adin,"
"Ater, Hezekiah, Azzur,","Ater, Hezekia, Azzur,"
"Hodiah, Hashum, Bezai,","Hodia, Hasum, Bezai,"
"Hariph, Anathoth, Nobai,","Hariph, Anathoth, Nebai,"
"Magpiash, Meshullam, Hezir,","Magpias, Mesullam, Hezir,"
"Meshezabel, Zadok, Jaddua,","Mesezabel, Zadok, Jaddua,"
"Pelatiah, Hanan, Anaiah,","Pelatia, Hanan, Anaia,"
"Hoshea, Hananiah, Hasshub,","Hosea, Hanania, Hassub,"
"Hallohesh, Pilha, Shobek,","Hallohes, Pilha, Sobek,"
"Rehum, Hashabnah, Maaseiah,","Rehum, Hasabna, Maaseia,"
"and Ahiah, Hanan, Anan,","Ahia, Hanan, Anan,"
"Malluch, Harim, Baanah.","Malluk, Harim le Baana hai an nih."
"And the rest of the people, the priests, the Levites, the porters, the singers, the Nethinim, and all they that had separated themselves from the peoples of the lands unto the law of God, their wives, their sons, and their daughters, every one that had knowledge, and understanding;","Chun, mi dang, thiempuhai, Levi mihai, kawtkhâr vêngtuhai, hla- saktuhai, Nethinim mihai le Pathien Dân zâwm tuma chuong rama mihaia inthawka insiekienghai po po, an nuhmeihai, an naupasalhai, an nau- nuhmeihai, hrietna le hrietthiemna neihai taphawt chun,"
"they clave to their brethren, their nobles, and entered into a curse, and into an oath, to walk in God’s law, which was given by Moses the servant of God, and to observe and do all the commandments of Jehovah our Lord, and his ordinances and his statutes;","an unauhai, an mi lienhai chu an chel tlat a, ṭawngsephur dinga inkhâm rauin thu an tiem a; Pathien siehlaw Mosie pêk Pathien Dân zâwm dinga LALPA ei Lalpa thupêkhai po po le a rorêlnahai le a thuruothai chu zâwm ve vawng a;"
"and that we would not give our daughters unto the peoples of the land, nor take their daughters for our sons;","chu rama mihai chu kan nau- nuhmeihai inneitir lo a, kan naupa- salhai ta dinga an naunuhmeihai nei bawk lo a,"
"and if the peoples of the land bring wares or any grain on the sabbath day to sell, that we would not buy of them on the sabbath, or on a holy day; and that we would forego the seventh year, and the exaction of every debt.","chu rama mihaiin châwlniha thil zawr ding thuomhnaw amanih, fâk ding hrim hrim zawr amanih an hung lâk a, châwlnia manih, umni inser nia maniha inchawpêk lo a; kum sarinaa ram sielui a, leiba po po ṭhin lo dingin."
"Also we made ordinances for us, to charge ourselves yearly with the third part of a shekel for the service of the house of our God;","Chun, kan Pathien in tienga rawngbâwlna dinga shekel hmun thuma ṭhea hmun khat kum tina pêk dingin dân kan ta dingin kan siem bawk a;"
"for the showbread, and for the continual meal-offering, and for the continual burnt-offering, for the sabbaths, for the new moons, for the set feasts, and for the holy things, and for the sin-offerings to make atonement for Israel, and for all the work of the house of our God.","bei inhlân ding le, beiphit thil inhlân ding le, pumrawhmang thilin- hlân rawp ding dâmin, châwlnia ding dâmin, thla thara ding dâmin, hunbi nei ruoiṭhea ding dâmin, thil in- thienga ding dâmin, Israel mihai ta dinga inremna siemna dinga suol inthâwinaa ding le, kan Pathien in tienga thaw ding po po thawna ding dâmin."
"And we cast lots, the priests, the Levites, and the people, for the wood-offering, to bring it into the house of our God, according to our fathers’ houses, at times appointed, year by year, to burn upon the altar of Jehovah our God, as it is written in the law;","Kan pi le puhai sûngkuo ang peia kum tina hunbi ruota Dân bu ziek anga, LALPA kan Pathien mâichâma raw ding thing inhlân kan Pathien ina inkhâwmtu ding hrietna dingin thiempuhai leh, Levi mihai leh, mipuihai leh ai kan sân a;"
"and to bring the first-fruits of our ground, and the first-fruits of all fruit of all manner of trees, year by year, unto the house of Jehovah;","chun, kum tina kan loa thlai thar hmasa tak le, thing chi tinrêng ra hmasa tak LALPA ina sie lût ding dâm,"
"also the first-born of our sons, and of our cattle, as it is written in the law, and the firstlings of our herds and of our flocks, to bring to the house of our God, unto the priests that minister in the house of our God;","Dâna ziek anga kan naupasal le kan ran pieng hmasa takhai, kan bâwng ruol le berâm ruol laia pieng hmasa takhai khawm kan Pathien ina rawngbâwltu thiempuhai kuoma kan Pathien ina ṭhuoi ding dâm;"
"and that we should bring the first-fruits of our dough, and our heave-offerings, and the fruit of all manner of trees, the new wine and the oil, unto the priests, to the chambers of the house of our God; and the tithes of our ground unto the Levites; for they, the Levites, take the tithes in all the cities of our tillage.","kan Pathien in pindana thiem- puhai kuoma kan bei hmet hmasa tak dâm, a thêna thêna kan thilinhlânhai dâm, thing chi tinrêng rahai dâm, uoin le hriek chawi ding dâm; kan loa mi sâwma pakhat Levi mihai pêk ding dâmin dân kan ta dingin kan siem bawk a, anni Levi mihai chun kan khuo laia lohma nei khuo ta- phawtah sâwma pakhat an lâk hlâk a nih."
"And the priest the son of Aaron shall be with the Levites, when the Levites take tithes: and the Levites shall bring up the tithe of the tithes unto the house of our God, to the chambers, into the treasure-house.","Chun, Levi mihaiin sâwma pakhat an lâk laiin Aron thla thiempu chu Levi mihai kuoma chun an um ding a nih; Levi mihai chun sâwma pakhat an ilâka sâwma pa- khat chu kan Pathien inah ro sie- khâwmna pindana chun an hung sie ding a nih."
"For the children of Israel and the children of Levi shall bring the heave-offering of the grain, of the new wine, and of the oil, unto the chambers, where are the vessels of the sanctuary, and the priests that minister, and the porters, and the singers: and we will not forsake the house of our God.","Israel thlahai le Levi thlahai chun bu le uoin le hriek a thêna thêna thilinhlân hmun inthieng bûr-le-bêl le rawngbâwltu thiempuhai, kawt- khâr vêngtuhai dâm, hlasaktuhai umna pindana chun an sie ding a nih; chuong ang chun a nih, kan Pathien in chu thlathlam lo dinga dân kan insiempêk chu."
"And the princes of the people dwelt in Jerusalem: the rest of the people also cast lots, to bring one of ten to dwell in Jerusalem the holy city, and nine parts in the other cities.","Mipuihai hotuhai chu Jeru- salema chun an um a; sâwm laia pakhat pei khawpui inthieng Jerusalema um ding le sâwm laia pakuo khaw danga um dinghai in- hrietna dingin, mi dang po chun ai an sân a."
And the people blessed all the men that willingly offered themselves to dwell in Jerusalem.,Lungnitaka Jerusalema um dinga inpehai po po chun mipuihai inpâk an hlawh a.
"Now these are the chiefs of the province that dwelt in Jerusalem: but in the cities of Judah dwelt every one in his possession in their cities, to wit, Israel, the priests, and the Levites, and the Nethinim, and the children of Solomon’s servants.","Hienghai hi chu rama Jerusa- lema hotu umhai chu an nih: ami- ruokchu, Juda rama khuoahai chun, an khuoa mâni chan ding sengah an um a; chuonghai chu Israel mihai, thiempuhai, Levi mihai, Nethinim mihai le Solomon siehlaw thlahai chu an nih."
"And in Jerusalem dwelt certain of the children of Judah, and of the children of Benjamin. Of the children of Judah: Athaiah the son of Uzziah, the son of Zechariah, the son of Amariah, the son of Shephatiah, the son of Mahalalel, of the children of Perez;","Jerusalema chun Juda thlaa mi le Benjamin thlaa mihai chu an um a. Juda thlahai laia mi Perez thlahai laia mi Mahalalel naupa Sephatia, chu naupa Amaria, chu naupa Zeka- ria, chu naupa Uzzia, chu naupa Athaia le"
"and Maaseiah the son of Baruch, the son of Col-hozeh, the son of Hazaiah, the son of Adaiah, the son of Joiarib, the son of Zechariah, the son of the Shilonite.","Silon mi naupa Zekaria, chu naupa Joiarib, chu naupa Adaia, chu naupa Hazaia, chu naupa Kolhoze, chu naupa Baruk, chu naupa Maa- seia."
All the sons of Perez that dwelt in Jerusalem were four hundred threescore and eight valiant men.,"Perez thlahai Jerusalema um chu mi huoisen za li, sâwmruk pariet an nih."
"And these are the sons of Benjamin: Sallu the son of Meshullam, the son of Joed, the son of Pedaiah, the son of Kolaiah, the son of Maaseiah, the son of Ithiel, the son of Jeshaiah.","Chun, Benjamin thlahai laia mihai chu hieng hi an nih: Jesaia naupa Ithiel, chu naupa Maaseia, chu naupa Kolaia, chu naupa Pedaia, chu naupa Joed, chu naupa Mesullam, chu naupa Sallu."
"And after him Gabbai, Sallai, nine hundred twenty and eight.","Ama hnunga chun Gabbai hai, Sallai hai, mi za kuo, sâwmhni pariet."
And Joel the son of Zichri was their overseer; and Judah the son of Hassenuah was second over the city.,"Chun, Zikri naupa Joel chu an hotu a na; Hassenua naupa Juda chu khaw hotu tak dawttu a nih."
"Of the priests: Jedaiah the son of Joiarib, Jachin,","Thiempuhai laia mi; Joiarib naupa Jedai hai, Jakin hai,"
"Seraiah the son of Hilkiah, the son of Meshullam, the son of Zadok, the son of Meraioth, the son of Ahitub, the ruler of the house of God,","Pathien in hotu Ahitub naupa Meraioth, chu naupa Zadok, chu naupa Mesullam, chu naupa Hilkia, chu naupa Seraia hai;"
"and their brethren that did the work of the house, eight hundred twenty and two; and Adaiah the son of Jeroham, the son of Pelaliah, the son of Amzi, the son of Zechariah, the son of Pashhur, the son of Malchijah,","an unau, ina rawngbâwltuhai chu, za riet, sâwmhni pahni an nih; chun, Malkija naupa Pas-hur, chu naupa Zekaria, chu naupa Amzi, chu naupa Pelalia, chu naupa Jeroham, chu naupa Adaia,"
"and his brethren, chiefs of fathers’ houses, two hundred forty and two; and Amashsai the son of Azarel, the son of Ahzai, the son of Meshillemoth, the son of Immer,","le a unauhai, an sûngkaw luhai leh za hni, sâwmli pahni an nih; chun, Immer naupa Mesillemoth, chu naupa, Ahzai, chu naupa Azarel, chu naupa Amasai,"
"and their brethren, mighty men of valor, a hundred twenty and eight; and their overseer was Zabdiel, the son of Haggedolim.","le an unau mi hrât huoisen za, sâwmhni pariet an nih; an hotu chu Haggedolim naupa Zabdiel a nih."
"And of the Levites: Shemaiah the son of Hasshub, the son of Azrikam, the son of Hashabiah, the son of Bunni;","Chun, Levi mihai laia mi: Bunni naupa Hasabia, chu naupa Azrikam; chu naupa Hassub, chu naupa Semaia leh;"
"and Shabbethai and Jozabad, of the chiefs of the Levites, who had the oversight of the outward business of the house of God;",Levi mi an ṭhuoituhai laia mi Pathien in puotieng sin enkawltu Sabbethai le Jozabad;
"and Mattaniah the son of Mica, the son of Zabdi, the son of Asaph, who was the chief to begin the thanksgiving in prayer, and Bakbukiah, the second among his brethren; and Abda the son of Shammua, the son of Galal, the son of Jeduthun.","Asaph naupa Zabdi, chu naupa Mika, chu naupa lâwmthu hrila ṭawngṭaina ṭantu tak Mattania le, a unauhai laia a dawttu Bakbukia; Jeduthun naupa Galal, chu naupa Sammua, chu naupa Abda hai."
All the Levites in the holy city were two hundred fourscore and four.,"Khawpui inthienga Levi mi um po po chu za hni, sâwmriet pali an nih."
"Moreover the porters, Akkub, Talmon, and their brethren, that kept watch at the gates, were a hundred seventy and two.","Chuong naw khawm chu kawtkhâr vêngtu Akkub hai, Talmon hai le, an unauhai kul kawtkhâr vêngtuhai za, sâwmsari pahni an nih."
"And the residue of Israel, of the priests, the Levites, were in all the cities of Judah, every one in his inheritance.",A bâk Israelhai le thiempuhai le Levi mihai chu Juda ram khaw tinah mâni ram sengah an um a.
But the Nethinim dwelt in Ophel: and Ziha and Gishpa were over the Nethinim.,Nethinimhai ruok chu Ophelah an um a; Ziha le Gispa chu Nethi- nimhai hotu an nih.
"The overseer also of the Levites at Jerusalem was Uzzi the son of Bani, the son of Hashabiah, the son of Mattaniah, the son of Mica, of the sons of Asaph, the singers, over the business of the house of God.","Jerusalem khuoa Levi mihai hotu chu Asaph naupa hla saktuhai laia mi Mika, chu naupa Mattania, chu naupa Hasabia, chu naupa Bania, chu naupa Uzzi a nih; Pathien in tieng sin ngaituotu a nih."
"For there was a commandment from the king concerning them, and a settled provision for the singers, as every day required.","An sûngkaw chungchâng thuah lal thupêk a um a, hlasaktuhai chu ni tina an tlâk tâwk ding ruotpêk ding thu a um bawk a."
"And Pethahiah the son of Meshezabel, of the children of Zerah the son of Judah, was at the king’s hand in all matters concerning the people.",Juda naupa Zera thlaa mi Mese- zabel naupa Pethahia chu mipuihai chungchâng thua iengkima lal aiaw a nih.
"And as for the villages, with their fields, some of the children of Judah dwelt in Kiriath-arba and the towns thereof, and in Dibon and the towns thereof, and in Jekabzeel and the villages thereof,","Chun, an khuo le an ram thua chun, Juda thlaa mi ṭhenkhathai chu, Kiriath-arba le a khawpera dâm, Dibon le a khawpera dâm, Zekabzeel le a khawpera dâm;"
"and in Jeshua, and in Moladah, and Beth-pelet,","Jesuaa le Moladaa le Beth- peleta dâm,"
"and in Hazar-shual, and in Beer-sheba and the towns thereof,","Hazarsuala dâm, Beer-sebaa le a khawpera dâm;"
"and in Ziklag, and in Meconah and in the towns thereof,","Ziklaga dâm, Mekonaa le a khawpera dâm;"
"and in En-rimmon, and in Zorah, and in Jarmuth,","En-rimmona dâm, Zoraa dâm, Jarmuth-a dâm;"
"Zanoah, Adullam, and their villages, Lachish and the fields thereof, Azekah and the towns thereof. So they encamped from Beer-sheba unto the valley of Hinnom.","Zanoaa dâm, Adullama dâm, le an khawpera dâm, Lakis le a rama dâm, Azeka le a khawpera dâm chun an um a. Chuongchun, Beer-sebaa inthawkin Hinnom ruom chenin umhmun an khuor a."
"The children of Benjamin also dwelt from Geba onward, at Michmash and Aija, and at Beth-el and the towns thereof,","Chun, Benjamin thlahai chu Geba khêl tieng, Mikmas-a dâm, Aija-a dâm, Bethel le a khawperahai dâm:"
"at Anathoth, Nob, Ananiah,","Anathoth-a dâm, Nob-a dâm, Anania-a dâm,"
"Hazor, Ramah, Gittaim,","Hazor-a dâm, Rama-a dâm, Gittaim-a dâm,"
"Hadid, Zeboim, Neballat,","Hadid-a dâm, Zeboim-a dâm, Neballat-a dâm,"
"Lod, and Ono, the valley of craftsmen.","Lod-a dâm, themthiemhai ruom Ono-a dâm an um a."
"And of the Levites, certain courses in Judah were joined to Benjamin.","Chun, Juda rama um hlak Levi mihai pâwl ṭhenkhat chu Benjamin rama chun an ṭhang tah a."
"Now these are the priests and the Levites that went up with Zerubbabel the son of Shealtiel, and Jeshua: Seraiah, Jeremiah, Ezra,","Sealtiel naupa Zerubbabel le Jesua kuoma fe ve thiempuhai le Levi mihai chu hieng hi an nih; Seraia, Jeremia, Ezra,"
"Amariah, Malluch, Hattush,","Amaria, Malluk, Hattus,"
"Shecaniah, Rehum, Meremoth,","Sekania, Rehum, Meremoth,"
"Iddo, Ginnethoi, Abijah,","Iddo, Ginnethoi, Abija,"
"Mijamin, Maadiah, Bilgah,","Mijamin, Maadia, Bilga,"
"Shemaiah, and Joiarib, Jedaiah.","Semaia, Joiarib, Jedaia,"
"Sallu, Amok, Hilkiah, Jedaiah. These were the chiefs of the priests and of their brethren in the days of Jeshua.","Sallu, Amok, Hilkia le Jedaia. Hienghai hi Jesua dam laia thiem- puhai lai le an unauhai laia hotuhai an nih."
"Moreover the Levites: Jeshua, Binnui, Kadmiel, Sherebiah, Judah, and Mattaniah, who was over the thanksgiving, he and his brethren.","Chuong naw khawm Levi mihai chu: Jesua, Binnui, Kadmiel, Serebia, Juda, lâwmthu hrila hotu Mattania, ama le a unauhai leh."
"Also Bakbukiah and Unno, their brethren, were over against them according to their offices.",Bakbukia le Unno le an unauhai khawm chu a pâwl pâwlin inepin an ngîr hlak a.
"And Jeshua begat Joiakim, and Joiakim begat Eliashib, and Eliashib begat Joiada,","Chun, Jesua chun Joiakim chu a nei a, Joiakim chun Eliasib a nei a, Eliasib chun Joiada a nei a,"
"and Joiada begat Jonathan, and Jonathan begat Jaddua.","Joiada chun Jonathan a nei a, Jonathan chun Jaddua a nei a nih."
"And in the days of Joiakim were priests, heads of fathers’ houses: of Seraiah, Meraiah; of Jeremiah, Hananiah;","Chun, hienghai hi Joiakim dam lai chun thiempu, an sûngkaw luhai chu an nih: Seraia thlaa mi Meraia; Jeremia thlaa mi Hanania;"
"of Ezra, Meshullam; of Amariah, Jehohanan;","Ezra thlaa mi Mesullam, Ama- ria thlaa mi Jehohanan;"
"of Malluchi, Jonathan; of Shebaniah, Joseph;","Malluki thlaa mi Jonathan, Sebania thlaa mi Josef;"
"of Harim, Adna; of Meraioth, Helkai;",Harim thlaa mi Adna; Meraioth thlaa mi Helkai;
"of Iddo, Zechariah; of Ginnethon, Meshullam;",Iddo thlaa mi Zekaria; Ginne- thon thlaa mi Mesullam;
"of Abijah, Zichri; of Miniamin, of Moadiah, Piltai;",Abija thlaa mi Zikri; Miniamin thlaa mi; Moadia thlaa mi Piltai;
"of Bilgah, Shammua; of Shemaiah, Jehonathan;",Bilga thlaa mi Sammua; Se- maia thlaa mi Jehonathan;
"and of Joiarib, Mattenai; of Jedaiah, Uzzi;",Joiarib thlaa mi Mattenai; Jedaia thlaa mi Uzzi;
"of Sallai, Kallai; of Amok, Eber;",Sallai thlaa mi Kallai; Amok thlaa mi Eber;
"of Hilkiah, Hashabiah; of Jedaiah, Nethanel.",Hilkia thlaa mi Hasabia; Jedaia thlaa mi Nethanel.
"As for the Levites, in the days of Eliashib, Joiada, and Johanan, and Jaddua, there were recorded the heads of fathers’ houses; also the priests, in the reign of Darius the Persian.","Eliasib, Joiada, Johanan le Jaddua hai dam laia Levi mihai chu sûngkaw luhaia ziek an na; Persia mi Daria inlal laia thiempuhai khawm chu."
"The sons of Levi, heads of fathers’ houses, were written in the book of the chronicles, even until the days of Johanan the son of Eliashib.",Eliasib naupa Johanan dam lai chen khawmin Levi nauhai sûngkaw luhai chu chanchin ziekna bua chun ziek an nih.
"And the chiefs of the Levites: Hashabiah, Sherebiah, and Jeshua the son of Kadmiel, with their brethren over against them, to praise and give thanks, according to the commandment of David the man of God, watch next to watch.","Chun, Levi chia a luhai: Hasabia, Serebia, Kadmiel naupa Jesua le an unau, Pathien mi David thupêk anga a pâwl pâwla inkhienga inpâk le lâwmthu hril dinghai leh."
"Mattaniah, and Bakbukiah, Obadiah, Meshullam, Talmon, Akkub, were porters keeping the watch at the store-houses of the gates.","Mattania, Bakbukia, Obadia, Mesullam, Talmon le Akkub hai chu kawtkhâr kâwla thuomhnaw sie- khâwmna le kawtkhâr vêngtuhai an nih."
"These were in the days of Joiakim the son of Jeshua, the son of Jozadak, and in the days of Nehemiah the governor, and of Ezra the priest the scribe.","Hienghai hi Jesua, Jozadak naupa Joiakim dam laia mi le ram awptu Nehemia le Ezra, thiempu le lakhaziektu dam laia mi an nih."
"And at the dedication of the wall of Jerusalem they sought the Levites out of all their places, to bring them to Jerusalem, to keep the dedication with gladness, both with thanksgivings, and with singing, with cymbals, psalteries, and with harps.","Jerusalem kul an inhlânnaa chun dârbenthekhai, perkhuonghai, ṭingṭanghai le hla sak le, lâwmthu hril lâwmtaka an inhlânnaa ṭhang dinga Jerusalema hung ṭhuoi dingin Levi mihai chu an hmun po poa in- thawk chun an zawng suok a."
"And the sons of the singers gathered themselves together, both out of the plain round about Jerusalem, and from the villages of the Netophathites;","Jerusalem kâwl vêl le, Neto- phath mihai khuohaia inthawk dâmin hla sak hotu nauhai chu an fe khâwm a;"
"also from Beth-gilgal, and out of the fields of Geba and Azmaveth: for the singers had builded them villages round about Jerusalem.","Beth-gilgal le, Geba le, Azma- veth rama inthawk dâm khâwmin hlasaktuhai chun Jerusalem vêla chun khuo an lo siem tâwl ta sih a."
"And the priests and the Levites purified themselves; and they purified the people, and the gates, and the wall.","Chun, thiempuhai le Levi mihai chu an insukthieng a, chun, mipui- hai, kulhai, a kawtkhârhai an suk- thieng a."
"Then I brought up the princes of Judah upon the wall, and appointed two great companies that gave thanks and went in procession; whereof one went on the right hand upon the wall toward the dung gate:","Chuongchun, Judahai mi lien- hai chu kul chunga chun ka hang ṭhuoi a; lâwmthu hril inzui nghuon nghuon ding pâwl lientak pâwl hni ka ruot a; pâwl khat chu hmunhnawk kawtkhâr tieng, kul chung chang- tieng pangah an feh a;"
