en,hmr
"And I went unto the house of Shemaiah the son of Delaiah the son of Mehetabel, who was shut up; and he said, Let us meet together in the house of God, within the temple, and let us shut the doors of the temple: for they will come to slay thee; yea, in the night will they come to slay thee.","Chu hnunga chun Mehetabel nau Delaia naupa Semaia, insuk- tumpa ina chun ka feh a; ama chun, “Pathien inah, biekin sûng ngeiah inhmûng ei ti khai; biekin kawtkhâr- hai chu khâr tlat ei ta; nangma that ding chein an hung ding a nih, zânah a nih that ding chea an hung nghe nghe ding chu,” a lo tih a."
"And I said, Should such a man as I flee? and who is there, that, being such as I, would go into the temple to save his life? I will not go in.","Kei ruok chun, “Keia ang hi hang tlânse el ding khawm am ka nih? Mâni hringna humhim nuom chun tu am biekina chun lût an ta? Lût dêr naw ning,” ka tih a."
"And I discerned, and, lo, God had not sent him; but he pronounced this prophecy against me: and Tobiah and Sanballat had hired him.","Chun, ka hang hriet dawk a, Pathien tir a lo ni dêr da el a; keima mi dodâlin chuong thu chu a hril a lo ni lem a, Tobia le Sanballatin an ruoi a lo ni zing a."
"For this cause was he hired, that I should be afraid, and do so, and sin, and that they might have matter for an evil report, that they might reproach me.","Ka ṭi a, chuong anga ka thaw a, thil ka suksuol a, a mi sukhming- sietna ding an nei theina dingin a nih an ruoi chu."
"Remember, O my God, Tobiah and Sanballat according to these their works, and also the prophetess Noadiah, and the rest of the prophets, that would have put me in fear.","Aw ka Pathien, Tobia le Sanbal- lat hi an thilthaw ang pei hin hre zing rawh, zâwlneinu Noadia le zâwlnei dang mi sukṭi tumtuhai po po le hin."
"So the wall was finished in the twenty and fifth day of the month Elul, in fifty and two days.","Chuongchun, kul chu ni sâwm- nga le ni hniah, Elul thla ni sâwmhni panga niin zo a ni tah a."
"And it came to pass, when all our enemies heard thereof, that all the nations that were about us feared, and were much cast down in their own eyes; for they perceived that this work was wrought of our God.","Chun, kan hmêlmahai po poin chu chu an lo hriet chun, kan vêla hnam danghai chun an ṭi tah a, chan se ta hlein an inhriet a, sin chu kan Pathien thaw a nih ti an hriet ta sih a."
"Moreover in those days the nobles of Judah sent many letters unto Tobiah, and the letters of Tobiah came unto them.","Chu naw hrima khawm, chuong lai chun Juda mi ṭhahai chun Tobia chu lekha tamtak an inphur hlak a; chun, Tobia lekha khawm an hmu bawk hlak."
"For there were many in Judah sworn unto him, because he was the son-in-law of Shecaniah the son of Arah; and his son Jehohanan had taken the daughter of Meshullam the son of Berechiah to wife.","Ama chu Ara naupa Sekania mâkpa a ni leiin, Juda rama mi tam- tak inkhâm hiela ama inthuruolpui an um a; chun, a naupa Jehohanan chun Berekia naupa Mesullam naunu chu nuhmeiah a nei a nih."
"Also they spake of his good deeds before me, and reported my words to him. And Tobiah sent letters to put me in fear.","Ka hrieta chun a thilthaw ṭhahai chu an hril hlak a, ka thu hrilhai a kuoma chun an intlun bawk hlak. Chuongchun, Tobia chun mîn ṭhi dingin lekha dâm chu a hung thawn hlak a nih."
"Now it came to pass, when the wall was built, and I had set up the doors, and the porters and the singers and the Levites were appointed,","Chun, kulhai chu kan siem a, kawtkhârhai chu ka rem tah a, kawtkhâr vêngtuhai, hla saktuhai, Levihai ruot an ni zo chun,"
"that I gave my brother Hanani, and Hananiah the governor of the castle, charge over Jerusalem; for he was a faithful man, and feared God above many.","ka unau Hanani le, kulbîng hotu Hanania chu Jerusalem chu kân awptir a; mi ringumtak, mi dang tamtak nêka Pathien ṭi mi a na."
"And I said unto them, Let not the gates of Jerusalem be opened until the sun be hot; and while they stand on guard, let them shut the doors, and bar ye them: and appoint watches of the inhabitants of Jerusalem, every one in his watch, and every one to be over against his house.","Chun, an kuomah, “Jerusalem kawtkhârhai hi nisa inkâng hma chun hawng ni naw sienla; vêngtuhai an la ngir laiin kawthai chu khârin kal tlat raw hai se; chun, Jerusalema umhai laia mi vêngtuhai ruot unla, mi tin mâni ngîr hmun hmunah, mi tin mâni in zâwn sengah,” ka tih a."
"Now the city was wide and large; but the people were few therein, and the houses were not builded.","Khuo chu a lienin ân dar hle sih a, a mi umhai chu an tlâwm hleh a, inhai khawm chu la bâwl lo an ni tâwl sih a."
"And my God put into my heart to gather together the nobles, and the rulers, and the people, that they might be reckoned by genealogy. And I found the book of the genealogy of them that came up at the first, and I found written therein:","Chun, ka Pathien chun ka lung- rilah, mi ṭhahai, rorêltuhai, mipuihai ko khâwm vawnga an thlatuhai dungzuia tiem dingin a mîn hriettir a. Chun, a phut taka hang fehai thla- tuhai hming ziekna bu chu ka hmu suok a; chutaka chun hieng anga ziek hi ka hmuh a:"
"These are the children of the province, that went up out of the captivity of those that had been carried away, whom Nebuchadnezzar the king of Babylon had carried away, and that returned unto Jerusalem and to Judah, every one unto his city;","Sala ṭhuoi Babulon lal Nebukad- nezzarin a ṭhuoihai laia, sala intâng suoka, Jerusalem le Juda rama mâni khuo senga kîr nâwka, chu rama um tahai chu hienghai hi an nih:"
"who came with Zerubbabel, Jeshua, Nehemiah, Azariah, Raamiah, Nahamani, Mordecai, Bilshan, Mispereth, Bigvai, Nehum, Baanah. The number of the men of the people of Israel:","Zerubbabel, Jesua, Nehemia, Azaria, Raamia, Nahamani, Morde- kai, Bilsan, Mispereth, Bigvai, Nehum le Baana hai ruol hin an fe a nih. Israel hai laia mi vântlâng tam tieng chu:"
"The children of Parosh, two thousand a hundred and seventy and two.","Paros thlahai sâng hni, za sâwmsari pahni."
"The children of Shephatiah, three hundred seventy and two.","Sephatia thlahai za thum, sâwmsari pahni."
"The children of Arah, six hundred fifty and two.","Ara thlahai za ruk, sâwmnga pahni."
"The children of Pahath-moab, of the children of Jeshua and Joab, two thousand and eight hundred and eighteen.","Jesua le Joab thlahai laia Pahath-Moab thlahai sâng hni, za riet, sâwmpariet."
"The children of Elam, a thousand two hundred fifty and four.","Elam thlahai sâng khat, za hni, sâwmnga pali."
"The children of Zattu, eight hundred forty and five.","Zattu thlahai za riet, sâwmli panga."
"The children of Zaccai, seven hundred and threescore.",Zakkai thlahai za sari sâwm- ruk.
"The children of Binnui, six hundred forty and eight.","Binnui thlahai za ruk, sâwmli pariet."
"The children of Bebai, six hundred twenty and eight.","Bebai thlahai za ruk, sâwmhni pariet."
"The children of Azgad, two thousand three hundred twenty and two.","Azgad thlahai sâng hni, za thum, sâwmhni pahni."
"The children of Adonikam, six hundred threescore and seven.","Adonikam thlahai za ruk, sâwmruk pasari."
"The children of Bigvai, two thousand threescore and seven.","Bigvai thlahai sâng hni, sâwmruk pasari."
"The children of Adin, six hundred fifty and five.","Adin thlahai za ruk, sâwmnga panga."
"The children of Ater, of Hezekiah, ninety and eight.",Hezekia thlaa mi Ater thlahai sâwmkuo pariet.
"The children of Hashum, three hundred twenty and eight.","Hasum thlahai za thum, sâwm- hni pariet."
"The children of Bezai, three hundred twenty and four.","Bezai thlahai za thum, sâwm- hni pali."
"The children of Hariph, a hundred and twelve.",Hariph thlahai za sâwmpahni.
"The children of Gibeon, ninety and five.",Gibeon thlahai sâwmkuo panga.
"The men of Beth-lehem and Netophah, a hundred fourscore and eight.","Bethlehem le Netopha khuoa mi za, sâwmriet pariet."
"The men of Anathoth, a hundred twenty and eight.","Anathoth khuoa mi za, sâwmhni pariet."
"The men of Beth-azmaveth, forty and two.",Beth-azmaveth khuoa mi sâwmli pahni.
"The men of Kiriath-jearim, Chephirah, and Beeroth, seven hundred forty and three.","Kiriath-jearim dâm, Kephira dâm le, Beeroth khuoa mi za sari, sâwmli pathum."
"The men of Ramah and Geba, six hundred twenty and one.","Rama le Geba khuoa mi za ruk, sâwmhni pakhat."
"The men of Michmas, a hundred and twenty and two.","Mikmas khuoa mi za, sâwmhni pahni."
"The men of Beth-el and Ai, a hundred twenty and three.","Bethel le Ai khuoa mi za, sâwmhni pathum."
"The men of the other Nebo, fifty and two.",Nebo danga mi sâwmnga pahni.
"The children of the other Elam, a thousand two hundred fifty and four.","Elam dang thlahai sâng khat, za hni, sâwmnga pali."
"The children of Harim, three hundred and twenty.",Harim thlahai za thum sâwm- hni.
"The children of Jericho, three hundred forty and five.","Jeriko thlahai za thum, sâwmli panga."
"The children of Lod, Hadid, and Ono, seven hundred twenty and one.","Lod thlahai le, Hadid le Ono thlahai za sari, sâwmhni pakhat."
"The children of Senaah, three thousand nine hundred and thirty.","Senaa thlahai sâng thum, za kuo sâwmthum:"
"The priests: The children of Jedaiah, of the house of Jeshua, nine hundred seventy and three.","Thiempuhai: Jesua sûnghai laia mi Jedai thlahai za kuo, sâwmsari pathum."
"The children of Immer, a thousand fifty and two.","Immer thlahai sâng khat, sâwmnga pahni."
"The children of Pashhur, a thousand two hundred forty and seven.","Pas-hur thlahai sâng khat, za hni, sâwmli pasari."
"The children of Harim, a thousand and seventeen.",Harim thlahai sâng khat sâwm- pasari.
"The Levites: the children of Jeshua, of Kadmiel, of the children of Hodevah, seventy and four.",Levi-hai: Hodeva thlaa mi Jesua le Kadmiel thlahai sâwmsari pali.
"The singers: the children of Asaph, a hundred forty and eight.","Hlasaktuhai: Asaph thlahai za, sawmli pariet."
"The porters: the children of Shallum, the children of Ater, the children of Talmon, the children of Akkub, the children of Hatita, the children of Shobai, a hundred thirty and eight.","Kawtkhâr vêngtuhai: Sallum thlahai, Ater thlahai, Talmon thla- hai, Akkub thlahai, Hatita thlahai, Sobai thlahai za khat, sawmthum pariet."
"The Nethinim: the children of Ziha, the children of Hasupha, the children of Tabbaoth,","Nethinim hai: Ziha thlahai, Hasupha thlahai, Tabboath thlahai,"
"the children of Keros, the children of Sia, the children of Padon,","Keros thlahai, Sia thlahai, Padon thlahai,"
"the children of Lebana, the children of Hagaba, the children of Salmai,","Lebana thlahai, Hagaba thlahai, Salmai thlahai,"
"the children of Hanan, the children of Giddel, the children of Gahar,","Hanan thlahai, Giddel thlahai, Gahar thlahai,"
"the children of Reaiah, the children of Rezin, the children of Nekoda,","Reaia thlahai, Rezin thlahai, Nekoda thlahai,"
"the children of Gazzam, the children of Uzza, the children of Paseah.","Gazzam thlahai, Uzza thlahai, Pasea thlahai,"
"The children of Besai, the children of Meunim, the children of Nephushesim,","Besai thlahai, Meunim thlahai, Nephusesim thlahai,"
"the children of Bakbuk, the children of Hakupha, the children of Harhur,","Bakbuk thlahai, Hakupha thla- hai, Harhur thlahai,"
"the children of Bazlith, the children of Mehida, the children of Harsha,","Bazlith thlahai, Mehida thla- hai, Harsa thlahai,"
"the children of Barkos, the children of Sisera, the children of Temah,","Barkos thlahai, Sisera thlahai, Tema thlahai,"
"the children of Neziah, the children of Hatipha.","Nezia thlahai, Hatipha thla- hai."
"The children of Solomon’s servants: the children of Sotai, the children of Sophereth, the children of Perida,","Solomon siehlaw thlahai: Sotai thlahai, Sophereth thlahai, Perida thlahai,"
"the children of Jaala, the children of Darkon, the children of Giddel,","Jaala thlahai, Darkon thlahai, Giddel thlahai,"
"the children of Shephatiah, the children of Hattil, the children of Pochereth-hazzebaim, the children of Amon.","Sephatia thlahai, Hattil thla- hai, Pokereth-hazzebaim thlahai, Amon thlahai."
"All the Nethinim, and the children of Solomon’s servants, were three hundred ninety and two.","Nethinim mi po po le Solomon siehlawhai thlahai chu za thum, sâwmkuo pahni an nih."
"And these were they that went up from Tel-melah, Tel-harsha, Cherub, Addon, and Immer; but they could not show their fathers’ houses, nor their seed, whether they were of Israel:","Chun, Tel-mela dâm, Tel-harsa dâm, Kerub dâm, Addon dâm, Im- mera inthawk dâma hunghai chu hienghai hi an na; nisienlakhawm, an pi le puhai sûnghai le an thla peihai Israel mi an ni le an ni naw an sui thei ta nawh a;"
"The children of Delaiah, the children of Tobiah, the children of Nekoda, six hundred forty and two.","Delaia thlahai, Tobia thlahai, Nekoda thlahai za ruk, sâwmli pahni."
"And of the priests: the children of Hobaiah, the children of Hakkoz, the children of Barzillai, who took a wife of the daughters of Barzillai the Gileadite, and was called after their name.","Chun, thiempuhai laia mi: Hobaia thlahai, Hakkoz thlahai, Gilead mi (Barzillai naunuhai laia mi nuhmeia neia, an hming put nghâl tah,) Barzillai thlahai chu."
"These sought their register among those that were reckoned by genealogy, but it was not found: therefore were they deemed polluted and put from the priesthood.","chuonghai chun an thlatuhai ang peia tiemhai laia chun an hming ziekna an zawng a, nisienlakhawm, an hmu nawh a; chuleiin, thieng lo anga ngaiin an um a, an thiempu nina chu an bân a."
"And the governor said unto them, that they should not eat of the most holy things, till there stood up a priest with Urim and Thummim.","Chun, ram awptu chun anni chu Urim le Thummim inbela thiempu a ngîr hmakhat chun thil serhai chu an fâk ding a ni nawh ti a hril a."
"The whole assembly together was forty and two thousand three hundred and threescore,","Mipui pungkhâwm po po chu sîng li, sâng hni, za thum le sâwmruk an nih,"
"besides their men-servants and their maid-servants, of whom there were seven thousand three hundred thirty and seven: and they had two hundred forty and five singing men and singing women.","an siehlaw nuhmei le pasal sâng sari, za thum, sâwmthum pasari tiem loin; chun, hlasaktu nuhmei le pasal za hni, sâwmli panga an nei a."
"Their horses were seven hundred thirty and six; their mules, two hundred forty and five;","An sakawr chu za sari, sâwm- thum paruk a nih; an sabengtung lien chi chu za hni, sâwmli panga a nih;"
"their camels, four hundred thirty and five; their asses, six thousand seven hundred and twenty.","an sanghâwngsei chu za li sâwmthum panga a nih; an sabeng- tung chu sâng ruk, za sari, sâwmhni a nih."
"And some from among the heads of fathers’ houses gave unto the work. The governor gave to the treasury a thousand darics of gold, fifty basins, five hundred and thirty priests’ garments.","Chun, sûngkuo luhai ṭhenkhat- hai chun chu sina ding chun an pêk a. Ram awptu chun thawlâwmah râng- kachak darik sâng khat, maihûn sâwmnga, thiempu silfên za nga le sâwmthum a thawh a."
"And some of the heads of fathers’ houses gave into the treasury of the work twenty thousand darics of gold, and two thousand and two hundred pounds of silver.","Chun, sûngkuo lu ṭhenkhathai chun in bâwlna ding thawlâwmah rângkachak darik sing hni le, tang- karuo bûk sâng hni le za hni an thawh a."
"And that which the rest of the people gave was twenty thousand darics of gold, and two thousand pounds of silver, and threescore and seven priests’ garments.","Chun, mi dang po pohai pêk chu rângkachak darik sîng hni le tangkaruo bûk sâng hni le thiempu silfên sâwmruk le pasari a nih."
"So the priests, and the Levites, and the porters, and the singers, and some of the people, and the Nethinim, and all Israel, dwelt in their cities. And when the seventh month was come, the children of Israel were in their cities.","Chuongchun, thiempuhai, Levi mihai, kawtkhâr vêngtuhai, hlasak- tuhai le mi ṭhenkhathai le Nethinim mihai le Israel mi po po chu mâni khuo sengah an um tah a. Chuong- chun, thla sarina a hung tlung chun Israel thlahai chu an khuohaia chun an um a."
"And all the people gathered themselves together as one man into the broad place that was before the water gate; and they spake unto Ezra the scribe to bring the book of the law of Moses, which Jehovah had commanded to Israel.","Chun, mi po po chu lungril hmunkhatin Tui kawtkhâr zâwn hmun lienna laia chun an fe khâwm a; chun, lekhaziektu Ezra chu LALPAIN Israelhai zâwm dinga thu a pêk Mosie Dân bu chu hung chawi dingin an hril a."
"And Ezra the priest brought the law before the assembly, both men and women, and all that could hear with understanding, upon the first day of the seventh month.","Chuongchun, thla sarina, ni khat niin thiempu Ezra chun pung- khâwmhai nutling, patling le a hrethiem thei chin po po hmaa chun Dân chu a hung chawi a."
"And he read therein before the broad place that was before the water gate from early morning until midday, in the presence of the men and the women, and of those that could understand; and the ears of all the people were attentive unto the book of the law.","Chutaka mi chu Tui kawtkhâr hmazâwn hmun lienna laia chun nutling, patling le a hrethiem thei chinhai lai zîngtienga inthawkin sûn chenin a tiem a; mi po po chun Dân bu thua chun an na an sit ṭhuop el a."
"And Ezra the scribe stood upon a pulpit of wood, which they had made for the purpose; and beside him stood Mattithiah, and Shema, and Anaiah, and Uriah, and Hilkiah, and Maaseiah, on his right hand; and on his left hand, Pedaiah, and Mishael, and Malchijah, and Hashum, and Hashbaddanah, Zechariah, and Meshullam.","Chun, chuong ang dinga an siem hrim thing dawkân insânga chun lekhaziektu Ezra chu a ngîr a, a sir changtienga chun Mattithia, Sema, Anaia, Uria, Hilkia le Maaseia hai an ngîr a; chun, a vawitienga chun Pedaia, Misael, Malkija, Hasum, Hasbaddana, Zekaria le Mesullam an ngîr a."
"And Ezra opened the book in the sight of all the people (for he was above all the people); and when he opened it, all the people stood up.","Chun, Ezra chun mi po po mithmua chun lekhabu ziel chu a hang sût a, (mi po po nêka insânga ngîr a na), chun, a hang sût chun mi po po chu an ngîr ta vawng a;"
"And Ezra blessed Jehovah, the great God; and all the people answered, Amen, Amen, with the lifting up of their hands: and they bowed their heads, and worshipped Jehovah with their faces to the ground.","chuongchun, Ezra chun LALPA Pathien ropuitak chu ân pâk a; chun, mipui po po chun an bân pharin, “Amen, Amen,” tiin an lo dawn a; chun, an kûn a, an hmaia hnuoi sikin LALPA chu chibai an bûk a."
"Also Jeshua, and Bani, and Sherebiah, Jamin, Akkub, Shabbethai, Hodiah, Maaseiah, Kelita, Azariah, Jozabad, Hanan, Pelaiah, and the Levites, caused the people to understand the law: and the people stood in their place.","Jesua, Bani, Serebia, Jamin, Akkub, Sabbethai, Hodia, Maaseia, Kelita, Azaria, Zojabad, Hanan, Pelaia, Levi mihai chun mipuihai kuomah Dân an hrilfie a: mipuihai chu an ngirhmuna chun an um zing a."
"And they read in the book, in the law of God, distinctly; and they gave the sense, so that they understood the reading.","Chun, Lekhabu Pathien Dân bua mi chu fietakin an tiem a; a umzie an hrilfieh a, chuongchun, an tiem chu an inhriettir pei a."
"And Nehemiah, who was the governor, and Ezra the priest the scribe, and the Levites that taught the people, said unto all the people, This day is holy unto Jehovah your God; mourn not, nor weep. For all the people wept, when they heard the words of the law.","Chun, ram awptu Nehemia le thiempu le lekhaziektu ni fâwm Ezra le mipuihai inchûktirtu Levi mihai chun mipui po po kuoma chun, “Vawisûn ni hi LALPA in Pathien ta dinga ni inthieng a nih; lungriemin thlâk naw sienla cheu, ṭap khawm ṭap bawk naw ro,” an tih a. Dân thu chu an hrietin mipui po po chu an ṭap an ṭap el sih a."
"Then he said unto them, Go your way, eat the fat, and drink the sweet, and send portions unto him for whom nothing is prepared; for this day is holy unto our Lord: neither be ye grieved; for the joy of Jehovah is your strength.","Chuongchun, ama chun an kuomah, “Fe unla, a thâu thâu fa unla, a thlum thlum dâwn unla, ieng- khawm buotsai nei lohai ta dingin chanpuol inphur unla, vawisûn ni hi ei LALPA ta dinga ni inthieng a ni hi; lungngaiin um naw ro, LALPA chunga lâwmna chu in hrâtna a ni sih a,” a ta."
"So the Levites stilled all the people, saying, Hold your peace, for the day is holy; neither be ye grieved.","Chuongchun, Levi mihai chun, “To ṭawk ṭawk ro khai, vawisûn hi ni inthieng a ni sih a; lungngai khawm lungngai nuom naw ro,” tiin, mipui po po chu an sukto ta ṭhuop el a."
"And all the people went their way to eat, and to drink, and to send portions, and to make great mirth, because they had understood the words that were declared unto them.","Chuongchun, thu a hrilfie chu an hrietthiem leiin mipui po po chu fa ding dâmin, dâwn ding dâmin, mi dang chanpuol thawn ding dâmin, hlimtaka um ding dâm chun an ṭîn ta vawng a."
"And on the second day were gathered together the heads of fathers’ houses of all the people, the priests, and the Levites, unto Ezra the scribe, even to give attention to the words of the law.","Chun, a ni hni ni chun sûngkaw tinrênga a luhai dâm, thiempuhai dâm, Levi mihai chu Dân thu inchûk ding bawk chun lekhaziektu Ezra kuoma chun an fe khâwm a."
"And they found written in the law, how that Jehovah had commanded by Moses, that the children of Israel should dwell in booths in the feast of the seventh month;","Chun, LALPAIN Mosie hmanga zâwm dinga thu a pêk dâna chun thla sarina ruoiṭhe laia Israel thlahai sâwlbûka an um ding thu le,"
"and that they should publish and proclaim in all their cities, and in Jerusalem, saying, Go forth unto the mount, and fetch olive branches, and branches of wild olive, and myrtle branches, and palm branches, and branches of thick trees, to make booths, as it is written.","an ziek anga, “Tlângah fe unla, oliv kauhai, oliv hlêm kauhai le inhmui kauhai, intûm kauhai dâm, thing lien taktak kauhai chu sâwlbûk bâwlna dingin va la ro,” tiin an khuo po poa le, Jerusalem khuoa chun an hrildar ding thu le, phuong vêl ding a ni thu dâm chu an tiem a."
"So the people went forth, and brought them, and made themselves booths, every one upon the roof of his house, and in their courts, and in the courts of the house of God, and in the broad place of the water gate, and in the broad place of the gate of Ephraim.","Chuong ang chun mipuihai chu an va feh a, mi po poin an in chung- haia dâm, an kawthaia dâm, Pathien in kawta dâm, Tui kawtkhâr hmun lienna laia dâm, Ephraim kawtkhâr hmun lienna laia dâm sâwlbûk an bâwl seng a."
"And all the assembly of them that were come again out of the captivity made booths, and dwelt in the booths: for since the days of Jeshua the son of Nun unto that day had not the children of Israel done so. And there was very great gladness.","Chun, sala suok pungkhâwm- hai po po chun sâwlbûk an siem a. Sâwlbûkhaia chun an um a; Nun naupa Josua chena inthawk tah, Israel nauhai chun chuong ang lâwm chun an la thaw ngai nawh a. Chuongchun, lâwmna nasatak a hung um tah a,"
"Also day by day, from the first day unto the last day, he read in the book of the law of God. And they kept the feast seven days; and on the eighth day was a solemn assembly, according unto the ordinance.",ni tin a ṭantir nia inthawka a tâwp chenin Pathien Dân bua mi an tiem bawk a. Ruoiṭhe chun ni sari an awh a; chun a ni riet ni chu thupêk anga a ṭumṭiekna ni chu a nih.
"Now in the twenty and fourth day of this month the children of Israel were assembled with fasting, and with sackcloth, and earth upon them.","Chuongchun, chu thla ni sâwm- hni pali ni chun Israel thlahai chu bu ngheia, saiip puon sila an lua pilvut kai nungin an fe khâwm tâwl a."
"And the seed of Israel separated themselves from all foreigners, and stood and confessed their sins, and the iniquities of their fathers.","Chun, Israel hnam chu hnam danghai laia chun an insuktum a; an ngîr a, an suolnahai le an pi le puhai bawsietna thupha an chawi a."
"And they stood up in their place, and read in the book of the law of Jehovah their God a fourth part of the day; and another fourth part they confessed, and worshipped Jehovah their God.","Chun, mâni hmun sengah an ngîr a, chu ni hmun lia ṭhea hmun khat sûng chun LALPA an Pathien dân bu an tiem a; chun, hmun lia ṭhea hmun khat dang sung chun thupha an chawi a, LALPA an Pathien chu an biek a."
"Then stood up upon the stairs of the Levites, Jeshua, and Bani, Kadmiel, Shebaniah, Bunni, Sherebiah, Bani, and Chenani, and cried with a loud voice unto Jehovah their God.","Chuongchun, Levi mihai dawkân insânga chun Jesua, Bani, Kadmiel, Sebania, Bunni, Serebia, Bani, Kena- ni hai chu an ngîr a; inringtakin LALPA an Pathien chu an ko a."
"Then the Levites, Jeshua, and Kadmiel, Bani, Hashabneiah, Sherebiah, Hodiah, Shebaniah, and Pethahiah, said, Stand up and bless Jehovah your God from everlasting to everlasting; and blessed be thy glorious name, which is exalted above all blessing and praise.","Chuongchun, Levi mi, Jesua, Kadmiel, Bani, Hasabneia, Serebia, Hodia, Sebania le Pethahia hai chun an hril a, “Ngîr unla, LALPA in Pathien chu chatuona inthawka cha- tuon chenin inpâk ro khai; chun, chawimawina le inpâkna po po khawmin a phâk lo, i hming ropui chu inpâkin um raw se."
