en,hmr
"And next unto them repaired Melatiah the Gibeonite, and Jadon the Meronothite, the men of Gibeon, and of Mizpah, that appertained to the throne of the governor beyond the River.","Chun, anni dawta Gibeon mi Melatia le Meronoth mi Jadon, vadung râl awptu thu hnuoia um Gibeon mihai le Mizpa mihai le chun an siem ṭha a."
"Next unto him repaired Uzziel the son of Harhaiah, goldsmiths. And next unto him repaired Hananiah one of the perfumers, and they fortified Jerusalem even unto the broad wall.","A dawta chun rângkachak suttu- hai laia mi Harhaia naupa Uzziel chun a siem ṭha a. Chun, a dawt nâwka chun riminhnik siemtu laia mi Hanania chun a siem ṭha a; a kul sâna lai chenin Jerusalem chu an siem ṭha a."
"And next unto them repaired Rephaiah the son of Hur, the ruler of half the district of Jerusalem.","Chun, anni dawta chun Jerusa- lem biel chenve hotu Hur naupa Rephaia chun a siem ṭha a."
"And next unto them repaired Jedaiah the son of Harumaph, over against his house. And next unto him repaired Hattush the son of Hashabneiah.",Anni dawta chun Harumaph naupa Jedaia chun a in zâwn chu a siem ṭha a. A dawta chun Hasabneia naupa Hattus chun a siem ṭha a.
"Malchijah the son of Harim, and Hasshub the son of Pahath-moab, repaired another portion, and the tower of the furnaces.",Harim naupa Malkija le Pahath-Moab naupa Hassub hai chun meipui sepna in insâng le hmun dang an siem ṭha a.
"And next unto him repaired Shallum the son of Hallohesh, the ruler of half the district of Jerusalem, he and his daughters.",A dawta chun Jerusalem biel chenve hotu Hallohes naupa Sallum chun a naunuhmeihai leh an siem ṭha a.
"The valley gate repaired Hanun, and the inhabitants of Zanoah; they built it, and set up the doors thereof, the bolts thereof, and the bars thereof, and a thousand cubits of the wall unto the dung gate.","Ruom kawtkhâr chu Hanun le Zanoa umhai chun an siem ṭha a; an siem a, a kawtkhârhai chu an inkal a, a kalnahai le a bâtnahai chu an rem a; chun, Hmunhnawk kawtkhâr chenin kul tawng sâng khat an siem bawk a."
"And the dung gate repaired Malchijah the son of Rechab, the ruler of the district of Beth-haccherem; he built it, and set up the doors thereof, the bolts thereof, and the bars thereof.","Hmunhnawk kawtkhâr ruok chu Beth-Hakerem biel hotu Rekab naupa Malkija chun a siem ṭha a; a siem a, kawtkhârhai chu a rem a, a kalnahai le a bâtnahai chu a siem ṭha a."
"And the fountain gate repaired Shallun the son of Col-hozeh, the ruler of the district of Mizpah; he built it, and covered it, and set up the doors thereof, the bolts thereof, and the bars thereof, and the wall of the pool of Shelah by the king’s garden, even unto the stairs that go down from the city of David.","Chun, Mizpa biel hotu Kolhoze naupa Sallum chun tuikhur kawt- khâr chu a siem ṭha a; a siem a, ân khum a, a kawtkhârhai a rem a, a kalnahai le a bâtnahai chu a rem a; chun, lal huon kâwla Sela dîl inhuon- na chu David khuoa inthawka fe thla kaiṭen chen khan a siem ṭha bawk a."
"After him repaired Nehemiah the son of Azbuk, the ruler of half the district of Beth-zur, unto the place over against the sepulchres of David, and unto the pool that was made, and unto the house of the mighty men.","A dawta chun Azbuk, Beth-zur biel chenve hotu naupa Nehemia chun David thlân zâwn le dîl tieng le mi huoisenhai in chenin a siem ṭha a."
"After him repaired the Levites, Rehum the son of Bani. Next unto him repaired Hashabiah, the ruler of half the district of Keilah, for his district.",A dawta chun Levihaiin an siem ṭha a. Bani naupa Rehum hai rawi chun. A dawta chun Keila biel chenve hotu Hasabia chun ama biel hmingin a siem ṭha a.
"After him repaired their brethren, Bavvai the son of Henadad, the ruler of half the district of Keilah.",A dawta chun an unauhaiin an siem ṭha a; Keila biel chenve hotu Henadad naupa Bavvai rawiin an siem ṭha a.
"And next to him repaired Ezer the son of Jeshua, the ruler of Mizpah, another portion, over against the ascent to the armory at the turning of the wall.","Chun, a dawta chun Mizpa hotu Jesua naupa Ezer chun hmun dang, kul kâwi ṭannaa râlthuom siena hang panna zâwn chu a siem ṭha a."
"After him Baruch the son of Zabbai earnestly repaired another portion, from the turning of the wall unto the door of the house of Eliashib the high priest.","A dawta chun Zabbai naupa Baruk chun ṭhahnemngaitakin hmun dang, kul kâwi ṭannaa inthawka thiempu lal Eliasib in kawtkhâr chenin a siem ṭha a."
"After him repaired Meremoth the son of Uriah the son of Hakkoz another portion, from the door of the house of Eliashib even to the end of the house of Eliashib.","A dawta chun Hakkoz naupa Uria naupa Meremoth chun hmun dang, Eliasib in kawtkhâra inthawk- a Eliasib in tâwp chenin a siem ṭha a."
"And after him repaired the priests, the men of the Plain.","Chun, a dawta chun chulai vêla thiempuhai chun an siem ṭha a."
After them repaired Benjamin and Hasshub over against their house. After them repaired Azariah the son of Maaseiah the son of Ananiah beside his own house.,Anni dawta chun Benjamin le Hassub chun anni in zâwn chu an siem ṭha a. Anni dawta chun Anania nau Maaseia naupa Azaria chun ama in kâwl chu a siem ṭha a.
"After him repaired Binnui the son of Henadad another portion, from the house of Azariah unto the turning of the wall, and unto the corner.","A dawta chun Henadad naupa Binnui chun hmun dang, Azaria ina inthawka kul kâwi ṭanna a kil chenin a siem ṭha a."
"Palal the son of Uzai repaired over against the turning of the wall, and the tower that standeth out from the upper house of the king, which is by the court of the guard. After him Pedaiah the son of Parosh repaired.","Uzai naupa Palal chun kul kâwi ṭanna zâwn le intângna in kâwl, lal in chunghnung lema inthawka va lawr in insâng zâwn a siem ṭha a. A dawta chun Paros naupa Pedaia chun a siem ṭha a."
"(Now the Nethinim dwelt in Ophel, unto the place over against the water gate toward the east, and the tower that standeth out.)","Nethinimhai Ophela umhai chun saktieng panga Tui kawtkhâr zâwn chen le, in insâng va lawr chen khan an siem ṭha a."
"After him the Tekoites repaired another portion, over against the great tower that standeth out, and unto the wall of Ophel.","A dawta chun Teko-haiin hmun dang, in insâng lientak va lawr zâwn le Ophel kul chenin an siem ṭha a."
"Above the horse gate repaired the priests, every one over against his own house.",Sakawr kawtkhâr chung tieng thiempuhaiin mâni in zâwn seng an siem ṭha a.
"After them repaired Zadok the son of Immer over against his own house. And after him repaired Shemaiah the son of Shecaniah, the keeper of the east gate.","Anni dawta chun Immer naupa Zadok chun ama in zâwn a siem ṭha a. Chun, a dawta chun saktieng kawt- khâr vêngtu Sekania naupa Semaia chun a siem ṭha a."
"After him repaired Hananiah the son of Shelemiah, and Hanun the sixth son of Zalaph, another portion. After him repaired Meshullam the son of Berechiah over against his chamber.",A dawta chun Selemia naupa Hanania le Zalaph naupa parukna Hanun chun hmun dang an siem ṭhah a. A dawta chun Berekia naupa Mesullam chun a umna zâwn a siem ṭhah a.
"After him repaired Malchijah one of the goldsmiths unto the house of the Nethinim, and of the merchants, over against the gate of Hammiphkad, and to the ascent of the corner.","A dawta chun rângkachak suttu laia mi Malkija chun Hamiphkad kawtkhâr zâwn Nethinimhai in le sumdâwnghai in chen le, a kil hang panna chen khan a siem ṭhah a."
And between the ascent of the corner and the sheep gate repaired the goldsmiths and the merchants.,"Chun, a kil hang panna le berâm kawtkhâr inkâr chu rângka- chak suttuhai le sumdâwngtuhai chun an siem ṭhah a."
"But it came to pass that, when Sanballat heard that we were building the wall, he was wroth, and took great indignation, and mocked the Jews.","Nisienlakhawm, Sanballat chun kul kan siem ṭha ti a hriet chun, nasatakin a lunginsen a, a lungawi ta nawh a, Judahai chu a dêusâw tah a."
"And he spake before his brethren and the army of Samaria, and said, What are these feeble Jews doing? will they fortify themselves? will they sacrifice? will they make an end in a day? will they revive the stones out of the heaps of rubbish, seeing they are burned?","Chuongchun, a unauhai le Samari sipaihai hmaa chun thu a hril a, “Hieng Juda mi hrâtlohai hin ieng am a ni leh an thaw? An inkul pui- tling vei ding am a ni ie? An inthâwi vei ding am a nih? Ni khat thil thuin an puitlin ding maw? Hmunhnawk um khâwm mei meia inthawk le lung kâng se ta sa an inngîr thartir ding maw?” a tih a."
"Now Tobiah the Ammonite was by him, and he said, Even that which they are building, if a fox go up, he shall break down their stone wall.","Chun, a kâwla Ammon mi Tobia chun, “Hang inngîrtir hrim raw hai se chu, sihal khawm hang lâwn sien an lung kul chu sukchim el a tih,” a tih a."
"Hear, O our God; for we are despised: and turn back their reproach upon their own head, and give them up for a spoil in a land of captivity;","Aw kan Pathien, en ta, hmusitin kan um hi, an mi hrilsietna chu anni lu chunga ngei inlêttir la, anni khawm khâwlai rama manih muol- photakin intângtir zing rawh;"
"and cover not their iniquity, and let not their sin be blotted out from before thee; for they have provoked thee to anger before the builders.","an bawsietnahai chu inkhum naw la, an suolnahai chu i hmaa inthawka thaihmangin inumtir naw rawh; kul siemtuhai hmaah an suk- lungsen che hi."
So we built the wall; and all the wall was joined together unto half the height thereof: for the people had a mind to work.,"Chuongchun, kul chu kan siem a, ân sâng tieng chenvein kul po po chu kan zawm suok vawng a; mipuihai chun thaw inhâwkna lungril chu an put hle a."
"But it came to pass that, when Sanballat, and Tobiah, and the Arabians, and the Ammonites, and the Ashdodites, heard that the repairing of the walls of Jerusalem went forward, and that the breaches began to be stopped, then they were very wroth;","Amiruokchu, Sanballat hai, Tobia hai, Arab mihai, Ammon mihai le Asdod mihaiin kul chu siem ṭhat a ni pei ti an hriet chun an lunginsen ta hle el a;"
"and they conspired all of them together to come and fight against Jerusalem, and to cause confusion therein.","chuongchun, Jerusalem chu hung thawa buoina siem chu an rawt tâwl tah a."
"But we made our prayer unto our God, and set a watch against them day and night, because of them.","Nisienlakhawm, anni lei chun kan Pathien kuomah kan ṭawngṭai a, sûn le zânah anni chu a vêngtu ding kan sie zing a."
"And Judah said, The strength of the bearers of burdens is decayed, and there is much rubbish; so that we are not able to build the wall.","Chun, Juda chun, “Sinthaw- tuhai tha hlak a châu zo tah a, hmunhnawk hlak a nasa sih a; kul chu ei siem thei ta naw ding a ni hi,” a tih a."
"And our adversaries said, They shall not know, neither see, till we come into the midst of them, and slay them, and cause the work to cease.","Kan hmêlmahai hlak chun, “Anni lai ei hang feh a, ei hang that a, sin chu ei hang suktâwppêk hmakhat chun hre naw ni hai a, mi hmu bawk naw ni hai,” an lo ti bawk a."
"And it came to pass that, when the Jews that dwelt by them came, they said unto us ten times from all places, Ye must return unto us.","An kuoma Juda umhai an hung hlak khan hmun tum tuma miin vawi sâwm zet, “Kan kuomah in hung nâwk ding a nih,” an mi lo ti zawm- zawt bawk a."
"Therefore set I in the lowest parts of the space behind the wall, in the open places, I set there the people after their families with their swords, their spears, and their bows.","Chuleichun, kul phên, ân hnuoi- na lai tak, hmun inthâwlna fai laia chun mipuihai chu a sûng sûngin an kâwlhnâmhai, an feihai, an thal- ngulhai chawiin ṭhanghmun kân khuortir a."
"And I looked, and rose up, and said unto the nobles, and to the rulers, and to the rest of the people, Be not ye afraid of them: remember the Lord, who is great and terrible, and fight for your brethren, your sons, and your daughters, your wives, and your houses.","Chun, ka hang en vêl a, ka tho a, mi ṭhahai le rorêltuhai le mi danghai kuoma chun, “Anni chu ṭi dêr naw unla, LALPA ropuitak le, ṭiumtak el chu hre zingin in unauhai, in nau- pasalhai, in naunuhmeihai, in nu- hmeihai, in inhai hum dingin thaw ro khai,” ka tih a."
"And it came to pass, when our enemies heard that it was known unto us, and God had brought their counsel to nought, that we returned all of us to the wall, every one unto his work.","Chun, kan hmêlmahai chun kan lo hriet ti le, an thil thaw tum chu Pathienin teploah a siem ti an hrietin, kul tieng mâni sinthawna sengah kan fe nâwk tâwl tah a."
"And it came to pass from that time forth, that half of my servants wrought in the work, and half of them held the spears, the shields, and the bows, and the coats of mail; and the rulers were behind all the house of Judah.","Chutaka inthawk chu ka mihai a zâtve chun sin chu an thaw nâwk tah a; a zâtve danghai chun feihai, phawhai, thalngulhai, âwmphaw- hai chu an kawl a; chun rorêltuhai chu Juda sûnghai hnunga chun an um a,"
"They that builded the wall and they that bare burdens laded themselves; every one with one of his hands wrought in the work, and with the other held his weapon;","chuong bang siemtuhai hnunga chun. Chun, chuong phurrik phur- tuhai chu an inbel rik ṭeu a, an kut khingkhatin sin an thawh a, khing- tiengin hriemhrei an chawi a;"
"and the builders, every one had his sword girded by his side, and so builded. And he that sounded the trumpet was by me.","a siemtuhai chun an kâwlhnâm an pâi seng a, chuong pum chun an siem a nih. Tawtawrâwt mûttu chu keia kâwlah a um a."
"And I said unto the nobles, and to the rulers and to the rest of the people, The work is great and large, and we are separated upon the wall, one far from another:","Chun, mi ṭhahai le rorêltuhai le mipuihai hmaa chun, “Sin hi a nasain a lien êm a, kula hin ei inhlatin ei indar hle el sih a;"
"in what place soever ye hear the sound of the trumpet, resort ye thither unto us; our God will fight for us.","tawtawrâwt ri in hrietna hmun hmuna chun keini kuom tieng hung tlân khâwm unla; ei Pathien chun mi dopêk a tih,” ka tih a."
So we wrought in the work: and half of them held the spears from the rising of the morning till the stars appeared.,"Chuong ang chun sin chu kan thawh a, chun, a zâtve chun vârṭiena inthawka arasi inlang chen feihai chu an kawl zing a."
"Likewise at the same time said I unto the people, Let every one with his servant lodge within Jerusalem, that in the night they may be a guard to us, and may labor in the day.","Chuong ang bawkin chuong lai chun mipuihai kuoma chun, “Zâna mi vênga, sûna sin thaw dingin tu- khawm an siehlawhai leh Jerusalem sûngah riek vawng raw hai se,” ka tih a."
"So neither I, nor my brethren, nor my servants, nor the men of the guard that followed me, none of us put off our clothes, every one went with his weapon to the water.","Chuongchun, kei khawm, ka unauhai khawm, ka tlangvâlhai khawm, vêngtu a mi zui hlakhai khawm, tukhawma kan silfên kan hlîp hrim hrim nawh a, hriemhrei inbel pum zingin tui tienga chun kan fe hlak a nih."
Then there arose a great cry of the people and of their wives against their brethren the Jews.,"Chun, mipuihai le an nuhmeihai chu an unau Judahai chunga chierin an khêk ta mur mur el a,"
"For there were that said, We, our sons and our daughters, are many: let us get grain, that we may eat and live.","“Eini rawi hi ei naupasalhai le ei naunuhmeihai leh tam tâwk tak ei na; bu hi inchûin inchû el ei tiu, ei fâka ei hring theina dingin,” ti dâm an um a."
"Some also there were that said, We are mortgaging our fields, and our vineyards, and our houses: let us get grain, because of the dearth.","Chun, ṭhenkat, “Ei lohai, ei inhai, ei grêp huonhai hrên dingin ei sie sih a, ṭâm lei hin bu hi ân chûin inchû el ei tiu,” ti dâm khawm an um bawk a."
"There were also that said, We have borrowed money for the king’s tribute upon our fields and our vineyards.","“Ei lohai, ei grêp huonhai hrên dinga siein lal kuoma dâm sie chawi dingin sum dâm ei pûk a."
"Yet now our flesh is as the flesh of our brethren, our children as their children: and, lo, we bring into bondage our sons and our daughters to be servants, and some of our daughters are brought into bondage already: neither is it in our power to help it; for other men have our fields and our vineyards.","Ei taksa chu ei unauhai taksa ang bawk a na; ei nauhai khawm an nauhai ang bawk an ni sih a; nisienla- khawm, hi, ei naunuhmeihai, ei naupasalhai hi siehlawa um dingin suokah ei inlûttir takngiel ding a ni hi; ei naunuhmei ṭhenkhat lem chu suokah an lût ta nghe ngheh a, san ngaina hre nghâl lo me; mihaiin ei huonhai le ei grêp huonhai chu an nei ta sih a,” ti dâm an um nuol bawk a."
And I was very angry when I heard their cry and these words.,Chuong thuhai le an rihâu chu ka hrietin ka lunginsen êm êm el a.
"Then I consulted with myself, and contended with the nobles and the rulers, and said unto them, Ye exact usury, every one of his brother. And I held a great assembly against them.","Chuongchun, ka lungrilin ka ngaituo a, mi ṭhahai le rorêltuhai chu ka khak a, an kuomah, “Mi tinin in unauhai a pung hnawtin sum in inpûktir zing el a,” ka tih a. Chun, an chungchâng chu ngaituo dingin mi ka ko khâwm ṭeu el a."
"And I said unto them, We after our ability have redeemed our brethren the Jews, that were sold unto the nations; and would ye even sell your brethren, and should they be sold unto us? Then held they their peace, and found never a word.","An kuomah, “Hnam dang kuoma zawra um ei unau Judahai chu ei thei ang angin ei intlan a; nangni hin in unauhai hi zawr in tum a ni maw? Nangni kuoma ngei hin zawr an ni ding a ni maw?” ka tih a. Chuong- chun, an to zing a, dawnna ding ieng- khawm an hriet nawh a."
"Also I said, The thing that ye do is not good: ought ye not to walk in the fear of our God, because of the reproach of the nations our enemies?","“In thil thaw hi a ṭha naw tawp el a nih: ei hmêlma, hnam danghai mi hrilsietna lei hin ei Pathien chu ṭiha in um a ṭûl a ni naw am a nih?"
"And I likewise, my brethren and my servants, do lend them money and grain. I pray you, let us leave off this usury.",Kei le ka unauhai le ka mihai khawmin kan sum le bu kan inpûktir ve bawk in sawnnaw. A pung hnawta inpûktir hi bân dai ei tiu khai.
"Restore, I pray you, to them, even this day, their fields, their vineyards, their oliveyards, and their houses, also the hundredth part of the money, and of the grain, the new wine, and the oil, that ye exact of them.","Vawisûn ngei hin an lohai, an grêp huonhai, an oliv huonhai, an inhai le, an sum le an bu le an uoin le hriek hmun zaa hmun khat in lâk hlak khawm chu, pe nâwk vawng ro khai,” ka ti bawk a."
"Then said they, We will restore them, and will require nothing of them; so will we do, even as thou sayest. Then I called the priests, and took an oath of them, that they would do according to this promise.","Chuongchun, anni chun, “Pe nâwk vawng kan tih, annia inthawk- in iengkhawm phût naw ning ungah; i ti ang tak chun thâwng kan tih,” an tih a. Chuongchun, thiempuhai ka ko a, an hmaah chu thutiem ang taka thaw ngei ding chun kân khâmtir a."
"Also I shook out my lap, and said, So God shake out every man from his house, and from his labor, that performeth not this promise; even thus be he shaken out, and emptied. And all the assembly said, Amen, and praised Jehovah. And the people did according to this promise.","Ka dierkei chu ka thin a, “Hi thutiem anga thaw naw taphawt chu Pathien chun a ina inthawk le a sin- thawa inthawkin hieng ang hin thinthla raw se; hieng anga thin thlâkin um sienla, sukruokin um raw se,” ka tih a. Chun, a pungkhâwmhai po po chun, “Amen,” an tih a, Lalpa an inpâk a. Chun, mipuihai chun chu thutiem ang chun an thaw tah a."
"Moreover from the time that I was appointed to be their governor in the land of Judah, from the twentieth year even unto the two and thirtieth year of Artaxerxes the king, that is, twelve years, I and my brethren have not eaten the bread of the governor.","Chu naw khawm chu Juda rama anni awptu dinga ruot ka ni china inthawk, lal Artazerzia kum sâwmhni ân lal kuma inthawka kum sâwmthum pahni ân lal kum chen, kum sâwm pahni sûng chun kei le ka unauhai hin ram awptu puol bei hrim hrim khawm kan fâk ngai nawh a."
"But the former governors that were before me were chargeable unto the people, and took of them bread and wine, besides forty shekels of silver; yea, even their servants bare rule over the people: but so did not I, because of the fear of God.","Nisienlakhawm, kha hmaa ram awptu ka hmaa lo umhai chu mihai chungah lu an lo ling hleh a, tangka shekel sâwmli tiem loin an beihai le uoinhai an lâkpêk hlak a; a chu nâksapah an siehlawhai chu mihai chunga chun an insuklal hle hlak a; amiruokchu, kei chun chu Pathien ṭina leiin chuong ang chun ka thaw ve nawh."
"Yea, also I continued in the work of this wall, neither bought we any land: and all my servants were gathered thither unto the work.","Anih, hi kul sin thaw hin ka um zing a, ram hrim hrim inchâwk khawm kân châwk nawh a: ka mihai po po khawm sin chu thawin chutaka chun an um khâwm zing a nih."
"Moreover there were at my table, of the Jews and the rulers, a hundred and fifty men, besides those that came unto us from among the nations that were round about us.",Chu chau khawm chu ni loin kan vêla hnam danghai laia inthawk- a hunghai tiem loin Judahai le rorêl- tuhai laia mi ka dawkâna awt hlak mi za le sâwmnga an um zing a nih.
"Now that which was prepared for one day was one ox and six choice sheep; also fowls were prepared for me, and once in ten days store of all sorts of wine: yet for all this I demanded not the bread of the governor, because the bondage was heavy upon this people.","Chun, ni khat dinga an buotsai chu sebâwngchal pakhat le berâm paruk a ṭha ṭhieu a na; chun, ârhai khawm ka ta dingin an buotsai a, ni sâwm dan peiah uoin hran hran tam tâwk tak leh; chuong ang chun buot- sai hai sienla khawm hieng mihai tuor hi a rik êm leiin ram awptu puol bei chu ka phût naw hrim hrim a nih."
"Remember unto me, O my God, for good, all that I have done for this people.","Aw ka Pathien, hieng mihai ta dinga ka thilthawhai po po hi ka ṭhatna dingin hre zing rawh aw."
"Now it came to pass, when it was reported to Sanballat and Tobiah, and to Geshem the Arabian, and unto the rest of our enemies, that I had builded the wall, and that there was no breach left therein (though even unto that time I had not set up the doors in the gates),","Chun, Sanballat le Tobia le Arab mi Gesem le kan hmêlma dang hrim hrimhaiin kulhai ka siem a, a chimna lai hrim hrim a um ta nawh ti an hang hriet chun, (amiruokchu, chuong lai chun kawthaia chun kawt- khârhai chu ka la rem nawh a),"
"that Sanballat and Geshem sent unto me, saying, Come, let us meet together in one of the villages in the plain of Ono. But they thought to do me mischief.","Sanballat le Gesem chun, “Hung la, Ono phaia khuo pakhatah intuok khâwm ei tiu,” tiin thu an mi hung inphur a. Nisienlakhawm, ka chunga thil ṭha naw thaw tum an lo ni zing a."
"And I sent messengers unto them, saying, I am doing a great work, so that I cannot come down: why should the work cease, whilst I leave it, and come down to you?","Kei chun an kuomah, “Sin ropui- tak ka thawh a, ka hung thla thei nawh, ieng dingin am in kuoma ka hung thlâk kârin sin chu châwl el a ta?” tiin mi ka tir a."
And they sent unto me four times after this sort; and I answered them after the same manner.,"Chuong ang ruok chun vawi li thu an hung inphur a, chuong ang ruok chun kei khawma ka dawn a."
"Then sent Sanballat his servant unto me in like manner the fifth time with an open letter in his hand,","Chuongchun, Sanballat chun chuong ang bawk chun a vawi nganaa chun a siehlaw chu lekha châr loa chawiin ka kuomah a hung tir a;"
"wherein was written, It is reported among the nations, and Gashmu saith it, that thou and the Jews think to rebel; for which cause thou art building the wall: and thou wouldest be their king, according to these words.","chutaka chun, “Nang le Judahai hin hel in lungril a, chuleiin, kul chu i siem a nih ti thu hnam danghai lai chun ân thang a, Gesem khawm hin a hril bawk a; chun, an hril pei dâna chun nang hi an lal ding i ni âwm a."
"And thou hast also appointed prophets to preach of thee at Jerusalem, saying, There is a king in Judah: and now shall it be reported to the king according to these words. Come now therefore, and let us take counsel together.","Chun, ‘Juda rama chun lal a um,’ tiha i chanchin Jerusalema hril vêl dingin zâwlnei khawm i ruot hiel ta bawk a; hieng thu hi lal kuoma chun hril vak ngei an ta. Chuleiin, hung la, lo inrâwn ei ti khai,” ti hi a chuong a."
"Then I sent unto him, saying, There are no such things done as thou sayest, but thou feignest them out of thine own heart.","Chuongchun, a kuomah, “I hril ang hrim hrim hin iengkhawm thaw a um nawh, i phuokfâwm el a ni hi,” tiin mi ka tir a."
"For they all would have made us afraid, saying, Their hands shall be weakened from the work, that it be not done. But now, O God, strengthen thou my hands.","“An sinthaw chu an puitling thei nawna dingin an kuthai chu suk- sietin um a tih,” tiha mi hrilṭi nuom ruok an nih. Chuongchun, aw Pathien, ka kuthai hi mi hung suk- hrâtpêk rawh aw."
