en,hmr
"Hear my voice according unto thy lovingkindness: Quicken me, O Jehovah, according to thine ordinances.","I zainêmna ang peiin ka râwl hi ngai la, Aw LALPA, i rorêlnahai ang peiin mi sukhar rawh."
They draw nigh that follow after wickedness; They are far from thy law.,"Ngaituona suol hnawttuhai chun an hung hnai a, Anni chu i dân hlata um an nih."
"Thou art nigh, O Jehovah; And all thy commandments are truth.","Aw LALPA, nang chu i hnai a, I thupêk po po chu thutak a nih."
"Of old have I known from thy testimonies, That thou hast founded them for ever. ר RESH.","Tienlaiin, i thuinhriettirhaia inthawkin, Chuong chu kumkhawtluonga dingin i sukdet ti ka lo hriet tah."
"Consider mine affliction, and deliver me; For I do not forget thy law.","Ka rimsikzie hi ngaituo la, mi sanhim rawh, I dân chu ka theinghil ngai si nawh a."
"Plead thou my cause, and redeem me: Quicken me according to thy word.","Ka thu mi hrilpuiin mîn tlan la, I thu ang peiin mi sukhar rawh."
Salvation is far from the wicked; For they seek not thy statutes.,"Sandamna chu mi rilohaia inthawk chun a hla a nih, I thuruothai chu an zawng naw leiin."
"Great are thy tender mercies, O Jehovah: Quicken me according to thine ordinances.","Aw LALPA, i lainatnahai chu a nasa a nih, I rorêlnahai ang peiin mi sukhar rawh."
Many are my persecutors and mine adversaries; Yet have I not swerved from thy testimonies.,"A mi suknawmnatu le a mi dotuhai chu tamtak an nih. Nisienlakhawm, i thu inhriettirhai chu ka pêt san nawh."
"I beheld the treacherous, and was grieved, Because they observe not thy word.","Vervêktaka thawtuhai chu, ka en a, ka lungni nawh a, I thu an zâwm naw leiin."
"Consider how I love thy precepts: Quicken me, O Jehovah, according to thy lovingkindness.","I thununna thuhai ka ngainatzie hi ngaituo la, Aw LALPA, i ngilneina ang peiin mi sukhar rawh."
The sum of thy word is truth; And every one of thy righteous ordinances endureth for ever. ש SHIN.,"I thu inpawl khâwm chu thutak a nih, I rorêlna fel tinrêng khawm hi kumkhawtluongin um zing a tih."
Princes have persecuted me without a cause; But my heart standeth in awe of thy words.,"Mi lienhaiin a san um loin an mi suknawmna a, Nisienlakhawm, ka lungril chun i thuhai a nih a ṭî chu."
"I rejoice at thy word, As one that findeth great spoil.","I thua hin ka hlim a nih, Thil ropuitak râllâka hmutu angin."
I hate and abhor falsehood; But thy law do I love.,"Khêl hi ka theidain ka tirdak a, I dân ruok chu ka ngaina a nih."
"Seven times a day do I praise thee, Because of thy righteous ordinances.","Ni khatah vawi sari kân pâk hlak che a nih, I rorêl felhai leiin."
Great peace have they that love thy law; And they have no occasion of stumbling.,"I dân ngainatuhai chun thla- muongna nasatak an nei a, Tlûkna hrim hrim an nei nawh."
"I have hoped for thy salvation, O Jehovah, And have done thy commandments.","Aw LALPA, i sandamna ka beisei zing a, I thupêkhai angin ka thaw hlak."
My soul hath observed thy testimonies; And I love them exceedingly.,"Ka hringna hin i thuinhriet- tirhai chu a zâwm hlak a, Ka ngaina êm êm a nih."
I have observed thy precepts and thy testimonies; For all my ways are before thee. ת TAV.,"I thununna thuhai le i thuinhriettirhai chu ka zâwm hlak a, Ka um dân po po khawm hi i hmaa um a ni sih a."
"Let my cry come near before thee, O Jehovah: Give me understanding according to thy word.","Aw LALPA, ka khêkri hi i hmaah hung hnai raw se, I thu ang peiin hrietthiemna mi pe rawh."
Let my supplication come before thee: Deliver me according to thy word.,Lunginsiet ka hnina hi i hmaah tlung raw se: I thu ang peiin mi sanhim rawh.
Let my lips utter praise; For thou teachest me thy statutes.,"Ka hmûr hin inpâkna thu hril raw se, Nangin i thuruot thuhai chu i mîn chûktir hlak leiin."
Let my tongue sing of thy word; For all thy commandments are righteousness.,"Ka lei hi,i thu inpâkin hla sak raw se, I thupêk po po chu felna a ni leiin."
Let thy hand be ready to help me; For I have chosen thy precepts.,"I kut chu mi ṭhangpui dinga inzosain um raw se, I thununna thuhai chu ka thlang sih a."
"I have longed for thy salvation, O Jehovah; And thy law is my delight.","Aw LALPA, i sandamna chu ka châk hlak a, I dân chu ka lâwmna a nih."
"Let my soul live, and it shall praise thee; And let thine ordinances help me.","Ka hringna hi hring raw se; chuongchun, ân pâk ding che annâwm, I rorêlnahai khawmin mi ṭhangpui raw se."
I have gone astray like a lost sheep; seek thy servant; For I do not forget thy commandments.,"Berâm inhmang angin kân vâkhmang a, i siehlaw hi zawng rawh. I thupêkhai chu ka theinghil ngai si nawh."
"Help, Jehovah; for the godly man ceaseth; For the faithful fail from among the children of men.","LALPA, mi ṭhangpui rawh, Pathien ngaisak mi an um ta si nawh a, Mihriem nauhai laia hin mi ringum chu an bo ta sih a."
"They speak falsehood every one with his neighbor: With flattering lip, and with a double heart, do they speak.","Mi tin chun an vênghai kuomah thu teplo mei mei an hril hlak sih a; Mi inpâk tehlêmna hmûr le, hlêmna lungril putin thu an hril hlak a;"
"Jehovah will cut off all flattering lips, The tongue that speaketh great things;","LALPA chun inpâk tehlêmna hmûr po po chu ât thlâng a ta, Thu chapotak hrilna lei le chun."
"Who have said, With our tongue will we prevail; Our lips are our own: who is lord over us?","Anni chun, “Ei lei hin hnêng ei ta, Ei hmûrhai hi eini ta ngei a ni annâwm, tu am ie ei chunga lala um chu?” an ti hlak."
"Because of the oppression of the poor, because of the sighing of the needy, Now will I arise, saith Jehovah; I will set him in the safety he panteth for.","LALPA chun, “Rimsihai an nêksâwr lei le, pasiehai inrûm lei chun, Tho nghâl el ka ta, An innuisan chu himtakin inumtir ka tih,” a tih a."
"The words of Jehovah are pure words; As silver tried in a furnace on the earth, Purified seven times.","LALPA thuhai hi thu inthieng- tak a na, Tangka hnuoi chunga rawtuina meia fieh a, Vawi sari sukthieng ta hnung ang hi a nih."
"Thou wilt keep them, O Jehovah, Thou wilt preserve them from this generation for ever.","Aw LALPA, anni chu nangin vawng ṭhâng i ta, Hieng ṭhangtharhaia inthawk hin kumkhuoin humhim tâng i tih."
"The wicked walk on every side, When vileness is exalted among the sons of men.","Mihriem nauhai lai hin suolna chu chawimawia a umin, Mi rilohai chu an invâk vêl ruoi hlak."
"In my distress I cried unto Jehovah, And he answered me.","Ka lunginzîng ni chun LALPA chu ka ko a, Chuongchun, ama chun a mi hung dawn a."
"Deliver my soul, O Jehovah, from lying lips, And from a deceitful tongue.","Aw LALPA, hmûr khêlhliphai le, lei mi hlêm hmanghaia inthawk chun, Ka hringna hi sanhim rawh."
"What shall be given unto thee, and what shall be done more unto thee, Thou deceitful tongue?","Nang lei mi hlêm hmang, I kuomah ieng am pêng an ti cheh a, ieng am belsâng an ti cheh a?"
"Sharp arrows of the mighty, With coals of juniper.","Mi hrât thal inzumtakhai, Juniper thing inlinghai leh,"
"Woe is me, that I sojourn in Meshech, That I dwell among the tents of Kedar!","Meshekhai rama ka châm le, Kedarhai puon ina ka um hi, ka chung a va rik de!"
My soul hath long had her dwelling With him that hateth peace.,"Ka hringna hin inremna theidatu kuomah, Sâwttak umna a nei tah a."
"I am for peace: But when I speak, they are for war.","Kei chu inrem ka nuom a, Nisienlakhawm, thu ka hril phingleh indo an nuom hlak."
I will lift up mine eyes unto the mountains: From whence shall my help come?,"Tlâng tiengahai khin ka mit hang inlên ka ta, Khâwtienga inthawkin am a mi ṭhangpuina ding hung tlung a ta?"
"My help cometh from Jehovah, Who made heaven and earth.","A mi ṭhangpuina ding chu LALPA, Hnuoi le vân siemtu kuoma inthawkin hung tlung a tih."
He will not suffer thy foot to be moved: He that keepeth thee will not slumber.,"Ama chun i ke chu khaisawn phal naw nih a, Nangma vêngtu chu inlusu naw ni."
"Behold, he that keepeth Israel Will neither slumber nor sleep.","Ngai ta, Israelhai vêngtu chu, Inlusuin, ininnghil bawk naw ni."
Jehovah is thy keeper: Jehovah is thy shade upon thy right hand.,"LALPA chu nangma vêngtu a nih, LALPA chu i changtienga hlietu che a nih."
"The sun shall not smite thee by day, Nor the moon by night.","Sûnah nisa chun em naw ni cheh a, Zâna chun thlain em bawk naw ni che."
Jehovah will keep thee from all evil; He will keep thy soul.,"LALPA chun suol tinrênga inthawk chun vêng a ti cheh a, I hringna chu vêng a tih."
Jehovah will keep thy going out and thy coming in From this time forth and for evermore.,"LALPA chun i suok le i lût chu vêng a ti che, Tuta inthawka kumkhaw- tluongin."
"I was glad when they said unto me, Let us go unto the house of Jehovah.","“LALPA inah fêng ei tiu,” Ka kuoma an ti lai khan ka lâwm a."
"Our feet are standing Within thy gates, O Jerusalem,","Aw Jerusalem, i kul kawtkhâr sûngah, Kan kehai chu a ngîr ta hi."
"Jerusalem, that art builded As a city that is compact together;","Jerusalem, khawpui indin thar, Detindo taka rem chu."
"Whither the tribes go up, even the tribes of Jehovah, For an ordinance for Israel, To give thanks unto the name of Jehovah.","LALPA hming inpâk dingin, Chutaka chun hnamhai chu an hang fe hlak, LALPA hnamhai chu, Israelhai kuoma thuinhriettirna dingin."
"For there are set thrones for judgment, The thrones of the house of David.","Chutaka chun rorêlna dingin ṭhungphahai daw a ni sih a, David sûnghai lalṭhungphahai chu."
Pray for the peace of Jerusalem: They shall prosper that love thee.,"Jerusalem thlamuongna ding hnipêk ro, Nangma ngainatuhai chu thawveng an tih."
"Peace be within thy walls, And prosperity within thy palaces.","I kul sûnga chun thlamuongna um sienla, I lal inhaia chun thawvengna um raw se."
"For my brethren and companions’ sakes, I will now say, Peace be within thee.","Ka unauhai le ka ruolhai leiin, “I sûngah thlamuongna um raw se,” tîng ka tih."
For the sake of the house of Jehovah our God I will seek thy good.,"LALPA ei Pathien in lei chun, I ṭhatna ding zawng ka tih."
"Unto thee do I lift up mine eyes, O thou that sittest in the heavens.","Aw, nang vâna ṭhung hlak, Nanga tieng ka mit ka hung inlên hlak."
"Behold, as the eyes of servants look unto the hand of their master, As the eyes of a maid unto the hand of her mistress; So our eyes look unto Jehovah our God, Until he have mercy upon us.","Ngai ta, siehlawhai mitin an pu kut tieng a en hlak ang le, Siehlawnu mitin a pi kut tieng a en hlak angin, Keini mit khawma LALPA kan Pathien kuom tieng a en zing a nih, Keini a mi lunginsiet hmakhat chun."
"Have mercy upon us, O Jehovah, have mercy upon us; For we are exceedingly filled with contempt.","Aw LALPA, mi lunginsiet rawh, mi lunginsiet rawh, Hmusitna kan tuor nasa taluo tah."
"Our soul is exceedingly filled With the scoffing of those that are at ease, And with the contempt of the proud.","Mi inhawitirhai dêuna le, Chapohai hmusitnain, Kan hringna hi a sukchau sâwt taluo a nih."
"If it had not been Jehovah who was on our side, Let Israel now say,","“Eini tienga ṭhang chu LALPA ni naw sien chu,” Israelhaiin ti raw se."
"If it had not been Jehovah who was on our side, When men rose up against us;","“Mihaiin an mi thaw lai khan, Eini tienga ṭhang chu LALPA ni naw sienla chu;"
"Then they had swallowed us up alive, When their wrath was kindled against us:","Kha lai khan anni chun ei hring pumin mi lem tâng an tih, Ei chunga an lung a chawk lai khan:"
"Then the waters had overwhelmed us, The stream had gone over our soul;","Kha lai ngei khan tuihai chun mi chîm tlum tâng an ta, Vadung chun ei hringna hi vurhmang tâng a tih;"
Then the proud waters had gone over our soul.,"Kha lai ngei khan tui chapo chun ei hringna hi vur hmang tâng a ta,"
"Blessed be Jehovah, Who hath not given us as a prey to their teeth.","Sase anga se dinga an haa mi pe nâwtu, LALPA chu inpâkin um raw se."
"Our soul is escaped as a bird out of the snare of the fowlers: The snare is broken, and we are escaped.","Châng kamtu chânga vate a suok angin ei hringna hi a suok tah a, Châng chu a se tah a, eini hi ei suok ta hlau a nih."
"Our help is in the name of Jehovah, Who made heaven and earth.","Eini mi ṭhangpuina ding chu, LALPA hnuoi le vân siemtu hmingah a um,” tiin."
"They that trust in Jehovah Are as mount Zion, which cannot be moved, but abideth for ever.","LALPA ringtuhai chu Zion tlâng sukhnîng ruol lo, kumkhawtluonga um zing ding ang chu an nih."
"As the mountains are round about Jerusalem, So Jehovah is round about his people From this time forth and for evermore.","Tlânghai chu Jerusalem vêla a um angin, LALPA chu a mihai vêlah a um hlak, Tuta inthawka kumkhaw- tluongin."
For the sceptre of wickedness shall not rest upon the lot of the righteous; That the righteous put not forth their hands unto iniquity.,"Rîtlona lalhmawl chu mi fel chan chunga chun ân nghat âwm si nawh a, Mi felhai chun an kuthaia khawhlona an ban nawna dingin."
"Do good, O Jehovah, unto those that are good, And to them that are upright in their hearts.","Aw LALPA, ṭhataka umhai chunga chun ṭhatakin thaw la, An lungril indiktaka umhai chunga khawm."
"But as for such as turn aside unto their crooked ways, Jehovah will lead them forth with the workers of iniquity. Peace be upon Israel.","An lampui kâwia pêthai ruok hi chu, LALPA chun thil suksuoltuhai leh ṭhuoi hmang a tih; Israelhai chunga chun thlamuongna um raw se."
"When Jehovah brought back those that returned to Zion, We were like unto them that dream.","LALPAIN Zion salhai a ṭhuoi kîr lai khan, Manga mangtuhai ang el ei na,"
"Then was our mouth filled with laughter, And our tongue with singing: Then said they among the nations, Jehovah hath done great things for them.","Chuong lai chun ei bau chu innuiin a sip a, Ei lei chu hla sakin. Chuong lai chun hnam tin laia chun, “LALPAIN an ta dingin thil ropuitakhai a thawpêk a nih,” an tih a."
"Jehovah hath done great things for us, Whereof we are glad.","LALPA chun thil ropuitakhai a mi thawpêk a, Ei lâwm hleh a."
"Turn again our captivity, O Jehovah, As the streams in the South.","Aw LALPA, sala kan intâng hi mi ṭhuoi kîr nâwk la, Sim rama vadunghai angin,"
They that sow in tears shall reap in joy.,Mitthli tla puma tûtuhai chun hlimtakin sîk an tih.
"He that goeth forth and weepeth, bearing seed for sowing, Shall doubtless come again with joy, bringing his sheaves with him.","Ṭap pumin bu chi fe suokpui sien khawm, A bu phalhai chawiin hlimtakin hung nâwk a tih."
"Except Jehovah build the house, They labor in vain that build it: Except Jehovah keep the city, The watchman waketh but in vain.","LALPAIN in a bâwl naw chun, A bâwltuhai chu an inrim thlâwn el a nih: LALPAIN khawpui a vawngṭha naw chun, A vêngtu chu a meng thlâwn el a nih."
"It is vain for you to rise up early, To take rest late, To eat the bread of toil; For so he giveth unto his beloved sleep.","Zîngkâr in tho va, inhnutakin in châwl a, Sininrimna bu in fâk hlak hi, in ta dingin a thlâwn el a nih. Hieng ang hin a mi dittak chu a ininnghiltir hlak a nih."
"Lo, children are a heritage of Jehovah; And the fruit of the womb is his reward.","Ngai ta, nau le têhai hi LALPAA inthawka ei rochan an na, Rîla ra hi a lâwmman mi pêk a nih."
"As arrows in the hand of a mighty man, So are the children of youth.","Vânglai nauhai chu, Mi hrât kuta thal umhai ang hi an nih."
"Happy is the man that hath his quiver full of them: They shall not be put to shame, When they speak with their enemies in the gate.","A thal bâwm naua sip nei mi chu lâwmtakin a um hlak a nih: Kul kawtkhâra an dohai an biek lai khawmin, Muolpho naw ni hai."
"Blessed is every one that feareth Jehovah, That walketh in his ways.","LALPA ṭî taphawt chu an hamṭha ie, A lampui hrawtuhai chu."
"For thou shalt eat the labor of thy hands: Happy shalt thou be, and it shall be well with thee.","I kut sininrim ra chu i fâk ding a ni sih a, Lâwmtakin um i ta, thawvengin um bawk i tih."
"Thy wife shall be as a fruitful vine, In the innermost parts of thy house; Thy children like olive plants, Round about thy table.","I nuhmei chu i in sûng rila chun, grêp hrui ra nuomtak angin um a ta, I nauhai chu i dâwkân vêla chun oliv kakhai angin um an tih."
"Behold, thus shall the man be blessed That feareth Jehovah.","Ngai ta, LALPA ṭî mi chu, Chuong ang chun malsâwmin um an tih."
Jehovah bless thee out of Zion: And see thou the good of Jerusalem all the days of thy life.,"LALPA chun Ziona inthawkin malsâwm a ti che: Chuongchun, i dam sûng po chun Jerusalem ṭhatna chu hmûng i tih."
"Yea, see thou thy children’s children. Peace be upon Israel.","Anih, i tuhai chu la hmûng i ta; Israelhai chunga chun thlamuongna um raw se."
"Many a time have they afflicted me from my youth up, Let Israel now say,","“Ka naupang chîntea inthawk mihaiin vawi tamtak an mi suklungzîng a,” Israelhaiin ti raw se."
Many a time have they afflicted me from my youth up: Yet they have not prevailed against me.,"“Ka naupang chîntea inthawk mihaiin vawi tamtak an mi suklungzîng a, Nisienlakhawm, an mi hne si nawh."
The plowers plowed upon my back; They made long their furrows.,"Hnuoi inlettuhai chun ka ruongzânga hin hnuoi an inlet a, An changkuong tlâng thlûrhai chu an suksei hleh a."
Jehovah is righteous: He hath cut asunder the cords of the wicked.,"LALPA chu a fel a nih: Mi rilohai hruihruolhai chu a ât tan tah a,” tiin."
"Let them be put to shame and turned backward, All they that hate Zion.","Anni chu muolpho le intlânsiettirin um raw hai se, Zion theidatuhai po po chu."
"Let them be as the grass upon the housetops, Which withereth before it groweth up;","Ân ṭhang insâng hmaha vuoi el hlak, In chunga hlobet angin um raw se."
"Wherewith the reaper filleth not his hand, Nor he that bindeth sheaves, his bosom:","Chu hlobet chun bu âttuin a kut a suksip ngai nawh a, Buphal intêltuin a ângsûng a suksip ngai bawk nawh."
"Neither do they that go by say, The blessing of Jehovah be upon you; We bless you in the name of Jehovah.","“LALPA malsâwmna in chungah um raw se, LALPA hmingin mal kan sâwm cheu hi,” A fe khêltuhaiin an ti ngai bawk nawh."
"How long, O Jehovah? wilt thou forget me for ever? How long wilt thou hide thy face from me?","Aw LALPA, ieng chen am i mi theinghil kumkhuo ding a na? Ieng chen am ka kuoma hin i hmai i thup ding a na?"
"How long shall I take counsel in my soul, Having sorrow in my heart all the day? How long shall mine enemy be exalted over me?","Sûnnithlâkin ka lungrila lungngaina neiin, Ieng chen am ka lungvarah rem ka ruot ding a na? Ieng chen am ka hmêlma chu ka chungah chawimawiin a um ding a na?"
"Consider and answer me, O Jehovah my God: Lighten mine eyes, lest I sleep the sleep of death;","Aw LALPA ka Pathien, ngaituo la, mi hung dawn ta khai, Ka mit mi sukvarpêk rawh, chuong naw chun thina inin in rawi ka tih."
"Lest mine enemy say, I have prevailed against him; Lest mine adversaries rejoice when I am moved.","Ka hmêlma chun, “Ama ka ngam tah,” ti rawi a tih, Kân hnîng chun a mi dotuhai lâwm rawi an tih."
But I have trusted in thy lovingkindness; My heart shall rejoice in thy salvation.,"Nisienlakhawm, kei chun chu i ngilneina hi ka ring a nih, I mi sandamnaa hin ka lungril chu lâwm a tih."
"I will sing unto Jehovah, Because he hath dealt bountifully with me.","Ka chunga ṭhataka a thaw ta leiin, LALPA chawimawiin hla sak ka tih."
"Out of the depths have I cried unto thee, O Jehovah.","Aw LALPA, tui inthûktakainthawk hin ka ko che hi."
"Lord, hear my voice: Let thine ears be attentive To the voice of my supplications.","LALPA, ka râwl hi lo ngai la, Lunginsiet ka hnina râwl hi, I nain lo ngai raw se."
"If thou, Jehovah, shouldest mark iniquities, O Lord, who could stand?","LALPA, nangin rîtlonahai în chik chun, Aw LALPA, tu am ngîr an ti leh?"
"But there is forgiveness with thee, That thou mayest be feared.","Nisienlakhawm, i kuomah ngaidamna a um a nih, Ṭiha i um theina dingin."
"I wait for Jehovah, my soul doth wait, And in his word do I hope.","LALPA chu ka nghâk zing a, ka hringna hin a nghâk zing a, A thu khawm ka beisei a nih."
"My soul waiteth for the Lord More than watchmen wait for the morning; Yea, more than watchmen for the morning.","Vêngtuhaiin khawvar an thlîr nêka nasain, Anih, vêngtuhaiin khawvar an thlîr nêka nasa hmanin, Ka hringna hin LALPA chu a thlîr zing hlak a nih."
"O Israel, hope in Jehovah; For with Jehovah there is lovingkindness, And with him is plenteous redemption.","Aw Israelhai, LALPA chu beisei ro; LALPA kuoma chun ngilneina a um sih a, A kuomah intlanna tamtak a um bawk a."
And he will redeem Israel From all his iniquities.,"Chuongchun, ama chun Israelhai chu, An rîtlona po poa inthawkin sansuok a tih."
"Jehovah, my heart is not haughty, nor mine eyes lofty; Neither do I exercise myself in great matters, Or in things too wonderful for me.","LALPA, ka lungril hi a chapo nawh a, ka mithai hi ân sâng bawk nawh; Thil ropuitakhaiah ka ṭhangsa ve ngai nawh, Ka ta dinga thilmak taluohaia khawm."
"Surely I have stilled and quieted my soul; Like a weaned child with his mother, Like a weaned child is my soul within me.","Ka hringna hi kân awitleiin kân totir ṭawk ṭawk ta ngei a, Naupang nene nêk bân tah a nu kuoma a um angin, Ka hringna hi naupang nêne nêk bân tah angin ka kuomah a um a."
"O Israel, hope in Jehovah From this time forth and for evermore.","Aw Israelhai, LALPA chu beisei ro. Tuta inthawka kumkhaw- tluongin."
"Jehovah, remember for David All his affliction;","LALPA, David chu a rinumtuorna po po Hrietpui la."
"How he sware unto Jehovah, And vowed unto the Mighty One of Jacob:","LALPA kuoma ṭawng inkhâma, Jakob Mi Hrât kuoma thu a tiemzie kha:"
"Surely I will not come into the tabernacle of my house, Nor go up into my bed;","“Ka umna inah lût dêr naw ning a, Ka khumah kai bawk naw ning a."
"I will not give sleep to mine eyes, Or slumber to mine eyelids;","Ka mithai hi insîm phal naw ning a, Ka mit vunhai hi insîm phal bawk naw ning ah."
"Until I find out a place for Jehovah, A tabernacle for the Mighty One of Jacob.","LALPA hmun ding ka zawng suok hmakhat chun, Jakob Mi Hrât umna ding chu,” tiin."
"Lo, we heard of it in Ephrathah: We found it in the field of the wood.","Ngai ta, a thu chu Ephrathaah kan hriet a, Rampui phûla chun kan hmu tah a."
We will go into his tabernacles; We will worship at his footstool.,"Ama umnaahai chun lût ei ta, A ke innghatna bula chun chibai bûk ei tih."
"Arise, O Jehovah, into thy resting-place; Thou, and the ark of thy strength.","Aw LALPA, tho la, i châwl hmun dinga chun lût rawh, Nang le i hrâtna bâwm leh."
Let thy priests be clothed with righteousness; And let thy saints shout for joy.,"I thiempuhai chu felnain inthuom sienla, I mi inthienghai chu hlimin khêk raw hai se."
For thy servant David’s sake Turn not away the face of thine anointed.,"I siehlaw David leiin, I hriek nâl hmêl chu innghat kîrtir naw rawh."
Jehovah hath sworn unto David in truth; He will not turn from it: Of the fruit of thy body will I set upon thy throne.,"LALPA chun David kuomah thutakin ṭawng ân khâm tah a, Chu chu nghatsan naw nih. “I taksa raa mi i lalṭhungphaa chun inṭhungtir ka ta;"
"If thy children will keep my covenant And my testimony that I shall teach them, Their children also shall sit upon thy throne for evermore.","I nauhai chun ka thuthlung le, Ka thuinhriettir, anni ka lân chûktir ding chu, an zâwm chun, An nauhai khawm kumkhawtluongin i lalṭhungphaa chun ṭhung pei an tih,” tiin."
For Jehovah hath chosen Zion; He hath desired it for his habitation.,LALPA chun Zion chu a thlang sih a; A umna dingin a dit a nih.
This is my resting-place for ever: Here will I dwell; for I have desired it.,"“Hi hi kumkhuoa dinga ka châwl hmun ding a nih, Hitaka hin um zing ka tih, ka nuom zâwng a ni sih a."
I will abundantly bless her provision: I will satisfy her poor with bread.,"A fâk ding chu malsâwm rei rui ka ta, A mi rimsihai chu beiin sukkhawp ka tih."
Her priests also will I clothe with salvation; And her saints shall shout aloud for joy.,"A thiempuhai chu sandamnain inthuom ka ta, A mi inthienghai chu hlimin khêk khêk an tih."
There will I make the horn of David to bud: I have ordained a lamp for mine anointed.,"Chutaka chun David ki chu inder suoktir ka ta, Ka hriek nâl ta ding chun khâwnvar ka ruot tah a."
His enemies will I clothe with shame; But upon himself shall his crown flourish.,"Ama dotuhai chu muolphonain inthuom ka ta, Ama chunga ruok chun a lallu- khum chu tle sur a tih,” tiin."
"Behold, how good and how pleasant it is For brethren to dwell together in unity!","Ngai ta, unauhai inngei diel diela um khâwm hi, A va ṭhain, a vân hawi de!"
"It is like the precious oil upon the head, That ran down upon the beard, Even Aaron’s beard; That came down upon the skirt of his garments;","Luha hriek hlutak, Khâkhmula luong thla, Aron khâkhmul ngeia luong thla a, A zakawfuol hmawra luong thla ang kha a nih."
"Like the dew of Hermon, That cometh down upon the mountains of Zion: For there Jehovah commanded the blessing, Even life for evermore.","Hermon daidaw Zion tlânghaia tla hlak ang hi a nih; Chutaka chun LALPA chun malsâwmna thu a pêk a, Kumkhuoa hringna dingin."
"Behold, bless ye Jehovah, all ye servants of Jehovah, That by night stand in the house of Jehovah.","Ngai ta u, LALPA siehlaw, LALPA ina zâna ngîr hlak po pohai, LALPA chu inpâk ro."
"Lift up your hands to the sanctuary, And bless ye Jehovah.","In kuthai chu hmun inthieng tienga chun phar unla, LALPA chu inpâk ro."
