en,hmr
"And the kings of the earth, who committed fornication and lived wantonly with her, shall weep and wail over her, when they look upon the smoke of her burning,","“Chun, hnuoia lal, a dit hlakhai le ân hawitirpui hlakhai chun, a kâng khu chu an hmu pha a chunga ṭapin âwm inchum an ta;"
"standing afar off for the fear of her torment, saying, Woe, woe, the great city, Babylon, the strong city! for in one hour is thy judgment come.","sawisakna ṭi leia hlataka ngîr- in,Babulon khaw ropui, khaw det chu a chung a rik, a chung a rik! Dârkâr khat chauah i chungah rorêl- na chu a hung tlung ta si,” an tih a."
"And the merchants of the earth weep and mourn over her, for no man buyeth their merchandise any more;","“Chun, hnuoia sumdâwngtuhai chu a chunga ṭapin an lungngai a, tûkhawma an thuomhnaw an in- châwk ta naw leiin."
"merchandise of gold, and silver, and precious stone, and pearls, and fine linen, and purple, and silk, and scarlet; and all thyine wood, and every vessel of ivory, and every vessel made of most precious wood, and of brass, and iron, and marble;","An thuomhnawhai chu, rângka- chak dâm, tangka dâm, lungmantam dâm, tuikeplung dâm, puon zai inhmi dâm, puon senduk dâm, tuktulungêk puon dâm, puon sen inlâr dâm leh; thing riminhnik tinrêng dâm, saiha bêl tinrêng dâm, thing hlutak le dâr le thîr le sailungvâra siem, bêl tinrêng dâm leh;"
"and cinnamon, and spice, and incense, and ointment, and frankincense, and wine, and oil, and fine flour, and wheat, and cattle, and sheep; and merchandise of horses and chariots and slaves; and souls of men.","thingzungthak dâm, thil rimin- hnik dâm, riminhnik rawmi dâm, innâlna chi dâm, murra dâm, beraw dâm, uoin dâm, sahriek dâm, beiphit indi tak dâm, bu dâm, sebâwng dâm, berâm dâm leh; sakawr dâm, tawlailîr dâm, suok dâm leh; mihriem hringna dâm leh a nih."
"And the fruits which thy soul lusted after are gone from thee, and all things that were dainty and sumptuous are perished from thee, and men shall find them no more at all.","‘Ra i lungrilin a châkhai chun a fe hmang san cheh a, thil tuihnâi le mawi po po chun an bohmang san cheh a, hmu nâwk ta naw tawp an tih,’ an tih a."
"The merchants of these things, who were made rich by her, shall stand afar off for the fear of her torment, weeping and mourning;","“Chuong thila sumdâwngtu, ama leia hung hausahai chu ṭap le lungngai pumin a sawisakna chu ṭi leia hlataka ngîrin,"
"saying, Woe, woe, the great city, she that was arrayed in fine linen and purple and scarlet, and decked with gold and precious stone and pearl!","‘Khaw ropui, puon zai inhmi le puon sen duk le puon sen inlâr sila, rângkachak le lungmantam le tui- keplunga inchei chu, a chung a rik, a chung a rik!"
"for in one hour so great riches is made desolate. And every shipmaster, and every one that saileth any whither, and mariners, and as many as gain their living by sea, stood afar off,","Dârkâr khat chauah sum chuong zozai chu teplo a lo ni ta hi,’ tîng an tih."
"and cried out as they looked upon the smoke of her burning, saying, What city is like the great city?","“Chun, lawng hotu taphawt dâm, lawnga fe hlak taphawt dâm, lawng mi dâm, tuisuorieta sinthaw taphawt dâm chu hlataka ngîrin, a kâng khu chu thlîr pumin, ‘Hi khaw ropui tluk hi khâwlai khuo am um a ta?’ tiin an khêk a."
"And they cast dust on their heads, and cried, weeping and mourning, saying, Woe, woe, the great city, wherein all that had their ships in the sea were made rich by reason of her costliness! for in one hour is she made desolate.","Chun, ṭap le lungngai pumin, ‘A muk leia tuisuorieta lawng neituhai hausakna khaw ropui chu, a chung a rik ie, a chung a rik ie! Dârkâr khat chauah teplo a hung ni ta hi!’ tia khêkin an luah pilvutin an theh a."
"Rejoice over her, thou heaven, and ye saints, and ye apostles, and ye prophets; for God hath judged your judgment on her.","“Aw vân le nangni mi in- thienghai, tirkohai dâm, zâwlneihai dâm, lâwm ro, ama chun in chunga ro a rêlna chun Pathienin a chungah ro a rêl ve ta hi,” tiin."
"And a strong angel took up a stone as it were a great millstone and cast it into the sea, saying, Thus with a mighty fall shall Babylon, the great city, be cast down, and shall be found no more at all.","Chun, vântirko hrâttak hin burawtnawina lung lientak ang hi lung a lâk a, tuisuorietah a peithlâk a, “Babulon khaw ropui chu hieng anga nasa hin peithlâk nîng a tih, tûkhawmin hmu nâwk ta naw tawp an tih."
"And the voice of harpers and minstrels and flute-players and trumpeters shall be heard no more at all in thee; and no craftsman, of whatsoever craft, shall be found any more at all in thee; and the voice of a mill shall be heard no more at all in thee;","Ṭingṭang keituhai dâm, ieng- khat mût thiemhai dâm, theihle mûttuhai dâm, tawtawrâwt puhai ri dâm i sûngah hre nâwk ta naw tawp an ta; themthiem kawng hrim hrim- ah themthiem hrim khawm i sûngah hmu nâwk ta naw tawp an ta; burawtnawina ri khawm i sûngah hre nâwk ta naw tawp an tih."
and the light of a lamp shall shine no more at all in thee; and the voice of the bridegroom and of the bride shall be heard no more at all in thee: for thy merchants were the princes of the earth; for with thy sorcery were all the nations deceived.,Khâwnvar khawm i sûngah var nâwk ta naw tawp a ta; pasal le mo ri khawm i sûngah hre nâwk ta naw tawp an tih. I sumdâwngtuhai chu hnuoia mi lienhai an ni sih a; i dâwiin hnam po po hlêm an ni kha.
"And in her was found the blood of prophets and of saints, and of all that have been slain upon the earth.","A sûngah zâwlneihai dâm, mi inthienghai dâm, hnuoia that po pohai thisen dâm chu an hmuh a,” a tih a."
"After these things I heard as it were a great voice of a great multitude in heaven, saying, Hallelujah; Salvation, and glory, and power, belong to our God:","Chuong hnunga chun vânah mipui nasatakhai rawl inring- tak ni âwmtak hin, “Halleluia, san- damna dâm, ropuina dâm, thil- thawtheina dâm, ei Pathien ta a nih."
"for true and righteous are his judgments; for he hath judged the great harlot, her that corrupted the earth with her fornication, and he hath avenged the blood of his servants at her hand.","A rorêlnahai chu ân dikin a fel a nih. Ama chun nawchizawr ropuitak, a mi dit chîng leia hnuoi suk- khawhlotu chu, a ro a rêl a, a suokhai thisen insuo phuba chu a kutin a lâk ta hi, an ti ka hriet a.”"
"And a second time they say, Hallelujah. And her smoke goeth up for ever and ever.","Chun, “Halleluia! A khu chu chatuonin a tungin fêng a tih,” an ti nâwk a."
"And the four and twenty elders and the four living creatures fell down and worshipped God that sitteth on the throne, saying, Amen; Hallelujah.","Chun, upa sâwmhni le pali le thilhring palihai chu an bawkkhup a, “Amen, Halleluia,” tiin Pathien lalṭhungphaa ṭhung chu chibai an bûk a."
"And a voice came forth from the throne, saying, Give praise to our God, all ye his servants, ye that fear him, the small and the great.","Chun, lalṭhungphaa inthawkin rawl a hung suok a, “Nangni a suok po po, ân zâtu mi lien le mi chînhai, ei Pathien chu inpâk ro,” a ta."
"And I heard as it were the voice of a great multitude, and as the voice of many waters, and as the voice of mighty thunders, saying, Hallelujah: for the Lord our God, the Almighty, reigneth.","Chun, mipui nasatak rawl ang le, tui tamtak ri ang le, vâninrûm nasatak ri angin, “Halleluia, Lalpa ei Pathien Iengkimthawthei chun ro a rêl ta hi."
"Let us rejoice and be exceeding glad, and let us give the glory unto him: for the marriage of the Lamb is come, and his wife hath made herself ready.","Hlimtakin lâwm inla, ama chawimawi ei tiu, Berâmte nuhmei nei chu a hun ta sih a; a mo khawm ânzo tah,” a ti ka hriet."
"And it was given unto her that she should array herself in fine linen, bright and pure: for the fine linen is the righteous acts of the saints.","Puon zai inhmi faitak, vârtak sil phal pêk a nih a, (puon zai inhmi chu mi inthienghai thilthaw fel a ni sih a.)"
"And he saith unto me, Write, Blessed are they that are bidden to the marriage supper of the Lamb. And he saith unto me, These are true words of God.","Chun, “ ‘Berâmte nuhmei neina ruoiṭhea fielhai chu an hamṭha ie,’ tiin ziek rawh,” a mi tih a. Chun, ka kuomah, “Hieng thu hi Pathien thu tak a nih,” a ti bawk a."
"And I fell down before his feet to worship him. And he saith unto me, See thou do it not: I am a fellow-servant with thee and with thy brethren that hold the testimony of Jesus: worship God: for the testimony of Jesus is the spirit of prophecy.","Chuongchun, Pathien chibai bûka bûk dingin a ke bulah ka bawkkhup a. Chun, ama chun ka kuomah, “Hienghin thaw naw raw khai, kei chu nangma le i unau, Isu inhriettirna thu pawmhai suok chan- pui ka ni annâwm; Pathien chibai bûk lem rawh; Isu inhriettirna thu chu thu hrilna thlarau a ni sih a,” a ta."
"And I saw the heaven opened; and behold, a white horse, and he that sat thereon called Faithful and True; and in righteousness he doth judge and make war.","Chun, vân inhawng ka hmuh a; chun, ngai ta, sakawr vâr le a chunga chuong Ringum le Indiktak, an iti chu ka hmu bawk a; ama chun feltakin ro a rêl a, mi a do hlak."
"And his eyes are a flame of fire, and upon his head are many diadems; and he hath a name written which no one knoweth but he himself.","A mithai chu meichawk ang a na, lallukhum tamtak a khum a, achun, hming ziek ama chau naw chun tûkhawmin an ihriet naw a nei a."
And he is arrayed in a garment sprinkled with blood: and his name is called The Word of God.,"Puon thisen kai a sil a, a hminga chun, “Pathien Thu,” an ta."
"And the armies which are in heaven followed him upon white horses, clothed in fine linen, white and pure.","Vâna sipaihai chun, puon zai inhmi vârtak, faitak silin, sakawr vârhai chunga chuongin an zui a."
"And out of his mouth proceedeth a sharp sword, that with it he should smite the nations: and he shall rule them with a rod of iron: and he treadeth the winepress of the fierceness of the wrath of God, the Almighty.","Chun, a baua inthawkin kâwl- hnâm ngeitak a suok a, chu chu hnam tin a sâtna ding a nih; chun, thîr hmawlin an ro rêl a ta; Pathien Iengkimthawthei lunginsen nasatna grêp sâwrna khura chun sir sâwr a tih."
"And he hath on his garment and on his thigh a name written, KING OF KINGS, AND Lord OF LORDS.","Chun, a puona le a êlpuia chun, “Lalhai Lal le hotuhai Hotu,” tia hming ziek a um."
"And I saw an angel standing in the sun; and he cried with a loud voice, saying to all the birds that fly in mid heaven, Come and be gathered together unto the great supper of God;","Chun, nisaa khin vântirko ngîr ka hmuh a; ama chun vânlaizâwla vate vuong po pohai kuoma chun rawl inringtaka khêkin, “Pathien ruoi ropuitak ṭhenaa chun hung inkhâwm ro,"
"that ye may eat the flesh of kings, and the flesh of captains, and the flesh of mighty men, and the flesh of horses and of them that sit thereon, and the flesh of all men, both free and bond, and small and great.","lal sa dâm, sipai hotu sa dâm, mi hrât sa dâm, sakawr sa le a chunga chuong sa dâm, mi po po– suok le suok naw, a lien a chîn khawm-an sa in fâk theina dingin,” a tih a."
"And I saw the beast, and the kings of the earth, and their armies, gathered together to make war against him that sat upon the horse, and against his army.","Chun, Sahrâng dâm, hnuoia lalhai dâm, an sipaihai dâm, sakawr chunga chuong kha do ding le a sipaihai chu do dinga an inkhâwm ka hmuh a."
"And the beast was taken, and with him the false prophet that wrought the signs in his sight, wherewith he deceived them that had received the mark of the beast and them that worshipped his image: they two were cast alive into the lake of fire that burneth with brimstone:","Chun, Sahrâng chu an man a, zâwlnei tehlêm-Sahrâng inchikna nei le a lim chibai bûktuhai a hlêmna hlak thilmak a mithmua thawtu kha-an man sah a. An pahni chun kâta kâng mei dîla chun a hringin an pei a."
"and the rest were killed with the sword of him that sat upon the horse, even the sword which came forth out of his mouth: and all the birds were filled with their flesh.","Mi danghai chu sakawr chunga chuong kâwlhnâm, a baua inthawka suok khan sâthlum an ni tah a; vate po po chu an sahai fain an khawp ta vawng a."
"To the angel of the church in Ephesus write: These things saith he that holdeth the seven stars in his right hand, he that walketh in the midst of the seven golden candlesticks:","“Ephesia kohran tirko kuoma chun hieng hin ziek rawh: “ ‘A kut changtienga arasi pasari chawia, rângkachak khâwnvar siena pasari laia inlawn inlawn khan, hieng thu hi a hril a nih:"
"I know thy works, and thy toil and patience, and that thou canst not bear evil men, and didst try them that call themselves apostles, and they are not, and didst find them false;","I thilthawzie dâm, i sininrimzie dâm, i selzie dâm, mi suolhai i ngaitheinawzie dâm ka hriet. Tirko ni si loa tirko intihai chu I fie bawk a, khêlhlip an nih ti i lo hriet tah a."
"and thou hast patience and didst bear for my name’s sake, and hast not grown weary.","Selna i nei bawk a, ka hming leiin i tuor tah a, i châu si nawh a."
"But I have this against thee, that thou didst leave thy first love.","Nisienlakhawm, demna che ka nei a nih, i hmangaina hmasatak kha i bân tâk leiin."
"Remember therefore whence thou art fallen, and repent and do the first works; or else I come to thee, and will move thy candlestick out of its place, except thou repent.","Chuongchun, i tlûktâkna chu hre zing la, simin, i thil thaw hmasa takhai kha thaw nâwk rawh; chuong naw chun, i kuomah hung ka ta, i sim naw chun i khâwnvar siena kha a hmuna inthawkin sawn ka tih."
"But this thou hast, that thou hatest the works of the Nicolaitans, which I also hate.","Nisienlakhawm, hi hi i ṭhatna chu a nih. Nikolahai thilthawhai i theida hi; chu chu kei khawmin ka theida ve a nih."
"He that hath an ear, let him hear what the Spirit saith to the churches. To him that overcometh, to him will I give to eat of the tree of life, which is in the Paradise of God.","Thlarauin kohranhai kuoma thu a hril hi na nei chun hre raw se. A hnetu taphawt chu Pathien Paradisa Hringna Thinga chu infâktir ka tih,’ tiin."
"And to the angel of the church in Smyrna write: These things saith the first and the last, who was dead, and lived again:","“Chun, Smurnaa kohran tirko kuoma chun hieng hin ziek rawh:— “ ‘Hmasatak le Nuhnungtak, thia hung hring nâwk ta khan, hieng thu hi a hril a nih:"
"I know thy tribulation, and thy poverty (but thou art rich), and the blasphemy of them that say they are Jews, and they are not, but are a synagogue of Satan.","I rinumzie dâm, i pasietzie dâm, (nisienlakhawm i hausa si), Juda tak ni loa, Setan inkhâwmna inhai ni lem sih a, Juda intihai i hrilsiet zie dâm ka hriet."
"Fear not the things which thou art about to suffer: behold, the devil is about to cast some of you into prison, that ye may be tried; and ye shall have tribulation ten days. Be thou faithful unto death, and I will give thee the crown of life.","I tuor dinghai hi ṭi naw; ngai ta, fiea i um theina dingin, Diebol chun nangni laia mi ṭhenkhat intângna inah a khum ding cheu a nih; chun, ni sâwm rinum tuor in tih. Thi chenin ringumin lo um rawh, chuongchun, hringna lallukhum pêng ka ti che."
"He that hath an ear, let him hear what the Spirit saith to the churches. He that overcometh shall not be hurt of the second death.","Thlarauin kohranhai kuoma thu a hril hi na nei chun hre raw se. A hnetu taphawt chu thi hnina chun iengkhawm law naw ni, a tih,’ tiin."
And to the angel of the church in Pergamum write: These things saith he that hath the sharp two-edged sword:,"“Chun, Pergamosa kohran tirko kuoma chun hieng hin ziek rawh:— “ ‘Kâwlhnâm ngeituo ngeitak neitu khan hieng thu hi a hril a nih:"
"I know where thou dwellest, even where Satan’s throne is; and thou holdest fast my name, and didst not deny my faith, even in the days of Antipas my witness, my faithful one, who was killed among you, where Satan dwelleth.","I umna Setan ṭhungpha umna kha ka hriet; chun, ka hming i kawl tlat a, ka thu hretu Antipa, Setan umnaa nangni laia an ithat, ka mi ringumtak um lai ngei khawm khan i mi ringna hi în phat san naw bawk a."
"But I have a few things against thee, because thou hast there some that hold the teaching of Balaam, who taught Balak to cast a stumblingblock before the children of Israel, to eat things sacrificed to idols, and to commit fornication.","Nisienlakhawm, tlâwmtêin demna che ka nei, khataka Balaam inchûktirna thu pawm tuhai amanih in umpui lei khan, ama chun milim biekna sa an fâkna ding le, an inditna dingin Balak chu Israel thlahai hmaah tlûkna sie ân chûktir kha."
So hast thou also some that hold the teaching of the Nicolaitans in like manner.,Nang khawmin Nikolahai in- chûktirna thu chuong ang bawka pawm tuhai amanih i umpui bawk a nih.
"Repent therefore; or else I come to thee quickly, and I will make war against them with the sword of my mouth.","Chuongchun, sim rawh, chuong naw chun i kuomah hung vak ka ta, ka baua kâwlhnâm chun anni hung do ka tih."
"He that hath an ear, let him hear what the Spirit saith to the churches. To him that overcometh, to him will I give of the hidden manna, and I will give him a white stone, and upon the stone a new name written, which no one knoweth but he that receiveth it.","Thlarauin kohranhai kuoma thu a hril hi na nei chun hre raw se. A hnetu taphawt kuom ngeia chun manna thuphmang laia kha pêng ka ta, lung vâr khawm pêng ka tih, chu lung chunga hming thar ziek leh; chu hming chu a changtu chau naw chun tûkhawmin an hriet nawh, a tih,’ tiin."
"And to the angel of the church in Thyatira write: These things saith the Son of God, who hath his eyes like a flame of fire, and his feet are like unto burnished brass:","“Chun, Thuatiraa kohran tirko kuoma chun hieng hin ziek rawh:— “ ‘Pathien Naupa, mit meichawk ang nei, a kephahai dâr tle mi ang khan, hieng thu hi a hril a nih:"
"I know thy works, and thy love and faith and ministry and patience, and that thy last works are more than the first.","I thilthawzie dâm, i hmangaizie dâm, i awizie dâm, i rawngbâwlzie dâm, i selzie dâm ka hriet, i thilthaw nuhnungtakhai chu a tîr nêk khan a nasa lem ti ka hriet bawk."
"But I have this against thee, that thou sufferest the woman Jezebel, who calleth herself a prophetess; and she teacheth and seduceth my servants to commit fornication, and to eat things sacrificed to idols.","Nisienlakhawm, demna che ka nei; nuhmei, Jezebel, Zâwlneinu inti kha, i ngai thei leiin; ama chun ka suokhai chu indit le milim biekna thil fâk inchûktirin, a ṭhuoi hmang bawk hlak a nih."
And I gave her time that she should repent; and she willeth not to repent of her fornication.,"Simna dingin a kuomah hun bi ka tuk a, nisienlakhawm, mi dit a chîng chu a sim nuom nawh."
"Behold, I cast her into a bed, and them that commit adultery with her into great tribulation, except they repent of her works.","Ngai ta, ama chu khumah ka pei ding a nih, a rêtpuituhai khawm chu, a thil thaw chînghai chu an sim san naw chun, rinum nasatakah pei bawk ka tih."
And I will kill her children with death; and all the churches shall know that I am he that searcheth the reins and hearts: and I will give unto each one of you according to your works.,"A nauhai chu hriin sukhlum ka ta; chuongchun, kei lungril le lungvar entu ka ni ti kohranhai po po chun hrieng an tih; chun in thaw ang peiin pe seng ka ti cheu."
"But to you I say, to the rest that are in Thyatira, as many as have not this teaching, who know not the deep things of Satan, as they are wont to say; I cast upon you none other burden.","Nisienlakhawm, nangni Thua- tiraa mi dang um, chu inchûktirna thu pawm loa, Setan thil inthûk an itihai hre naw taphawt kuoma chun, phurrik dang hrim bel naw ning cheu ka ti a nih."
"Nevertheless that which ye have, hold fast till I come.",In nei sa ruok kha chu ka hung hmakhat chun kawl tlat ro.
"And he that overcometh, and he that keepeth my works unto the end, to him will I give authority over the nations:",A hnetu taphawt le a tâwp chena ka thilthawhai pawmtu chu hnam tin chungah thu inneitir ka tih;
"and he shall rule them with a rod of iron, as the vessels of the potter are broken to shivers; as I also have received of my Father:","chun, ama chun bêlhemtu bêl- hai kawinawi dapa a um angin thîr hmawlin ro rêlpêk a tih,"
and I will give him the morning star.,"keiin ka Paa inthawka thuneina ka hmu ang bawk hin. Chun, Sikhawvar chu ama pêng ka tih."
"He that hath an ear, let him hear what the Spirit saith to the churches.","Thlarauin kohranhai kuoma thu a hril hi na nei chun hre raw se, a tih, tiin."
"And I saw an angel coming down out of heaven, having the key of the abyss and a great chain in his hand.","Chun, vântirko vânsam chabi le khaidiet lientak chawia, vâna inthawka hung ṭum ka hmuh a."
"And he laid hold on the dragon, the old serpent, which is the Devil and Satan, and bound him for a thousand years,","Drakon, rûlpui tar chu (chu chu Diebol le Setan a nih) a man a, kum sâng khata dingin a khuop a,"
"and cast him into the abyss, and shut it, and sealed it over him, that he should deceive the nations no more, until the thousand years should be finished: after this he must be loosed for a little time.","vânsama chun a pei lût a, a khâr khum a, kum sâng khat chu ân vawi hmakhat chu hnam tin a hlêm nâwk ta nawna dingin a châr nel tah a; chu hnunga chun sâwtnawtêa dingin insuo nâwk ding a nih."
"And I saw thrones, and they sat upon them, and judgment was given unto them: and I saw the souls of them that had been beheaded for the testimony of Jesus, and for the word of God, and such as worshipped not the beast, neither his image, and received not the mark upon their forehead and upon their hand; and they lived, and reigned with Christ a thousand years.","Chun, lalṭhungphahai ka hmuh a, a chungah mi an ṭhung a, an kuoma chun rorêlna an pêk a. Chun, Isu inhriettirna thu lei le, Pathien thu leia lu tanhai thlarau le sahrâng le a lim chibai bûk loa, an bâwka manih, an kuta manih inchikna nei nawhai thlarau chu ka hmu bawk a. Chuonghai chu an hung hring a, kum sâng khat sûnga dingin Krista leh rorêlin an um a."
The rest of the dead lived not until the thousand years should be finished. This is the first resurrection.,(Mithi danghai ruok chu kum sâng khat chu ân vawi hmakhat chu an la hring hri nawh a.) Chu chu thonâwkna hmasa chu a nih.
"Blessed and holy is he that hath part in the first resurrection: over these the second death hath no power; but they shall be priests of God and of Christ, and shall reign with him a thousand years.","Thonâwkna hmasaa ṭhanghai chu an hamṭhain an inthieng a nih; chuonghai chunga chun thi hnina chun thu hrim a nei nawh a. Pathien le Krista thiempuhai nîng an ta, ama leh kum sâng khat rorêlin um lem an tih."
"And when the thousand years are finished, Satan shall be loosed out of his prison,","Chun, kum sâng khat chu ân vawi pha chun Setan chu ân tângnaa inthawka insuoin um a ta,"
"and shall come forth to deceive the nations which are in the four corners of the earth, Gog and Magog, to gather them together to the war: the number of whom is as the sand of the sea.","hnuoi kil lia hnamhai, Gog le Magog chu, hlêma, indonaa ṭhuoi khâwm dingin fe suok a tih; chuong- hai tamzie chu tuisuorieta phaiphin ang el an nih."
"And they went up over the breadth of the earth, and compassed the camp of the saints about, and the beloved city: and fire came down out of heaven, and devoured them.","Chun, hnuoi khang tieng dâpin a tungin an fe a, mi inthienghai le khuo ditumtak chu an inhuol tah a, chun, vâna inthawkin mei a hung tlah a, anni chu a kânghmang tah a."
"And the devil that deceived them was cast into the lake of fire and brimstone, where are also the beast and the false prophet; and they shall be tormented day and night for ever and ever.","Chun, anni hlêmtu, Diebol chu Sahrâng le zâwlnei tehlêm umna, mei le kât dîla chun an pei tah a; chuongchun, chatuonin a sûn a zâna sawisakin um an tih."
"And I saw a great white throne, and him that sat upon it, from whose face the earth and the heaven fled away; and there was found no place for them.","Chun, lalṭhungpha lientak vâr- tak le a chunga ṭhung chu ka hmuh a, a hmaa inthawk chun hnuoi le vân an tlân hmang a, an ta dingin hmun hrim a um ta nawh a."
"And I saw the dead, the great and the small, standing before the throne; and books were opened: and another book was opened, which is the book of life: and the dead were judged out of the things which were written in the books, according to their works.","Chun, mithihai a lien a chîn, lalṭhungpha hmaa ngîr ka hmuh a. Chun, mithihai chu lekhabuhaia ziek an thilthaw ang peiin rêlpêkin an um tah a."
And the sea gave up the dead that were in it; and death and Hades gave up the dead that were in them: and they were judged every man according to their works.,"Tuisuoriet chun a sûnga mithi umhai chu ân suoktir a, Thina le Mithi Khuo chun an sûnga mithi umhai chu an insuoktir bawk a; chun, mi tin an thilthaw ang peia rêlpêkin an um tah a."
"And death and Hades were cast into the lake of fire. This is the second death, even the lake of fire.","Chun, Thina le Mithi Khuohai chu mei dîlah an pei a. Chu chu thi hnina chu a nih–mei dîl chu."
"And if any was not found written in the book of life, he was cast into the lake of fire.",Tûkhawm Hringna Buah a hming ziek an hmu naw chun mei dilah an pei bawk a.
