en,hmr
"The Revelation of Jesus Christ, which God gave him to show unto his servants, even the things which must shortly come to pass: and he sent and signified it by his angel unto his servant John;","Isu Krista thuphuongsuo, Pathienin a suokhai inhriettir dinga a kuoma a pêk, thil hung um vak ding thu chu; chu chu a vântirko hmangin a suok Johan kuomah a hung inhriettir a;"
"who bare witness of the word of God, and of the testimony of Jesus Christ, even of all things that he saw.","chu Johan chun, Pathien thu le Isu Krista inhriettirna thu, a thil hmu po pohai chu ân hriettir a."
"Blessed is he that readeth, and they that hear the words of the prophecy, and keep the things that are written therein: for the time is at hand.",Hi hrillâwkna bu thu tiemtu le ngaia a sûnga thu ziek pawmtuhai chu an hamṭha; a hun chu a hnai ta sih a.
"John to the seven churches that are in Asia: Grace to you and peace, from him who is and who was and who is to come; and from the seven Spirits that are before his throne;","Johan chun: Asia rama kohran pasarihai kuoma chun: Um zing le um ta le hung um ding kuoma inthawk dâm, a lalṭhungpha hmaa thlarau pasari umhai kuoma inthawk dâm,"
"and from Jesus Christ, who is the faithful witness, the firstborn of the dead, and the ruler of the kings of the earth. Unto him that loveth us, and loosed us from our sins by his blood;","Isu Krista, thu hretu ringumtak, mithi laia inthawka tho hmasatak le hnuoia lalhai rorêltu kuoma inthawk dâm chun, lunginsietna le inremna in kuomah um raw se. A mi hmangai a, a thisenin ei suolhaia inthawkin a mîn tlan suok a,"
"and he made us to be a kingdom, to be priests unto his God and Father; to him be the glory and the dominion for ever and ever. Amen.","khuoletui le a Pathien le a Pa tienga thiempua mi siemtu kuomah, anih, ama kuom ngeiah, ropuina le rorêlna chu chatuonin um raw se! Amen."
"Behold, he cometh with the clouds; and every eye shall see him, and they that pierced him; and all the tribes of the earth shall mourn over him. Even so, Amen.","Ngai ta u, ama chu sûmhai le chun a hung ding a nih; mit tinrêngin hmûng an ta, a suntuhai ngei khawm khan; khawvêla hnam po poin ama ṭa bawk an tih. Chuong angtak chun ning a tih, Amen."
"I am the Alpha and the Omega, saith the Lord God, who is and who was and who is to come, the Almighty.","“Kei Alpha le Omega ka nih,” Lalpa Pathien um zing le um ta le hung um ding, Iengkimthawthei chun a ti a nih."
"I John, your brother and partaker with you in the tribulation and kingdom and patience which are in Jesus, was in the isle that is called Patmos, for the word of God and the testimony of Jesus.","Kei Johan, in unaupa le, Isu rinumna dâm, khuoletui dâm, selna dâm inṭâwmpuitu cheu hi, Pathien thu lei le, Isu inhriettirna thu leiin Patmos thlierkâr an tia chun ka um a."
"I was in the Spirit on the Lord’s day, and I heard behind me a great voice, as of a trumpet","Lalpa nia chun Thlarauin ka lo um a; chun, ka hnung tiengah, tawtawrâwt ri ang, rawl inringtakin,"
"saying, What thou seest, write in a book and send it to the seven churches: unto Ephesus, and unto Smyrna, and unto Pergamum, and unto Thyatira, and unto Sardis, and unto Philadelphia, and unto Laodicea.","“I thil hmu ding chu lekhabuah ziek la, kohran pasarihai kuomah, Ephesia dâm, Smurnaa dâm, Pergamosa dâm, Thuatiraa dâm, Sardisa dâm, Philadelphiaa dâm, Laodikeia dâm chun thawn rawh,” a ti ka hriet a."
And I turned to see the voice that spake with me. And having turned I saw seven golden candlesticks;,"Chun, a mi biekna rawl chu hmu tumin ka hang nghale tah a. Ka hang nghale chun, rângkachak khâwnvar siena pasari ka hmuh a;"
"and in the midst of the candlesticks one like unto a son of man, clothed with a garment down to the foot, and girt about at the breasts with a golden girdle.","khâwnvar siena lai chun, mi tu amanih mihriem naupa ang, ke lêr chena puon sil, a âwma rângkachak kâwngkhia inkhit ka hmu bawk a."
"And his head and his hair were white as white wool, white as snow; and his eyes were as a flame of fire;","A lu le a sam chu berâm hmul vâr angin a vâr a, vûr ang elin; a mithai chu meichawk ang a nih."
"and his feet like unto burnished brass, as if it had been refined in a furnace; and his voice as the voice of many waters.","A kephahai chu dâr tle mi ang a na, raw tuina meia raw thieng ta ang elin; a rawl chu tui tamtak ri ang el a nih."
And he had in his right hand seven stars: and out of his mouth proceeded a sharp two-edged sword: and his countenance was as the sun shineth in his strength.,"A kut chang tieng chun arasi pasari a chawi a; a baua inthawk chun kâwlhnâm ngeituo ngeitak a suok a, a hmêl chu nisa sat vânglai tak ang a nih."
"And when I saw him, I fell at his feet as one dead. And he laid his right hand upon me, saying, Fear not; I am the first and the last,","Ama chu ka hmu phingleh thi ang dêrin a ke bulah ka tlu tah a. Ama chun a kut changtieng chu ka chunga innghatin,ka kuomah, “Ṭi naw rawh; kei Hmasatak le, Nu- hnungtak le,"
"and the Living one; and I was dead, and behold, I am alive for evermore, and I have the keys of death and of Hades.","Mi Hring chu ka nih, ka lo thi a, nisienlakhawm, ngai ta, kumkhuoa dingin ka hring nâwk ta a nih. Thina le Mithi Khaw chabihai chu ka nei bawk a."
"Write therefore the things which thou sawest, and the things which are, and the things which shall come to pass hereafter;","“Chuongchun, i thil hmu tahai le thil um zinghai le tuta hnunga thil hung um dinghai thu chu ziek rawh;"
"the mystery of the seven stars which thou sawest in my right hand, and the seven golden candlesticks. The seven stars are the angels of the seven churches: and the seven candlesticks are seven churches.","ka kut changtienga arasi pasari um i hmuhai le, rângkachak khâwn- var siena pasarihai thurûk chu, Arasi pasari chu kohran pasarihai tirko an na, khâwnvar pasari chu kohran pasarihai chu an nih."
"And I saw another strong angel coming down out of heaven, arrayed with a cloud; and the rainbow was upon his head, and his face was as the sun, and his feet as pillars of fire;","Chun, vântirko hrâttak dang pakhat, sûma inthuom, vâna inthawka hung ṭum ka hmuh a; a lua chun sumrisâng ân zâm a, a hmai chu nisa ang a na, a kehai chu mei ban ang a nih."
"and he had in his hand a little book open: and he set his right foot upon the sea, and his left upon the earth;","A kuta chun lekhabu chîtê phawk sa a chawi a, a ke changtiengin tui- suoriet a sir a, a vawitiengin khaw- muol a sir a;"
"and he cried with a great voice, as a lion roareth: and when he cried, the seven thunders uttered their voices.",sakeibaknei inhûk angin rawl inringtakin a khêk tah a. A khêk zo chun vâninrûm pasarihai chun an rawl an insuo tah a.
"And when the seven thunders uttered their voices, I was about to write: and I heard a voice from heaven saying, Seal up the things which the seven thunders uttered, and write them not.","Chun, vâninrûm pasarihai chun an rawl an insuo phingleh ziek ka tum a; chuongchun, “Vâninrûm pasarihai thu hril chu ip tlat la ziek naw,” tiin vâna inthawkin rawl ka hriet a."
"And the angel that I saw standing upon the sea and upon the earth lifted up his right hand to heaven,","Chun, vântirko tuisuoriet le khawmuola ngîr ka ihmu chun a kut chang tieng vân tieng a phar a,"
"and sware by him that liveth for ever and ever, who created the heaven and the things that are therein, and the earth and the things that are therein, and the sea and the things that are therein, that there shall be delay no longer:","chatuona hring zing, vân, a chunga thil umhai le hnuoi, a chunga thil umhai le, tuisuoriet, a sûnga thil umhai le siemtu chu sâlin, “Hun um ta naw ni."
"but in the days of the voice of the seventh angel, when he is about to sound, then is finished the mystery of God, according to the good tidings which he declared to his servants the prophets.","nisienlakhawm, vântirko pasari- na rawl ri a um phaleh, a mût ding ṭêpin, Pathien thurûk chu kim tâng a tih, a suok zâwlneihai kuoma a chanchin ṭha hril ang khan,” a tih a."
"And the voice which I heard from heaven, I heard it again speaking with me, and saying, Go, take the book which is open in the hand of the angel that standeth upon the sea and upon the earth.","Chun, vâna inthawka rawl ka ihriet khan a mi biek nâwk a, “Tuisuoriet le khawmuola ngîr vân- tirko kuta lekhabu phar sa saw va la rawh,” a ti ka hriet a."
"And I went unto the angel, saying unto him that he should give me the little book. And he saith unto me, Take it, and eat it up; and it shall make thy belly bitter, but in thy mouth it shall be sweet as honey.","Chun, vântirko kuoma chun ka va feh a, a kuomah, “Lekhabu chîtê kha mi pe rawh,” ka tih a. Ama chun ka kuomah, “La la, fa zo vawng rawh, chuongchun, i phîng chu sukkhâng a ta, i baua ruok chun khuoizu angin thlum a tih,” a ta."
"And I took the little book out of the angel’s hand, and ate it up; and it was in my mouth sweet as honey: and when I had eaten it, my belly was made bitter.","Chun, vântirko kuta inthawkin lekhabu chîtê chu ka lâk a, ka fâk zo vawng a; chuongchun, ka baua chun khuoizu angin a thlum a; nisien- lakhawm, ka fâk zo phingleh, ka phîng chu a kha zo tah a."
"And they say unto me, Thou must prophesy again over many peoples and nations and tongues and kings.","Chun, ka kuomah, “Mi tamtak dâm, hnam tamtak dâm, ṭawng tam- tak dâm, lal tamtak dâm chungchâng thu hril nâwk i tih,” an tih a."
"And there was given me a reed like unto a rod: and one said, Rise, and measure the temple of God, and the altar, and them that worship therein.","Chun, luong, hmawl ang hi pêkin ka um a, chuongchun, tûin amanih, “Tho la, Pathien biekin le mâichâm chu inkhi la, a sûnga betuhai khawm tiem rawh."
"And the court which is without the temple leave without, and measure it not; for it hath been given unto the nations: and the holy city shall they tread under foot forty and two months.","Biekin puotienga inhuonna sûng tuollai ruok chu inkhi sa naw, chu chu Jentailhai kuoma pêk a ni ta sih a; anni chun khaw Inthieng chu thla sawmli pahni sir dêng an tih."
"And I will give unto my two witnesses, and they shall prophesy a thousand two hundred and threescore days, clothed in sackcloth.","Chun, ka thu hretu pahnihai kuoma chun thu pêng ka ta, chuongchun, saiip puon silin ni sâng khat za hni sâwmruk sûng po thu hril an tih,” a ta."
"These are the two olive trees and the two candlesticks, standing before the Lord of the earth.","Chuong chu Oliv thing pahni le khâwnvar siena pahni, khawvêl Lal hmaa ngîrhai chu an nih."
"And if any man desireth to hurt them, fire proceedeth out of their mouth and devoureth their enemies; and if any man shall desire to hurt them, in this manner must he be killed.","Anni chu tûkhawmin suknat an tum chun, an baua inthawkin mei a hung suok a, an hmêlmahai chu a kânghmang hlak. Tûkhawmin anni chu suknat tum ang sienla, chuong ang bawka sukhlumin an um ding a nih."
"These have the power to shut the heaven, that it rain not during the days of their prophecy: and they have power over the waters to turn them into blood, and to smite the earth with every plague, as often as they shall desire.","Chuonghai chun an thu hril sûng po ruo sûr naw dinga vân sukping theina an nei a; an nuom pha phaa thisena inchangtir dingin tuihai chungah thu an nei a, khawvêl hi hremna tinrênga hrem dingin thu an nei bawk a."
"And when they shall have finished their testimony, the beast that cometh up out of the abyss shall make war with them, and overcome them, and kill them.","Chun, an inhriettirna thu chu an hril zo phaa vânsama inthawka Sahrâng hung suok ding chun anni do a ta, hnêng a ta, sukhlum a tih."
"And their dead bodies lie in the street of the great city, which spiritually is called Sodom and Egypt, where also their Lord was crucified.","Chun, an ruong chu khaw ropui kawtthlêra chun um zing a ta; chu khaw ropui chu thlarau tieng thua chu Sodom le Aigupta an ti a nih, chutaka bawk chun an Lalpa chu hemdein a um kha."
"And from among the peoples and tribes and tongues and nations do men look upon their dead bodies three days and a half, and suffer not their dead bodies to be laid in a tomb.","Chun, mihai laia mi dâm, chihai laia mi dâm, ṭawnghai laia mi dâm, hnamhai laia mi dâmin ni thum le a chenve an ruong chu en an ta, an ruonghai chu thlâna phûm phal naw ni hai."
"And they that dwell on the earth rejoice over them, and make merry; and they shall send gifts one to another; because these two prophets tormented them that dwell on the earth.","An thi leiin hnuoia umhai chu lâwm an ta, hlimna siem an ta, thilpêkhai inthawn tuo bawk an tih; zâwlnei pahni hai chun hnuoia umhai chu an sukrimsik hlak leiin."
"And after the three days and a half the breath of life from God entered into them, and they stood upon their feet; and great fear fell upon them that beheld them.","Chun, ni thum le a chenve hnunga chun Pathien kuoma in- thawka hringna thuok an sûngah a hung lût a, an kein an ngîr tah a, chuongchun, a hmutuhai chun an ṭi ta bêk bêk a."
"And they heard a great voice from heaven saying unto them, Come up hither. And they went up into heaven in the cloud; and their enemies beheld them.","Chun, an kuomah, “Hitaka hin hung ro,” tiin vâna inthawkin rawl inringtak an hriet a. Chuongchun, sûm lai chun vânah an hang fe tah a; an hmêlmahai chun an hmu zing a."
"And in that hour there was a great earthquake, and the tenth part of the city fell; and there were killed in the earthquake seven thousand persons: and the rest were affrighted, and gave glory to the God of heaven.","Chun, chu lai tak chun sim- khawleihnuoi nasatakin a hung inhnîng a, khuo chu hmun sâwma ṭhea hmun khat a chim tah a, simkhawleihnuoi inhnînga chun mi sâng sari an thih a; a danghai chun an ṭih a, vân Pathien chu an chawimawi tah a."
"The second Woe is past: behold, the third Woe cometh quickly.","Chungrikna pahnina chu a bo tah a, ngai ta, chungrikna pathumna chu a hung um vak ding a nih."
"And the seventh angel sounded; and there followed great voices in heaven, and they said, The kingdom of the world is become the kingdom of our Lord, and of his Christ: and he shall reign for ever and ever.","Chun, vântirko pasarina chun a hang mût a, chuongchun, “Khawvêl ram chu ei Lalpa le a Krista ram a hung ni tah, ama chun chatuonin ro rêl a tih,” tiin vâna chun rawl inringtakin a hung suok nghâl tah a."
"And the four and twenty elders, who sit before God on their thrones, fell upon their faces and worshipped God,","Chuongchun, Pathien hmaa an lalṭhungphaa upa sâwmhni le pali ṭhunghai chu an bawkkhup a, Pathien chibai an bûk a."
"saying, We give thee thanks, O Lord God, the Almighty, who art and who wast; because thou hast taken thy great power, and didst reign.","“Aw Lalpa Pathien, Iengkim- thawthei, um zing le um tah, i thilthawtheina ropuitak chu laa ro i rêl leiin lâwmthu kan hril che."
"And the nations were wroth, and thy wrath came, and the time of the dead to be judged, and the time to give their reward to thy servants the prophets, and to the saints, and to them that fear thy name, the small and the great; and to destroy them that destroy the earth.","Hnamhai chu an lunginsen a, chun, i lunginsenna chu a hung tlung ve thung a, mithi rorêlpêk hun le, i suok zâwlneihai kuoma dâm, mi in- thienghai kuoma dâm, i hming inza mi lien le mi chînhai kuoma dâm, an lâwmman pêk hun le, hnuoi sukse- tuhai suksiet ve thung hun chu a hung tlung bawk a,” tiin."
"And there was opened the temple of God that is in heaven; and there was seen in his temple the ark of his covenant; and there followed lightnings, and voices, and thunders, and an earthquake, and great hail.","Chun, vâna Pathien biekin chu ân hawng a, chuongchun, biekina chun a thuthlungna bâwm chu a hung inlang tah a; chun kâwlinlep dâm, rawl dâm, vân inrûm dâm, simkhawleihnuoi inhnîng dâm, riel nasatak dâm, a hung um nghâl tah a."
"And a great sign was seen in heaven: a woman arrayed with the sun, and the moon under her feet, and upon her head a crown of twelve stars;","Chun, thilmak ropuitak vânah a hung inlang tah a; nuhmei nisaa inthuom, a ke hnuoia thla um, arasi sâwm le pahnia siem lallukhum khum a hung um a;"
"and she was with child; and she crieth out, travailing in birth, and in pain to be delivered.",ama chun nau a vawn a; nauhase nain ân rûm a.
"And there was seen another sign in heaven: and behold, a great red dragon, having seven heads and ten horns, and upon his heads seven diadems.","Chun, thilmak dang vânah a hung inlang nâwk a; ngai ta; drakon sen lientak lu sari le ki sâwm nei, lallukhum pasari khum a hung um a."
"And his tail draweth the third part of the stars of heaven, and did cast them to the earth: and the dragon standeth before the woman that is about to be delivered, that when she is delivered he may devour her child.","A mei chun vân arasi hmun thuma ṭhea hmun khat chu a kei a, hnuoiah a peithlâk tah a. Chun, a nei phaa a nau chu a lem theina dingin drakon chu nuhmei nau nei ding hmaa chun a ngîr zing a."
"And she was delivered of a son, a man child, who is to rule all the nations with a rod of iron: and her child was caught up unto God, and unto his throne.","Chun, naupasal, hnam po po chunga thîr hmawla rorêl ding a nei a, chun, a nau chu Pathien kuoma le a lalṭhungphaa chun zuk lâkin a um tah a."
"And the woman fled into the wilderness, where she hath a place prepared of God, that there they may nourish her a thousand two hundred and threescore days.","Chun, nuhmei chu thlalêra Pathien ibuotsai hmun a neinaa chun a tlân hmang a, chutaka chun ni sâng khat za hni sâwmruk an châwm theina dingin."
And there was war in heaven: Michael and his angels going forth to war with the dragon; and the dragon warred and his angels;,"Chun, vâna chun indona a hung um a; Mikael le a vântirkohai chun drakon chu an do a;"
"and they prevailed not, neither was their place found any more in heaven.","drakon le a tirkohai khawm chun an do ve a; nisienlakhawm, an hne ta nawh a, an hmun chu vânah a um ta bawk nawh."
"And the great dragon was cast down, the old serpent, he that is called the Devil and Satan, the deceiver of the whole world; he was cast down to the earth, and his angels were cast down with him.","Chun, drakon lientak, Rûlpui tar, Diebol le Setan an ti, khawvêl po po hlêmtu chu, an pei thlâk tah a; hnuoiah an pei a, a tirkohai khawm an pei thlâk sa veh a."
"And I heard a great voice in heaven, saying, Now is come the salvation, and the power, and the kingdom of our God, and the authority of his Christ: for the accuser of our brethren is cast down, who accuseth them before our God day and night.","Chun, vâna chun rawl inring- takin, “Tuhin chu ei Pathien sandam- na le thilthawtheina le ram chu a hung tlung tah a, a Krista thuneina leh; ei unauhai hêktu, ei Pathien hmaa a sûn a zâna hêk hlaktu chu, an pei thlâk ta sih a."
"And they overcame him because of the blood of the Lamb, and because of the word of their testimony; and they loved not their life even unto death.","Berâmte thisen lei le an in- hriettirna thu leiin, ama chu an hne a nih; thi ngam khawpin an hringna an ngainêp bawk a."
"Therefore rejoice, O heavens, and ye that dwell in them. Woe for the earth and for the sea: because the devil is gone down unto you, having great wrath, knowing that he hath but a short time.","Chuleiin, aw vânhai le a sûnga umhai, lâwm ro! Hnuoi le tuisuoriet, in chung a rik ie! Diebol chun hun tlâwmte chau a nei ti ân hriet leiin lunginsen bêk bêka in kuoma a hung thla ta leiin,” a ti ka hriet a."
"And when the dragon saw that he was cast down to the earth, he persecuted the woman that brought forth the man child.","Chun, drakon chun hnuoia pei thlâk a nih ti ân hriet phingleh nau- pasal neitu nuhmei chu a suknawm- na tah a."
"And there were given to the woman the two wings of the great eagle, that she might fly into the wilderness unto her place, where she is nourished for a time, and times, and half a time, from the face of the serpent.","Chuongchun, thlalêra a hmuna chun a vuong lût theina dingin nuhmei chu mupui lientak thla khing hni an pêk a, chutaka chun rûlpui hmu phâk nawah hun khat le hunhai le hun chenve sûng po châwm an tih."
"And the serpent cast out of his mouth after the woman water as a river, that he might cause her to be carried away by the stream.","Chun, rûlpui chun tuiin a lên hmang theina dingin nuhmei hnunga chun vadung ang elin a baua tui a pik suok a."
"And the earth helped the woman, and the earth opened her mouth and swallowed up the river which the dragon cast out of his mouth.","Nisienlakhawm, hnuoiin nuhmei chu a ṭhangpui a, hnuoi chun a bau a kah a, drakonin abaua inthawka a pik suok vadung chu a lem zo tah a."
"And the dragon waxed wroth with the woman, and went away to make war with the rest of her seed, that keep the commandments of God, and hold the testimony of Jesus:","Chuongchun, drakon chu nu- hmei chunga chun a hung lunginsen a, a thla la um Pathien thupêkhai zâwm a, Isu inhriettirna thu pawm- hai chu do dingin a fe tah a."
"and he stood upon the sand of the sea. And I saw a beast coming up out of the sea, having ten horns and seven heads, and on his horns ten diadems, and upon his heads names of blasphemy.","Chuongchun, tuisuoriet ṭieu- phoa chun a ngîr tah a. Chun, Sahrâng ki sâwm le lu sari nei, tuisuorieta hung suok ka hmuh a, a kihaia chun lallukhum sâwm a uma, a luhaia chun Pathien hrilsietna hminghai a um bawk a."
"And the beast which I saw was like unto a leopard, and his feet were as the feet of a bear, and his mouth as the mouth of a lion: and the dragon gave him his power, and his throne, and great authority.","Chun, ka Sahrâng hmu chu keitê ang a na, a kehai chu savawm ke ang a nih; a bau chu sakeibaknei bau ang a nih; chun, drakon chun a kuomah a thilthawtheina le a lalṭhungpha le thuneina nasatak a pêk a."
And I saw one of his heads as though it had been smitten unto death; and his death-stroke was healed: and the whole earth wondered after the beast;,"A lu pakhat chu thipui khawp raua hliem angin ka hmuh a, nisien- lakhawm, thipui khawp rau dinga hliem chu a dam tah a; chuongchun, hnuoia mi po poin Sahrâng chu mak an tih a, an zui a."
"and they worshipped the dragon, because he gave his authority unto the beast; and they worshipped the beast, saying, Who is like unto the beast? and who is able to war with him?","Chun, Sahrâng kuoma chun a thuneina chu a pêk leiin drakon chu Pathien chibai bûkin an bûk a; chun, “Sahrâng ang hi tu am a uma, tuin am do thei a ta?” tiin Sahrâng khawm chu an bûk bawk a."
and there was given to him a mouth speaking great things and blasphemies; and there was given to him authority to continue forty and two months.,"Chun, uongna le Pathien hril- sietna thu hrilna bau a kuoma pêk a na, thla sâwmli pahni châng dingin thuneina pêk a ni bawk a."
"And he opened his mouth for blasphemies against God, to blaspheme his name, and his tabernacle, even them that dwell in the heaven.","Chuongchun, Pathien hrilsein a bau a ka tah a, a hming le a umna, vâna umhai chu hrilse dingin."
"And it was given unto him to make war with the saints, and to overcome them: and there was given to him authority over every tribe and people and tongue and nation.","Chun, mi inthienghai a do le a hne phal a na, chi tinrêng dâm, mi tinrêng dâm, ṭawng tinrêng dâm, hnam tinrêng dâm chunga thuneina a kuoma pêk a ni bawk a."
"And all that dwell on the earth shall worship him, every one whose name hath not been written from the foundation of the world in the book of life of the Lamb that hath been slain.","Chuongchun, hnuoia um po po, leilung insieng tîra that tah Berâmtê Hringna Bua hming ziek naw po chun, Pathien chibai bûkin bûk an tih."
"If any man hath an ear, let him hear.",Tûkhawmin na a nei chun hre raw se.
"If any man is for captivity, into captivity he goeth: if any man shall kill with the sword, with the sword must he be killed. Here is the patience and the faith of the saints.","Tûkhawm sala um ding ani chun salah a um hlak, tûkhawmin kâwlhnâma mi a that chun kâwl- hnâma that ding a nih. Hitaka hin mi inthienghai selna le ringna inlang theina a um."
"And I saw another beast coming up out of the earth; and he had two horns like unto a lamb, and he spake as a dragon.","Chun, Sahrâng dang hnuoia hung suok ka hmuh a; berâmte kî ang ki pahni a nei a, drakon ṭawng angin a ṭawng a."
"And he exerciseth all the authority of the first beast in his sight. And he maketh the earth and them that dwell therein to worship the first beast, whose death-stroke was healed.","Sahrâng hmasa thuneina po po ang kha a mithmuah a hmang a, Hnuoi le a chunga um po pohai chu Sahrâng hmasa lem, thipui khawp rau dinga hliem dam nâwk chu, chibai ân bûktir bawk a."
"And he doeth great signs, that he should even make fire to come down out of heaven upon the earth in the sight of men.","Chun, mihriem mithmuah vâna inthawka hnuoia mei intlâktir thei khawp rauin thilmak ropuitak a thaw hlak."
"And he deceiveth them that dwell on the earth by reason of the signs which it was given him to do in the sight of the beast; saying to them that dwell on the earth, that they should make an image to the beast who hath the stroke of the sword and lived.","Hnuoia umhai kuomah, Sa- hrâng kâwlhnâma hliem hnung la dam chawimawina dingin ama lim an siem ding a ni ti hrilin, Sahrâng mithmua thilmak thaw dinga thu a ihmu, chuong thilmak lei chun hnuoia umhai chu a hlêm bawk a."
