en,hmr
And I saw a new heaven and a new earth: for the first heaven and the first earth are passed away; and the sea is no more.,"Chun, vân thar le hnuoi thar ka hmuh a; vân hmasa le hnuoi hmasa chu a bohmang tah a, tuisuoriet khawm a um ta naw a nih."
"And I saw the holy city, new Jerusalem, coming down out of heaven from God, made ready as a bride adorned for her husband.","Chun, khaw inthieng Jerusalem thar chu, mo a pasal ela ân chei angin inzosa hieuin, Pathien kuoma vâna inthawka hung ṭum ka hmu bawk a."
"And I heard a great voice out of the throne saying, Behold, the tabernacle of God is with men, and he shall dwell with them, and they shall be his peoples, and God himself shall be with them, and be their God:","Chun, lalṭhungphaa inthawkin rawl inring tak ka hriet a, “Ngai ta, Pathien bâwkte chu mihriem lai a hung um tah, Ama chu an kuomah um a ta, Anni chu a mihai nîng an ta, Pathien ngei chu an kuomah um a ta, An Pathien ni bawk a tih;"
"and he shall wipe away every tear from their eyes; and death shall be no more; neither shall there be mourning, nor crying, nor pain, any more: the first things are passed away.","An mita inthawkin mitthli po po hrufai a ta; Thina um nâwk ta naw nih a, Lungngai dâm, ṭap dâm, nat dâm khawm, Um nâwk ta bawk naw nih a; Thil hmasahai chu a bo tah,” tiin."
"And he that sitteth on the throne said, Behold, I make all things new. And he saith, Write: for these words are faithful and true.","Chun, lalṭhungphaa ṭhung chun, “Ngai ta, thil iengkim ka siem thar ie,” a ta. Chun, “Ziek rawh, hieng thu hi ring a umin â n dik sih a,” a ti bawk a."
"And he said unto me, They are come to pass. I am the Alpha and the Omega, the beginning and the end. I will give unto him that is athirst of the fountain of the water of life freely.","Chun, ka kuomah, “A hung tlung tah. Kei Alpha le Omega, a Bul le a Tâwp ka nih; dangchâr taphawt kuoma chun Hringna Tuikhura in- thawkin a thlâwnin pêng ka tih."
"He that overcometh shall inherit these things; and I will be his God, and he shall be my son.","Hnetu taphawt chun chuong chu hluong an tih, kei an Pathien nîng ka ta, anni chu ka nauhai nîng an tih."
"But for the fearful, and unbelieving, and abominable, and murderers, and fornicators, and sorcerers, and idolaters, and all liars, their part shall be in the lake that burneth with fire and brimstone; which is the second death.","Amiruokchu, mi dawi dâm, awi- naw dâm, tirdakum dâm, tuolthat dâm, indit hmang dâm, dawithiem dâm, milim bie dâm, khêlinhlip po po dâm chan ding chu mei le kâta kâng dîla chun um a tih; chu chu thi hnina chu a nih,” a ta."
"And there came one of the seven angels who had the seven bowls, who were laden with the seven last plagues; and he spake with me, saying, Come hither, I will show thee the bride, the wife of the Lamb.","Chun, berbu pasari, hremna nuhnungtak pasaria sip chawi, vântirko pasari laia pakhat chu a hung a; ama chun, “Hung ta, mo, Berâmte nuhmei chu inentir ka ti che,” tiin a mi biek a."
"And he carried me away in the Spirit to a mountain great and high, and showed me the holy city Jerusalem, coming down out of heaven from God,","Chun, ama chun Thlarauin tlâng lientak insângtakah a mifepui a, Jerusalem khaw inthieng chu, Pathien kuoma vâna inthawka hung ṭum a mîn entir a."
"having the glory of God: her light was like unto a stone most precious, as it were a jasper stone, clear as crystal:","Pathien ropuina a nei a, a varzie chu lung mantamtak ang, jaspi lung ang el hi a na, krustal lung angin a tle a nih."
"having a wall great and high; having twelve gates, and at the gates twelve angels; and names written thereon, which are the names of the twelve tribes of the children of Israel:","Kul nasatak insângtak a nei a, kawtkhâr sâwm le pahni a nei a, kawtkhâr bulahai chun vântirko sâwm le pahni an um a, chuong kawt- khâra chun hming ziek a um bawk a, chuong chu Israel thlahai hnam sâwm le pahnihai hming chu a nih;"
on the east were three gates; and on the north three gates; and on the south three gates; and on the west three gates.,"saktieng pangah kawtkhâr pa- thum, hmârtieng pangah kawtkhâr pathum, simtieng pangah kawtkhâr pathum, thlangtieng pangah kawt- khâr pathum a um a."
"And the wall of the city had twelve foundations, and on them twelve names of the twelve apostles of the Lamb.","Chun, chu khaw kul chun lung- phûm sâwm le pahni a nei a, chuonga chun Berâmte tirko sâwm le pahnihai hming a chuong a."
"And he that spake with me had for a measure a golden reed to measure the city, and the gates thereof, and the wall thereof.","Chun, a mi betu chun, khuo le kawtkhârhai le a kul chu inkhina dingin rângkachak luong a chawi a."
"And the city lieth foursquare, and the length thereof is as great as the breadth: and he measured the city with the reed, twelve thousand furlongs: the length and the breadth and the height thereof are equal.","Khuo chu inbiel vêlin a um a, a dungtieng chu a khangtieng chen a nih; khuo chu luong chun ân khih a, fîng sîng khat le sâng hni a nih. A dungtieng le a khangtieng le ân sângtieng chu ân ang a nih."
"And he measured the wall thereof, a hundred and forty and four cubits, according to the measure of a man, that is, of an angel.","Chun, a kul chu ân khi nâwk a, mihriem inkhi dân pangngaiin (chu chu vântirko inkhi dân pângngai chu a nih) tawng za khat sâwmli pali a nih."
"And the building of the wall thereof was jasper: and the city was pure gold, like unto pure glass.","Chun, a kul chu jaspi lunga siem a nih, khuo chu hlimen inthieng ang ela, rângkachak inthienga siem a nih."
"The foundations of the wall of the city were adorned with all manner of precious stones. The first foundation was jasper; the second, sapphire; the third, chalcedony; the fourth, emerald;","Chu khaw kul lungphûmhai chu lung mantam chi tinrênga chei- mawi a nih. Lungphûm hmasatak chu jaspi lung a na; a pahnina chu sapphir lung a na, a pathumna chu kalkidon lung a na; a palina chu smaragdin lung a na,"
"the fifth, sardonyx; the sixth, sardius; the seventh, chrysolite; the eighth, beryl; the ninth, topaz; the tenth, chrysoprase; the eleventh, jacinth; the twelfth, amethyst.","a pangana chu sardonuk lung a na, a parukna chu sardion lung a na, a pasarina chu kruso lung a na; a parietna chu birul lung a na, a pakuona chu topaz lung a na; a sâwm- na chu krusopra lung a na; a sâwm- pakhatna chu ngên lung a na; a sâwm- pahnina chu amethusto lung a nih."
"And the twelve gates were twelve pearls; each one of the several gates was of one pearl: and the street of the city was pure gold, as it were transparent glass.","Chun, kawtkhâr sâwm le pahni chu tuikeplung sâwm le pahni a nih a, kawtkhâr po po chu tuikeplung pa- khat senga siem a nih; chun, chu khaw kawtthlêr chu rângkachak inthieng a nih, hlimen entlang thei ang el hi."
"And I saw no temple therein: for the Lord God the Almighty, and the Lamb, are the temple thereof.","Chun, a sûnga chun biekin hrim ka hmu nawh a; Lalpa Pathien Iengkimthawthei le Berâmte chu an biekin an ni sih a."
"And the city hath no need of the sun, neither of the moon, to shine upon it: for the glory of God did lighten it, and the lamp thereof is the Lamb.","Chu khuo chun a ên dingin nisa a ngai nawh a, thla khawm a ngai bawk nawh; Pathien ropuina chun a ên a, an khâwnvar chu Berâmte a ni sih a."
And the nations shall walk amidst the light thereof: and the kings of the earth bring their glory into it.,"A vara chun hnam tin um an ta, hnuoia lalhai chun an ropuina la lût an tih."
And the gates thereof shall in no wise be shut by day (for there shall be no night there):,"A kawthai chu sûnah khâr naw tawp an ta, chutaka chun zân hrim a um naw ding a ni sih a."
and they shall bring the glory and the honor of the nations into it:,A sûnga chun hnam tin ropuina le chawimawina la lût an tih.
"and there shall in no wise enter into it anything unclean, or he that maketh an abomination and a lie: but only they that are written in the Lamb’s book of life.","Nisienlakhawm, thil inthieng- naw hrim lût dêr naw nih a, thil tirdakum thawhai le khêlinhlip khawm lût naw bawk an tih; Berâmte Hringna Bua hming an ziekhai chau lût an tih."
"And he showed me a river of water of life, bright as crystal, proceeding out of the throne of God and of the Lamb,","Chun, ama chun, a khawlai taka, hringna tui vadung, krustal lung anga tle, Pathien le Berâmte lalṭhungphaa inthawka hung suok, a mîn entir a."
"in the midst of the street thereof. And on this side of the river and on that was the tree of life, bearing twelve manner of fruits, yielding its fruit every month: and the leaves of the tree were for the healing of the nations.","Chun, vadung pang tuoka chun Hringna Thing, chi tum sâwm le pahnia ra, thla kipa ra, a um a; chu thing hnahai chu hnam tin sukdamna ding a nih."
And there shall be no curse any more: and the throne of God and of the Lamb shall be therein: and his servants shall serve him;,"Chun, ṭawngsie hrim um nâwk ta naw nih a, Pathien le Berâmte lal- ṭhungpha chu um lem tâng a tih; chuongchun, a suokhai chun a rawng bâwl an ta,"
and they shall see his face; and his name shall be on their foreheads.,"a hmêl hmûng an ta, a hming chu an bâwkah chuong bawk a tih."
"And there shall be night no more; and they need no light of lamp, neither light of sun; for the Lord God shall give them light: and they shall reign for ever and ever.","Chun, zân um nâwk ta naw nih a; khâwnvar le nisa var ngai naw ni hai a; Lalpa Pathien chun anni a ên ding a ni sih a; chuongchun, chatuonin ro rêl an tih."
"And he said unto me, These words are faithful and true: and the Lord, the God of the spirits of the prophets, sent his angel to show unto his servants the things which must shortly come to pass.","Chun, ama chun ka kuomah, “Hieng thu hi ring a umin ân dik a nih; chuongchun, Lalpa zâwlneihai thlarau Pathien chun, thil hung tlung vak dinghai chu a suokhai kuoma inentir dingin, a vântirko a tir a nih."
"And behold, I come quickly. Blessed is he that keepeth the words of the prophecy of this book.","Chun, ngai ta, ka hung vak ding a nih,” a ta. Hi lekhabu hrillâwkna pawm taphawt chu an hamṭha."
"And I John am he that heard and saw these things. And when I heard and saw, I fell down to worship before the feet of the angel that showed me these things.","Kei Johan hieng thil po po hmutu le hretu chu ka nih. Chun, ka hrieta ka hmu chun hieng thil mîn entirtu vântirko ke bulah Pathien chibai bûka bûk dingin ka bawkkhup a."
"And he saith unto me, See thou do it not: I am a fellow-servant with thee and with thy brethren the prophets, and with them that keep the words of this book: worship God.","Ama chun ka kuoma, “Hienghin chu thaw naw raw khai; kei chu nangma le i unau zâwlneihai le, hi lekhabu pawmtuhai suok chanpui ka nih annâwm, Pathien chibai bûk lem rawh,” a ta."
"And he saith unto me, Seal not up the words of the prophecy of this book; for the time is at hand.","Chun, ama chun ka kuomah, “Hi lekhabu hrillâwkna thuhai hi ip naw; a hun chu a hung tlung ding a ni ta sih a."
"He that is unrighteous, let him do unrighteousness still: and he that is filthy, let him be made filthy still: and he that is righteous, let him do righteousness still: and he that is holy, let him be made holy still.","Mi felnaw chu sukfelnawin um zing raw se, mi inthiengnaw chu sukthiengnawin um zing raw se, mi fel chu sukfelin um zing raw se, mi inthieng chu sukthiengin um zing raw se."
"Behold, I come quickly; and my reward is with me, to render to each man according as his work is.","“Ngai ta, ka hung vak ding a nih; mi tin an thilthaw ang peia pêk dingin ka lâwmman ka kuomah a um a."
"I am the Alpha and the Omega, the first and the last, the beginning and the end.","Kei Alpha le Omega, a Hmasa- tak le a Nuhnungtak, a Bul le a Tâwp ka nih."
"Blessed are they that wash their robes, that they may have the right to come to the tree of life, and may enter in by the gates into the city.","Hringna Thing chunga chun thu an nei theina ding le, kawtkhâra chun khuoa an lût theina dinga an puon sâwpfaihai chu an hamṭha."
"Without are the dogs, and the sorcerers, and the fornicators, and the murderers, and the idolaters, and every one that loveth and maketh a lie.","Tuola chun, ui dâm, dawithiem dâm, indit chîng dâm, tuolthat dâm, milim bie dâm, khêl ngaina le khêlinhlip taphawthai chu um an tih."
"I Jesus have sent mine angel to testify unto you these things for the churches. I am the root and the offspring of David, the bright, the morning star.","“Kei Isu hin kohranhai ta ding- in hieng thu hi in kuomah inhriettir dingin ka vântirko chu ka hung tir a nih. David bulpui le a thla arasi vartak, sikhawvar chu ka nih,” a ta."
"And the Spirit and the bride say, Come. And he that heareth, let him say, Come. And he that is athirst, let him come: he that will, let him take the water of life freely.","Thlarau le mo chun, “Hung rawh,” an tih a. A hre taphawt chun, “Hung rawh,” ti raw se. Dangchâr taphawt hung raw se; a nuom taphawtin hringna tui hi a thlâwnin la raw se."
"I testify unto every man that heareth the words of the prophecy of this book, If any man shall add unto them, God shall add unto him the plagues which are written in this book:","Hi lekhabu hrillâwkna thu hre taphawt chu kân hriettir; tûkhawmin hieng thu hi a belsa chun, a lekhabua hremna ziekhai hi, Pathienin a chungah belsa vêng a tih;"
"and if any man shall take away from the words of the book of this prophecy, God shall take away his part from the tree of life, and out of the holy city, which are written in this book.","chun, tûkhawmin hi hrillâwkna lekhabu thua inthawka thu a lâk- hmang chun hi lekhabua ziek Hring- na Thing le Khaw Inthienga a chan chu Pathienin la hmang vêng a tih."
"He who testifieth these things saith, Yea: I come quickly. Amen: come, Lord Jesus.","Hieng thu inhriettirtu hin, “Anih, ka hung vak ding a nih,” a tih. Amen, hung ta la, Lalpa Isu."
The grace of the Lord Jesus be with the saints. Amen.,Lalpa Isu lunginsietna chu mi inthienghai kuomah um raw se. Amen.
"And to the angel of the church in Sardis write: These things saith he that hath the seven Spirits of God, and the seven stars: I know thy works, that thou hast a name that thou livest, and thou art dead.","“Chun Sardisa kohran tirko kuoma chun hieng hin ziek rawh:— “ ‘Pathien Thlarau pasari le arasi pasari nei khan hieng thu hi a hril a nih: I thil thawziehai ka hriet, thi zing sih a, hring hming i put hi."
"Be thou watchful, and establish the things that remain, which were ready to die: for I have found no works of thine perfected before my God.","Invêng la, thil la um, thi vâng vânghai kha sukdet rawh; i thil- thawhai hrim ka Pathien mit tlung zoin ka hmu si nawh."
"Remember therefore how thou hast received and didst hear; and keep it, and repent. If therefore thou shalt not watch, I will come as a thief, and thou shalt not know what hour I will come upon thee.","Chuongchun, i changta le i hriet ta kha hre zing rawh; chun, chu chu pawm la, sim rawh. în vêng naw chun inru angin hung ka ta, ieng hun âm ka hung phâwk ding che hre si naw ti nih a."
But thou hast a few names in Sardis that did not defile their garments: and they shall walk with me in white; for they are worthy.,"Nisienlakhawm, Sardisa khan an puonhai sukthiengnaw naw hming tlâwmtê i nei a nih; anni chu puon vâr silin ka kuomah lêng ve hlak an tih; chuong ang thaw tlâk an ni sih a."
"He that overcometh shall thus be arrayed in white garments; and I will in no wise blot his name out of the book of life, and I will confess his name before my Father, and before his angels.","A hnetu taphawt chu chuong ang chun puon vârhai insiltir nîng a tih; chun, Hringna Bua inthawkin a hming chu thai hmang naw tawp ka tih, ka Pa hmaa le vântirkohai hmaa chun a hming chu ṭan lem ka tih."
"He that hath an ear, let him hear what the Spirit saith to the churches.","Thlarauin kohranhai kuoma thu a hril hi na nei chun hre raw se, a tih,’ tiin."
"And to the angel of the church in Philadelphia write: These things saith he that is holy, he that is true, he that hath the key of David, he that openeth and none shall shut, and that shutteth and none openeth:","“Chun, Philadelphiaa kohran tir- ko kuoma chun hieng hin ziek rawh:— “ ‘Mi inthieng, mi indiktak, David chabi nei, tu ikhâr lo dinga hawnga, tu ihawng lo dinga khârtu khan, hieng thu hi a hril a nih:"
"I know thy works (behold, I have set before thee a door opened, which none can shut), that thou hast a little power, and didst keep my word, and didst not deny my name.","I thilthawziehai ka hriet. Ngai ta, tûkhawm ikhâr thei naw kawt- khâr hawng sa i hmaah kân umtir, thilthawtheina tlâwmtê i nei leiin: chu chu sa khawm chun ka thu i pawm a, ka hming khawm în phat naw kha."
"Behold, I give of the synagogue of Satan, of them that say they are Jews, and they are not, but do lie; behold, I will make them to come and worship before thy feet, and to know that I have loved thee.","Ngai ta, Setan inkhâwmna inhai laia mi, Juda tak ni loa, khêl hrila Juda intihai laia mi chu, ka tir ding a nih, ngai ta, i ke bulah chibai hung inbûktir ka ta, ka hmangai che ti inhriettir bawk ka tih."
"Because thou didst keep the word of my patience, I also will keep thee from the hour of trial, that hour which is to come upon the whole world, to try them that dwell upon the earth.","Ka selna thu i pawm lei khan, hnuoia umhai fie dinga khawvêl po po chunga fiena hun hung tlung dinga inthawk chun, kei khawmin humhim ka ti che."
"I come quickly: hold fast that which thou hast, that no one take thy crown.","Ka hung vak ding a nih, tû- khawmin i lallukhum chu an lâkpêk nawna ding chein, i thil nei sa kha kawl tlat rawh."
"He that overcometh, I will make him a pillar in the temple of my God, and he shall go out thence no more: and I will write upon him the name of my God, and the name of the city of my God, the new Jerusalem, which cometh down out of heaven from my God, and mine own new name.","A hnetu taphawt chu ka Pathien biekina chun banah siem ka ta, chutaka inthawk chun suok ta naw ni; chun, amaa chun ka Pathien hming leh, ka Pathien khuo Jerusalem Thar, ka Pathien kuoma mi vâna inthawka hung ṭum ding hming leh, ka hming thar leh ziek ka tih."
"He that hath an ear, let him hear what the Spirit saith to the churches.","Thlarauin kohranhai kuoma thu a hril hi na nei chun hre raw se, a tih,’ tiin."
"And to the angel of the church in Laodicea write: These things saith the Amen, the faithful and true witness, the beginning of the creation of God:","“Chun, Laodikeia tirko kuoma chun hieng hin ziek rawh:— “Amen, thuhretu ringum le indik- tak, Pathien thilsiem bul khan, hieng thu hi a hril a nih;"
"I know thy works, that thou art neither cold nor hot: I would thou wert cold or hot.","I thilthawziehai ka hriet, i dei chuong nawh a, i lum chuong naw hi; i dei amanih, i lum amanih ka nuom a nih."
"So because thou art lukewarm, and neither hot nor cold, I will spew thee out of my mouth.","Chuongchun, lum si loa, dei si loa, i lum dep dep leiin ka baua inthawk peisâk ka ti che."
"Because thou sayest, I am rich, and have gotten riches, and have need of nothing; and knowest not that thou art the wretched one and miserable and poor and blind and naked:","‘Ka hausa a, sum ka hau a, iengkhawm ka tlasam nawh,’ i ti lei le, nang mi rimsi, lungsietum, pasie, mitdel, saruok chu i ni ti în hriet naw leiin,"
"I counsel thee to buy of me gold refined by fire, that thou mayest become rich; and white garments, that thou mayest clothe thyself, and that the shame of thy nakedness be not made manifest; and eyesalve to anoint thine eyes, that thou mayest see.","i hung hausak theina dingin rângkachak meia sukthieng dâm, puon i sil theina ding le i saruok zamaw chu ân lang nawna dingin puon vâr dâm, i hmu theina dingin i mita i nâl ding mitna hlo dâm ka kuoma inchaw dingin ka ngên che."
"As many as I love, I reprove and chasten: be zealous therefore, and repent.","Ka hmangai taphawt chu ka kâwkin ka thunun hlak; chuongchun, ṭhahnem ngai la sim rawh."
"Behold, I stand at the door and knock: if any man hear my voice and open the door, I will come in to him, and will sup with him, and he with me.","Ngai ta, kawtkhâr bula ngîrin ka nawk hi; tûkhawmin ka rawl hrea kawt a hawng chun a kuomah lût ka ta, a kuomah zânbu fâng ka ta, ama khawmin ka kuomah fa bawk a tih."
"He that overcometh, I will give to him to sit down with me in my throne, as I also overcame, and sat down with my Father in his throne.","A hnetu taphawt chu ka lal- ṭhungphaah ka kuomah inṭhungtir ka tih; kei khawmin ka hneh a, ka pa kuomah lalṭhungphaa ka ṭhung ang khan."
"He that hath an ear, let him hear what the Spirit saith to the churches.","Thlarauin kohranhai kuoma thu a hril hi na nei chun hre raw se, a tih,” a tih a."
"After these things I saw, and behold, a door opened in heaven, and the first voice that I heard, a voice as of a trumpet speaking with me, one saying, Come up hither, and I will show thee the things which must come to pass hereafter.","Chuong thil hnunga chun ka hang en a, chun, ngai ta, vânah kawtkhâr inhawng ka hmuh a; chun, rawl ka hriet hmasak, tawtawrâwt ri anga mi bie khan, “Hitaka hin hung rawh, chuongchun, tuta hnunga thil hung um dinghai inentir ka ti che,” a ta."
"Straightway I was in the Spirit: and behold, there was a throne set in heaven, and one sitting upon the throne;","Chun, kârloin Thlarauin ka lo um nghâl tah a; chun, ngai ta, vânah lalṭhungpha a lo inṭhut a, chu ṭhungphaa chun mi pakhat a lo ṭhung bawk a."
"and he that sat was to look upon like a jasper stone and a sardius: and there was a rainbow round about the throne, like an emerald to look upon.","Chu a ṭhung chu jaspi le sardion lung ang elin ân lang a; chun, lalṭhungpha vêla chun sumrisâng, ena smaragdin lung ang, ân zâm a."
"And round about the throne were four and twenty thrones: and upon the thrones I saw four and twenty elders sitting, arrayed in white garments; and on their heads crowns of gold.","Lalṭhungpha vêla chun lalṭhung- pha sâwmhni le pali a um a; chun lalṭhungphahaia chun upa sâwmhni le pali puon vâr sila ṭhung ka hmu a, rângkachak lallukhumhai an khum a."
"And out of the throne proceed lightnings and voices and thunders. And there were seven lamps of fire burning before the throne, which are the seven Spirits of God;","Lalṭhungphaa inthawk chun kâwlinlep dâm, rawl dâm, vâninrûm dâm a hung suok dur dur a. Chun, meiser pasari lalṭhungpha hmaa chun a chawk a, chuong chu Pathien thlarau pasari kha an nih."
"and before the throne, as it were a sea of glass like unto crystal; and in the midst of the throne, and round about the throne, four living creatures full of eyes before and behind.","Chun, lalṭhungpha hmaa chun hlimen tuisuoriet ang, krustal lung ang el a um a; chun, Lalṭhungpha laia le lalṭhungpha vêlah thilhring pali hma tieng le hnung tieng mita sip, an um a."
"And the first creature was like a lion, and the second creature like a calf, and the third creature had a face as of a man, and the fourth creature was like a flying eagle.","Thilhring pakhatna chu sakei- baknei ang a na, thilhring pahnina chu sebâwngte ang a na, thilhring pathumna chun mihriem hmêl ang a put a, thilhring palina chu mupui vuong lai ang a nih."
"And the four living creatures, having each one of them six wings, are full of eyes round about and within: and they have no rest day and night, saying, Holy, holy, holy, is the Lord God, the Almighty, who was and who is and who is to come.","Chun, thilhring pali chu thla paruk seng nei, an pumin an sûng tieng chena mita sip an nih. “Lalpa Pathien Iengkimthawthei, Um ta le, um zing le hung um ding chu, Ân thieng ie, ân thieng ie, ân thieng ie,” tiin sûn le zân an châwl ngai nawh."
"And when the living creatures shall give glory and honor and thanks to him that sitteth on the throne, to him that liveth for ever and ever,","Chun, thilhringhai chun lal- ṭhungphaa ṭhung chatuona hring zing chu an sukropuia, an chawi- mawia, lâwmthu an hril po leh,"
"the four and twenty elders shall fall down before him that sitteth on the throne, and shall worship him that liveth for ever and ever, and shall cast their crowns before the throne, saying,","upa sâwmhni le pali hai chu lalṭhungphaa ṭhung hmaa chun an bawkkhup a, chatuona hring zing chu chibai an bûk a, an lallukhumhai chu lalṭhungpha hmaa chun an sieh a,"
"Worthy art thou, our Lord and our God, to receive the glory and the honor and the power: for thou didst create all things, and because of thy will they were, and were created.","“Nang kan Lalpa le kan Pathien, Ropuina dâm, chawimawina dâm, thilthawtheina dâm chu Hmu tlâk i nih ie, Nangin iengkim i siem a, I dit leia um le siem An ni bawk sih a,” tiin."
"And I saw in the right hand of him that sat on the throne a book written within and on the back, close sealed with seven seals.","Chun, lalṭhungphaa ṭhung kut chang tienga chun lekhabu sûng tieng le puo tienga ziek, inchikna pasaria inchik tlat ka hmuh a."
"And I saw a strong angel proclaiming with a great voice, Who is worthy to open the book, and to loose the seals thereof?","Chun, vântirko hrâttak rawl inringtaka, “Tu am lekhabu hi phara a închiknahai hi sût tlâk um an ta?” tia tlânginsamin ka hmu bawk a."
"And no one in the heaven, or on the earth, or under the earth, was able to open the book, or to look thereon.","Chun, vâna dâm, hnuoia dâm, hnuoi hnuoia dâm khawm lekhabu chu phar thei tûkhawm an um nawh a, a en thei khawm an um bawk nawh a."
