en,hmr
"And it was given unto him to give breath to it, even to the image of the beast, that the image of the beast should both speak, and cause that as many as should not worship the image of the beast should be killed.","Chun, Sahrâng lim chu a ṭawng theina ding le, Sahrâng lim chibai bûk naw taphawt ân sukhlumtir theina dingin Sahrâng lim kuoma chun inthuokna pêk phal a nih."
"And he causeth all, the small and the great, and the rich and the poor, and the free and the bond, that there be given them a mark on their right hand, or upon their forehead;","Chun, mi po po a lien a chînin, a hausa a pasiein, suok le suok nawhai khawm, an kut chang tienga manih, an chala manih inchikna ân neitir tâwl a;"
"and that no man should be able to buy or to sell, save he that hath the mark, even the name of the beast or the number of his name.","inchikna, Sahrâng hming ama- nih, a hming nambar amanih, neihai chau naw chun, tûkhawmin ieng- khawm an inchâwkin an zawr thei nawna dingin."
"Here is wisdom. He that hath understanding, let him count the number of the beast; for it is the number of a man: and his number is Six hundred and sixty and six.",Hitaka hin varna inlang theina a um. Hriet theina nei chun Sahrâng nambar chu sût raw se; mihriem nambar a ni sih a; a nambar chu za ruk sâwmruk paruk a nih.
"And I saw, and behold, the Lamb standing on the mount Zion, and with him a hundred and forty and four thousand, having his name, and the name of his Father, written on their foreheads.","Chun, ka hang en a, Berâmte chu Zion Tlânga ngîrin le an chala a hming le a Pa hming ziek, mi nuoi khat le sîng li le sâng li a kuoma chun an um a."
"And I heard a voice from heaven, as the voice of many waters, and as the voice of a great thunder: and the voice which I heard was as the voice of harpers harping with their harps:","Chun, vâna inthawka rawl ri, tui tamtak ri ang le, vâninrûm ri nasatak ri ang, ka hriet a; chun, ka ri hriet chu ṭingṭang keituhaiin an ṭingṭang an kei ri ang a na,"
"and they sing as it were a new song before the throne, and before the four living creatures and the elders: and no man could learn the song save the hundred and forty and four thousand, even they that had been purchased out of the earth.","lalṭhungpha hmaa le, thilhring pali le upahai hmaa chun hla thar ni âwmtak hi an sak a; chun, hnuoia inthawka intlan tah, mi nuoi khat le sîng li le sâng li chau naw khan chu, tûkhawmin chu hla chu an inchûk thei nawh."
"These are they that were not defiled with women; for they are virgins. These are they that follow the Lamb whithersoever he goeth. These were purchased from among men, to be the firstfruits unto God and unto the Lamb.",Chuonghai chu nuhmeia insuk- thiengnaw nawhai chu an nih; nunghâk inthieng ang an ni sih a. Chuong chu Berâmte a fena taphawta zuituhai chu an nih. Chuong chu Berâmte le Pathien ta dinga ra hma- satak ni dinga mihriem laia inthawka intlan suok an nih.
And in their mouth was found no lie: they are without blemish.,"An baua khêl a suok hrim miin an hriet ngai nawh, sawisêlbo an ni sih a."
"And I saw another angel flying in mid heaven, having eternal good tidings to proclaim unto them that dwell on the earth, and unto every nation and tribe and tongue and people;","Chun, hnuoia umhai kuoma le, hnam tinrêng dâm, chi tinrêng dâm, ṭawng tinrêng dâm kuoma tlângin- sampui dinga chatuon Chanchin Ṭha nei vântirko dang vânlaizâwla vuong ka hmuh a;"
"and he saith with a great voice, Fear God, and give him glory; for the hour of his judgment is come: and worship him that made the heaven and the earth and sea and fountains of waters.","Ama chun rawl inringtakin, “A rorêl hun chu a hung tlung ta leiin Pathien chu ṭi unla, chawimawi ro; vân dâm, hnuoi dâm, tuisuoriet dâm, tui hnâr dâm siemtu chu chibai bûk ro,” a tih a."
"And another, a second angel, followed, saying, Fallen, fallen is Babylon the great, that hath made all the nations to drink of the wine of the wrath of her fornication.","Chun, vântirko dang, a pahnina chun, “Babulon khaw ropui, a mi dit chîngna leia lunginsenna uoiin hnam po po indâwntirtu chu, a tlâwm tah!” tiin a hung zui a."
"And another angel, a third, followed them, saying with a great voice, If any man worshippeth the beast and his image, and receiveth a mark on his forehead, or upon his hand,","Chun, vântirko dang, a pathum- na chun rawl inringtakin, “Tû- khawmin Sahrâng le a lim chibai bûkin a chala manih, a kuta manih inchikna a nei chun, chu mi ngei chun Pathien lunginsenna uoiin,"
"he also shall drink of the wine of the wrath of God, which is prepared unmixed in the cup of his anger; and he shall be tormented with fire and brimstone in the presence of the holy angels, and in the presence of the Lamb:","a lunginsenna noa iengkhawm pawl loa siem chu dâwn a ta, vântirko inthienghai mithmua le Berâmte mithmua chun mei le kâta sawisakin um bawk a tih."
"and the smoke of their torment goeth up for ever and ever; and they have no rest day and night, they that worship the beast and his image, and whoso receiveth the mark of his name.","Chun, chuong mihai sawisakna meikhu chu chatuonin hang fêng a ta; Sahrâng le a lim chibai bûktuhai, a hming inchikna nei taphawthai khawm chun, a sûn a zânin châwl hrim nei naw ni hai,” tiin anni chu a hung zui a."
"Here is the patience of the saints, they that keep the commandments of God, and the faith of Jesus.",Hitaka hin mi inthieng Pathien thupêkhai le Isu ringna thu zâwm- tuhai selna inlang theina a um.
"And I heard a voice from heaven saying, Write, Blessed are the dead who die in the Lord from henceforth: yea, saith the Spirit, that they may rest from their labors; for their works follow with them.","Chun, vâna inthawkin rawlin, “Hienghin ziek rawh: Tuta hnung chu mithi, Lalpaa thihai chu, an hamṭha. Thlarau chun, ‘Anih, an sinin- rimnahai chu châwl san tâng an tih; an thilthawhai chun a hung zui ve ding a ni sih a,’ a tih,” a ti ka hriet a."
"And I saw, and behold, a white cloud; and on the cloud I saw one sitting like unto a son of man, having on his head a golden crown, and in his hand a sharp sickle.","Chun, ka hang en a, sûm vâr tak ka hmuh a. Sûm chunga chun mihriem naupa ang tak hi, rângka- chak lallukhum khuma, kâwite ngei- tak chawia ṭhung ka hmu bawk a."
"And another angel came out from the temple, crying with a great voice to him that sat on the cloud, Send forth thy sickle, and reap: for the hour to reap is come; for the harvest of the earth is ripe.","Chun, vântirko dang, Pathien biekina inthawkin a hung suok a, sûm chunga ṭhung kuoma chun rawl inringtakin, “I kâwite kha keidawk la, ât rawh; ât a hun ta sih a; hnuoi bu khu a ngui zo tah khu,” a ta."
And he that sat on the cloud cast his sickle upon the earth; and the earth was reaped.,"Chuongchun, sûm chunga ṭhung chun a kâwite chu hnuoiah a thlâk a, hnuoi bu chu an ât tah a."
"And another angel came out from the temple which is in heaven, he also having a sharp sickle.","Chun, vântirko dang vâna Pathien biekina inthawkin a hung suok nâwk a, ama khawm chun kâwite ngeitak a chawi bawk a."
"And another angel came out from the altar, he that hath power over fire; and he called with a great voice to him that had the sharp sickle, saying, Send forth thy sharp sickle, and gather the clusters of the vine of the earth; for her grapes are fully ripe.","Chun, vântirko dang, mei chunga thuneitu chu, mâichâma inthawkin a hung suok nâwk a; chun, ama chun rawl inringtakin, “I kâwite ngeitak kha keidawk la, hnuoia grêp hrui ra bâwrhai khu zu ât rawh, grêp rahai khu a hmin ṭuo ta khu,” tiin kâwite ngeitak chawitu chu a ko a."
"And the angel cast his sickle into the earth, and gathered the vintage of the earth, and cast it into the winepress, the great winepress, of the wrath of God.","Chuongchun, vântirko chun a kâwite chu hnuoiah a thlâk a, hnuoia grêp ra chu a ât a, grêp sâwrna khur lientak, Pathien lunginsenna grêp sâwrna khura chun a the lût a."
"And the winepress was trodden without the city, and there came out blood from the winepress, even unto the bridles of the horses, as far as a thousand and six hundred furlongs.","Chun, khaw puo tienga grêp sâwrna khura chun a sir sâwr a, chuongchun, grêp sâwrna khura inthawk chun thisen a hung suok a, fîng sîng khat le za ruk chen sakawr- hai thîrbar chena inthûk a nih."
"And I saw another sign in heaven, great and marvellous, seven angels having seven plagues, which are the last, for in them is finished the wrath of God.","Chun, vânah inchikna dang ropuitak le maktak ka hmu a, vântirko pasari hremna pasari chawihai chu; chuong chu hremna nuhnung takhai an nih; chuonga chun Pathien lunginsenna chu a kim ta sih a."
"And I saw as it were a sea of glass mingled with fire; and them that come off victorious from the beast, and from his image, and from the number of his name, standing by the sea of glass, having harps of God.","Chun, hlimen mei le inpawl tuisuoriet ni âwmtak ka hmuh a; Sahrâng dâm, a lim dâm, a hming nambar dâm hnea hung suokhai chu Pathien ṭingṭang chawia, hlimen tuisuoriet panga ngîr ka hmu bawk a."
"And they sing the song of Moses the servant of God, and the song of the Lamb, saying, Great and marvellous are thy works, O Lord God, the Almighty; righteous and true are thy ways, thou King of the ages.","Chun, Pathien suok Mosie le Berâmte hla an sak a, “Aw Lalpa Pathien Iengkimthawthei, I thilthawhai chu a ropuiin a mak a; Nang, hnam tin Laltak, I lampuihai chu a felin ân dik a nih."
"Who shall not fear, O Lord, and glorify thy name? for thou only art holy; for all the nations shall come and worship before thee; for thy righteous acts have been made manifest.","Aw Lalpa, tu am i hming inza nawh a, Chawimawi naw ding? Nang chau în thieng si; I thilthaw felhai chu suklang a ni ta leiin, Hnam tinrêngin chibai hung bûk an ti che,” tiin."
"And after these things I saw, and the temple of the tabernacle of the testimony in heaven was opened:","Chuong hnunga chun ka hang en a, chun, vâna inhriettirna biekbûk pindan sûngril chu ân hawng a;"
"and there came out from the temple the seven angels that had the seven plagues, arrayed with precious stone, pure and bright, and girt about their breasts with golden girdles.","chuongchun, pindan sûngrila inthawk chun hremna pasari chawi vântirko pasarihai chu, puon in- thieng vârtak silin, an âwm rang- kachak kâwngkhia inkhitin an hung suok a."
"And one of the four living creatures gave unto the seven angels seven golden bowls full of the wrath of God, who liveth for ever and ever.","Chun, thilhring pali laia pakhat chun vântirko pasarihai kuoma chun, Pathien chatuona hring zing lungin- sennaa sip rângkachak berbu pasari a pêk a."
"And the temple was filled with smoke from the glory of God, and from his power; and none was able to enter into the temple, till the seven plagues of the seven angels should be finished.","Chun, pindan sûngril chu Pathien ropuina le a thilthawtheina khuin a sip tah a; vântirko pasarihai hremna pasari chu a bo hmakhat pindan sûngrila chun tûkhawm an lût thei nawh."
"And I heard a great voice out of the temple, saying to the seven angels, Go ye, and pour out the seven bowls of the wrath of God into the earth.","Chun, pindan sûngrila in- thawk chun rawl inringtakin, vântirko pasarihai kuoma chun, “Fe unla, Pathien lunginsenna berbuhai chu hnuoiah bunthla ro,” a ti ka hriet a."
"And the first went, and poured out his bowl into the earth; and it became a noisome and grievous sore upon the men that had the mark of the beast, and that worshipped his image.","Chun, a hmasatak chu a feh a, a berbu chu hnuoiah a bunthlâk a; chuongchun, Sahrâng inchikna nei- hai le a lim chibai bûkhai chunga chun pânsie natakin ân chang tah a."
"And the second poured out his bowl into the sea; and it became blood as of a dead man; and every living soul died, even the things that were in the sea.","Chun, a pahnina chun a berbu chu tuisuorietah a bunthlâk a; chuongchun, mithi thisen angin thi- senin ân chang tah a; chun, thilhring tinrêng tuisuorieta umhai chu an thi ta vawng a."
And the third poured out his bowl into the rivers and the fountains of the waters; and it became blood.,"Chun, a pathumna chun a berbu chu vadungahai le tuikhurahai a bunthlâk a; chuongchun, thisenin ân chang tah a."
"And I heard the angel of the waters saying, Righteous art thou, who art and who wast, thou Holy One, because thou didst thus judge:","Chun, tui vântirko chun, “Nang Mi Inthieng, hieng anga ro i rêl leiin, nang um zing le um tah, i fel ie."
"for they poured out the blood of saints and prophets, and blood hast thou given them to drink: they are worthy.","Anni chun mi inthienghai le zâwlneihai thisen an insuoh a; chun, nangin dâwn dinga thisen ma i pêk thung hi dâwn tlâk an ni hrim deh,” a ti ka hriet a."
"And I heard the altar saying, Yea, O Lord God, the Almighty, true and righteous are thy judgments.","Chun, mâichâm chun, “Anih, Aw Lalpa Pathien, Iengkimthawthei, i rorêlhai chu ân dikin a fel a nih,” a ti ka hriet a."
And the fourth poured out his bowl upon the sun; and it was given unto it to scorch men with fire.,"Chun, a palina chun a berbu chu nisaah a bunthlâk a; chuongchun, nisa chu meia mihriem em ût dingin thilthawtheina an pêk a."
And men were scorched with great heat: and they blasphemed the name of God who hath the power over these plagues; and they repented not to give him glory.,"Chuongchun, mihai chu lumtaka em ûtin an um a, chuong hremna chunga thuneitu Pathien hming chu an hrilsiet a, ama chawimawi dingin an sim chuong nawh."
"And the fifth poured out his bowl upon the throne of the beast; and his kingdom was darkened; and they gnawed their tongues for pain,","Chun, a pangana chun a berbu chu Sahrâng lalṭhungphaah a bun- thlâk a; chuongchun, a ram chu a hung inthim ta vawng a. Chun, an nat leiin an lei an se a,"
and they blasphemed the God of heaven because of their pains and their sores; and they repented not of their works.,an nahai le an pânnahai leiin vâna Pathien chu an hrilsiet a; an thilthawhai chu an sim chuong nawh.
"And the sixth poured out his bowl upon the great river, the river Euphrates; and the water thereof was dried up, that the way might be made ready for the kings that come from the sunrising.","Chun, a parukna chun a berbu chu tuipui Euphratesa chun a bunthlâk a; chuongchun, nisa suokna tieng panga lal hung dinghai ta dinga lampui chu inzosa a hung ni theina dingin, a tui chu a kang intan tah a."
"And I saw coming out of the mouth of the dragon, and out of the mouth of the beast, and out of the mouth of the false prophet, three unclean spirits, as it were frogs:","Chun, drakon baua inthawk le Sahrâng baua inthawk le, zâwlnei tehlêm baua inthawk chun thlarau inthiengnaw pathum u ni âwmtak, hung suok ka hmuh a."
"for they are spirits of demons, working signs; which go forth unto the kings of the whole world, to gather them together unto the war of the great day of God, the Almighty.","Chuong chu khawhri thlarau, thilmak thaw hlakhai an nih. Anni chu Pathien Iengkimthawthei ni ropuia indonaa ṭhuoi khâwm dingin khawvêl po poa lalhai kuomah an feh a."
"(Behold, I come as a thief. Blessed is he that watcheth, and keepeth his garments, lest he walk naked, and they see his shame.)","(Ngai ta, inru angin ka hung ding a nih; inringa a puon dierkei zing chu a hamṭha, chuong naw chun, saruokin lêng a ta, a zamaw hmu rawi an tih)."
And they gathered them together into the place which is called in Hebrew Har-Magedon.,Hmun pakhat Hebrai ṭawnga Har-Magedon an tia chun an ṭhuoi khâwm tah a.
"And the seventh poured out his bowl upon the air; and there came forth a great voice out of the temple, from the throne, saying, It is done:","Chun, a pasarina chun a berbu chu boruokah a bunthlâk a; chuong- chun, pindan sûngrila, Lalṭhungphaa inthawkin, “A kim tah,” tiin rawl inringtak a hung suok a."
"and there were lightnings, and voices, and thunders; and there was a great earthquake, such as was not since there were men upon the earth, so great an earthquake, so mighty.","Chun, kâwlinlep dâm, rawl dâm, vâninrûm dâm, a hung um tah a, simkhawleihnuoi khawm nasatak- in ân hnîng a, hnuoia mihriem uma inthawk chuong ang hrima nasa a la um ngai nawh, simkhawleihnuoi inhnîng chuong ang lâwma nasa le ropui chu."
"And the great city was divided into three parts, and the cities of the nations fell: and Babylon the great was remembered in the sight of God, to give unto her the cup of the wine of the fierceness of his wrath.","Chuongchun, khaw ropui chu hmun thumah a hung inṭheh a, hnam tin khuohai chu a hung chim a; chun, a lunginsen nasatna uoin no chu a kuoma pêk dingin Babulon khaw ropui chu Pathien hmaa hriet zingin a lo um tah a."
"And every island fled away, and the mountains were not found.","Chun, thlierkâr tinrêng a bo ta vawng a, tlânghai khawm a um ta nawh a."
"And great hail, every stone about the weight of a talent, cometh down out of heaven upon men: and men blasphemed God because of the plague of the hail; for the plague thereof is exceeding great.","Chun, riel lientak talent tluk raua rik seng, vâna inthawkin mihriemhai chungah a tlah a; chun, mihriemhai chun riela hremna lei chun Pathien an hrilsiet tah a; chu hremna chu a nasa bêk bêk sih a."
"And there came one of the seven angels that had the seven bowls, and spake with me, saying, Come hither, I will show thee the judgment of the great harlot that sitteth upon many waters;","Chun, vântirko pasari berbu pasari chawihai laia pakhat chun a mi biek a. “Hung ta, tui tamtaka ṭhung, nawchizawr ropuitak hremna chu inentir ka ti che."
"with whom the kings of the earth committed fornication, and they that dwell in the earth were made drunken with the wine of her fornication.","Hnuoia lalhai chun ama chu an dit hlak a, hnuoia umhai khawm chu a mi dit chîngna uoin chun vai ruiin an um hlak,” a ta."
"And he carried me away in the Spirit into a wilderness: and I saw a woman sitting upon a scarlet-colored beast, full of names of blasphemy, having seven heads and ten horns.","Chuongchun, ama chun Thla- rauin thlalêrah a mi fepui a; chun, Pathien hrilsietna hminga sip, lu sari le ki sâwm nei, sahrâng seninlâr chunga chuong nuhmei ka hmuh a."
"And the woman was arrayed in purple and scarlet, and decked with gold and precious stone and pearls, having in her hand a golden cup full of abominations, even the unclean things of her fornication,","Chu nuhmei chun puon sen duk le sen lâr a sil a, rângkachak le lungmantam le tuikeplungin ân chei a. Rângkachak no, thil tirdakum, a mi dit chîngna thil inthiengnawa sip a chawi a."
"and upon her forehead a name written, MYSTERY, BABYLON THE GREAT, THE MOTHER OF THE HARLOTS AND OF THE ABOMINATIONS OF THE EARTH.","A bâwka chun thurûk, “BABU- LON KHAW ROPUI, HNUOIA NAW- CHIZAWRHAI LE THIL TIRDAK- UMHAI NU,” tia hming ziek a um a."
"And I saw the woman drunken with the blood of the saints, and with the blood of the martyrs of Jesus. And when I saw her, I wondered with a great wonder.","Chun, chu nuhmei chu mi inthienghai thisen le Isu martarhai thisena inruiin ka hmuh a. Ka hmu phingleh mak ka ti bêk bêk a."
"And the angel said unto me, Wherefore didst thou wonder? I will tell thee the mystery of the woman, and of the beast that carrieth her, which hath the seven heads and the ten horns.","Chuongchun, vântirko chun ka kuomah, “Ieng leiin am mak i tih a? Nuhmei le a phurtu sahrâng lu sari le ki sâwm nei thurûk hril ka ti che."
"The beast that thou sawest was, and is not; and is about to come up out of the abyss, and to go into perdition. And they that dwell on the earth shall wonder, they whose name hath not been written in the book of life from the foundation of the world, when they behold the beast, how that he was, and is not, and shall come.","Sahrâng i hmu kha a um ta zet a, a um nâwk ta nawh a; chun, vânsama inthawkin hung suok a ta, bo- hmangnaah fêng a tih. Chun, hnuoia umhai, leihnuoi insieng tîra Hringna Bua hming ziek nawhai chun, sahrâng chu an hmu phâleh, a um ta zeta, a um nâwk ta nawh a, a hung nâwk ding chu mak la tîng an tih."
"Here is the mind that hath wisdom. The seven heads are seven mountains, on which the woman sitteth:",Hitaka hin lungril varna nei inlang theina a um. Lu sarihai chu nuhmei ṭhungna tlâng pasarihai chu an nih. Lal pasari khawm an na;
"and they are seven kings; the five are fallen, the one is, the other is not yet come; and when he cometh, he must continue a little while.","pangahai chu an tlâwm tah a, pakhat chu a la um, pakhat chu a la hung um hri nawh a; a hung um pha chun sâwtnawtê um ding a nih."
"And the beast that was, and is not, is himself also an eighth, and is of the seven; and he goeth into perdition.","Chun, sahrâng um ta zeta, um nâwk ta naw ngei khawm kha a parietna a na, pasarihai laia mi kha a ni nghe nghe a; bohmangnaah fêng a tih."
"And the ten horns that thou sawest are ten kings, who have received no kingdom as yet; but they receive authority as kings, with the beast, for one hour.","“Chun, ki sâwm i hmuhai kha lal sâwm ram la nei nawhai an nih; dârkâr khat sûng chu sahrâng leh lalhai angin thuneina la hmûng an tih."
"These have one mind, and they give their power and authority unto the beast.","Chuongchun, thu hmunkhatin an thilthawtheina le thuneina chu sahrâng pêng an tih."
"These shall war against the Lamb, and the Lamb shall overcome them, for he is Lord of lords, and King of kings; and they also shall overcome that are with him, called and chosen and faithful.","Chuongchun, Berâmte chu do an ta, chun, Berâmte chu hotuhai Hotu le lalhai Lal a ni leiin anni chu hnêng a tih; chun, a kuoma um, ko- hai, thlanghai, ringumhai chun hne bawk an tih,” a tih a."
"And he saith unto me, The waters which thou sawest, where the harlot sitteth, are peoples, and multitudes, and nations, and tongues.","Chun, ama bawk chun ka kuomah, “Nawchizawr ṭhungna tui i hmuhai kha, mi dâm, mipui dâm, hnam dâm, ṭawng dâm a nih."
"And the ten horns which thou sawest, and the beast, these shall hate the harlot, and shall make her desolate and naked, and shall eat her flesh, and shall burn her utterly with fire.","Chun, ki sâwm i hmu le sahrâng chun nawchizawr chu theidâng an ta, iengkhawm neinaw le saruokin siem an tih, a sa khawm fâng an ta, meiin rawhmang an tih."
"For God did put in their hearts to do his mind, and to come to one mind, and to give their kingdom unto the beast, until the words of God should be accomplished.","Pathien thuhai chu a tlung hmakhat chun a dit zâwng an thawna ding le thu thuhmuna an um theina dingin le, an ram chu sahrâng kuoma an pêkna dingin Pathienin an lung- rilah a tir ta sih a."
"And the woman whom thou sawest is the great city, which reigneth over the kings of the earth.","Chun, i nuhmei hmu kha, khaw ropui, hnuoia lalhai chunga rorêltu chu a nih,” a ta."
"After these things I saw another angel coming down out of heaven, having great authority; and the earth was lightened with his glory.","Chuong hnunga chun vântir- ko dang, thuneina nasatak neiin vâna inthawka hung ṭum ka hmuh a; a ropuinain hnuoi chu a el ta vawng a."
"And he cried with a mighty voice, saying, Fallen, fallen is Babylon the great, and is become a habitation of demons, and a hold of every unclean spirit, and a hold of every unclean and hateful bird.","Chun, ama chun rawl inring- takin, “Babulon khaw ropui chu a tlâwm tah, a tlâwm tah! khawhrihai umna le, thlarau inthiengnaw tin- rêng kulbîng le, vate inthiengnaw le tirdakum tinrêng kulbîng a hung ni tah."
"For by the wine of the wrath of her fornication all the nations are fallen; and the kings of the earth committed fornication with her, and the merchants of the earth waxed rich by the power of her wantonness.","A mi dit chîng leia a lunginsenna uoin chu hnam po poin an dâwn ta sih a; hnuoia lalhai chun ama chu an dit hlak a, hnuoia sumdâwngtuhai chun ân hawitir taluotna chu an hausak pha hlak,” tiin a khêk a."
"And I heard another voice from heaven, saying, Come forth, my people, out of her, that ye have no fellowship with her sins, and that ye receive not of her plagues:","Chun, vâna inthawkin rawl dangin hienghin a hril ka hriet, “Ka mihai, an rîtlonaahai in ṭhangnawna ding le, a hremnahai in hmu ve nawna dingin a sûnga inthawkin suok ro."
"for her sins have reached even unto heaven, and God hath remembered her iniquities.","A suolnahai chun vân khawm a tawng ta hiel a, Pathienin a thilthaw felnawhai khawm chu a hriet zing sih a."
"Render unto her even as she rendered, and double unto her the double according to her works: in the cup which she mingled, mingle unto her double.","Amain a pêk ang ngei khan pe thung unla, a thilthawzie ang pei chu a lêt hniin thung unla, a chawkpawl- na noa chun a ta dingin a lêt hniin chawkpawlpêk ro."
"How much soever she glorified herself, and waxed wanton, so much give her of torment and mourning: for she saith in her heart, I sit a queen, and am no widow, and shall in no wise see mourning.","“Ân sukropui le ân hawitirzie ang pei khan sawisain suklungngai thung ro; a lungril chun, ‘Lalnuin ka ṭhung a nih, hmeithai hrim ka ni nawh a, lungngaina hmu dêr naw ningah’, a ti sih a."
"Therefore in one day shall her plagues come, death, and mourning, and famine; and she shall be utterly burned with fire; for strong is the Lord God who judged her.","Chuleiin, ni khat sûngin a hrem- na hri dâm, lungngaina dâm, ṭâm dâm chu–hung tlung vawng a tih; meia rawhmangin um bawk a tih; a rorêltu, Lalpa Pathien chu a hrât sih a."
